id,institutionCode,collectionCode,ownerInstitutionCode,basisOfRecord,occurrenceID,catalogNumber,otherCatalogNumbers,kingdom,phylum,class,order,family,scientificName,taxonID,scientificNameAuthorship,genus,specificEpithet,taxonRank,infraspecificEpithet,identifiedBy,dateIdentified,identificationReferences,identificationRemarks,taxonRemarks,identificationQualifier,typeStatus,recordedBy,recordedByID,associatedCollectors,recordNumber,eventDate,year,month,day,startDayOfYear,endDayOfYear,verbatimEventDate,occurrenceRemarks,habitat,substrate,verbatimAttributes,fieldNumber,informationWithheld,dataGeneralizations,dynamicProperties,associatedTaxa,reproductiveCondition,establishmentMeans,cultivationStatus,lifeStage,sex,individualCount,samplingProtocol,samplingEffort,preparations,country,stateProvince,county,municipality,locality,locationRemarks,localitySecurity,localitySecurityReason,decimalLatitude,decimalLongitude,geodeticDatum,coordinateUncertaintyInMeters,verbatimCoordinates,georeferencedBy,georeferenceProtocol,georeferenceSources,georeferenceVerificationStatus,georeferenceRemarks,minimumElevationInMeters,maximumElevationInMeters,minimumDepthInMeters,maximumDepthInMeters,verbatimDepth,verbatimElevation,disposition,language,recordEnteredBy,modified,sourcePrimaryKey-dbpk,collId,recordId,references
105031,UCSB,IZC,,PreservedSpecimen,e4d1a57d-1aef-47cb-a3e2-e8bc40a05a6d,UCSB-IZC00000532,,Animalia,Arthropoda,Insecta,Hymenoptera,Formicidae,Camponotus,2424,"Mayr, 1861",Camponotus,,,,I. Naughton,2017,,,,,,,,,,,,,,,,May 197,,,,,,,,,,,,,,,,,,,United States,California,Santa Barbara,,Cachuma Campground,,0,,34.583084,-119.958515,WGS84,9161,,,,GeoLocate,,Included all of Cachuma Lake Recreation Area,,,,,,,,,phorsley,2/21/2019 10:34,,1,urn:uuid:e4d1a57d-1aef-47cb-a3e2-e8bc40a05a6d,https://symbiota.ccber.ucsb.edu:443/collections/individual/index.php?occid=105031
105032,UCSB,IZC,,PreservedSpecimen,89936c4b-d4cd-4edc-839a-92288df476ee,UCSB-IZC00000760,,Animalia,Arthropoda,Insecta,Hymenoptera,Formicidae,Camponotus,2424,"Mayr, 1861",Camponotus,,,,I. Naughton,2017,,,,,,,,,,1975-05-00,1975,5,,,,,,,,,,,,,,,,,,,,,,,United States,California,Santa Barbara,,Santa Ynez River,,0,,34.657247,-120.310617,WGS84,1384,,,,GeoLocate,,Drew Polygon across entire River,,,,,,,,,phorsley,2/21/2019 11:23,,1,urn:uuid:89936c4b-d4cd-4edc-839a-92288df476ee,https://symbiota.ccber.ucsb.edu:443/collections/individual/index.php?occid=105032
105041,UCSB,IZC,,PreservedSpecimen,2e260cc0-3243-424f-af7f-0c55413295c5,UCSB-IZC00003905,,Animalia,Arthropoda,Insecta,Hymenoptera,Formicidae,Camponotus,2424,"Mayr, 1861",Camponotus,,,,I. Naughton,2017,,,,,,,,,,1977-06-00,1977,6,,,,,,,,,,,,,,,,,,,,,,,United States,California,Santa Barbara,,Figueroa Mountain Station,,0,,34.768394,-119.863098,,69073,,rbehm (2018-09-28 15:50:44),,georef batch tool 2018-09-28; GeoLocate,reviewed - high confidence,,,,,,,,,,phorsley,9/28/2018 15:50,,1,urn:uuid:2e260cc0-3243-424f-af7f-0c55413295c5,https://symbiota.ccber.ucsb.edu:443/collections/individual/index.php?occid=105041
105055,UCSB,IZC,,PreservedSpecimen,8298f3cf-e49e-4714-a36b-938f80cd82ff,UCSB-IZC00003920,,Animalia,Arthropoda,Insecta,Hymenoptera,Formicidae,Camponotus,2424,"Mayr, 1861",Camponotus,,,,I. Naughton,2017,,,,,,,,,,5/21/1983,1983,5,21,141,,,,,,,,,,,,,,,,,,,,,United States,California,Santa Barbara,,Figueroa Mountain Station,,0,,34.768394,-119.863098,,69073,,rbehm (2018-09-28 15:50:44),,georef batch tool 2018-09-28; GeoLocate,reviewed - high confidence,,,,,,,,,,phorsley,9/28/2018 15:50,,1,urn:uuid:8298f3cf-e49e-4714-a36b-938f80cd82ff,https://symbiota.ccber.ucsb.edu:443/collections/individual/index.php?occid=105055
105067,UCSB,IZC,,PreservedSpecimen,4dd33a87-daf9-42a7-897b-83e68b473569,UCSB-IZC00003939,,Animalia,Arthropoda,Insecta,Hymenoptera,Formicidae,Camponotus,2424,"Mayr, 1861",Camponotus,,,,I. Naughton,2017,,,,,,Ed Sounhein,,,,4/7/1953,1953,4,7,97,,,,,,,,,,,,,,,,,,,,,United States,California,Santa Barbara,Santa Ynez,Santa Ynez Valley,,0,,34.584154,-120.097368,,6152,,rbehm (2018-09-28 15:26:13),,georef batch tool 2018-09-28; GeoLocate,reviewed - high confidence,,,,,,,,,,phorsley,9/28/2018 15:26,,1,urn:uuid:4dd33a87-daf9-42a7-897b-83e68b473569,https://symbiota.ccber.ucsb.edu:443/collections/individual/index.php?occid=105067
105081,UCSB,IZC,,PreservedSpecimen,f41faf13-7eb0-404d-89e6-7b1620706dbd,UCSB-IZC00004381,,Animalia,Arthropoda,Insecta,Hymenoptera,Formicidae,Camponotus,2424,"Mayr, 1861",Camponotus,,,,I. Naughton,2017,,,,,,B. Sign,,,,6/1/1954,1954,6,1,152,,,,,,,,,,,,,,,,,,,,,United States,California,Santa Barbara,Santa Barbara,Camino Cielo,,0,,34.527499,-119.851642,WGS84,12494,,,,GeoLocate,,Covered most of Southern Los Padres National Forest near Knapp's Castle,,,,,,,,,phorsley,2/21/2019 10:47,,1,urn:uuid:f41faf13-7eb0-404d-89e6-7b1620706dbd,https://symbiota.ccber.ucsb.edu:443/collections/individual/index.php?occid=105081
105084,UCSB,IZC,,PreservedSpecimen,329d94f8-6999-4ee5-b883-245c62f0af5e,UCSB-IZC00004385,,Animalia,Arthropoda,Insecta,Hymenoptera,Formicidae,Camponotus,2424,"Mayr, 1861",Camponotus,,,,I. Naughton,2017,,,,,,,,,,6/3/2015,2015,6,3,154,,,,,,,,,,,,,,,,,,,,,United States,California,Santa Barbara,Santa Barbara,Lido Way,,0,,34.423595,-119.748107,WGS84,42,,,,GeoLocate,,Lido Way Cul-de-sac,,,,,,,,,phorsley,2/21/2019 11:02,,1,urn:uuid:329d94f8-6999-4ee5-b883-245c62f0af5e,https://symbiota.ccber.ucsb.edu:443/collections/individual/index.php?occid=105084
105096,UCSB,IZC,,PreservedSpecimen,0674158d-1a01-457f-aaef-7fba5d81ee93,UCSB-IZC00004399,,Animalia,Arthropoda,Insecta,Hymenoptera,Formicidae,Camponotus,2424,"Mayr, 1861",Camponotus,,,,I. Naughton,2017,,,,,,,,,,1981-05-00,1981,5,,,,,,,,,,,,,,,,,,,,,,,United States,California,Santa Barbara,,Red Rock Campground,,0,,34.53981,-119.71913,,136,,rbehm (2018-09-17 15:17:48),,georef batch tool 2018-09-17,reviewed - high confidence,,,,,,,,,,phorsley,9/17/2018 15:17,,1,urn:uuid:0674158d-1a01-457f-aaef-7fba5d81ee93,https://symbiota.ccber.ucsb.edu:443/collections/individual/index.php?occid=105096
105101,UCSB,IZC,,PreservedSpecimen,3051aaa7-1881-456a-a9eb-8ead2ead274d,UCSB-IZC00004405,,Animalia,Arthropoda,Insecta,Hymenoptera,Formicidae,Camponotus,2424,"Mayr, 1861",Camponotus,,,,I. Naughton,2017,,,,,,,,,,5/21/1983,1983,5,21,141,,,,,,,,,,,,,,,,,,,,,United States,California,Santa Barbara,,"Pino Alto, Figueroa Mountain",,0,,34.743317,-119.985143,WGS84,16332,,,,GeoLocate,,Covered most of Figueroa Mountain,,,,,,,,,phorsley,2/21/2019 10:49,,1,urn:uuid:3051aaa7-1881-456a-a9eb-8ead2ead274d,https://symbiota.ccber.ucsb.edu:443/collections/individual/index.php?occid=105101
105112,UCSB,IZC,,PreservedSpecimen,6fdeeca7-1e99-44c0-94fe-c74ab3aa9ef1,UCSB-IZC00004419,,Animalia,Arthropoda,Insecta,Hymenoptera,Formicidae,Camponotus,2424,"Mayr, 1861",Camponotus,,,,I. Naughton,2017,,,,,,UCSB Zoology 125,,,,6/13/1989,1989,6,13,164,,,,in rock,,,,,,,,,,,,,,,,,United States,California,Santa Barbara,,Goddard,,0,,34.755437,-119.977081,WGS84,59626,,,,GeoLocate,,All of Santa Barbara County,,,,,,,,,phorsley,2/21/2019 11:17,,1,urn:uuid:6fdeeca7-1e99-44c0-94fe-c74ab3aa9ef1,https://symbiota.ccber.ucsb.edu:443/collections/individual/index.php?occid=105112
105115,UCSB,IZC,,PreservedSpecimen,7536cdc2-f793-462b-b755-b1a05091846d,UCSB-IZC00004422,,Animalia,Arthropoda,Insecta,Hymenoptera,Formicidae,Camponotus,2424,"Mayr, 1861",Camponotus,,,,I. Naughton,2017,,,,,,,,,,5/26/1983,1983,5,26,146,,,,,,,,,,,,,,,,,,,,,United States,California,Santa Barbara,,Oso,,0,,34.545861,-119.775765,WGS84,914,,,,GeoLocate,,"Oso Canyon and Oso Campground, uncertainty halfway between Oso Canyon and nearest landmark",,,,,,,,,phorsley,2/21/2019 11:21,,1,urn:uuid:7536cdc2-f793-462b-b755-b1a05091846d,https://symbiota.ccber.ucsb.edu:443/collections/individual/index.php?occid=105115
105126,UCSB,IZC,,PreservedSpecimen,f828d811-841a-4e0d-96c5-f67f6072ffb5,UCSB-IZC00004435,,Animalia,Arthropoda,Insecta,Hymenoptera,Formicidae,Camponotus,2424,"Mayr, 1861",Camponotus,,,,I. Naughton,2017,,,,,,,,,,7/1/1977,1977,7,1,182,,,,,,,,,,,,,,,,,,,,,United States,California,Santa Barbara,,Santa Cruz Island,,0,,34.008126,-119.724201,,20754,,rbehm (2018-09-17 15:29:17),,georef batch tool 2018-09-17; GeoLocate,reviewed - high confidence,,,,,,,,,,phorsley,9/17/2018 15:29,,1,urn:uuid:f828d811-841a-4e0d-96c5-f67f6072ffb5,https://symbiota.ccber.ucsb.edu:443/collections/individual/index.php?occid=105126
105130,UCSB,IZC,,PreservedSpecimen,a8ec1909-a11c-4613-87ea-733d99bfc096,UCSB-IZC00004441,,Animalia,Arthropoda,Insecta,Hymenoptera,Formicidae,Camponotus,2424,"Mayr, 1861",Camponotus,,,,I. Naughton,2017,,,,,,M. Walton,,,,5/8/2003,2003,5,8,128,,,,,,,,,,,,,,,,,,,,,United States,California,Santa Barbara,,Refugio stream area,,0,,34.490317,-119.781731,,15811,,rbehm (2018-09-28 15:25:14),,georef batch tool 2018-09-28; GeoLocate,reviewed - high confidence,,,,,,,,,,phorsley,9/28/2018 15:25,,1,urn:uuid:a8ec1909-a11c-4613-87ea-733d99bfc096,https://symbiota.ccber.ucsb.edu:443/collections/individual/index.php?occid=105130
105132,UCSB,IZC,,PreservedSpecimen,98fa04b4-0f73-4c9a-9b45-66a28286366c,UCSB-IZC00004443,,Animalia,Arthropoda,Insecta,Hymenoptera,Formicidae,Camponotus,2424,"Mayr, 1861",Camponotus,,,,I. Naughton,2017,,,,,,D. Frame,,,,2/28/1954,1954,2,28,59,,,,,,,,,,,,,,,,,,,,,United States,California,Santa Barbara,Santa Ynez,Santa Ynez Valley,,0,,34.584154,-120.097368,,6152,,rbehm (2018-09-28 15:26:13),,georef batch tool 2018-09-28; GeoLocate,reviewed - high confidence,,,,,,,,,,phorsley,9/28/2018 15:26,,1,urn:uuid:98fa04b4-0f73-4c9a-9b45-66a28286366c,https://symbiota.ccber.ucsb.edu:443/collections/individual/index.php?occid=105132
105133,UCSB,IZC,,PreservedSpecimen,7a7233f3-c228-4d14-9537-a76bbd68c8cb,UCSB-IZC00004444,,Animalia,Arthropoda,Insecta,Hymenoptera,Formicidae,Camponotus,2424,"Mayr, 1861",Camponotus,,,,I. Naughton,2017,,,,,,,,,,5/30/1983,1983,5,30,150,,,,,,,,,,,,,,,,,,,,,United States,California,Santa Barbara,,Figueroa Mountain Station,,0,,34.768394,-119.863098,,69073,,rbehm (2018-09-28 15:50:44),,georef batch tool 2018-09-28; GeoLocate,reviewed - high confidence,,,,,,,,,,phorsley,9/28/2018 15:50,,1,urn:uuid:7a7233f3-c228-4d14-9537-a76bbd68c8cb,https://symbiota.ccber.ucsb.edu:443/collections/individual/index.php?occid=105133
105134,UCSB,IZC,,PreservedSpecimen,811b5ab9-7c9a-443a-b220-f0c86d5cefc3,UCSB-IZC00004445,,Animalia,Arthropoda,Insecta,Hymenoptera,Formicidae,Camponotus,2424,"Mayr, 1861",Camponotus,,,,I. Naughton,2017,,,,,,,,,,1977-04-00,1977,4,,,,,,,,,,,,,,,,,,,,,,,United States,California,Santa Barbara,,Goddard,,0,,34.755437,-119.977081,WGS84,59626,,,,GeoLocate,,All of Santa Barbara County,,,,,,,,,phorsley,2/21/2019 11:32,,1,urn:uuid:811b5ab9-7c9a-443a-b220-f0c86d5cefc3,https://symbiota.ccber.ucsb.edu:443/collections/individual/index.php?occid=105134
105141,UCSB,IZC,,PreservedSpecimen,c30028c4-2179-45c2-873b-e5117160bc8f,UCSB-IZC00004452,,Animalia,Arthropoda,Insecta,Hymenoptera,Formicidae,Camponotus,2424,"Mayr, 1861",Camponotus,,,,I. Naughton,2017,,,,,,,,,,1973-05-00,1973,5,,,,,,,,,,,,,,,,,,,,,,,United States,California,Santa Barbara,,Santa Cruz Island,,0,,34.008126,-119.724201,,20754,,rbehm (2018-09-17 15:29:17),,georef batch tool 2018-09-17; GeoLocate,reviewed - high confidence,,,,,,,,,,phorsley,9/17/2018 15:29,,1,urn:uuid:c30028c4-2179-45c2-873b-e5117160bc8f,https://symbiota.ccber.ucsb.edu:443/collections/individual/index.php?occid=105141
105142,UCSB,IZC,,PreservedSpecimen,93c3302a-35dd-4738-b691-b6c4f273a4a7,UCSB-IZC00004454,,Animalia,Arthropoda,Insecta,Hymenoptera,Formicidae,Camponotus,2424,"Mayr, 1861",Camponotus,,,,I. Naughton,2017,,,,,,M. McGinnis,,,,4/22/1975,1975,4,22,112,,,,,,,,,,,,,,,,,,,,,United States,California,Santa Barbara,Santa Barbara,,,0,,34.42083,-119.69819,WGS84,6633,,,,GeoLocate,,Santa Barbara Municipality,,,,,,,,,phorsley,2/21/2019 11:33,,1,urn:uuid:93c3302a-35dd-4738-b691-b6c4f273a4a7,https://symbiota.ccber.ucsb.edu:443/collections/individual/index.php?occid=105142
105145,UCSB,IZC,,PreservedSpecimen,bc6ebefe-204c-4919-9040-194afb9b73d9,UCSB-IZC00004457,,Animalia,Arthropoda,Insecta,Hymenoptera,Formicidae,Camponotus,2424,"Mayr, 1861",Camponotus,,,,I. Naughton,2017,,,,,,J. Oster,,,,5/26/2015,2015,5,26,146,,,,,,,,,,,,,,,,,,,,,United States,California,Santa Barbara,Goleta,"University of California, Santa Barbara Campus",,0,,34.412534,-119.847305,,722,,rbehm (2018-10-01 13:18:25),,georef batch tool 2018-10-01; GeoLocate,reviewed - high confidence,,,,,,,,,,phorsley,10/1/2018 13:18,,1,urn:uuid:bc6ebefe-204c-4919-9040-194afb9b73d9,https://symbiota.ccber.ucsb.edu:443/collections/individual/index.php?occid=105145
105146,UCSB,IZC,,PreservedSpecimen,e5fcd0a3-5c51-4da6-a8c0-c8e9dc661756,UCSB-IZC00004458,,Animalia,Arthropoda,Insecta,Hymenoptera,Formicidae,Camponotus,2424,"Mayr, 1861",Camponotus,,,,I. Naughton,2017,,,,,,,,,,5/18/1973,1973,5,18,138,,,,,,,,,,,,,,,,,,,,,United States,California,Santa Barbara,,Santa Ynez Valley,,0,,34.584154,-120.097368,,6152,,rbehm (2018-09-28 15:26:13),,georef batch tool 2018-09-28; GeoLocate,reviewed - high confidence,,,,,,,,,,phorsley,9/28/2018 15:26,,1,urn:uuid:e5fcd0a3-5c51-4da6-a8c0-c8e9dc661756,https://symbiota.ccber.ucsb.edu:443/collections/individual/index.php?occid=105146
105147,UCSB,IZC,,PreservedSpecimen,5be3dbca-9e4b-4b12-93ae-a7f38a208334,UCSB-IZC00004459,,Animalia,Arthropoda,Insecta,Hymenoptera,Formicidae,Camponotus,2424,"Mayr, 1861",Camponotus,,,,I. Naughton,2017,,,,,,,,,,,,,,,,,,,,,,,,,,,,,,,,,,,United States,California,Santa Barbara,,Santa Cruz Island,,0,,34.008126,-119.724201,,20754,,rbehm (2018-09-17 15:29:17),,georef batch tool 2018-09-17; GeoLocate,reviewed - high confidence,,,,,,,,,,phorsley,9/17/2018 15:29,,1,urn:uuid:5be3dbca-9e4b-4b12-93ae-a7f38a208334,https://symbiota.ccber.ucsb.edu:443/collections/individual/index.php?occid=105147
105149,UCSB,IZC,,PreservedSpecimen,c59fb13d-54dd-4cee-bb9c-939bb152ee29,UCSB-IZC00004461,,Animalia,Arthropoda,Insecta,Hymenoptera,Formicidae,Camponotus,2424,"Mayr, 1861",Camponotus,,,,I. Naughton,2017,,,,,,L. Phelps,,,,5/25/2011,2011,5,25,145,,,,,,,,,,,,,,,,,,,,,United States,California,Santa Barbara,,"University of California, Santa Barbara, San Clemente",,0,,34.41794,-119.856206,WGS84,236,,,,GeoLocate,,San Clemente Villages,,,,,,,,,phorsley,2/21/2019 11:31,,1,urn:uuid:c59fb13d-54dd-4cee-bb9c-939bb152ee29,https://symbiota.ccber.ucsb.edu:443/collections/individual/index.php?occid=105149
105158,UCSB,IZC,,PreservedSpecimen,830dfe82-9ac5-4bb8-96f7-d320262a568f,UCSB-IZC00004471,,Animalia,Arthropoda,Insecta,Hymenoptera,Formicidae,Camponotus,2424,"Mayr, 1861",Camponotus,,,,I. Naughton,2017,,,,,,,,,,4/19/1973,1973,4,19,109,,,,grassland,,,,,,,,,,,,,,,,,United States,California,Santa Barbara,,Rattlesnake,,0,,34.471588,-119.687669,,3036,,rbehm (2018-09-28 15:51:51),,georef batch tool 2018-09-28; GeoLocate,reviewed - high confidence,,,,,,,,,,phorsley,9/28/2018 15:51,,1,urn:uuid:830dfe82-9ac5-4bb8-96f7-d320262a568f,https://symbiota.ccber.ucsb.edu:443/collections/individual/index.php?occid=105158
105159,UCSB,IZC,,PreservedSpecimen,40f06b56-f415-4a97-b3bc-b1adc1474bb9,UCSB-IZC00004472,,Animalia,Arthropoda,Insecta,Hymenoptera,Formicidae,Camponotus,2424,"Mayr, 1861",Camponotus,,,,I. Naughton,2017,,,,,,,,,,1969-00-00,1969,,,,,,,,,,,,,,,,,,,,,,,,United States,California,Santa Barbara,,Santa Ynez Valley,,0,,34.584154,-120.097368,,6152,,rbehm (2018-09-28 15:26:13),,georef batch tool 2018-09-28; GeoLocate,reviewed - high confidence,,,,,,,,,,phorsley,9/28/2018 15:26,,1,urn:uuid:40f06b56-f415-4a97-b3bc-b1adc1474bb9,https://symbiota.ccber.ucsb.edu:443/collections/individual/index.php?occid=105159
105161,UCSB,IZC,,PreservedSpecimen,299aad7e-5e18-46c6-bc7b-75330473aac9,UCSB-IZC00004474,,Animalia,Arthropoda,Insecta,Hymenoptera,Formicidae,Camponotus,2424,"Mayr, 1861",Camponotus,,,,I. Naughton,2017,,,,,,,,,,,,,,,,May 197,,,,,,,,,,,,,,,,,,,United States,California,Santa Barbara,,Cachuma Campground,,0,,34.583084,-119.958515,WGS84,9161,,,,GeoLocate,,Cachuma Lake Recreation Area,,,,,,,,,phorsley,2/21/2019 11:34,,1,urn:uuid:299aad7e-5e18-46c6-bc7b-75330473aac9,https://symbiota.ccber.ucsb.edu:443/collections/individual/index.php?occid=105161
105163,UCSB,IZC,,PreservedSpecimen,a149f5d3-f46d-4db8-8dc4-3d37093e697c,UCSB-IZC00004476,,Animalia,Arthropoda,Insecta,Hymenoptera,Formicidae,Camponotus,2424,"Mayr, 1861",Camponotus,,,,I. Naughton,2017,,,,,,Arun Sengupta,,,,5/30/2015,2015,5,30,150,,,,,,,,,,,,,,,,,,,,,United States,California,Santa Barbara,,Seven Falls,,0,,34.474766,-119.705127,WGS84,164,,,,GeoLocate,,"Seven Falls, halfway between Tunnel Trail",,,,,,,,,phorsley,2/21/2019 11:36,,1,urn:uuid:a149f5d3-f46d-4db8-8dc4-3d37093e697c,https://symbiota.ccber.ucsb.edu:443/collections/individual/index.php?occid=105163
105166,UCSB,IZC,,PreservedSpecimen,d654601d-6c3c-4a94-a717-82072d5d13cf,UCSB-IZC00004479,,Animalia,Arthropoda,Insecta,Hymenoptera,Formicidae,Camponotus,2424,"Mayr, 1861",Camponotus,,,,I. Naughton,2017,,,,,,UCSB Zoology 125: Susan,,,,5/6/1989,1989,5,6,126,,,,,,,,,,,,,,,,,,net,,,United States,California,Santa Barbara,,Refugio,,0,,34.490317,-119.781731,,15811,,rbehm (2018-09-28 15:25:14),,georef batch tool 2018-09-28; GeoLocate,reviewed - high confidence,,,,,,,,,,phorsley,9/28/2018 15:25,,1,urn:uuid:d654601d-6c3c-4a94-a717-82072d5d13cf,https://symbiota.ccber.ucsb.edu:443/collections/individual/index.php?occid=105166
105167,UCSB,IZC,,PreservedSpecimen,b83e23b2-7296-4616-a0be-21596754ffcd,UCSB-IZC00004481,,Animalia,Arthropoda,Insecta,Hymenoptera,Formicidae,Camponotus,2424,"Mayr, 1861",Camponotus,,,,I. Naughton,2017,,,,,,,,,,5/12/1983,1983,5,12,132,,,,,,,,,,,,,,,,,,,,,United States,California,Santa Barbara,,Goddard,,0,,34.755437,-119.977081,WGS84,59626,,,,GeoLocate,,All of Santa Barbara County,,,,,,,,,phorsley,2/21/2019 11:38,,1,urn:uuid:b83e23b2-7296-4616-a0be-21596754ffcd,https://symbiota.ccber.ucsb.edu:443/collections/individual/index.php?occid=105167
105175,UCSB,IZC,,PreservedSpecimen,5faa228d-6c10-400a-a3cf-5d20d3001630,UCSB-IZC00004490,,Animalia,Arthropoda,Insecta,Hymenoptera,Formicidae,Camponotus,2424,"Mayr, 1861",Camponotus,,,,I. Naughton,2017,,,,,,UCSB Zoology 125: KML,,,,9/26/1987,1987,9,26,269,,,,,,,,,,,,,,,,,,,,,United States,California,Santa Barbara,,Arroyo Burro,,0,,34.516667,-119.75,WGS84,10,34° 31' N 119° 45' W,,,GeoLocate,,,800,,,,,800m,,,phorsley,2/21/2019 15:33,,1,urn:uuid:5faa228d-6c10-400a-a3cf-5d20d3001630,https://symbiota.ccber.ucsb.edu:443/collections/individual/index.php?occid=105175
105177,UCSB,IZC,,PreservedSpecimen,d59a9869-61e0-4669-9965-7fded6810264,UCSB-IZC00004493,,Animalia,Arthropoda,Insecta,Hymenoptera,Formicidae,Camponotus,2424,"Mayr, 1861",Camponotus,,,,I. Naughton,2017,,,,,,,,,,4/12/1984,1984,4,12,103,,,,,,,,,,,,,,,,,,,,,United States,California,Santa Barbara,,Camino Cielo,,0,,34.537115,-119.889408,WGS84,11068,,,,GeoLocate,,,,,,,,,,,phorsley,2/21/2019 11:39,,1,urn:uuid:d59a9869-61e0-4669-9965-7fded6810264,https://symbiota.ccber.ucsb.edu:443/collections/individual/index.php?occid=105177
105180,UCSB,IZC,,PreservedSpecimen,890320bc-7381-4e8f-b9b9-a1ae876c75a7,UCSB-IZC00004496,,Animalia,Arthropoda,Insecta,Hymenoptera,Formicidae,Camponotus,2424,"Mayr, 1861",Camponotus,,,,I. Naughton,2017,,,,,,,,,,5/21/1983,1983,5,21,141,,,,,,,,,,,,,,,,,,,,,United States,California,Santa Barbara,,Figueroa Mountain Station,,0,,34.768394,-119.863098,,69073,,rbehm (2018-09-28 15:50:44),,georef batch tool 2018-09-28; GeoLocate,reviewed - high confidence,,,,,,,,,,phorsley,9/28/2018 15:50,,1,urn:uuid:890320bc-7381-4e8f-b9b9-a1ae876c75a7,https://symbiota.ccber.ucsb.edu:443/collections/individual/index.php?occid=105180
105181,UCSB,IZC,,PreservedSpecimen,7dd1afe5-6558-4671-b1b6-9786fbdd395b,UCSB-IZC00004497,,Animalia,Arthropoda,Insecta,Hymenoptera,Formicidae,Camponotus,2424,"Mayr, 1861",Camponotus,,,,I. Naughton,2017,,,,,,,,,,5/19/1984,1984,5,19,140,,,,,,,,,,,,,,,,,,,,,United States,California,Santa Barbara,,"Pino Alto, Figueroa Mountain",,0,,34.743317,-119.985143,WGS84,10182,,,,GeoLocate,,,,,,,,,,,phorsley,2/21/2019 11:40,,1,urn:uuid:7dd1afe5-6558-4671-b1b6-9786fbdd395b,https://symbiota.ccber.ucsb.edu:443/collections/individual/index.php?occid=105181
105182,UCSB,IZC,,PreservedSpecimen,a3b8b67a-5102-48c8-a275-e83b095b56f0,UCSB-IZC00004499,,Animalia,Arthropoda,Insecta,Hymenoptera,Formicidae,Camponotus,2424,"Mayr, 1861",Camponotus,,,,I. Naughton,2017,,,,,,,,,,,,,,,,Fe. 5/70 05,,,,,,,,,,,,,,,,,,,United States,California,Santa Barbara,,Refugio Canyon,,0,,34.490317,-119.781731,,15811,,rbehm (2018-09-28 15:25:14),,georef batch tool 2018-09-28; GeoLocate,reviewed - high confidence,,,,,,,,,,phorsley,9/28/2018 15:25,,1,urn:uuid:a3b8b67a-5102-48c8-a275-e83b095b56f0,https://symbiota.ccber.ucsb.edu:443/collections/individual/index.php?occid=105182
105184,UCSB,IZC,,PreservedSpecimen,c044f7f6-b90d-436b-888a-a436722b6865,UCSB-IZC00004628,,Animalia,Arthropoda,Insecta,Hymenoptera,Formicidae,Crematogaster,2473,"Lund, 1831",Crematogaster,,,,Zach Brown,2018,,,,,,Sean Brennan,,,,6/20/2016,2016,6,20,172,,,,,,,,,,,,,,,Adult,,1,sweep net,,Pinned,United States,California,Santa Barbara,,"University of California Santa Barbara, West Lagoon; 34.4083 -119.8534",,0,,34.408342,-119.853429,WGS84,10,,,,GeoLocate,,,3,,,,,3.0m,,,phorsley,2/21/2019 15:48,,1,urn:uuid:c044f7f6-b90d-436b-888a-a436722b6865,https://symbiota.ccber.ucsb.edu:443/collections/individual/index.php?occid=105184
105185,UCSB,IZC,,PreservedSpecimen,f4ba4635-fee9-40a2-ac53-9dd2a36c5766,UCSB-IZC00004668,,Animalia,Arthropoda,Insecta,Hymenoptera,Formicidae,Crematogaster,2473,"Lund, 1831",Crematogaster,,,,Zach Brown,2018,,,,,,Adam Lambert,,,,6/21/2016,2016,6,21,173,,,,,,,,,,,,,,,Adult,,1,sweep net,,Pinned,United States,California,Santa Barbara,,"University of California, Santa Barbara West Lagoon",,0,,34.407904,-119.849953,WGS84,20,,,,GeoLocate,,,3,,,,,3.0m,,,phorsley,2/21/2019 15:51,,1,urn:uuid:f4ba4635-fee9-40a2-ac53-9dd2a36c5766,https://symbiota.ccber.ucsb.edu:443/collections/individual/index.php?occid=105185
105186,UCSB,IZC,,PreservedSpecimen,309c790b-d4b9-48ac-88fc-d132fb30c6ea,UCSB-IZC00004681,,Animalia,Arthropoda,Insecta,Hymenoptera,Formicidae,Crematogaster,2473,"Lund, 1831",Crematogaster,,,,Zach Brown,2018,,,,,,Kevin Holm,,,,7/26/2016,2016,7,26,208,,,,,,,,,,,,,,,Adult,,1,sweep net,,Pinned,United States,California,Santa Barbara,Goleta,Storke Ranch; 34.4188 -119.8621,,0,,34.41883,-119.862113,WGS84,235,,,,GeoLocate,,,1,,,,,1.0m,,,phorsley,2/21/2019 15:54,,1,urn:uuid:309c790b-d4b9-48ac-88fc-d132fb30c6ea,https://symbiota.ccber.ucsb.edu:443/collections/individual/index.php?occid=105186
105187,UCSB,IZC,,PreservedSpecimen,ff767fe3-fc3f-440a-8d01-145f97b3a90e,UCSB-IZC00004699,,Animalia,Arthropoda,Insecta,Hymenoptera,Formicidae,Crematogaster,2473,"Lund, 1831",Crematogaster,,,,Zach Brown,2018,,,,,,Adam Lambert,,,,6/21/2016,2016,6,21,173,,,,,,,,,,,,,,,Adult,,1,malaise trap,,Pinned,United States,California,Santa Barbara,Goleta,University of California Santa Barbara West Lagoon; 34.4061 -119.8478,,0,,34.406102,-119.847839,WGS84,10,,,,GeoLocate,,,1,,,,,1.0m,,,phorsley,2/21/2019 15:56,,1,urn:uuid:ff767fe3-fc3f-440a-8d01-145f97b3a90e,https://symbiota.ccber.ucsb.edu:443/collections/individual/index.php?occid=105187
105189,UCSB,IZC,,PreservedSpecimen,20b0795e-d45a-457a-8e29-b60712617aac,UCSB-IZC00004705,,Animalia,Arthropoda,Insecta,Hymenoptera,Formicidae,Crematogaster,2473,"Lund, 1831",Crematogaster,,,,Zach Brown,2018,,,,,,,,,,6/25/2016,2016,6,25,177,,,,,,,,,,,,,,,Adult,,1,mesh net,,Pinned,United States,California,Santa Barbara,,Refugio Canyon,,0,,34.507726,-120.0645,WGS84,10,,,,GeoLocate,,,3,,,,,3.0m,,,phorsley,2/21/2019 16:08,,1,urn:uuid:20b0795e-d45a-457a-8e29-b60712617aac,https://symbiota.ccber.ucsb.edu:443/collections/individual/index.php?occid=105189
105191,UCSB,IZC,,PreservedSpecimen,812253b4-55d4-4c90-98e0-39c42d2a84b7,UCSB-IZC00004736,,Animalia,Arthropoda,Insecta,Hymenoptera,Formicidae,Crematogaster,2473,"Lund, 1831",Crematogaster,,,,Zach Brown,2018,,,,,,Kai Wilmsen,,,,6/21/2016,2016,6,21,173,,,,"ex. Calystegia macrostegia, crawling on stems",,,,,,,Calyystegia macrostegia,,,,Adult,,1,hand collecting,,Pinned,United States,California,Santa Barbara,,University of California Santa Barbara West Lagoon,,0,,34.4058,-119.8456,WGS84,10,,,,"GPS, on label",,,3,,,,,3.0m,,,phorsley,2/21/2019 16:09,,1,urn:uuid:812253b4-55d4-4c90-98e0-39c42d2a84b7,https://symbiota.ccber.ucsb.edu:443/collections/individual/index.php?occid=105191
105192,UCSB,IZC,,PreservedSpecimen,15c56c8c-f159-4a9a-8057-2da3ab8dc937,UCSB-IZC00004740,,Animalia,Arthropoda,Insecta,Hymenoptera,Formicidae,Crematogaster,2473,"Lund, 1831",Crematogaster,,,,Zach Brown,2018,,,,,,,,,,1968-05-00,1968,5,,,,,,,,,,,,,,,,,Adult,,1,,,Pinned,United States,California,Santa Barbara,,"University of California, Santa Barbara Campus",,0,,34.412534,-119.847305,,722,,rbehm (2018-10-01 13:18:25),,georef batch tool 2018-10-01; GeoLocate,reviewed - high confidence,,,,,,,,,,phorsley,2/20/2019 15:16,,1,urn:uuid:15c56c8c-f159-4a9a-8057-2da3ab8dc937,https://symbiota.ccber.ucsb.edu:443/collections/individual/index.php?occid=105192
105193,UCSB,IZC,,PreservedSpecimen,ba4ace3f-2390-401d-818e-ba162e9580ae,UCSB-IZC00004743,,Animalia,Arthropoda,Insecta,Hymenoptera,Formicidae,Camponotus,2424,"Mayr, 1861",Camponotus,,,,I. Naughton,2017,,,,,,M. Roberts,,,,1969-04-00,1969,4,,,,,,,,,,,,,,,,,,,,,,,United States,California,Santa Barbara,Montecito,,,0,,34.436663,-119.632075,WGS84,5323,,,,GeoLocate,,All of Montecito Municipality,,,,,,,,,phorsley,2/21/2019 11:42,,1,urn:uuid:ba4ace3f-2390-401d-818e-ba162e9580ae,https://symbiota.ccber.ucsb.edu:443/collections/individual/index.php?occid=105193
105196,UCSB,IZC,,PreservedSpecimen,64bde853-a83d-44d0-85d2-56bdd31e9995,UCSB-IZC00004748,,Animalia,Arthropoda,Insecta,Hymenoptera,Formicidae,Camponotus,2424,"Mayr, 1861",Camponotus,,,,I. Naughton,2017,,,,,,,,,,1977-05-00,1977,5,,,,,,,,,,,,,,,,,,,,,,,United States,California,Santa Barbara,,Goddard,,0,,34.755437,-119.977081,WGS84,59626,,,,GeoLocate,,All of Santa Barbara County,,,,,,,,,phorsley,2/21/2019 11:43,,1,urn:uuid:64bde853-a83d-44d0-85d2-56bdd31e9995,https://symbiota.ccber.ucsb.edu:443/collections/individual/index.php?occid=105196
105198,UCSB,IZC,,PreservedSpecimen,6a47399b-622f-4826-a5c5-956dd733d996,UCSB-IZC00004750,,Animalia,Arthropoda,Insecta,Hymenoptera,Formicidae,Camponotus,2424,"Mayr, 1861",Camponotus,,,,I. Naughton,2017,,,,,,,,,,5/22/1972,1972,5,22,143,,,,,,,,,,,,,,,,,,,,,United States,California,Santa Barbara,,Cachuma Campground,,0,,34.583084,-119.958515,WGS84,9161,,,,GeoLocate,,Included all of Cachuma Lake Recreation Area,,,,,,,,,phorsley,2/21/2019 11:43,,1,urn:uuid:6a47399b-622f-4826-a5c5-956dd733d996,https://symbiota.ccber.ucsb.edu:443/collections/individual/index.php?occid=105198
105199,UCSB,IZC,,PreservedSpecimen,1c216b55-540a-45f4-98b7-77aca1a8ff15,UCSB-IZC00004751,,Animalia,Arthropoda,Insecta,Hymenoptera,Formicidae,Camponotus,2424,"Mayr, 1861",Camponotus,,,,I. Naughton,2017,,,,,,Alain Garkanian,,,,7/9/2016,2016,7,9,191,,,,,,,,,,,,,,,,,,,,,United States,California,Santa Barbara,,Refugio Canyon,,0,,34.5077,-120.0645,WGS84,10,,,,"GPS, on label",,,,,,,,,,,phorsley,2/21/2019 16:09,,1,urn:uuid:1c216b55-540a-45f4-98b7-77aca1a8ff15,https://symbiota.ccber.ucsb.edu:443/collections/individual/index.php?occid=105199
105200,UCSB,IZC,,PreservedSpecimen,e6cb3aa2-3b40-49de-bcce-4175c3cfa138,UCSB-IZC00004752,,Animalia,Arthropoda,Insecta,Hymenoptera,Formicidae,Camponotus,2424,"Mayr, 1861",Camponotus,,,,I. Naughton,2017,,,,,,N. Pham,,,,5/16/2015,2015,5,16,136,,,,,,,,,,,,,,,,,,,,,United States,California,Santa Barbara,,Lizards Mouth Trail,,0,,34.502242,-119.867937,WGS84,381,,,,GeoLocate,,Lizards Mouth Rock,,,,,,,,,phorsley,2/21/2019 16:10,,1,urn:uuid:e6cb3aa2-3b40-49de-bcce-4175c3cfa138,https://symbiota.ccber.ucsb.edu:443/collections/individual/index.php?occid=105200
105201,UCSB,IZC,,PreservedSpecimen,d4f7ba20-ddbf-4e5e-8d78-afa71f8be877,UCSB-IZC00004754,,Animalia,Arthropoda,Insecta,Hymenoptera,Formicidae,Camponotus,2424,"Mayr, 1861",Camponotus,,,,I. Naughton,2017,,,,,,,,,,1973-05-00,1973,5,,,,,,,,,,,,,,,,,,,,,,,United States,California,Santa Barbara,,Santa Cruz Island,,0,,34.008126,-119.724201,,20754,,rbehm (2018-09-17 15:33:25),,georef batch tool 2018-09-17; GeoLocate,reviewed - high confidence,,,,,,,,,,phorsley,2/21/2019 16:10,,1,urn:uuid:d4f7ba20-ddbf-4e5e-8d78-afa71f8be877,https://symbiota.ccber.ucsb.edu:443/collections/individual/index.php?occid=105201
105202,UCSB,IZC,,PreservedSpecimen,f130c57a-61fb-4e68-82bd-19a4c6f6d027,UCSB-IZC00004757,,Animalia,Arthropoda,Insecta,Hymenoptera,Formicidae,Camponotus,2424,"Mayr, 1861",Camponotus,,,,I. Naughton,2017,,,,,,Andy Lanes,,,69,5/6/2011,2011,5,6,126,,,,,,,,,,,,,,,,,,,,,United States,California,Santa Barbara,Santa Barbara,,,0,,34.42083,-119.69819,WGS84,6633,,,,GeoLocate,,Santa Barbara Municipality,,,,,,,,,phorsley,2/21/2019 16:11,,1,urn:uuid:f130c57a-61fb-4e68-82bd-19a4c6f6d027,https://symbiota.ccber.ucsb.edu:443/collections/individual/index.php?occid=105202
105204,UCSB,IZC,,PreservedSpecimen,011b5a90-41e4-48ae-8922-86c8921ce629,UCSB-IZC00004760,,Animalia,Arthropoda,Insecta,Hymenoptera,Formicidae,Camponotus,2424,"Mayr, 1861",Camponotus,,,,I. Naughton,2017,,,,,,,,,,1981-05-00,1981,5,,,,,,,,,,,,,,,,,,,,,,,United States,California,Santa Barbara,,Figueroa Mountain,,0,,34.768394,-119.863098,,69073,,rbehm (2018-09-28 15:50:44),,georef batch tool 2018-09-28; GeoLocate,reviewed - high confidence,,,,,,,,,,phorsley,9/28/2018 15:50,,1,urn:uuid:011b5a90-41e4-48ae-8922-86c8921ce629,https://symbiota.ccber.ucsb.edu:443/collections/individual/index.php?occid=105204
105206,UCSB,IZC,,PreservedSpecimen,861d9f9b-d151-4976-a318-3f9b39cdf0b3,UCSB-IZC00004762,,Animalia,Arthropoda,Insecta,Hymenoptera,Formicidae,Camponotus,2424,"Mayr, 1861",Camponotus,,,,I. Naughton,2017,,,,,,,,,,5/28/1969,1969,5,28,148,,,,,,,,,,,,,,,,,,,,,United States,California,Santa Barbara,,Santa Ynez Valley,,0,,34.584154,-120.097368,WGS84,2943,,,,GeoLocate,,"All of Santa Ynez Valley, uncertainty halfway between Valley and Solvang",,,,,,,,,phorsley,2/21/2019 11:50,,1,urn:uuid:861d9f9b-d151-4976-a318-3f9b39cdf0b3,https://symbiota.ccber.ucsb.edu:443/collections/individual/index.php?occid=105206
105208,UCSB,IZC,,PreservedSpecimen,ee17d3a7-2226-4bde-ba16-80e889d57229,UCSB-IZC00004764,,Animalia,Arthropoda,Insecta,Hymenoptera,Formicidae,Camponotus,2424,"Mayr, 1861",Camponotus,,,,I. Naughton,2017,,,,,,HLW,,,,4/10/1949,1949,4,10,100,,,,,,,,,,,,,,,,,,,,,United States,California,Santa Barbara,,Figueroa Mountain,,0,,34.768394,-119.863098,,69073,,rbehm (2018-09-28 15:50:44),,georef batch tool 2018-09-28; GeoLocate,reviewed - high confidence,,,,,,,,,,phorsley,9/28/2018 15:50,,1,urn:uuid:ee17d3a7-2226-4bde-ba16-80e889d57229,https://symbiota.ccber.ucsb.edu:443/collections/individual/index.php?occid=105208
105209,UCSB,IZC,,PreservedSpecimen,6ffaa2b3-b79d-4d98-8959-36d43bcc6215,UCSB-IZC00004765,,Animalia,Arthropoda,Insecta,Hymenoptera,Formicidae,Camponotus,2424,"Mayr, 1861",Camponotus,,,,I. Naughton,2017,,,,,,,,,,1969-00-00,1969,,,,,,,,,,,,,,,,,,,,,,,,United States,California,Santa Barbara,,Figueroa Mountain,,0,,34.768394,-119.863098,,69073,,rbehm (2018-09-28 15:50:44),,georef batch tool 2018-09-28; GeoLocate,reviewed - high confidence,,,,,,,,,,phorsley,9/28/2018 15:50,,1,urn:uuid:6ffaa2b3-b79d-4d98-8959-36d43bcc6215,https://symbiota.ccber.ucsb.edu:443/collections/individual/index.php?occid=105209
105210,UCSB,IZC,,PreservedSpecimen,78897fd6-6dc0-4ccb-b7c7-0090a851d5a5,UCSB-IZC00004766,,Animalia,Arthropoda,Insecta,Hymenoptera,Formicidae,Camponotus,2424,"Mayr, 1861",Camponotus,,,,I. Naughton,2017,,,,,,,,,,5/30/1981,1981,5,30,150,,,,,,,,,,,,,,,,,,,,,United States,California,Santa Barbara,,Figueroa Mountain Station,,0,,34.768394,-119.863098,,69073,,rbehm (2018-09-28 15:50:44),,georef batch tool 2018-09-28; GeoLocate,reviewed - high confidence,,,,,,,,,,phorsley,9/28/2018 15:50,,1,urn:uuid:78897fd6-6dc0-4ccb-b7c7-0090a851d5a5,https://symbiota.ccber.ucsb.edu:443/collections/individual/index.php?occid=105210
105211,UCSB,IZC,,PreservedSpecimen,5e6aee1f-b4fc-4105-a7a9-0eba001c1216,UCSB-IZC00004767,,Animalia,Arthropoda,Insecta,Hymenoptera,Formicidae,Camponotus,2424,"Mayr, 1861",Camponotus,,,,I. Naughton,2017,,,,,,UCSB Zoology 125: D.T. Sammond,,,,6/3/1984,1984,6,3,155,,,,dead logs,,,,,,,,,,,,,,,,,United States,California,Santa Barbara,,Figueroa Mountain,,0,,34.768394,-119.863098,,69073,,rbehm (2018-09-28 15:50:44),,georef batch tool 2018-09-28; GeoLocate,reviewed - high confidence,,,,,,,,,,phorsley,9/28/2018 15:50,,1,urn:uuid:5e6aee1f-b4fc-4105-a7a9-0eba001c1216,https://symbiota.ccber.ucsb.edu:443/collections/individual/index.php?occid=105211
105212,UCSB,IZC,,PreservedSpecimen,cae48442-d7ff-4c45-a6e6-a220ccc45d17,UCSB-IZC00004768,,Animalia,Arthropoda,Insecta,Hymenoptera,Formicidae,Camponotus,2424,"Mayr, 1861",Camponotus,,,,I. Naughton,2017,,,,,,Girl in Lab,,,,5/21/2015,2015,5,21,141,,,,,,,,,,,,,,,,,,,,,United States,California,Santa Barbara,,"University of California, Santa Barbara Lagoon",,0,,34.408606,-119.847083,,548,,rbehm (2018-09-28 16:05:54),,georef batch tool 2018-09-28; GeoLocate,reviewed - high confidence,,,,,,,,,,phorsley,9/28/2018 16:05,,1,urn:uuid:cae48442-d7ff-4c45-a6e6-a220ccc45d17,https://symbiota.ccber.ucsb.edu:443/collections/individual/index.php?occid=105212
105213,UCSB,IZC,,PreservedSpecimen,e8187df2-8cc7-48dd-9318-88472d638229,UCSB-IZC00004770,,Animalia,Arthropoda,Insecta,Hymenoptera,Formicidae,Camponotus,2424,"Mayr, 1861",Camponotus,,,,I. Naughton,2017,,,,,,Christopher Perry,,,,6/29/2016,2016,6,29,181,,,,,,,,,,,,,,,,,,Glass Jar,,,United States,California,Santa Barbara,Isla Vista,,,0,,34.413329,-119.860972,WGS84,2164,,,,GeoLocate,,"Coordinates show Lake Cachuma Recreation Area, but label indicates Isla Vista",3,,,,,3.0m,,,phorsley,2/21/2019 16:14,,1,urn:uuid:e8187df2-8cc7-48dd-9318-88472d638229,https://symbiota.ccber.ucsb.edu:443/collections/individual/index.php?occid=105213
105218,UCSB,IZC,,PreservedSpecimen,5439611f-8512-412f-bdc2-c7913334048a,UCSB-IZC00004778,,Animalia,Arthropoda,Insecta,Hymenoptera,Formicidae,Camponotus,2424,"Mayr, 1861",Camponotus,,,,I. Naughton,2017,,,,,,,,,,1964-02-00,1964,2,,,,,,,,,,,,,,,,,,,,,,,United States,California,Santa Barbara,,Santa Ynez Valley,,0,,34.584154,-120.097368,,6152,,rbehm (2018-09-28 15:26:13),,georef batch tool 2018-09-28; GeoLocate,reviewed - high confidence,,,,,,,,,,phorsley,9/28/2018 15:26,,1,urn:uuid:5439611f-8512-412f-bdc2-c7913334048a,https://symbiota.ccber.ucsb.edu:443/collections/individual/index.php?occid=105218
105219,UCSB,IZC,,PreservedSpecimen,e046efc4-a511-4294-8458-f5e543fb2076,UCSB-IZC00004780,,Animalia,Arthropoda,Insecta,Hymenoptera,Formicidae,Camponotus,2424,"Mayr, 1861",Camponotus,,,,I. Naughton,2017,,,,,,C.F. Soo Hoo,,,,4/19/1956,1956,4,19,110,,,,,,,,,,,,,,,,,,,,,United States,California,Santa Barbara,Santa Ynez,Davy Brown Canyon,,0,,34.758288,-119.954171,WGS84,944,,,,GeoLocate,,"Davy Brown Campground, uncertainty to Willow Creek Canyon",,,,,,,,,phorsley,2/21/2019 11:56,,1,urn:uuid:e046efc4-a511-4294-8458-f5e543fb2076,https://symbiota.ccber.ucsb.edu:443/collections/individual/index.php?occid=105219
105220,UCSB,IZC,,PreservedSpecimen,296afded-b98c-4af4-a502-3b326cd8220a,UCSB-IZC00004781,,Animalia,Arthropoda,Insecta,Hymenoptera,Formicidae,Camponotus,2424,"Mayr, 1861",Camponotus,,,,I. Naughton,2017,,,,,,,,,,6/3/1987,1987,6,3,154,,,,,,,,,,,,,,,,,,,,,United States,California,Santa Barbara,,Figueroa Mountain Station,,0,,34.768394,-119.863098,,69073,,rbehm (2018-09-28 15:50:44),,georef batch tool 2018-09-28; GeoLocate,reviewed - high confidence,,,,,,,,,,phorsley,9/28/2018 15:50,,1,urn:uuid:296afded-b98c-4af4-a502-3b326cd8220a,https://symbiota.ccber.ucsb.edu:443/collections/individual/index.php?occid=105220
105221,UCSB,IZC,,PreservedSpecimen,3b084b04-d1ed-4ad7-a662-496b1f6b0a94,UCSB-IZC00004782,,Animalia,Arthropoda,Insecta,Hymenoptera,Formicidae,Camponotus,2424,"Mayr, 1861",Camponotus,,,,I. Naughton,2017,,,,,,,,,,1973-05-00,1973,5,,,,,,,,,,,,,,,,,,,,,,,United States,California,Santa Barbara,,Santa Cruz Island,,0,,34.008126,-119.724201,,20754,,rbehm (2018-09-17 15:29:17),,georef batch tool 2018-09-17; GeoLocate,reviewed - high confidence,,,,,,,,,,phorsley,9/17/2018 15:29,,1,urn:uuid:3b084b04-d1ed-4ad7-a662-496b1f6b0a94,https://symbiota.ccber.ucsb.edu:443/collections/individual/index.php?occid=105221
105222,UCSB,IZC,,PreservedSpecimen,5f4266b1-93d5-4926-bb86-1142b04d3322,UCSB-IZC00004784,,Animalia,Arthropoda,Insecta,Hymenoptera,Formicidae,Camponotus,2424,"Mayr, 1861",Camponotus,,,,I. Naughton,2017,,,,,,Tim Burgess,,,,5/19/2003,2003,5,19,139,,,prep: A. Henderson,,,,,,,,,,,,,,,,,,United States,California,Santa Barbara,,Rattlesnake Canyon,,0,,34.471588,-119.687669,,3036,,rbehm (2018-09-28 15:51:51),,georef batch tool 2018-09-28; GeoLocate,reviewed - high confidence,,,,,,,,,,phorsley,9/28/2018 15:51,,1,urn:uuid:5f4266b1-93d5-4926-bb86-1142b04d3322,https://symbiota.ccber.ucsb.edu:443/collections/individual/index.php?occid=105222
105223,UCSB,IZC,,PreservedSpecimen,5265ffbc-aafa-4673-9ff6-7c389059b74b,UCSB-IZC00004785,,Animalia,Arthropoda,Insecta,Hymenoptera,Formicidae,Camponotus,2424,"Mayr, 1861",Camponotus,,,,I. Naughton,2017,,,,,,,,,,5/24/1973,1973,5,24,144,,,,,,,,,,,,,,,,,,,,,United States,California,Santa Barbara,,Oso Campground,,0,,34.546854,-119.770079,WGS84,1992,,,,GeoLocate,,"Upper, Lower, and Resort Oso Campground",,,,,,,,,phorsley,2/21/2019 11:59,,1,urn:uuid:5265ffbc-aafa-4673-9ff6-7c389059b74b,https://symbiota.ccber.ucsb.edu:443/collections/individual/index.php?occid=105223
105224,UCSB,IZC,,PreservedSpecimen,73be6813-567f-4d21-aa3f-fd0866f9892f,UCSB-IZC00004786,,Animalia,Arthropoda,Insecta,Hymenoptera,Formicidae,Camponotus,2424,"Mayr, 1861",Camponotus,,,,I. Naughton,2017,,,,,,,,,,1981-05-00,1981,5,,,,,,,,,,,,,,,,,,,,,,,United States,California,Santa Barbara,Isla Vista,,,0,,34.413329,-119.860972,WGS84,2164,,,,GeoLocate,,Isla Vista Municipality,,,,,,,,,phorsley,2/21/2019 12:00,,1,urn:uuid:73be6813-567f-4d21-aa3f-fd0866f9892f,https://symbiota.ccber.ucsb.edu:443/collections/individual/index.php?occid=105224
105225,UCSB,IZC,,PreservedSpecimen,cc9aee57-16f1-4e33-b649-73ec96e7fb21,UCSB-IZC00004787,,Animalia,Arthropoda,Insecta,Hymenoptera,Formicidae,Camponotus,2424,"Mayr, 1861",Camponotus,,,,I. Naughton,2017,,,,,,,,,,1975-05-00,1975,5,,,,,,,,,,,,,,,,,,,,,,,United States,California,Santa Barbara,Isla Vista,,,0,,34.413329,-119.860972,WGS84,2164,,,,GeoLocate,,Isla Vista Municipality,,,,,,,,,phorsley,2/21/2019 12:00,,1,urn:uuid:cc9aee57-16f1-4e33-b649-73ec96e7fb21,https://symbiota.ccber.ucsb.edu:443/collections/individual/index.php?occid=105225
105226,UCSB,IZC,,PreservedSpecimen,0482e955-c9bf-4d7b-b6f3-a77aae8dd526,UCSB-IZC00004788,,Animalia,Arthropoda,Insecta,Hymenoptera,Formicidae,Camponotus,2424,"Mayr, 1861",Camponotus,,,,I. Naughton,2017,,,,,,,,,,5/10/1981,1981,5,10,130,,,,,,,,,,,,,,,,,,,,,United States,California,Santa Barbara,,Carp Ranch,,0,,34.398884,-119.518456,WGS84,3873,,,,GeoLocate,,All of Carpinteria,,,,,,,,,phorsley,2/21/2019 12:08,,1,urn:uuid:0482e955-c9bf-4d7b-b6f3-a77aae8dd526,https://symbiota.ccber.ucsb.edu:443/collections/individual/index.php?occid=105226
105227,UCSB,IZC,,PreservedSpecimen,6b83f7dc-a1ef-40b4-aa55-a6400d2a27be,UCSB-IZC00004790,,Animalia,Arthropoda,Insecta,Hymenoptera,Formicidae,Camponotus,2424,"Mayr, 1861",Camponotus,,,,I. Naughton,2017,,,,,,Eduardo Moria,,,,4/23/1963,1963,4,23,113,,,,,,,,,,,,,,,,,,,,,United States,California,Santa Barbara,,Santa Ynez Valley,,0,,34.584154,-120.097368,,6152,,rbehm (2018-09-28 15:26:13),,georef batch tool 2018-09-28; GeoLocate,reviewed - high confidence,,,,,,,,,,phorsley,9/28/2018 15:26,,1,urn:uuid:6b83f7dc-a1ef-40b4-aa55-a6400d2a27be,https://symbiota.ccber.ucsb.edu:443/collections/individual/index.php?occid=105227
105228,UCSB,IZC,,PreservedSpecimen,2db7d0a2-c18a-4d2c-8716-360d13930698,UCSB-IZC00004793,,Animalia,Arthropoda,Insecta,Hymenoptera,Formicidae,Camponotus,2424,"Mayr, 1861",Camponotus,,,,I. Naughton,2017,,,,,,Alain Garkanian,,,,7/17/2016,2016,7,17,199,,,,,,,,,,,,,,,,,,,,,United States,California,Santa Barbara,,Girsh Park; 34.335 -119.8741,,0,,34.425798,-119.874626,WGS84,234,,,,GeoLocate,,"Coordinates show coast off Isla Vista, but label indicates Girsh Park",1,,,,,1.0m,,,phorsley,2/21/2019 16:17,,1,urn:uuid:2db7d0a2-c18a-4d2c-8716-360d13930698,https://symbiota.ccber.ucsb.edu:443/collections/individual/index.php?occid=105228
105229,UCSB,IZC,,PreservedSpecimen,51c11047-eb98-46aa-8ba7-c4a3cdfc8c8f,UCSB-IZC00004796,,Animalia,Arthropoda,Insecta,Hymenoptera,Formicidae,Camponotus,2424,"Mayr, 1861",Camponotus,,,,I. Naughton,2017,,,,,,,,,,1975-05-00,1975,5,,,,,,,,,,,,,,,,,,,,,,,United States,California,Santa Barbara,,Paradise,,0,,34.542216,-119.813751,WGS84,8022,,,,GeoLocate,,Paradise Campground,,,,,,,,,phorsley,2/21/2019 12:12,,1,urn:uuid:51c11047-eb98-46aa-8ba7-c4a3cdfc8c8f,https://symbiota.ccber.ucsb.edu:443/collections/individual/index.php?occid=105229
105230,UCSB,IZC,,PreservedSpecimen,589831d9-3292-49a6-a482-078463dc99f5,UCSB-IZC00004799,,Animalia,Arthropoda,Insecta,Hymenoptera,Formicidae,Camponotus,2424,"Mayr, 1861",Camponotus,,,,I. Naughton,2017,,,,,,,,,,6/1/1975,1975,6,1,152,,,,,,,,,,,,,,,,,,,,,United States,California,Santa Barbara,,Paradise,,0,,34.542216,-119.813751,WGS84,6355,,,,GeoLocate,,Paradise Campground,,,,,,,,,phorsley,2/21/2019 12:13,,1,urn:uuid:589831d9-3292-49a6-a482-078463dc99f5,https://symbiota.ccber.ucsb.edu:443/collections/individual/index.php?occid=105230
105233,UCSB,IZC,,PreservedSpecimen,0cfad8de-51b6-43c4-b6cd-7ab43a9c6d28,UCSB-IZC00007026,,Animalia,Arthropoda,Insecta,Hymenoptera,Formicidae,Camponotus,2424,"Mayr, 1861",Camponotus,,,,I. Naughton,2017,,,,,,,,,,1975-05-00,1975,5,,,,,,,,,,,,,,,,,,,,,,,United States,California,Santa Barbara,,Santa Ynez River,,0,,34.685483,-120.581155,WGS84,1384,,,,GeoLocate,,All along Santa Ynez River,,,,,,,,,phorsley,2/21/2019 12:14,,1,urn:uuid:0cfad8de-51b6-43c4-b6cd-7ab43a9c6d28,https://symbiota.ccber.ucsb.edu:443/collections/individual/index.php?occid=105233
105234,UCSB,IZC,,PreservedSpecimen,76d9773e-658d-437f-a396-8743d09a7e0b,UCSB-IZC00007027,,Animalia,Arthropoda,Insecta,Hymenoptera,Formicidae,Camponotus,2424,"Mayr, 1861",Camponotus,,,,Ida Naughton,2017,,,,,,,,,,6/1/1981,1981,6,1,152,,,,,,,,,,,,,,,,,,,,,United States,California,Santa Barbara,,"Pino Alto, Figueroa Mountain",,0,,34.743317,-119.985143,WGS84,10182,,,,GeoLocate,,Figueroa Mountain,,,,,,,,,phorsley,2/21/2019 12:14,,1,urn:uuid:76d9773e-658d-437f-a396-8743d09a7e0b,https://symbiota.ccber.ucsb.edu:443/collections/individual/index.php?occid=105234
105235,UCSB,IZC,,PreservedSpecimen,489624c4-f7ef-4859-a5c2-ec2f406e7a1f,UCSB-IZC00007028,,Animalia,Arthropoda,Insecta,Hymenoptera,Formicidae,Camponotus,2424,"Mayr, 1861",Camponotus,,,,I. Naughton,2017,,,,,,,,,,,,,,,,196,,,,,,,,,,,,,,,,,,,United States,California,Santa Barbara,,Refugio Canyon,,0,,34.490317,-119.781731,,15811,,rbehm (2018-09-28 15:25:14),,georef batch tool 2018-09-28; GeoLocate,reviewed - high confidence,,,,,,,,,,phorsley,9/28/2018 15:25,,1,urn:uuid:489624c4-f7ef-4859-a5c2-ec2f406e7a1f,https://symbiota.ccber.ucsb.edu:443/collections/individual/index.php?occid=105235
105237,UCSB,IZC,,PreservedSpecimen,5213adcc-9d6f-481b-a562-af572191300f,UCSB-IZC00007033,,Animalia,Arthropoda,Insecta,Hymenoptera,Formicidae,Camponotus,2424,"Mayr, 1861",Camponotus,,,,I. Naughton,2017,,,,,,,,,,1966-03-00,1966,3,,,,,,,,,,,,,,,,,,,,,,,United States,California,Santa Barbara,,Oso Campground,,0,,34.546854,-119.770079,WGS84,1992,,,,GeoLocate,,"Upper, Lower, and Resort Oso Campground",,,,,,,,,phorsley,2/21/2019 12:15,,1,urn:uuid:5213adcc-9d6f-481b-a562-af572191300f,https://symbiota.ccber.ucsb.edu:443/collections/individual/index.php?occid=105237
105238,UCSB,IZC,,PreservedSpecimen,5dd900c8-63cc-4f9a-b9de-bd27eb55aae5,UCSB-IZC00007039,,Animalia,Arthropoda,Insecta,Hymenoptera,Formicidae,Camponotus,2424,"Mayr, 1861",Camponotus,,,,I. Naughton,2017,,,,,,E. Mollenhauer,,,,5/23/2015,2015,5,23,143,,,,,,,,,,,,,,,,,,,,,United States,California,Santa Barbara,,Lizards Mouth,,0,,34.502548,-119.867905,WGS84,447,,,,GeoLocate,,Lizards Mouth Rock,,,,,,,,,phorsley,2/21/2019 12:18,,1,urn:uuid:5dd900c8-63cc-4f9a-b9de-bd27eb55aae5,https://symbiota.ccber.ucsb.edu:443/collections/individual/index.php?occid=105238
105239,UCSB,IZC,,PreservedSpecimen,dd861d57-c404-4c0d-b6b7-1650569b4317,UCSB-IZC00007040,,Animalia,Arthropoda,Insecta,Hymenoptera,Formicidae,Camponotus,2424,"Mayr, 1861",Camponotus,,,,I. Naughton,2017,,,,,,Paul Ross,,,,5/7/1989,1989,5,7,127,,,,on shirt,,,,,,,,,,,,,,,,,United States,California,Santa Barbara,Isla Vista,On shirt,,0,,34.413329,-119.860972,WGS84,2164,,,,GeoLocate,,,,,,,,,,,phorsley,2/21/2019 16:18,,1,urn:uuid:dd861d57-c404-4c0d-b6b7-1650569b4317,https://symbiota.ccber.ucsb.edu:443/collections/individual/index.php?occid=105239
105240,UCSB,IZC,,PreservedSpecimen,9ae1e0ec-dadd-456a-b08e-9a8a2cb8943b,UCSB-IZC00007045,,Animalia,Arthropoda,Insecta,Hymenoptera,Formicidae,Camponotus,2424,"Mayr, 1861",Camponotus,,,,I. Naughton,2017,,,,,,,,,,1970-05-00,1970,5,,,,May 10 or 70,,,,,,,,,,,,,,,,,,,United States,California,Santa Barbara,,Santa Ynez Valley,,0,,34.584154,-120.097368,,6152,,rbehm (2018-09-28 15:26:13),,georef batch tool 2018-09-28; GeoLocate,reviewed - high confidence,,,,,,,,,,phorsley,9/28/2018 15:26,,1,urn:uuid:9ae1e0ec-dadd-456a-b08e-9a8a2cb8943b,https://symbiota.ccber.ucsb.edu:443/collections/individual/index.php?occid=105240
105241,UCSB,IZC,,PreservedSpecimen,203dd302-6b66-4a77-b130-da6a43ea26f8,UCSB-IZC00007046,,Animalia,Arthropoda,Insecta,Hymenoptera,Formicidae,Camponotus,2424,"Mayr, 1861",Camponotus,,,,I. Naughton,2017,,,,,,,,,,5/31/1975,1975,5,31,151,,,,,,,,,,,,,,,,,,,,,United States,California,Santa Barbara,,Santa Ynez River,,0,,34.685483,-120.581155,WGS84,1384,,,,GeoLocate,,,,,,,,,,,phorsley,2/21/2019 16:19,,1,urn:uuid:203dd302-6b66-4a77-b130-da6a43ea26f8,https://symbiota.ccber.ucsb.edu:443/collections/individual/index.php?occid=105241
105243,UCSB,IZC,,PreservedSpecimen,da38a685-7e8a-4e1b-81e9-6f9c4d9e26c3,UCSB-IZC00007052,,Animalia,Arthropoda,Insecta,Hymenoptera,Formicidae,Camponotus,2424,"Mayr, 1861",Camponotus,,,,I. Naughton,2017,,,,,,R.A. Fraundorf,,,,3/16/1956,1956,3,16,76,,,,,,,,,,,,,,,,,,,,,United States,California,Santa Barbara,Santa Ynez,Oso Canyon,,0,,34.545272,-119.775695,WGS84,1506,,,,GeoLocate,,,,,,,,,,,phorsley,2/21/2019 16:20,,1,urn:uuid:da38a685-7e8a-4e1b-81e9-6f9c4d9e26c3,https://symbiota.ccber.ucsb.edu:443/collections/individual/index.php?occid=105243
105245,UCSB,IZC,,PreservedSpecimen,deacdd0d-412c-4024-b48e-791f48b8ec3c,UCSB-IZC00007058,,Animalia,Arthropoda,Insecta,Hymenoptera,Formicidae,Camponotus,2424,"Mayr, 1861",Camponotus,,,,I. Naughton,2017,,,,,,,,,,5/12/1983,1983,5,12,132,,,,,,,,,,,,,,,,,,,,,United States,California,Santa Barbara,,Goddard,,0,,34.525975,-119.954017,WGS84,9229,,,,GeoLocate,,,,,,,,,,,phorsley,2/21/2019 16:28,,1,urn:uuid:deacdd0d-412c-4024-b48e-791f48b8ec3c,https://symbiota.ccber.ucsb.edu:443/collections/individual/index.php?occid=105245
105246,UCSB,IZC,,PreservedSpecimen,fb2b3a20-eebf-4fb7-84b5-bd9bab843fab,UCSB-IZC00007059,,Animalia,Arthropoda,Insecta,Hymenoptera,Formicidae,Camponotus,2424,"Mayr, 1861",Camponotus,,,,I. Naughton,2017,,,,,,,,,,1981-05-00,1981,5,,,,,,,,,,,,,,,,,,,,,,,United States,California,Santa Barbara,,Red Rock Campground,,0,,34.53981,-119.71913,,136,,rbehm (2018-09-17 15:17:48),,georef batch tool 2018-09-17,reviewed - high confidence,,,,,,,,,,phorsley,9/17/2018 15:17,,1,urn:uuid:fb2b3a20-eebf-4fb7-84b5-bd9bab843fab,https://symbiota.ccber.ucsb.edu:443/collections/individual/index.php?occid=105246
105247,UCSB,IZC,,PreservedSpecimen,ccf74353-cd06-4e10-8960-8b2f84217c98,UCSB-IZC00007063,,Animalia,Arthropoda,Insecta,Hymenoptera,Formicidae,Camponotus,2424,"Mayr, 1861",Camponotus,,,,I. Naughton,2017,,,,,,,,,,1966-03-00,1966,3,,,,,,,,,,,,,,,,,,,,,,,United States,California,Santa Barbara,,Oso Campground,,0,,34.548975,-119.769135,WGS84,728,,,,GeoLocate,,,,,,,,,,,phorsley,2/21/2019 16:37,,1,urn:uuid:ccf74353-cd06-4e10-8960-8b2f84217c98,https://symbiota.ccber.ucsb.edu:443/collections/individual/index.php?occid=105247
105249,UCSB,IZC,,PreservedSpecimen,42a465c6-08d7-467e-907c-59f6adb19bf2,UCSB-IZC00007065,,Animalia,Arthropoda,Insecta,Hymenoptera,Formicidae,Camponotus,2424,"Mayr, 1861",Camponotus,,,,I. Naughton,2017,,,,,,,,,,1966-03-00,1966,3,,,,,,,,,,,,,,,,,,,,,,,United States,California,Santa Barbara,,Oso Campground,,0,,34.549505,-119.769693,WGS84,728,,,,GeoLocate,,,,,,,,,,,phorsley,2/21/2019 16:38,,1,urn:uuid:42a465c6-08d7-467e-907c-59f6adb19bf2,https://symbiota.ccber.ucsb.edu:443/collections/individual/index.php?occid=105249
105251,UCSB,IZC,,PreservedSpecimen,3b47e9ae-e6c9-4627-93c3-da4ba6e72b87,UCSB-IZC00007070,,Animalia,Arthropoda,Insecta,Hymenoptera,Formicidae,Camponotus,2424,"Mayr, 1861",Camponotus,,,,I. Naughton,2017,,,,,,,,,,4/29/1981,1981,4,29,119,,,,,,,,,,,,,,,,,,,,,United States,California,Santa Barbara,,Red Rock Campground,,0,,34.53981,-119.71913,,136,,rbehm (2018-09-17 15:17:48),,georef batch tool 2018-09-17,reviewed - high confidence,,,,,,,,,,phorsley,9/17/2018 15:17,,1,urn:uuid:3b47e9ae-e6c9-4627-93c3-da4ba6e72b87,https://symbiota.ccber.ucsb.edu:443/collections/individual/index.php?occid=105251
105252,UCSB,IZC,,PreservedSpecimen,7bec6e7a-f538-4d7c-a5b5-2333c9b667c2,UCSB-IZC00007072,,Animalia,Arthropoda,Insecta,Hymenoptera,Formicidae,Camponotus,2424,"Mayr, 1861",Camponotus,,,,I. Naughton,2017,,,,,,C.F. Soo Hoo,,,,4/19/1956,1956,4,19,110,,,,,,,,,,,,,,,,,,,,,United States,California,Santa Barbara,Santa Ynez,Davy Brown Canyon,,0,,34.758288,-119.954171,WGS84,1845,,,,GeoLocate,,Davy Brown Campground and Davy Brown Creek,,,,,,,,,phorsley,2/21/2019 16:56,,1,urn:uuid:7bec6e7a-f538-4d7c-a5b5-2333c9b667c2,https://symbiota.ccber.ucsb.edu:443/collections/individual/index.php?occid=105252
105520,UCSB,IZC,,PreservedSpecimen,36a39f19-9521-4cc5-b5f8-971fc75437dd,UCSB-IZC00010576,,Animalia,Arthropoda,Insecta,Hymenoptera,Formicidae,Camponotus,2424,"Mayr, 1861",Camponotus,,,,I. Naughton,2017,,,,,,,,,,4/13/1973,1973,4,13,103,,,,,,,,,,,,,,,,,,,,,United States,California,Santa Barbara,,Scofield Park,,0,,34.742348,-119.854858,,62591,,rbehm (2018-10-08 14:29:36),,georef batch tool 2018-10-08; GeoLocate,reviewed - high confidence,,,,,,,,,,phorsley,10/8/2018 14:29,,1,urn:uuid:36a39f19-9521-4cc5-b5f8-971fc75437dd,https://symbiota.ccber.ucsb.edu:443/collections/individual/index.php?occid=105520
105535,UCSB,IZC,,PreservedSpecimen,dbb40eb8-5ffe-430f-9731-b3a3b11132e9,UCSB-IZC00010596,,Animalia,Arthropoda,Insecta,Hymenoptera,Formicidae,Camponotus,2424,"Mayr, 1861",Camponotus,,,,I. Naughton,2017,,,,,,,,,,1982-04-00,1982,4,,,,,,,,,,,,,,,,,,,,,,,United States,California,Santa Barbara,,"University of California, Santa Barbara",,0,,34.412534,-119.847305,,722,,rbehm (2018-09-28 15:54:55),,georef batch tool 2018-09-28; GeoLocate,reviewed - high confidence,,,,,,,,,,phorsley,9/28/2018 15:54,,1,urn:uuid:dbb40eb8-5ffe-430f-9731-b3a3b11132e9,https://symbiota.ccber.ucsb.edu:443/collections/individual/index.php?occid=105535
105543,UCSB,IZC,,PreservedSpecimen,8a517a73-1118-4e9b-be56-8e1b5ef5e846,UCSB-IZC00010608,,Animalia,Arthropoda,Insecta,Hymenoptera,Formicidae,Camponotus,2424,"Mayr, 1861",Camponotus,,,,I. Naughton,2017,,,,,,,,,,5/19/1984,1984,5,19,140,,,,,,,,,,,,,,,,,,,,,United States,California,Santa Barbara,,"Pino Alto, Figueroa Mountain",,0,,34.743317,-119.985143,WGS84,1245,,,,GeoLocate,,Center at Pino Alto Picnic Area,,,,,,,,,phorsley,2/21/2019 17:04,,1,urn:uuid:8a517a73-1118-4e9b-be56-8e1b5ef5e846,https://symbiota.ccber.ucsb.edu:443/collections/individual/index.php?occid=105543
105971,UCSB,IZC,,PreservedSpecimen,dc663331-7057-424c-994c-70cf2ce4d7d2,UCSB-IZC00000520,,Animalia,Arthropoda,Insecta,Hymenoptera,Formicidae,Liometopum occidentale,5024,"Emery, 1895",Liometopum,occidentale,,,Elaine Tan,2018,,,,,,,,,,5/10/1974,1974,5,10,130,,,,,,,,,,,,,,,Adult,,1,,,Pinned,United States,California,Santa Barbara,,"Goddard Campground, Camino Cielo Road",,0,,34.525179,-119.960819,WGS84,3036,,,,GeoLocate,,Polygon around West Camino Cielo Rd,,,,,,,,,phorsley,2/21/2019 17:10,,1,urn:uuid:dc663331-7057-424c-994c-70cf2ce4d7d2,https://symbiota.ccber.ucsb.edu:443/collections/individual/index.php?occid=105971
105972,UCSB,IZC,,PreservedSpecimen,02e9ec07-2348-42e3-8b7a-3ed60dfec398,UCSB-IZC00000526,,Animalia,Arthropoda,Insecta,Hymenoptera,Formicidae,Liometopum occidentale,5024,"Emery, 1895",Liometopum,occidentale,,,Elaine Tan,2018,,,,,,,,,,5/7/2015,2015,5,7,127,,,near stream,,,,,,,,,,,,Adult,,1,,,Pinned,United States,California,Santa Barbara,,Lower Refugio Canyon,,0,,34.469471,-120.069339,WGS84,2293,,,,GeoLocate,,Polygon around lower half of Refugio Canyon Road,,,,,,,,,phorsley,2/21/2019 17:14,,1,urn:uuid:02e9ec07-2348-42e3-8b7a-3ed60dfec398,https://symbiota.ccber.ucsb.edu:443/collections/individual/index.php?occid=105972
105974,UCSB,IZC,,PreservedSpecimen,dd857e23-1f17-4064-b6fa-2ba42ecd84c0,UCSB-IZC00000718,,Animalia,Arthropoda,Insecta,Hymenoptera,Formicidae,Pogonomyrmex,2944,"Mayr, 1868",Pogonomyrmex,,,,Zach Brown,2018,,,,,,,,,,5/7/2015,2015,5,7,127,,,,,,,,,,,,,,,Adult,,1,,,Pinned,United States,California,Santa Barbara,,Refugio Canyon,,0,,34.499476,-120.077838,,8159,,rbehm (2018-09-17 15:19:16),,georef batch tool 2018-09-17,reviewed - high confidence,,,,,,,,,,phorsley,2/20/2019 14:11,,1,urn:uuid:dd857e23-1f17-4064-b6fa-2ba42ecd84c0,https://symbiota.ccber.ucsb.edu:443/collections/individual/index.php?occid=105974
105975,UCSB,IZC,,PreservedSpecimen,c949270a-923a-4e68-8dd5-aeefd3993de1,UCSB-IZC00000724,,Animalia,Arthropoda,Insecta,Hymenoptera,Formicidae,Myrmicinae,752,,,,,,I. Naughton,2017,,,,,,,,,,5/3/2015,2015,5,3,123,,,,,,,,,,,,,,,,,,,,,United States,California,Santa Barbara,,Inspiration Point,,0,,34.471957,-119.714254,WGS84,774,,,,GeoLocate,,,,,,,,,,,phorsley,2/21/2019 17:18,,1,urn:uuid:c949270a-923a-4e68-8dd5-aeefd3993de1,https://symbiota.ccber.ucsb.edu:443/collections/individual/index.php?occid=105975
105977,UCSB,IZC,,PreservedSpecimen,cd6ef896-0741-473e-af33-3f2002ea369a,UCSB-IZC00003930,,Animalia,Arthropoda,Insecta,Hymenoptera,Formicidae,Formica,2582,"Linnaeus, 1758",Formica,,,,Elaine Tan,2018,,,,,,G. Heisermann,,,78,5/5/1973,1973,5,5,125,,,,caught on sand near stream,,,,,,,,,,,Adult,,1,,,Pinned,United States,California,Santa Barbara,,Rattlesnake Canyon,,0,,34.471588,-119.687669,,3036,,rbehm (2018-09-28 15:51:51),,georef batch tool 2018-09-28; GeoLocate,reviewed - high confidence,,,,,,,,,,phorsley,2/13/2019 16:02,,1,urn:uuid:cd6ef896-0741-473e-af33-3f2002ea369a,https://symbiota.ccber.ucsb.edu:443/collections/individual/index.php?occid=105977
105979,UCSB,IZC,,PreservedSpecimen,a1936402-ca3e-4dc3-a737-a962fa15d2cf,UCSB-IZC00003946,,Animalia,Arthropoda,Insecta,Hymenoptera,Formicidae,Camponotus,2424,"Mayr, 1861",Camponotus,,,,I. Naughton,2017,,,,,,,,,,6/3/1987,1987,6,3,154,,,,,,,,,,,,,,,,,,,,,United States,California,Santa Barbara,,"University of California, Santa Barbara",,0,,34.412534,-119.847305,,722,,rbehm (2018-09-28 15:55:18),,georef batch tool 2018-09-28; GeoLocate,reviewed - high confidence,,,,,,,,,,phorsley,9/28/2018 15:55,,1,urn:uuid:a1936402-ca3e-4dc3-a737-a962fa15d2cf,https://symbiota.ccber.ucsb.edu:443/collections/individual/index.php?occid=105979
105980,UCSB,IZC,,PreservedSpecimen,5309170b-19da-4c03-bf2d-e63768f71bc4,UCSB-IZC00004469,,Animalia,Arthropoda,Insecta,Hymenoptera,Formicidae,Formica,2582,"Linnaeus, 1758",Formica,,,,Elaine Tan,2018,,,,,,Josh Vasquez,,,,5/8/2016,2016,5,8,129,,,,,,,,,,,,,,,Adult,,1,,,Pinned,United States,California,Santa Barbara,,San Marcos Road,,0,,34.572378,-119.94734,WGS84,22089,,,,GeoLocate,,"San Marcos Pass Rd, San Marcos Rd not in Santa Barbara Co.",,,,,,,,,phorsley,2/21/2019 10:13,,1,urn:uuid:5309170b-19da-4c03-bf2d-e63768f71bc4,https://symbiota.ccber.ucsb.edu:443/collections/individual/index.php?occid=105980
105981,UCSB,IZC,,PreservedSpecimen,e8708ec6-bdfc-405f-95f7-04bac6dc4cac,UCSB-IZC00004480,,Animalia,Arthropoda,Insecta,Hymenoptera,Formicidae,Camponotus,2424,"Mayr, 1861",Camponotus,,,,I. Naughton,2017,,,,,,R.G. Hurd,,,,3/25/1956,1956,3,25,85,,,,,,,,,,,,,,,,,,,,,United States,California,Santa Barbara,Santa Barbara,,,0,,34.42083,-119.69819,WGS84,6633,,,,GeoLocate,,,,,,,,,,,phorsley,2/21/2019 17:19,,1,urn:uuid:e8708ec6-bdfc-405f-95f7-04bac6dc4cac,https://symbiota.ccber.ucsb.edu:443/collections/individual/index.php?occid=105981
105983,UCSB,IZC,,PreservedSpecimen,ec6c71e8-8276-455c-a2aa-a88d8ed7e634,UCSB-IZC00004492,,Animalia,Arthropoda,Insecta,Hymenoptera,Formicidae,Linepithema humile,5028,"(Mayr, 1868)",Linepithema,humile,,,I. Naughton,2017,,,,,,,,,,,,,,,,19-Jun,,,,,,,,,,,,,,,1,,,,United States,California,Santa Barbara,,Rattlesnake Canyon,,0,,34.471588,-119.687669,,3036,,rbehm (2018-09-28 15:51:51),,georef batch tool 2018-09-28; GeoLocate,reviewed - high confidence,,,,,,,,,,phorsley,2/6/2019 14:05,,1,urn:uuid:ec6c71e8-8276-455c-a2aa-a88d8ed7e634,https://symbiota.ccber.ucsb.edu:443/collections/individual/index.php?occid=105983
105984,UCSB,IZC,,PreservedSpecimen,9aabe7cf-c452-4740-9cf4-70bc207ca0ad,UCSB-IZC00004625,,Animalia,Arthropoda,Insecta,Hymenoptera,Formicidae,Formica,2582,"Linnaeus, 1758",Formica,,,,Elaine Tan,2018,,,,,,J. Oster,,,,5/18/2015,2015,5,18,138,,,,,,,,,,,,,,,Adult,,1,,,Pinned,United States,California,Santa Barbara,,"Refugio Canyon, Refugio Creek",,0,,34.490317,-119.781731,,15811,,rbehm (2018-09-28 15:25:14),,georef batch tool 2018-09-28; GeoLocate,reviewed - high confidence,,,,,,,,,,phorsley,2/13/2019 13:24,,1,urn:uuid:9aabe7cf-c452-4740-9cf4-70bc207ca0ad,https://symbiota.ccber.ucsb.edu:443/collections/individual/index.php?occid=105984
105986,UCSB,IZC,,PreservedSpecimen,56b88dec-4fff-4838-9665-94d9aebb1745,UCSB-IZC00004635,,Animalia,Arthropoda,Insecta,Hymenoptera,Formicidae,Liometopum occidentale,5024,"Emery, 1895",Liometopum,occidentale,,,Elaine Tan,2018,,,,,,Arun Sengupta,,,,5/30/2015,2015,5,30,150,,,,,,,,,,,,,,,Adult,,1,,,Pinned,United States,California,Santa Barbara,Santa Barbara,Seven Falls,,0,,34.474766,-119.705127,WGS84,164,,,,GeoLocate,,,,,,,,,,,phorsley,2/21/2019 17:20,,1,urn:uuid:56b88dec-4fff-4838-9665-94d9aebb1745,https://symbiota.ccber.ucsb.edu:443/collections/individual/index.php?occid=105986
105989,UCSB,IZC,,PreservedSpecimen,01d5fa64-84fa-4217-b67d-bb6d9fe670aa,UCSB-IZC00004657,,Animalia,Arthropoda,Insecta,Hymenoptera,Formicidae,Linepithema humile,5028,"(Mayr, 1868)",Linepithema,humile,,,Elaine Tan,2018,,,,,,Jason Garland,,,,2016-06-00,2016,6,,,,,,,,,,,,,,,,,,,,,,,United States,California,Santa Barbara,,"University of California, Santa Barbara Campus",,0,,34.413403,-119.847136,WGS84,783,,,,GeoLocate,,,,,,,,,,,phorsley,2/21/2019 17:21,,1,urn:uuid:01d5fa64-84fa-4217-b67d-bb6d9fe670aa,https://symbiota.ccber.ucsb.edu:443/collections/individual/index.php?occid=105989
105991,UCSB,IZC,,PreservedSpecimen,9e4e4694-4301-427d-80cd-a23fb3ae9a59,UCSB-IZC00004664,,Animalia,Arthropoda,Insecta,Hymenoptera,Formicidae,Liometopum occidentale,5024,"Emery, 1895",Liometopum,occidentale,,,Elaine Tan,2018,,,,,,,,,,4/13/1981,1981,4,13,103,,,,,,,,,,,,,,,Adult,,1,,,Pinned,United States,California,Santa Barbara,,"University of California, Santa Barbara Campus",,0,,34.412534,-119.847305,,722,,rbehm (2018-09-28 15:55:18),,georef batch tool 2018-09-28; GeoLocate,reviewed - high confidence,,,,,,,,,,phorsley,2/13/2019 13:33,,1,urn:uuid:9e4e4694-4301-427d-80cd-a23fb3ae9a59,https://symbiota.ccber.ucsb.edu:443/collections/individual/index.php?occid=105991
105992,UCSB,IZC,,PreservedSpecimen,9c366aac-1efa-452b-8e85-ffc1a45879e2,UCSB-IZC00004666,,Animalia,Arthropoda,Insecta,Hymenoptera,Formicidae,Linepithema humile,5028,"(Mayr, 1868)",Linepithema,humile,,,Elaine Tan,2018,,,,,,,,,,5/26/2015,2015,5,26,146,,,On label: DD (collector?),,,,,,,,,,,,,,1,,,,United States,California,Santa Barbara,Isla Vista,my house,,0,,34.413329,-119.860972,WGS84,2476,,,,GeoLocate,,,,,,,,,,,phorsley,2/21/2019 17:22,,1,urn:uuid:9c366aac-1efa-452b-8e85-ffc1a45879e2,https://symbiota.ccber.ucsb.edu:443/collections/individual/index.php?occid=105992
105993,UCSB,IZC,,PreservedSpecimen,f6947432-f920-47af-8992-798e22b33cd0,UCSB-IZC00004671,,Animalia,Arthropoda,Insecta,Hymenoptera,Formicidae,Pogonomyrmex,2944,"Mayr, 1868",Pogonomyrmex,,,,Elaine Tan,2018,,,,,,,,,,8/20/1974,1974,8,20,232,,,,by beach cliff,,,,,,,,,,,Adult,,1,,,Pinned,United States,California,Santa Barbara,,"University of California, Santa Barbara Campus",,0,,34.412534,-119.847305,,722,,rbehm (2018-09-28 15:55:18),,georef batch tool 2018-09-28; GeoLocate,reviewed - high confidence,,,,,,,,,,phorsley,2/20/2019 14:41,,1,urn:uuid:f6947432-f920-47af-8992-798e22b33cd0,https://symbiota.ccber.ucsb.edu:443/collections/individual/index.php?occid=105993
105994,UCSB,IZC,,PreservedSpecimen,aa964c37-51c4-4c48-b56a-b99c96aa030e,UCSB-IZC00004683,,Animalia,Arthropoda,Insecta,Hymenoptera,Formicidae,Liometopum occidentale,5024,"Emery, 1895",Liometopum,occidentale,,,Zach Brown,2018,,,,,,Kieren Hughes,,,,4/10/2016,2016,4,10,101,,,,,,,,,,,,,,,Adult,,1,,,Pinned,United States,California,Santa Barbara,Isla Vista,Isla Vista,,0,,34.413329,-119.860972,WGS84,2476,,,,GeoLocate,,,,,,,,,,,phorsley,2/21/2019 17:23,,1,urn:uuid:aa964c37-51c4-4c48-b56a-b99c96aa030e,https://symbiota.ccber.ucsb.edu:443/collections/individual/index.php?occid=105994
105995,UCSB,IZC,,PreservedSpecimen,ec05bf54-1481-42cd-9a7e-f48984fbf974,UCSB-IZC00004688,,Animalia,Arthropoda,Insecta,Hymenoptera,Formicidae,Linepithema humile,5028,"(Mayr, 1868)",Linepithema,humile,,,Elaine Tan,2018,,,,,,,,,,5/6/2016,2016,5,6,127,,,,,,,,,,,,,,,,,1,,,,United States,California,Santa Barbara,Goleta,Picasso Road,,0,,34.415154,-119.858613,WGS84,10,,,,GeoLocate,,,,,,,,,,,phorsley,2/21/2019 17:24,,1,urn:uuid:ec05bf54-1481-42cd-9a7e-f48984fbf974,https://symbiota.ccber.ucsb.edu:443/collections/individual/index.php?occid=105995
105996,UCSB,IZC,,PreservedSpecimen,2df3fc59-30f7-4be9-b470-207e435b7c76,UCSB-IZC00004689,,Animalia,Arthropoda,Insecta,Hymenoptera,Formicidae,Crematogaster,2473,"Lund, 1831",Crematogaster,,,,Zach Brown,2018,,,,,,Kevin Phan,,,,7/10/2016,2016,7,10,192,,,,found near foliage,,,,,,,,,,,Adult,,1,,,Pinned,United States,California,Santa Barbara,,Santa Ynez Apartments; 34.4187 -119.8621,,0,,34.418703,-119.862105,WGS84,10,,,,GeoLocate,,,,,,,,,,,phorsley,2/21/2019 17:26,,1,urn:uuid:2df3fc59-30f7-4be9-b470-207e435b7c76,https://symbiota.ccber.ucsb.edu:443/collections/individual/index.php?occid=105996
105998,UCSB,IZC,,PreservedSpecimen,fb240a71-16b6-4cb4-af2a-d25d156d1c0e,UCSB-IZC00004715,,Animalia,Arthropoda,Insecta,Hymenoptera,Formicidae,Liometopum occidentale,5024,"Emery, 1895",Liometopum,occidentale,,,Elaine Tan,2018,,,,,,Alain Garkanian,,,,7/12/2016,2016,7,12,194,,,,,,,,,,,,,,,Adult,,1,Vial,,Pinned,United States,California,Santa Barbara,Isla Vista,,,0,,34.413,-119.8423,WGS84,10,,,,"GPS, on label",,,0,,,,,0.0m,,,phorsley,2/21/2019 17:26,,1,urn:uuid:fb240a71-16b6-4cb4-af2a-d25d156d1c0e,https://symbiota.ccber.ucsb.edu:443/collections/individual/index.php?occid=105998
105999,UCSB,IZC,,PreservedSpecimen,7977e2df-8ee7-4f1e-bf34-5516d4d15eed,UCSB-IZC00004717,,Animalia,Arthropoda,Insecta,Hymenoptera,Formicidae,Linepithema humile,5028,"(Mayr, 1868)",Linepithema,humile,,,Elaine Tan,2018,,,,,,Kai Wilmsen,,,,6/21/2016,2016,6,21,173,,,,,,,,,,,Umbellularia californica,,,,,,1,sweep net,,Pinned,United States,California,Santa Barbara,,"University of California, Santa Barbara West Lagoon; 34.4122 -119.8431",,0,,34.409103,-119.848687,WGS84,400,,,,GeoLocate,,Center at west side of UCSB Lagoon; coordinates show Biology buildings,3,,,,,3.0m,,,phorsley,2/21/2019 17:29,,1,urn:uuid:7977e2df-8ee7-4f1e-bf34-5516d4d15eed,https://symbiota.ccber.ucsb.edu:443/collections/individual/index.php?occid=105999
106000,UCSB,IZC,,PreservedSpecimen,85bc5aed-24a5-4d89-ae44-b75aee097af3,UCSB-IZC00004721,,Animalia,Arthropoda,Insecta,Hymenoptera,Formicidae,Liometopum occidentale,5024,"Emery, 1895",Liometopum,occidentale,,,Elaine Tan,2018,,,,,,Jolene Tran,,,,5/18/2015,2015,5,18,138,,,,,,,,,,,,,,,Adult,,1,,,Pinned,United States,California,Santa Barbara,Santa Barbara,Rattlesnake Canyon,,0,,34.471588,-119.687669,,3036,,rbehm (2018-09-28 15:51:51),,georef batch tool 2018-09-28; GeoLocate,reviewed - high confidence,,,,,,,,,,phorsley,2/13/2019 13:31,,1,urn:uuid:85bc5aed-24a5-4d89-ae44-b75aee097af3,https://symbiota.ccber.ucsb.edu:443/collections/individual/index.php?occid=106000
106001,UCSB,IZC,,PreservedSpecimen,816e4107-f910-429a-b6bd-a48ebe46a856,UCSB-IZC00004723,,Animalia,Arthropoda,Insecta,Hymenoptera,Formicidae,Linepithema humile,5028,"(Mayr, 1868)",Linepithema,humile,,,Zach Brown,2018,,,,,,,,,,6/3/2015,2015,6,3,154,,,,,,,,,,,,,,,,,,,,,United States,California,Santa Barbara,Santa Barbara,Lido Way,,0,,34.423653,-119.748182,WGS84,72,,,,GeoLocate,,,,,,,,,,,phorsley,2/21/2019 17:30,,1,urn:uuid:816e4107-f910-429a-b6bd-a48ebe46a856,https://symbiota.ccber.ucsb.edu:443/collections/individual/index.php?occid=106001
106002,UCSB,IZC,,PreservedSpecimen,a4da68f7-7337-42e7-bf96-ad34c7c94902,UCSB-IZC00004728,,Animalia,Arthropoda,Insecta,Hymenoptera,Formicidae,Liometopum occidentale,5024,"Emery, 1895",Liometopum,occidentale,,,Elaine Tan,2018,,,,,,,,,,5/30/1981,1981,5,30,150,,,,,,,,,,,,,,,Adult,,1,,,Pinned,United States,California,Santa Barbara,,"Pino Alto, Figueroa Mountain",,0,,34.743317,-119.985143,WGS84,1572,,,,GeoLocate,,,,,,,,,,,phorsley,2/21/2019 17:31,,1,urn:uuid:a4da68f7-7337-42e7-bf96-ad34c7c94902,https://symbiota.ccber.ucsb.edu:443/collections/individual/index.php?occid=106002
106003,UCSB,IZC,,PreservedSpecimen,7fd775a2-04eb-4c93-8da4-2a2cef607dd3,UCSB-IZC00004730,,Animalia,Arthropoda,Insecta,Hymenoptera,Formicidae,Linepithema humile,5028,"(Mayr, 1868)",Linepithema,humile,,,Elaine Tan,2018,,,,,,Jack Hammang,,,,4/6/2015,2015,4,6,96,,,,,,,,,,,,,,,,,1,,,Pinned,United States,California,Santa Barbara,Isla Vista,6599 Madrid Road,,0,,34.412308,-119.858404,WGS84,20,,,,GeoLocate,,,,,,,,,,,phorsley,2/21/2019 17:33,,1,urn:uuid:7fd775a2-04eb-4c93-8da4-2a2cef607dd3,https://symbiota.ccber.ucsb.edu:443/collections/individual/index.php?occid=106003
106004,UCSB,IZC,,PreservedSpecimen,85e719c7-ddd6-4089-aa7e-4b40ee18eca0,UCSB-IZC00004737,,Animalia,Arthropoda,Insecta,Hymenoptera,Formicidae,Crematogaster,2473,"Lund, 1831",Crematogaster,,,,Zach Brown,2018,,,,,,,,,,6/21/2016,2016,6,21,173,,,,,,,,,,,,,,,Adult,,1,Yellow Pan Trap,,Pinned,United States,California,Santa Barbara,,"University of California, Santa Barbara West Lagoon",,0,,34.407904,-119.849953,WGS84,10,,,,GeoLocate,,,,,,,,,,,phorsley,2/21/2019 17:34,,1,urn:uuid:85e719c7-ddd6-4089-aa7e-4b40ee18eca0,https://symbiota.ccber.ucsb.edu:443/collections/individual/index.php?occid=106004
106006,UCSB,IZC,,PreservedSpecimen,2cacd6f0-872c-4d61-aca2-f15d9b2cd014,UCSB-IZC00004741,,Animalia,Arthropoda,Insecta,Hymenoptera,Formicidae,Camponotus,2424,"Mayr, 1861",Camponotus,,,,I. Naughton,2017,,,,,,Ashley Treahy,,,,6/2/2015,2015,6,2,153,,,,,,,,,,,,,,,,,,,,,United States,California,Santa Barbara,,Lizard's Mouth,,0,,34.501847,-119.866102,WGS84,200,,,,GeoLocate,,,,,,,,,,,phorsley,2/21/2019 17:36,,1,urn:uuid:2cacd6f0-872c-4d61-aca2-f15d9b2cd014,https://symbiota.ccber.ucsb.edu:443/collections/individual/index.php?occid=106006
106008,UCSB,IZC,,PreservedSpecimen,3ffc8c81-9d61-4f09-a3e8-000bd70be910,UCSB-IZC00004747,,Animalia,Arthropoda,Insecta,Hymenoptera,Formicidae,Camponotus,2424,"Mayr, 1861",Camponotus,,,,I. Naughton,2017,,,,,,,,,,1969-00-00,1969,,,,,,,,,,,,,,,,,,,,,,,,United States,California,Santa Barbara,,Santa Ynez Valley,,0,,34.584154,-120.097368,,6152,,rbehm (2018-09-28 15:26:13),,georef batch tool 2018-09-28; GeoLocate,reviewed - high confidence,,,,,,,,,,phorsley,9/28/2018 15:26,,1,urn:uuid:3ffc8c81-9d61-4f09-a3e8-000bd70be910,https://symbiota.ccber.ucsb.edu:443/collections/individual/index.php?occid=106008
106010,UCSB,IZC,,PreservedSpecimen,ccf3dc3a-93d0-4472-bbea-5d2da27f2cac,UCSB-IZC00004755,,Animalia,Arthropoda,Insecta,Hymenoptera,Formicidae,Formica,2582,"Linnaeus, 1758",Formica,,,,Elaine Tan,2018,,,,,,,,,,5/2/1978,1978,5,2,122,,,,,,,,,,,,,,,Adult,,1,,,Pinned,United States,California,Santa Barbara,,Skofield,,0,,34.455416,-119.695385,WGS84,371,,,,GeoLocate,,,,,,,,,,,phorsley,2/21/2019 17:37,,1,urn:uuid:ccf3dc3a-93d0-4472-bbea-5d2da27f2cac,https://symbiota.ccber.ucsb.edu:443/collections/individual/index.php?occid=106010
106012,UCSB,IZC,,PreservedSpecimen,bfb3679f-6fa5-4864-afb6-201f30a2f152,UCSB-IZC00004769,,Animalia,Arthropoda,Insecta,Hymenoptera,Formicidae,Formica,2582,"Linnaeus, 1758",Formica,,,,Elaine Tan,2018,,,,,,,,,,4/28/1978,1978,4,28,118,,,,,,,,,,,,,,,Adult,,1,,,Pinned,United States,California,Santa Barbara,,Goddard,,0,,34.525828,-119.952018,WGS84,59626,,,,GeoLocate,,Polygon around West Camino Cielo Rd,,,,,,,,,phorsley,2/21/2019 17:39,,1,urn:uuid:bfb3679f-6fa5-4864-afb6-201f30a2f152,https://symbiota.ccber.ucsb.edu:443/collections/individual/index.php?occid=106012
106013,UCSB,IZC,,PreservedSpecimen,c0c17254-45fa-4b11-9c8c-487eaa283658,UCSB-IZC00004771,,Animalia,Arthropoda,Insecta,Hymenoptera,Formicidae,Camponotus,2424,"Mayr, 1861",Camponotus,,,,I. Naughton,2017,,,,,,UCSB Zoology 125,,,,5/13/1989,1989,5,13,133,,,,chaparral,,,,,,,,,,,,,,,,,United States,California,Santa Barbara,Santa Barbara,Santa Barbara Canyon; 34.872755 -119.517902,,0,,34.872755,-119.517902,,1506,,rbehm (2017-10-23 23:31:02),,georef batch tool 2017-10-23,reviewed - high confidence,,,,,,,,,,phorsley,2/21/2019 17:40,,1,urn:uuid:c0c17254-45fa-4b11-9c8c-487eaa283658,https://symbiota.ccber.ucsb.edu:443/collections/individual/index.php?occid=106013
106022,UCSB,IZC,,PreservedSpecimen,099704d3-b647-4bb5-b5d2-3ab2c4c49bd9,UCSB-IZC00004797,,Animalia,Arthropoda,Insecta,Hymenoptera,Formicidae,Liometopum occidentale,5024,"Emery, 1895",Liometopum,occidentale,,,Elaine Tan,2018,,,,,,,,,,1977-05-00,1977,5,,,,,,,,,,,,,,,,,Adult,,1,,,Pinned,United States,California,Santa Barbara,,"University of California, Santa Barbara",,0,,34.412534,-119.847305,,722,,rbehm (2018-09-28 15:54:55),,georef batch tool 2018-09-28; GeoLocate,reviewed - high confidence,,,,,,,,,,phorsley,2/13/2019 13:09,,1,urn:uuid:099704d3-b647-4bb5-b5d2-3ab2c4c49bd9,https://symbiota.ccber.ucsb.edu:443/collections/individual/index.php?occid=106022
106023,UCSB,IZC,,PreservedSpecimen,6762ff3f-72d0-44a6-b118-5293e9122c65,UCSB-IZC00004863,,Animalia,Arthropoda,Insecta,Hymenoptera,Formicidae,Formica,2582,"Linnaeus, 1758",Formica,,,,Elaine Tan,2018,,,,,,Alain Garkanian,,,,7/9/2016,2016,7,9,191,,,,,,,,,,,,,,,Adult,,1,Vial,,Pinned,United States,California,Santa Barbara,,Refugio Canyon,,0,,34.5077,-120.0645,WGS84,10,,,,"GPS, on label",,,0,,,,,0.0m,,,phorsley,2/21/2019 17:39,,1,urn:uuid:6762ff3f-72d0-44a6-b118-5293e9122c65,https://symbiota.ccber.ucsb.edu:443/collections/individual/index.php?occid=106023
106027,UCSB,IZC,,PreservedSpecimen,81352f3f-2c5a-4961-b1dc-b8dcd65ee1b7,UCSB-IZC00004870,,Animalia,Arthropoda,Insecta,Hymenoptera,Formicidae,Formica,2582,"Linnaeus, 1758",Formica,,,,Elaine Tan,2018,,,,,,,,,,6/1/1983,1983,6,1,152,,,,,,,,,,,,,,,Adult,,1,,,Pinned,United States,California,Santa Barbara,,Red Rock Campground,,0,,34.53981,-119.71913,,136,,rbehm (2018-09-17 15:17:48),,georef batch tool 2018-09-17,reviewed - high confidence,,,,,,,,,,phorsley,2/13/2019 16:26,,1,urn:uuid:81352f3f-2c5a-4961-b1dc-b8dcd65ee1b7,https://symbiota.ccber.ucsb.edu:443/collections/individual/index.php?occid=106027
106028,UCSB,IZC,,PreservedSpecimen,7288f7ac-3413-4bd4-a982-57212e0e5155,UCSB-IZC00004871,,Animalia,Arthropoda,Insecta,Hymenoptera,Formicidae,Formica,2582,"Linnaeus, 1758",Formica,,,,Elaine Tan,2018,,,,,,Jack Hammang,,,,5/24/2015,2015,5,24,144,,,,,,,,,,,,,,,Adult,,1,,,Pinned,United States,California,Santa Barbara,Isla Vista,Sands Bluff,,0,,34.408143,-119.878808,WGS84,300,,,,GeoLocate,,,,,,,,,,,phorsley,2/21/2019 17:41,,1,urn:uuid:7288f7ac-3413-4bd4-a982-57212e0e5155,https://symbiota.ccber.ucsb.edu:443/collections/individual/index.php?occid=106028
106030,UCSB,IZC,,PreservedSpecimen,30037f92-d4fb-4bbb-8578-91b9174efb1c,UCSB-IZC00004876,,Animalia,Arthropoda,Insecta,Hymenoptera,Formicidae,Liometopum occidentale,5024,"Emery, 1895",Liometopum,occidentale,,,Elaine Tan,2018,,,,,,,,,,5/10/1974,1974,5,10,130,,,,,,,,,,,,,,,Adult,,1,,,Pinned,United States,California,Santa Barbara,,"Goddard Campground, Camino Cielo Road",,0,,34.526876,-119.943309,WGS84,10151,,,,GeoLocate,,,,,,,,,,,phorsley,2/21/2019 17:43,,1,urn:uuid:30037f92-d4fb-4bbb-8578-91b9174efb1c,https://symbiota.ccber.ucsb.edu:443/collections/individual/index.php?occid=106030
106031,UCSB,IZC,,PreservedSpecimen,e8de224b-56e8-4b39-952e-2223b07a7a51,UCSB-IZC00004877,,Animalia,Arthropoda,Insecta,Hymenoptera,Formicidae,Camponotus,2424,"Mayr, 1861",Camponotus,,,,I. Naughton,2017,,,,,,,,,,1983-05-00,1983,5,,,,,,,,,,,,,,,,,,,,,,,United States,California,Santa Barbara,,Figueroa Mountain Station,,0,,34.768394,-119.863098,,69073,,rbehm (2018-09-28 15:50:44),,georef batch tool 2018-09-28; GeoLocate,reviewed - high confidence,,,,,,,,,,phorsley,9/28/2018 15:50,,1,urn:uuid:e8de224b-56e8-4b39-952e-2223b07a7a51,https://symbiota.ccber.ucsb.edu:443/collections/individual/index.php?occid=106031
106033,UCSB,IZC,,PreservedSpecimen,85ec6ee5-a012-40d6-a031-a8e7fbf25bec,UCSB-IZC00004883,,Animalia,Arthropoda,Insecta,Hymenoptera,Formicidae,Formica,2582,"Linnaeus, 1758",Formica,,,,Elaine Tan,2018,,,,,,,,,,5/31/1978,1978,5,31,151,,,,,,,,,,,,,,,Adult,,1,,,Pinned,United States,California,Santa Barbara,,Santa Ynez River,,0,,34.685483,-120.581155,WGS84,1384,,,,GeoLocate,,Polygon all along the river,,,,,,,,,phorsley,2/22/2019 16:05,,1,urn:uuid:85ec6ee5-a012-40d6-a031-a8e7fbf25bec,https://symbiota.ccber.ucsb.edu:443/collections/individual/index.php?occid=106033
106034,UCSB,IZC,,PreservedSpecimen,97bcc739-1ea3-486f-93a0-cde143c4dddd,UCSB-IZC00004887,,Animalia,Arthropoda,Insecta,Hymenoptera,Formicidae,Camponotus,2424,"Mayr, 1861",Camponotus,,,,I. Naughton,2017,,,,,,Katja Seltmann,,,,7/27/2016,2016,7,27,209,,,,,,,,,,,,,,,,,,,,,United States,California,Santa Barbara,Goleta,Cheadle Center for Biodiversity and Ecological Restoration (CCBER),,0,,34.4239,-119.9036,WGS84,10,,,,"GPS, on label",,,1,,,,,1.0m,,,phorsley,2/21/2019 17:44,,1,urn:uuid:97bcc739-1ea3-486f-93a0-cde143c4dddd,https://symbiota.ccber.ucsb.edu:443/collections/individual/index.php?occid=106034
106036,UCSB,IZC,,PreservedSpecimen,d6cd1194-291a-4d4e-be77-6660919b7b33,UCSB-IZC00004889,,Animalia,Arthropoda,Insecta,Hymenoptera,Formicidae,Camponotus,2424,"Mayr, 1861",Camponotus,,,,I. Naughton,2017,,,,,,,,,,,,,,,,196,,,,,,,,,,,,,,,,,,,United States,California,Santa Barbara,,Refugio Canyon,,0,,34.499476,-120.077838,,8159,,rbehm (2018-09-17 15:19:50),,georef batch tool 2018-09-17,reviewed - high confidence,,,,,,,,,,phorsley,9/17/2018 15:19,,1,urn:uuid:d6cd1194-291a-4d4e-be77-6660919b7b33,https://symbiota.ccber.ucsb.edu:443/collections/individual/index.php?occid=106036
106037,UCSB,IZC,,PreservedSpecimen,989ad237-02ff-441f-a24e-505a554d6590,UCSB-IZC00004893,,Animalia,Arthropoda,Insecta,Hymenoptera,Formicidae,Camponotus,2424,"Mayr, 1861",Camponotus,,,,I. Naughton,2017,,,,,,Gabby M.,,,,5/7/2015,2015,5,7,127,,,,,,,,,,,,,,,,,,,,,United States,California,Santa Barbara,,Refugio Park,,0,,34.490317,-119.781731,,15811,,rbehm (2018-09-28 15:25:14),,georef batch tool 2018-09-28; GeoLocate,reviewed - high confidence,,,,,,,,,,phorsley,9/28/2018 15:25,,1,urn:uuid:989ad237-02ff-441f-a24e-505a554d6590,https://symbiota.ccber.ucsb.edu:443/collections/individual/index.php?occid=106037
106038,UCSB,IZC,,PreservedSpecimen,1a3af41e-9c02-42ac-9fe7-3ed93c2c6ada,UCSB-IZC00004894,,Animalia,Arthropoda,Insecta,Hymenoptera,Formicidae,Liometopum occidentale,5024,"Emery, 1895",Liometopum,occidentale,,,I. Naughton,2017,,,,,,A. Henderson,,,,5/8/2003,2003,5,8,128,,,,,,,,,,,,,,,Adult,,1,,,Pinned,United States,California,Santa Barbara,,Refugio Canyon Creek,,0,,34.490317,-119.781731,,15811,,rbehm (2018-09-28 15:25:14),,georef batch tool 2018-09-28; GeoLocate,reviewed - high confidence,,,,,,,,,,phorsley,2/13/2019 13:19,,1,urn:uuid:1a3af41e-9c02-42ac-9fe7-3ed93c2c6ada,https://symbiota.ccber.ucsb.edu:443/collections/individual/index.php?occid=106038
106039,UCSB,IZC,,PreservedSpecimen,28c74c3e-b150-45be-b008-34277862e97f,UCSB-IZC00004895,,Animalia,Arthropoda,Insecta,Hymenoptera,Formicidae,Camponotus,2424,"Mayr, 1861",Camponotus,,,,I. Naughton,2017,,,,,,,,,,,,,,,,196,,,,,,,,,,,,,,,,,,,United States,California,Santa Barbara,,Refugio Canyon,,0,,34.499476,-120.077838,,8159,,rbehm (2018-09-17 15:19:50),,georef batch tool 2018-09-17,reviewed - high confidence,,,,,,,,,,phorsley,9/17/2018 15:19,,1,urn:uuid:28c74c3e-b150-45be-b008-34277862e97f,https://symbiota.ccber.ucsb.edu:443/collections/individual/index.php?occid=106039
106042,UCSB,IZC,,PreservedSpecimen,0edd364c-6398-483d-8502-635908574bd9,UCSB-IZC00004900,,Animalia,Arthropoda,Insecta,Hymenoptera,Formicidae,Liometopum occidentale,5024,"Emery, 1895",Liometopum,occidentale,,,Elaine Tan,2018,,,,,,,,,,5/1/1974,1974,5,1,121,,,,,,,,,,,,,,,Adult,,1,,,Pinned,United States,California,Santa Barbara,,"Santa Ynez Campground, Santa Ynez River",,0,,34.540056,-119.74299,WGS84,3036,,,,GeoLocate,,,,,,,,,,,phorsley,2/21/2019 17:45,,1,urn:uuid:0edd364c-6398-483d-8502-635908574bd9,https://symbiota.ccber.ucsb.edu:443/collections/individual/index.php?occid=106042
106045,UCSB,IZC,,PreservedSpecimen,47548621-5dae-471a-ac25-f5572a953468,UCSB-IZC00004904,,Animalia,Arthropoda,Insecta,Hymenoptera,Formicidae,Formica,2582,"Linnaeus, 1758",Formica,,,,Elaine Tan,2018,,,,,,M. Sun,,,,5/9/2015,2015,5,9,129,,,,,,,,,,,,,,,Adult,,1,,,Pinned,United States,California,Santa Barbara,,West Camino Cielo,,0,,34.524896,-119.941421,WGS84,3036,,,,GeoLocate,,,,,,,,,,,phorsley,2/21/2019 17:46,,1,urn:uuid:47548621-5dae-471a-ac25-f5572a953468,https://symbiota.ccber.ucsb.edu:443/collections/individual/index.php?occid=106045
106047,UCSB,IZC,,PreservedSpecimen,1824ad46-5677-4d60-8aee-6c392542bb0e,UCSB-IZC00004907,,Animalia,Arthropoda,Insecta,Hymenoptera,Formicidae,Camponotus,2424,"Mayr, 1861",Camponotus,,,,I. Naughton,2017,,,,,,,,,,1981-05-00,1981,5,,,,,,,,,,,,,,,,,,,,,,,United States,California,Santa Barbara,,Red Rock Campground,,0,,34.53981,-119.71913,,136,,rbehm (2018-09-17 15:17:48),,georef batch tool 2018-09-17,reviewed - high confidence,,,,,,,,,,phorsley,9/17/2018 15:17,,1,urn:uuid:1824ad46-5677-4d60-8aee-6c392542bb0e,https://symbiota.ccber.ucsb.edu:443/collections/individual/index.php?occid=106047
106049,UCSB,IZC,,PreservedSpecimen,f667b949-e96f-4a5b-997b-90cacf1f8da9,UCSB-IZC00004910,,Animalia,Arthropoda,Insecta,Hymenoptera,Formicidae,Formica,2582,"Linnaeus, 1758",Formica,,,,Elaine Tan,2018,,,,,,,,,,6/3/1980,1980,6,3,155,,,,,,,,,,,,,,,Adult,,1,,,Pinned,United States,California,Santa Barbara,,Oso,,0,,34.545861,-119.775765,WGS84,1200,,,,GeoLocate,,,,,,,,,,,phorsley,2/21/2019 17:48,,1,urn:uuid:f667b949-e96f-4a5b-997b-90cacf1f8da9,https://symbiota.ccber.ucsb.edu:443/collections/individual/index.php?occid=106049
106051,UCSB,IZC,,PreservedSpecimen,5409e6a0-2db1-4450-b6e6-d1073b720669,UCSB-IZC00004912,,Animalia,Arthropoda,Insecta,Hymenoptera,Formicidae,Liometopum occidentale,5024,"Emery, 1895",Liometopum,occidentale,,,Elaine Tan,2018,,,,,,Christopher Perry,,,,6/25/2016,2016,6,25,177,,,,,,,,,,,,,,,Adult,,1,mesh net,,Pinned,United States,California,Santa Barbara,,Refugio Canyon,,0,,34.5077,-120.0645,WGS84,10,,,,"GPS, on label",,,3,,,,,3.0m,,,phorsley,2/21/2019 17:48,,1,urn:uuid:5409e6a0-2db1-4450-b6e6-d1073b720669,https://symbiota.ccber.ucsb.edu:443/collections/individual/index.php?occid=106051
106052,UCSB,IZC,,PreservedSpecimen,e861686b-56cc-4d9f-bffc-17174d1e70c1,UCSB-IZC00004913,,Animalia,Arthropoda,Insecta,Hymenoptera,Formicidae,Camponotus,2424,"Mayr, 1861",Camponotus,,,,I. Naughton,2017,,,,,,UCSB Zoology 125: Susan,,,,5/15/1989,1989,5,15,135,,,,,,,,,,,,,,,,,,net,,,United States,California,Santa Barbara,,Oso,,0,,34.545861,-119.775765,WGS84,1200,,,,GeoLocate,,,,,,,,,,,phorsley,2/21/2019 17:49,,1,urn:uuid:e861686b-56cc-4d9f-bffc-17174d1e70c1,https://symbiota.ccber.ucsb.edu:443/collections/individual/index.php?occid=106052
106053,UCSB,IZC,,PreservedSpecimen,03c6bc90-41ec-4490-8d58-64ff44295f13,UCSB-IZC00004915,,Animalia,Arthropoda,Insecta,Hymenoptera,Formicidae,Liometopum occidentale,5024,"Emery, 1895",Liometopum,occidentale,,,Elaine Tan,2018,,,,,,C. Danh,,,,5/31/2015,2015,5,31,151,,,,,,,,,,,,,,,Adult,,1,,,Pinned,United States,California,Santa Barbara,,Los Padres Forest,,0,,34.742348,-119.783447,WGS84,44753,,,,GeoLocate,,,,,,,,,,,phorsley,2/21/2019 17:54,,1,urn:uuid:03c6bc90-41ec-4490-8d58-64ff44295f13,https://symbiota.ccber.ucsb.edu:443/collections/individual/index.php?occid=106053
106071,UCSB,IZC,,PreservedSpecimen,770da993-9ee8-457e-8627-75138f9b3a09,UCSB-IZC00006547,,Animalia,Arthropoda,Insecta,Hymenoptera,Formicidae,Pogonomyrmex,2944,"Mayr, 1868",Pogonomyrmex,,,,Elaine Tan,2018,,,,,,,,,,6/3/1977,1977,6,3,154,,,,,,,,,,,,,,,Adult,,1,,,Pinned,United States,California,Santa Barbara,,Paradise,,0,,34.539899,-119.848956,WGS84,3049,,,,GeoLocate,,Paradise Campground,,,,,,,,,phorsley,2/21/2019 19:17,,1,urn:uuid:770da993-9ee8-457e-8627-75138f9b3a09,https://symbiota.ccber.ucsb.edu:443/collections/individual/index.php?occid=106071
106077,UCSB,IZC,,PreservedSpecimen,cbfed343-f866-4b04-9ac4-0aa6e46c163b,UCSB-IZC00006553,,Animalia,Arthropoda,Insecta,Hymenoptera,Formicidae,Pogonomyrmex,2944,"Mayr, 1868",Pogonomyrmex,,,,Elaine Tan,2018,,,,,,,,,,8/27/1974,1974,8,27,239,,,,,,,,,,,,,,,Adult,,1,,,Pinned,United States,California,Santa Barbara,,Foothills of Santa Barbara,,0,,34.479434,-119.695787,WGS84,7006,,,,GeoLocate,,Mountains near Santa Barbara Municipality,61,,,,,200 ft.,,,phorsley,2/21/2019 19:20,,1,urn:uuid:cbfed343-f866-4b04-9ac4-0aa6e46c163b,https://symbiota.ccber.ucsb.edu:443/collections/individual/index.php?occid=106077
106089,UCSB,IZC,,PreservedSpecimen,e7a7658f-54a0-43a8-92eb-151fc3b73801,UCSB-IZC00006565,,Animalia,Arthropoda,Insecta,Hymenoptera,Formicidae,Pogonomyrmex,2944,"Mayr, 1868",Pogonomyrmex,,,,Elaine Tan,2018,,,,,,,,,,8/20/1974,1974,8,20,232,,,,by beach cliff,,,,,,,,,,,Adult,,1,,,Pinned,United States,California,Santa Barbara,,"University of California, Santa Barbara Campus",,0,,34.412534,-119.847305,,722,,rbehm (2018-10-01 13:18:25),,georef batch tool 2018-10-01; GeoLocate,reviewed - high confidence,,,,,,,,,,phorsley,2/20/2019 14:47,,1,urn:uuid:e7a7658f-54a0-43a8-92eb-151fc3b73801,https://symbiota.ccber.ucsb.edu:443/collections/individual/index.php?occid=106089
106113,UCSB,IZC,,PreservedSpecimen,d85fcd16-7cc9-488f-9054-1a6e2c982a44,UCSB-IZC00006589,,Animalia,Arthropoda,Insecta,Hymenoptera,Formicidae,Myrmicinae,752,,,,,,I. Naughton,2017,,,,,,Eduardo Moria,,,,4/9/1968,1968,4,9,100,,,,,,,,,,,,,,,,,,,,,United States,California,Santa Barbara,,Refugio Canyon,,0,,34.499476,-120.077838,,8159,,rbehm (2018-09-17 15:53:26),,georef batch tool 2018-09-17; GeoLocate,reviewed - high confidence,,,,,,,,,,phorsley,9/17/2018 15:53,,1,urn:uuid:d85fcd16-7cc9-488f-9054-1a6e2c982a44,https://symbiota.ccber.ucsb.edu:443/collections/individual/index.php?occid=106113
106120,UCSB,IZC,,PreservedSpecimen,da466864-3c04-4b6f-aeb6-81d2cabcafc7,UCSB-IZC00006595,,Animalia,Arthropoda,Insecta,Hymenoptera,Formicidae,Pogonomyrmex,2944,"Mayr, 1868",Pogonomyrmex,,,,Elaine Tan,2018,,,,,,Z. Galvan,,,,5/25/2015,2015,5,25,145,,,,,,,,,,,,,,,Adult,,1,,,Pinned,United States,California,Santa Barbara,,More Mesa,,0,,34.422003,-119.793968,WGS84,799,,,,GeoLocate,,More Mesa,,,,,,,,,phorsley,2/22/2019 10:22,,1,urn:uuid:da466864-3c04-4b6f-aeb6-81d2cabcafc7,https://symbiota.ccber.ucsb.edu:443/collections/individual/index.php?occid=106120
106130,UCSB,IZC,,PreservedSpecimen,bfbabe93-d669-496f-ada9-241e308f4f38,UCSB-IZC00006606,,Animalia,Arthropoda,Insecta,Hymenoptera,Formicidae,Veromessor andrei,5549,"(Mayr, 1886)",Veromessor,andrei,,,Zach Brown,2018,,,,,,,,,,8/24/1974,1974,8,24,236,,,,,,,,,,,,,,,Adult,,1,,,Pinned,United States,California,Santa Barbara,,Foothills of Santa Barbara,,0,,34.487242,-119.689326,WGS84,7831,,,,GeoLocate,,Mountains near Santa Barbara Municipality,61,,,,,200 ft.,,,phorsley,2/21/2019 19:26,,1,urn:uuid:bfbabe93-d669-496f-ada9-241e308f4f38,https://symbiota.ccber.ucsb.edu:443/collections/individual/index.php?occid=106130
106131,UCSB,IZC,,PreservedSpecimen,54d60e1d-bdc9-4175-b287-1f8845f8c2de,UCSB-IZC00006607,,Animalia,Arthropoda,Insecta,Hymenoptera,Formicidae,Pogonomyrmex,2944,"Mayr, 1868",Pogonomyrmex,,,,Zach Brown,2018,,,,,,,,,,5/13/2015,2015,5,13,133,,,On label: DD (collector?),,,,,,,,,,,,Adult,,1,,,Pinned,United States,California,Santa Barbara,,"University of California, Santa Barbara Lagoon area",,0,,34.408606,-119.847083,,548,,rbehm (2018-09-28 16:05:54),,georef batch tool 2018-09-28; GeoLocate,reviewed - high confidence,,,,,,,,,,phorsley,2/20/2019 14:21,,1,urn:uuid:54d60e1d-bdc9-4175-b287-1f8845f8c2de,https://symbiota.ccber.ucsb.edu:443/collections/individual/index.php?occid=106131
106136,UCSB,IZC,,PreservedSpecimen,7c239c1e-d6f4-4246-8cb7-047285321f1b,UCSB-IZC00006612,,Animalia,Arthropoda,Insecta,Hymenoptera,Formicidae,Veromessor pergandei,5551,"(Mayr, 1886)",Veromessor,pergandei,,,Zach Brown,2018,,,,,,Ashley Treahy,,,,6/2/2015,2015,6,2,153,,,,,,,,,,,,,,,Adult,,1,,,Pinned,United States,California,Santa Barbara,,Lizard's Mouth,,0,,34.502873,-119.868033,WGS84,663,,,,GeoLocate,,Lizards Mouth Rock,,,,,,,,,phorsley,2/22/2019 9:40,,1,urn:uuid:7c239c1e-d6f4-4246-8cb7-047285321f1b,https://symbiota.ccber.ucsb.edu:443/collections/individual/index.php?occid=106136
106137,UCSB,IZC,,PreservedSpecimen,e0185565-0370-4933-816b-fc48adc14d94,UCSB-IZC00006613,,Animalia,Arthropoda,Insecta,Hymenoptera,Formicidae,Stenamma,3078,"Westwood, 1839",Stenamma,,,,Zach Brown,2018,,,,,,M. Sun,,,,5/15/2015,2015,5,15,135,,,,,,,,,,,,,,,Adult,,1,,,Pinned,United States,California,Santa Barbara,,Refugio Canyon,,0,,34.490317,-119.781731,,15811,,rbehm (2018-09-28 15:25:14),,georef batch tool 2018-09-28; GeoLocate,reviewed - high confidence,,,,,,,,,,phorsley,2/20/2019 15:05,,1,urn:uuid:e0185565-0370-4933-816b-fc48adc14d94,https://symbiota.ccber.ucsb.edu:443/collections/individual/index.php?occid=106137
106139,UCSB,IZC,,PreservedSpecimen,4d3563bf-55c2-4a31-9ca0-5830ce758c03,UCSB-IZC00006615,,Animalia,Arthropoda,Insecta,Hymenoptera,Formicidae,Myrmicinae,752,,,,,,I. Naughton,2017,,,,,,,,,,1970-05-00,1970,5,,,,,,,,,,,,,,,,,,,,,,,United States,California,Santa Barbara,,Coastal Slope,,0,,34.437101,-119.764221,,14282,,rbehm (2018-09-28 15:28:43),,georef batch tool 2018-09-28; GeoLocate,reviewed - high confidence,,,,,,,,,,phorsley,9/28/2018 15:28,,1,urn:uuid:4d3563bf-55c2-4a31-9ca0-5830ce758c03,https://symbiota.ccber.ucsb.edu:443/collections/individual/index.php?occid=106139
106142,UCSB,IZC,,PreservedSpecimen,936c6f0e-b6ee-4677-bfd1-2efcaa2af3a1,UCSB-IZC00006618,,Animalia,Arthropoda,Insecta,Hymenoptera,Formicidae,Pogonomyrmex,2944,"Mayr, 1868",Pogonomyrmex,,,,Elaine Tan,2018,,,,,,,,,,4/28/1984,1984,4,28,119,,,,,,,,,,,,,,,Adult,,1,,,Pinned,United States,California,Santa Barbara,,Rattlesnake Canyon,,0,,34.471588,-119.687669,,3036,,rbehm (2018-09-28 15:51:51),,georef batch tool 2018-09-28; GeoLocate,reviewed - high confidence,,,,,,,,,,phorsley,2/20/2019 14:22,,1,urn:uuid:936c6f0e-b6ee-4677-bfd1-2efcaa2af3a1,https://symbiota.ccber.ucsb.edu:443/collections/individual/index.php?occid=106142
106145,UCSB,IZC,,PreservedSpecimen,22374cf6-ed67-4d3a-b04d-73131ed1fb0b,UCSB-IZC00006621,,Animalia,Arthropoda,Insecta,Hymenoptera,Formicidae,Pogonomyrmex,2944,"Mayr, 1868",Pogonomyrmex,,,,Elaine Tan,2018,,,,,,,,,,8/20/1974,1974,8,20,232,,,,by beach cliff,,,,,,,,,,,Adult,,1,,,Pinned,United States,California,Santa Barbara,,"University of California, Santa Barbara Campus",,0,,34.412534,-119.847305,,722,,rbehm (2018-10-01 13:18:25),,georef batch tool 2018-10-01; GeoLocate,reviewed - high confidence,,,,,,,,,,phorsley,2/20/2019 14:17,,1,urn:uuid:22374cf6-ed67-4d3a-b04d-73131ed1fb0b,https://symbiota.ccber.ucsb.edu:443/collections/individual/index.php?occid=106145
106157,UCSB,IZC,,PreservedSpecimen,cec94f74-8383-4be6-bf84-0a048e91a853,UCSB-IZC00006633,,Animalia,Arthropoda,Insecta,Hymenoptera,Formicidae,Myrmicinae,752,,,,,,I. Naughton,2017,,,,,,,,,,1978-05-00,1978,5,,,,,,,,,,,,,,,,,,,,,,,United States,California,Santa Barbara,,Lake Los Carneros,,0,,34.441666,-119.848335,,464,,rbehm (2018-09-28 15:21:44),,georef batch tool 2018-09-28; GeoLocate,reviewed - high confidence,,,,,,,,,,phorsley,9/28/2018 15:21,,1,urn:uuid:cec94f74-8383-4be6-bf84-0a048e91a853,https://symbiota.ccber.ucsb.edu:443/collections/individual/index.php?occid=106157
106158,UCSB,IZC,,PreservedSpecimen,9b233841-a440-42cc-b951-e56d2f39e1a5,UCSB-IZC00006634,,Animalia,Arthropoda,Insecta,Hymenoptera,Formicidae,Pogonomyrmex,2944,"Mayr, 1868",Pogonomyrmex,,,,Elaine Tan,2018,,,,,,Eduardo Moria,,,,5/4/1968,1968,5,4,125,,,,,,,,,,,,,,,Adult,,1,,,Pinned,United States,California,Santa Barbara,,Santa Ynez Valley,,0,,34.584154,-120.097368,,6152,,rbehm (2018-09-28 15:26:13),,georef batch tool 2018-09-28; GeoLocate,reviewed - high confidence,,,,,,,,,,phorsley,2/13/2019 17:12,,1,urn:uuid:9b233841-a440-42cc-b951-e56d2f39e1a5,https://symbiota.ccber.ucsb.edu:443/collections/individual/index.php?occid=106158
106160,UCSB,IZC,,PreservedSpecimen,3d0b0d26-8ebb-4ef0-b94f-892937a09a5d,UCSB-IZC00006636,,Animalia,Arthropoda,Insecta,Hymenoptera,Formicidae,Pogonomyrmex,2944,"Mayr, 1868",Pogonomyrmex,,,,Elaine Tan,2018,,,,,,,,,,6/1/1983,1983,6,1,152,,,,,,,,,,,,,,,Adult,,1,,,Pinned,United States,California,Santa Barbara,,Red Rock Campground,,0,,34.53981,-119.71913,,136,,rbehm (2018-09-17 15:17:48),,georef batch tool 2018-09-17,reviewed - high confidence,,,,,,,,,,phorsley,2/13/2019 17:10,,1,urn:uuid:3d0b0d26-8ebb-4ef0-b94f-892937a09a5d,https://symbiota.ccber.ucsb.edu:443/collections/individual/index.php?occid=106160
106163,UCSB,IZC,,PreservedSpecimen,85a784db-bc97-44fd-b53a-ccbc0c73db28,UCSB-IZC00006639,,Animalia,Arthropoda,Insecta,Hymenoptera,Formicidae,Pogonomyrmex,2944,"Mayr, 1868",Pogonomyrmex,,,,Elaine Tan,2018,,,,,,,,,,1983-05-00,1983,5,,,,,,,,,,,,,,,,,Adult,,1,,,Pinned,United States,California,Santa Barbara,,"University of California, Santa Barbara",,0,,34.412534,-119.847305,,722,,rbehm (2018-09-28 15:54:55),,georef batch tool 2018-09-28; GeoLocate,reviewed - high confidence,,,,,,,,,,phorsley,2/13/2019 17:09,,1,urn:uuid:85a784db-bc97-44fd-b53a-ccbc0c73db28,https://symbiota.ccber.ucsb.edu:443/collections/individual/index.php?occid=106163
106164,UCSB,IZC,,PreservedSpecimen,3ea4fcc8-e596-4390-9a75-833eb212eff4,UCSB-IZC00006640,,Animalia,Arthropoda,Insecta,Hymenoptera,Formicidae,Veromessor andrei,5549,"(Mayr, 1886)",Veromessor,andrei,,,Zach Brown,2018,,,,,,,,,,8/27/1974,1974,8,27,239,,,,,,,,,,,,,,,Adult,Female,1,,,Pinned,United States,California,Santa Barbara,Santa Barbara,Foothills of Santa Barbara,,0,,34.487242,-119.689326,WGS84,7831,,,,GeoLocate,,Mountains near Santa Barbara Municipality,152,,,,,500 ft.,,,phorsley,2/22/2019 9:52,,1,urn:uuid:3ea4fcc8-e596-4390-9a75-833eb212eff4,https://symbiota.ccber.ucsb.edu:443/collections/individual/index.php?occid=106164
106165,UCSB,IZC,,PreservedSpecimen,f23ed5eb-252a-4ac2-935f-505f539f9045,UCSB-IZC00006641,,Animalia,Arthropoda,Insecta,Hymenoptera,Formicidae,Stenamma,3078,"Westwood, 1839",Stenamma,,,,Zach Brown,2018,,,,,,Jim Latham,,,,1969-00-00,1969,,,,,,,,,,,,,,,,,,Adult,,1,,,Pinned,United States,California,Santa Barbara,,"University of California, Santa Barbara Campus",,0,,34.412534,-119.847305,,722,,rbehm (2018-10-01 13:18:25),,georef batch tool 2018-10-01; GeoLocate,reviewed - high confidence,,,,,,,,,,phorsley,2/20/2019 15:04,,1,urn:uuid:f23ed5eb-252a-4ac2-935f-505f539f9045,https://symbiota.ccber.ucsb.edu:443/collections/individual/index.php?occid=106165
106166,UCSB,IZC,,PreservedSpecimen,36c05251-7b4f-4a19-a625-c3bf8bf20c3a,UCSB-IZC00006642,,Animalia,Arthropoda,Insecta,Hymenoptera,Formicidae,Pogonomyrmex,2944,"Mayr, 1868",Pogonomyrmex,,,,Elaine Tan,2018,,,,,,,,,,1982-04-00,1982,4,,,,,,,,,,,,,,,,,Adult,,1,,,Pinned,United States,California,Santa Barbara,,"University of California, Santa Barbara Campus",,0,,34.412534,-119.847305,,722,,rbehm (2018-10-01 13:18:25),,georef batch tool 2018-10-01; GeoLocate,reviewed - high confidence,,,,,,,,,,phorsley,2/20/2019 14:36,,1,urn:uuid:36c05251-7b4f-4a19-a625-c3bf8bf20c3a,https://symbiota.ccber.ucsb.edu:443/collections/individual/index.php?occid=106166
106169,UCSB,IZC,,PreservedSpecimen,40c6712c-4314-4c1c-ad1d-8da59668a195,UCSB-IZC00006645,,Animalia,Arthropoda,Insecta,Hymenoptera,Formicidae,Pogonomyrmex,2944,"Mayr, 1868",Pogonomyrmex,,,,Elaine Tan,2018,,,,,,,,,,8/24/1974,1974,8,24,236,,,,,,,,,,,,,,,Adult,,1,,,Pinned,United States,California,Santa Barbara,,Foothills of Santa Barbara,,0,,34.487242,-119.689326,WGS84,7831,,,,GeoLocate,,Mountains near Santa Barbara Municipality,,,,,,500,,,phorsley,2/22/2019 9:52,,1,urn:uuid:40c6712c-4314-4c1c-ad1d-8da59668a195,https://symbiota.ccber.ucsb.edu:443/collections/individual/index.php?occid=106169
106181,UCSB,IZC,,PreservedSpecimen,103ae13a-2f5c-4a20-bc10-3de9176789c6,UCSB-IZC00006657,,Animalia,Arthropoda,Insecta,Hymenoptera,Formicidae,Pogonomyrmex,2944,"Mayr, 1868",Pogonomyrmex,,,,Elaine Tan,2018,,,,,,Diana Lua,,,,5/2/2015,2015,5,2,122,,,,,,,,,,,,,,,Adult,,1,,,Pinned,United States,California,Santa Barbara,Isla Vista,,,0,,34.413329,-119.860972,WGS84,2164,,,,GeoLocate,,Isla Vista Municipality,,,,,,,,,phorsley,2/22/2019 9:53,,1,urn:uuid:103ae13a-2f5c-4a20-bc10-3de9176789c6,https://symbiota.ccber.ucsb.edu:443/collections/individual/index.php?occid=106181
106183,UCSB,IZC,,PreservedSpecimen,4281159e-b689-49b9-ad31-61a76b761216,UCSB-IZC00006659,,Animalia,Arthropoda,Insecta,Hymenoptera,Formicidae,Pogonomyrmex,2944,"Mayr, 1868",Pogonomyrmex,,,,Elaine Tan,2018,,,,,,Cayla Lariosa,,,,4/14/2015,2015,4,14,104,,,,,,,,,,,,,,,Adult,,1,,,Pinned,United States,California,Santa Barbara,,Robs Gym 2320,,0,,34.416178,-119.849123,WGS84,77,,,,GeoLocate,,"Robertson Gym, University of California, Santa Barbara",,,,,,,,,phorsley,2/22/2019 9:56,,1,urn:uuid:4281159e-b689-49b9-ad31-61a76b761216,https://symbiota.ccber.ucsb.edu:443/collections/individual/index.php?occid=106183
106184,UCSB,IZC,,PreservedSpecimen,6f08b0d4-530e-4191-81e9-2859676b0c91,UCSB-IZC00006660,,Animalia,Arthropoda,Insecta,Hymenoptera,Formicidae,Myrmicinae,752,,,,,,I. Naughton,2017,,,,,,C. Calahan,,,,6/3/2015,2015,6,3,154,,,,,,,,,,,,,,,,,,,,,United States,California,Santa Barbara,,Cold Springs,,0,,34.52805,-119.829585,,1506,,rbehm (2018-09-28 15:50:06),,georef batch tool 2018-09-28; GeoLocate,reviewed - high confidence,,,,,,,,,,phorsley,9/28/2018 15:50,,1,urn:uuid:6f08b0d4-530e-4191-81e9-2859676b0c91,https://symbiota.ccber.ucsb.edu:443/collections/individual/index.php?occid=106184
106187,UCSB,IZC,,PreservedSpecimen,064211cc-8f57-40b2-916d-812859996be6,UCSB-IZC00006664,,Animalia,Arthropoda,Insecta,Hymenoptera,Formicidae,Myrmicinae,752,,,,,,I. Naughton,2017,,,,,,,,,,5/27/1984,1984,5,27,148,,,,,,,,,,,,,,,,,,,,,United States,California,Santa Barbara,,Coal Oil Point 1 & 2,,0,,34.415649,-119.876711,,943,,rbehm (2018-09-28 15:20:01),,georef batch tool 2018-09-28; GeoLocate,reviewed - high confidence,,,,,,,,,,phorsley,9/28/2018 15:20,,1,urn:uuid:064211cc-8f57-40b2-916d-812859996be6,https://symbiota.ccber.ucsb.edu:443/collections/individual/index.php?occid=106187
106189,UCSB,IZC,,PreservedSpecimen,23fd4a45-2c31-4943-843c-3a49d8c9c921,UCSB-IZC00006666,,Animalia,Arthropoda,Insecta,Hymenoptera,Formicidae,Veromessor andrei,5549,"(Mayr, 1886)",Veromessor,andrei,,,Elaine Tan,2018,,,,,,,,,,5/12/1974,1974,5,12,132,,,,ground,,,,,,,,,,,Adult,,1,,,Pinned,United States,California,Santa Barbara,,"Goddard Camp, ground of West Camino Cielo Road",,0,,34.527799,-119.951214,WGS84,3036,,,,GeoLocate,,All of West Camino Cielo Road,,,,,,,,,phorsley,2/22/2019 10:15,,1,urn:uuid:23fd4a45-2c31-4943-843c-3a49d8c9c921,https://symbiota.ccber.ucsb.edu:443/collections/individual/index.php?occid=106189
106197,UCSB,IZC,,PreservedSpecimen,12871a78-faaf-4f72-9aa1-ad9586895f0c,UCSB-IZC00006676,,Animalia,Arthropoda,Insecta,Hymenoptera,Formicidae,Pogonomyrmex,2944,"Mayr, 1868",Pogonomyrmex,,,,Elaine Tan,2018,,,,,,,,,,4/28/1973,1973,4,28,118,,,,,,,,,,,,,,,Adult,,1,,,Pinned,United States,California,Santa Barbara,,Santa Ynez Valley,,0,,34.584154,-120.097368,,6152,,rbehm (2018-09-28 15:26:13),,georef batch tool 2018-09-28; GeoLocate,reviewed - high confidence,,,,,,,,,,phorsley,2/20/2019 14:30,,1,urn:uuid:12871a78-faaf-4f72-9aa1-ad9586895f0c,https://symbiota.ccber.ucsb.edu:443/collections/individual/index.php?occid=106197
106203,UCSB,IZC,,PreservedSpecimen,ee6b44c1-5cb2-4928-81a1-1ca51a76c258,UCSB-IZC00006682,,Animalia,Arthropoda,Insecta,Hymenoptera,Formicidae,Myrmicinae,752,,,,,,I. Naughton,2017,,,,,,,,,,,,,,,,May 197,,,,,,,,,,,,,,,,,,,United States,California,Santa Barbara,,Refugio,,0,,34.490317,-119.781731,,15811,,rbehm (2018-09-28 15:25:14),,georef batch tool 2018-09-28; GeoLocate,reviewed - high confidence,,,,,,,,,,phorsley,9/28/2018 15:25,,1,urn:uuid:ee6b44c1-5cb2-4928-81a1-1ca51a76c258,https://symbiota.ccber.ucsb.edu:443/collections/individual/index.php?occid=106203
106205,UCSB,IZC,,PreservedSpecimen,8d4760d3-5f0a-44b1-9290-0299c860198e,UCSB-IZC00006684,,Animalia,Arthropoda,Insecta,Hymenoptera,Formicidae,Pogonomyrmex,2944,"Mayr, 1868",Pogonomyrmex,,,,Elaine Tan,2018,,,,,,,,,,1987-05-00,1987,5,,,,,,,,,,,,,,,,,Adult,,1,,,Pinned,United States,California,Santa Barbara,,"University of California, Santa Barbara",,0,,34.412534,-119.847305,,722,,rbehm (2018-09-28 15:55:18),,georef batch tool 2018-09-28; GeoLocate,reviewed - high confidence,,,,,,,,,,phorsley,2/20/2019 14:34,,1,urn:uuid:8d4760d3-5f0a-44b1-9290-0299c860198e,https://symbiota.ccber.ucsb.edu:443/collections/individual/index.php?occid=106205
106216,UCSB,IZC,,PreservedSpecimen,5e75c5e4-28e5-4aab-9dfe-798562e47cde,UCSB-IZC00006696,,Animalia,Arthropoda,Insecta,Hymenoptera,Formicidae,Pogonomyrmex,2944,"Mayr, 1868",Pogonomyrmex,,,,Elaine Tan,2018,,,,,,,,,,5/3/1978,1978,5,3,123,,,,,,,,,,,,,,,Adult,,1,,,Pinned,United States,California,Santa Barbara,,Santa Ynez River,,0,,34.653858,-120.329843,WGS84,33009,,,,GeoLocate,,All along Santa Ynez River,,,,,,,,,phorsley,2/22/2019 10:16,,1,urn:uuid:5e75c5e4-28e5-4aab-9dfe-798562e47cde,https://symbiota.ccber.ucsb.edu:443/collections/individual/index.php?occid=106216
106231,UCSB,IZC,,PreservedSpecimen,84a9269f-a909-4409-9198-eabb517f1b9f,UCSB-IZC00006714,,Animalia,Arthropoda,Insecta,Hymenoptera,Formicidae,Pogonomyrmex,2944,"Mayr, 1868",Pogonomyrmex,,,,Elaine Tan,2018,,,,,,C. Danh,,,,6/2/2015,2015,6,2,153,,,,,,,,,,,,,,,Adult,,1,,,Pinned,United States,California,Santa Barbara,Isla Vista,Anisqoyo Park,,0,,34.412346,-119.8562,WGS84,93,,,,GeoLocate,,,,,,,,,,,phorsley,2/22/2019 10:20,,1,urn:uuid:84a9269f-a909-4409-9198-eabb517f1b9f,https://symbiota.ccber.ucsb.edu:443/collections/individual/index.php?occid=106231
106240,UCSB,IZC,,PreservedSpecimen,464701bc-69b8-4554-8963-a5ec6ee1725c,UCSB-IZC00006730,,Animalia,Arthropoda,Insecta,Hymenoptera,Formicidae,Veromessor andrei,5549,"(Mayr, 1886)",Veromessor,andrei,,,Elaine Tan,2018,,,,,,N. Pham,,,,5/30/2015,2015,5,30,150,,,,,,,,,,,,,,,Adult,,1,,,Pinned,United States,California,Santa Barbara,,"Refugio Canyon, Refugio Creek",,0,,34.490317,-119.781731,,15811,,rbehm (2018-09-28 15:25:14),,georef batch tool 2018-09-28; GeoLocate,reviewed - high confidence,,,,,,,,,,phorsley,2/20/2019 13:19,,1,urn:uuid:464701bc-69b8-4554-8963-a5ec6ee1725c,https://symbiota.ccber.ucsb.edu:443/collections/individual/index.php?occid=106240
106242,UCSB,IZC,,PreservedSpecimen,4f404aad-ce0a-41ab-a1c6-4cfe9bf9e2f8,UCSB-IZC00006733,,Animalia,Arthropoda,Insecta,Hymenoptera,Formicidae,Tapinoma,1765,"Förster, 1850",Tapinoma,,,,Elaine Tan,2018,,,,,,Z. Galvan,,,,5/25/2015,2015,5,25,145,,,,,,,,,,,,,,,Adult,,1,,,Pinned,United States,California,Santa Barbara,,More Mesa,,0,,34.421507,-119.794568,WGS84,848,,,,GeoLocate,,More Mesa Park,,,,,,,,,phorsley,2/22/2019 10:21,,1,urn:uuid:4f404aad-ce0a-41ab-a1c6-4cfe9bf9e2f8,https://symbiota.ccber.ucsb.edu:443/collections/individual/index.php?occid=106242
106244,UCSB,IZC,,PreservedSpecimen,55215dea-8db3-438a-8e44-f84361a4aaa0,UCSB-IZC00006737,,Animalia,Arthropoda,Insecta,Hymenoptera,Formicidae,Polyergus,2945,"Latreille, 1804",Polyergus,,,,Zach Brown,2018,,,,,,N. Pham,,,,5/16/2015,2015,5,16,136,,,,,,,,,,,,,,,,,,,,,United States,California,Santa Barbara,,Lizards Mouth Trail,,0,,34.502242,-119.867937,WGS84,381,,,,GeoLocate,,Lizards Mouth Rock to road,,,,,,,,,phorsley,2/22/2019 10:32,,1,urn:uuid:55215dea-8db3-438a-8e44-f84361a4aaa0,https://symbiota.ccber.ucsb.edu:443/collections/individual/index.php?occid=106244
106264,UCSB,IZC,,PreservedSpecimen,d887ff82-509e-4c04-9368-a3b52b54c58f,UCSB-IZC00006769,,Animalia,Arthropoda,Insecta,Hymenoptera,Formicidae,Pogonomyrmex,2944,"Mayr, 1868",Pogonomyrmex,,,,Zach Brown,2018,,,,,,,,,,6/25/2016,2016,6,25,177,,,,,,,,,,,,,,,Adult,,1,mesh net,,Pinned,United States,California,Santa Barbara,,Refugio Canyon,,0,,34.5077,-120.0645,WGS84,,,,,"GPS, on label",,,3,,,,,3.0m,,,phorsley,2/20/2019 14:04,,1,urn:uuid:d887ff82-509e-4c04-9368-a3b52b54c58f,https://symbiota.ccber.ucsb.edu:443/collections/individual/index.php?occid=106264
106273,UCSB,IZC,,PreservedSpecimen,db8656e3-2b35-4932-a9b5-ae1d860f7f58,UCSB-IZC00006861,,Animalia,Arthropoda,Insecta,Hymenoptera,Formicidae,Liometopum occidentale,5024,"Emery, 1895",Liometopum,occidentale,,,Elaine Tan,2018,,,,,,,,,,5/1/1974,1974,5,1,121,,,,,,,,,,,,,,,Adult,,1,,,Pinned,United States,California,Santa Barbara,,"Santa Ynez Campground, Santa Ynez River",,0,,34.510967,-119.57971,WGS84,432,,,,GeoLocate,,Middle Santa Ynez Campground,,,,,,,,,phorsley,2/22/2019 10:36,,1,urn:uuid:db8656e3-2b35-4932-a9b5-ae1d860f7f58,https://symbiota.ccber.ucsb.edu:443/collections/individual/index.php?occid=106273
106274,UCSB,IZC,,PreservedSpecimen,b49fd2d1-ab00-42f8-be33-ea6e854e9ed9,UCSB-IZC00006863,,Animalia,Arthropoda,Insecta,Hymenoptera,Formicidae,Pogonomyrmex,2944,"Mayr, 1868",Pogonomyrmex,,,,Elaine Tan,2018,,,,,,,,,,8/27/1974,1974,8,27,239,,,,,,,,,,,,,,,Adult,,1,,,Pinned,United States,California,Santa Barbara,,Foothills of Santa Barbara,,0,,34.487242,-119.689326,WGS84,7831,,,,GeoLocate,,Mountains near Santa Barbara Municipality,91,,,,,300 ft.,,,phorsley,2/22/2019 10:36,,1,urn:uuid:b49fd2d1-ab00-42f8-be33-ea6e854e9ed9,https://symbiota.ccber.ucsb.edu:443/collections/individual/index.php?occid=106274
106275,UCSB,IZC,,PreservedSpecimen,c3a47397-fca2-4283-8c38-21f687157e8c,UCSB-IZC00006864,,Animalia,Arthropoda,Insecta,Hymenoptera,Formicidae,Liometopum occidentale,5024,"Emery, 1895",Liometopum,occidentale,,,Zach Brown,2018,,,,,,,,,,5/21/1983,1983,5,21,141,,,,,,,,,,,,,,,Adult,,1,,,Pinned,United States,California,Santa Barbara,,"Pino Alto, Figueroa Mountain",,0,,34.743317,-119.985143,WGS84,10182,,,,GeoLocate,,Figueroa Mountain,,,,,,,,,phorsley,2/22/2019 10:39,,1,urn:uuid:c3a47397-fca2-4283-8c38-21f687157e8c,https://symbiota.ccber.ucsb.edu:443/collections/individual/index.php?occid=106275
106276,UCSB,IZC,,PreservedSpecimen,581c6480-d456-4a20-92a5-33fb9ecd3779,UCSB-IZC00006867,,Animalia,Arthropoda,Insecta,Hymenoptera,Formicidae,Linepithema humile,5028,"(Mayr, 1868)",Linepithema,humile,,,Elaine Tan,2018,,,,,,Kristina Lopez,,,,7/20/2016,2016,7,20,202,,,,crawling in a flower,,,,,,,,,,,Adult,,1,hand collecting,,Pinned,United States,California,Santa Barbara,,"University of California, Santa Barbara West Lagoon; 34.4076 -119.8438",,0,,34.4076,-119.8438,WGS84,,,,,"GPS, on label",,,,,,,,,,,phorsley,2/6/2019 14:44,,1,urn:uuid:581c6480-d456-4a20-92a5-33fb9ecd3779,https://symbiota.ccber.ucsb.edu:443/collections/individual/index.php?occid=106276
106277,UCSB,IZC,,PreservedSpecimen,9f0807da-ee91-428f-a942-1dd67587fbf1,UCSB-IZC00006870,,Animalia,Arthropoda,Insecta,Hymenoptera,Formicidae,Liometopum occidentale,5024,"Emery, 1895",Liometopum,occidentale,,,Elaine Tan,2018,,,,,,,,,,5/11/2015,2015,5,11,131,,,On label: DD (collector?),,,,,,,,,,,,Adult,,1,,,Pinned,United States,California,Santa Barbara,,"University of California, Santa Barbara Lagoon area",,0,,34.408606,-119.847083,,548,,rbehm (2018-09-28 16:05:54),,georef batch tool 2018-09-28; GeoLocate,reviewed - high confidence,,,,,,,,,,phorsley,2/13/2019 12:59,,1,urn:uuid:9f0807da-ee91-428f-a942-1dd67587fbf1,https://symbiota.ccber.ucsb.edu:443/collections/individual/index.php?occid=106277
106278,UCSB,IZC,,PreservedSpecimen,4b051b08-23de-4743-8dd5-bdd4db6505df,UCSB-IZC00006874,,Animalia,Arthropoda,Insecta,Hymenoptera,Formicidae,Liometopum occidentale,5024,"Emery, 1895",Liometopum,occidentale,,,Elaine Tan,2018,,,,,,,,,,5/1/1974,1974,5,1,121,,,,,,,,,,,,,,,Adult,,1,,,Pinned,United States,California,Santa Barbara,,"Santa Ynez Campground, Santa Ynez River",,0,,34.510827,-119.579573,WGS84,3036,,,,GeoLocate,,Middle Santa Ynez Campground,,,,,,,,,phorsley,2/22/2019 10:43,,1,urn:uuid:4b051b08-23de-4743-8dd5-bdd4db6505df,https://symbiota.ccber.ucsb.edu:443/collections/individual/index.php?occid=106278
106279,UCSB,IZC,,PreservedSpecimen,02e9bcd6-6b5b-45be-921a-83df97d27df0,UCSB-IZC00006875,,Animalia,Arthropoda,Insecta,Hymenoptera,Formicidae,Crematogaster,2473,"Lund, 1831",Crematogaster,,,,Zach Brown,2018,,,,,,UCSB Zoology 125: PAR,,,,11/10/1987,1987,11,10,314,,,,,,,,,,,,,,,Adult,,1,,,Pinned,United States,California,Santa Barbara,,3km southwest of Goleta,,0,,34.416667,-119.85,,,34° 25' N 119° 51' W,,,,,,20,,,,,<20m,,,phorsley,2/20/2019 14:51,,1,urn:uuid:02e9bcd6-6b5b-45be-921a-83df97d27df0,https://symbiota.ccber.ucsb.edu:443/collections/individual/index.php?occid=106279
106280,UCSB,IZC,,PreservedSpecimen,0a3c84ee-0b48-4ffc-95d3-b0c019397f4e,UCSB-IZC00006877,,Animalia,Arthropoda,Insecta,Hymenoptera,Formicidae,Linepithema humile,5028,"(Mayr, 1868)",Linepithema,humile,,,Elaine Tan,2018,,,,,,C. Alba,,,,5/13/2003,2003,5,13,133,,,,,,,,,,,,,,,Adult,,1,,,,United States,California,Santa Barbara,,"University of California, Santa Barbara Garden Plot",,0,,34.413329,-119.860972,WGS84,2476,,,,GeoLocate,,Community Garden and Isla Vista,,,,,,,,,phorsley,2/22/2019 10:45,,1,urn:uuid:0a3c84ee-0b48-4ffc-95d3-b0c019397f4e,https://symbiota.ccber.ucsb.edu:443/collections/individual/index.php?occid=106280
106281,UCSB,IZC,,PreservedSpecimen,1b809d93-4a80-4d81-9249-aa56c9afbbc8,UCSB-IZC00006879,,Animalia,Arthropoda,Insecta,Hymenoptera,Formicidae,Linepithema humile,5028,"(Mayr, 1868)",Linepithema,humile,,,I. Naughton,2017,,,,,,Jason Garland,,,,2016-06-00,2016,6,,,,,,,,,,,,,,,,,,,1,,,Pinned,United States,California,Santa Barbara,,"University of California, Santa Barbara Campus; 34.4137 -119.8418",,0,,34.4137,-119.8418,,,,,,on label,,,,,,,,,,,phorsley,2/6/2019 14:55,,1,urn:uuid:1b809d93-4a80-4d81-9249-aa56c9afbbc8,https://symbiota.ccber.ucsb.edu:443/collections/individual/index.php?occid=106281
106282,UCSB,IZC,,PreservedSpecimen,6c16433a-7e03-477d-acc1-b661271cc368,UCSB-IZC00006888,,Animalia,Arthropoda,Insecta,Hymenoptera,Formicidae,Linepithema humile,5028,"(Mayr, 1868)",Linepithema,humile,,,I. Naughton,2017,,,,,,,,,,1970-04-00,1970,4,,,,,,,,,,,,,,,,,,,1,,,,United States,California,Santa Barbara,,Coastal Slope,,0,,34.437101,-119.764221,,14282,,rbehm (2018-09-28 15:28:43),,georef batch tool 2018-09-28; GeoLocate,reviewed - high confidence,,,,,,,,,,phorsley,2/6/2019 14:16,,1,urn:uuid:6c16433a-7e03-477d-acc1-b661271cc368,https://symbiota.ccber.ucsb.edu:443/collections/individual/index.php?occid=106282
106283,UCSB,IZC,,PreservedSpecimen,58ab6580-f623-4da1-857e-3a7cfa691f39,UCSB-IZC00006889,,Animalia,Arthropoda,Insecta,Hymenoptera,Formicidae,Liometopum occidentale,5024,"Emery, 1895",Liometopum,occidentale,,,Elaine Tan,2018,,,,,,Gabby M.,,,,5/7/2015,2015,5,7,127,,,,,,,,,,,,,,,Adult,,1,,,Pinned,United States,California,Santa Barbara,,Refugio Park,,0,,34.490317,-119.781731,,15811,,rbehm (2018-09-28 15:25:14),,georef batch tool 2018-09-28; GeoLocate,reviewed - high confidence,,,,,,,,,,phorsley,2/13/2019 13:20,,1,urn:uuid:58ab6580-f623-4da1-857e-3a7cfa691f39,https://symbiota.ccber.ucsb.edu:443/collections/individual/index.php?occid=106283
106285,UCSB,IZC,,PreservedSpecimen,366fb4a7-cc49-41bc-ab2d-a5540cc2ddb3,UCSB-IZC00006892,,Animalia,Arthropoda,Insecta,Hymenoptera,Formicidae,Linepithema humile,5028,"(Mayr, 1868)",Linepithema,humile,,,Elaine Tan,2018,,,,,,Maribel Lopez,,,,5/18/2016,2016,5,18,139,,,,,,,,,,,,,,,,,1,hand collecting,,Pinned,United States,California,Santa Barbara,,San Clemente Restoration Site; 34.4181 -119.8588,,0,,34.4181,-119.8588,,,,,,"Google Earth, on label",,,8,,,,,8m,,,phorsley,2/6/2019 14:13,,1,urn:uuid:366fb4a7-cc49-41bc-ab2d-a5540cc2ddb3,https://symbiota.ccber.ucsb.edu:443/collections/individual/index.php?occid=106285
106291,UCSB,IZC,,PreservedSpecimen,560018e5-02e9-4162-a3f3-6785e45c1717,UCSB-IZC00006941,,Animalia,Arthropoda,Insecta,Hymenoptera,Formicidae,Linepithema humile,5028,"(Mayr, 1868)",Linepithema,humile,,,Elaine Tan,2018,,,,,,Christopher Perry,,,,6/29/2016,2016,6,29,181,,,,,,,,,,,,,,,,,1,Glass jar,,Pinned,United States,California,Santa Barbara,Isla Vista,,,0,,34.4059,-119.8444,WGS84,,,,,"GPS, on label",,,3,,,,,3.0m,,,phorsley,2/6/2019 14:30,,1,urn:uuid:560018e5-02e9-4162-a3f3-6785e45c1717,https://symbiota.ccber.ucsb.edu:443/collections/individual/index.php?occid=106291
106294,UCSB,IZC,,PreservedSpecimen,fb8f59b3-f9cf-45ec-b8ad-b858c7b52ed7,UCSB-IZC00006953,,Animalia,Arthropoda,Insecta,Hymenoptera,Formicidae,Monomorium,2763,"Mayr, 1855",Monomorium,,,,Zach Brown,2018,,,,,,Cynthia Ibarra,,,,7/25/2016,2016,7,25,207,,,,walking along bench,,,,,,,,,,,Adult,,1,hand collected,,Pinned,United States,California,Santa Barbara,,Lake Los Carneros,,0,,34.442772,-119.848178,,,,,,on label,,,,,,,,,,,phorsley,2/20/2019 13:10,,1,urn:uuid:fb8f59b3-f9cf-45ec-b8ad-b858c7b52ed7,https://symbiota.ccber.ucsb.edu:443/collections/individual/index.php?occid=106294
106297,UCSB,IZC,,PreservedSpecimen,c8760982-d8a6-417d-9419-240794213f44,UCSB-IZC00007035,,Animalia,Arthropoda,Insecta,Hymenoptera,Formicidae,Camponotus,2424,"Mayr, 1861",Camponotus,,,,I. Naughton,2017,,,,,,,,,,1975-05-00,1975,5,,,,,,,,,,,,,,,,,,,,,,,United States,California,Santa Barbara,,Rattlesnake Canyon,,0,,34.471588,-119.687669,,3036,,rbehm (2018-09-28 15:51:51),,georef batch tool 2018-09-28; GeoLocate,reviewed - high confidence,,,,,,,,,,phorsley,9/28/2018 15:51,,1,urn:uuid:c8760982-d8a6-417d-9419-240794213f44,https://symbiota.ccber.ucsb.edu:443/collections/individual/index.php?occid=106297
106300,UCSB,IZC,,PreservedSpecimen,ae07cf4c-36ad-48a8-b6f9-5af171859b87,UCSB-IZC00007054,,Animalia,Arthropoda,Insecta,Hymenoptera,Formicidae,Formica,2582,"Linnaeus, 1758",Formica,,,,Elaine Tan,2018,,,,,,E. Mollenhauer,,,,5/16/2015,2015,5,16,136,,,,,,,,,,,,,,,Adult,,1,,,Pinned,United States,California,Santa Barbara,,Tangerine Falls,,0,,34.459111,-119.652207,WGS84,613,,,,GeoLocate,,Tangerine Falls Trail Head and Trail,,,,,,,,,phorsley,2/22/2019 10:55,,1,urn:uuid:ae07cf4c-36ad-48a8-b6f9-5af171859b87,https://symbiota.ccber.ucsb.edu:443/collections/individual/index.php?occid=106300
106304,UCSB,IZC,,PreservedSpecimen,cf5ff4fd-5d9d-4a31-947b-e430648b89de,UCSB-IZC00010564,,Animalia,Arthropoda,Insecta,Hymenoptera,Formicidae,Formica,2582,"Linnaeus, 1758",Formica,,,,Elaine Tan,2018,,,,,,Josh Vasquez,,,,5/30/2016,2016,5,30,151,,,,,,,,,,,,,,,Adult,,1,,,Pinned,United States,California,Santa Barbara,,East Camino Cielo/Painted Cave,,0,,34.504167,-119.787226,WGS84,1915,,,,GeoLocate,,Painted Cave and surrounding areas,,,,,,,,,phorsley,2/22/2019 10:57,,1,urn:uuid:cf5ff4fd-5d9d-4a31-947b-e430648b89de,https://symbiota.ccber.ucsb.edu:443/collections/individual/index.php?occid=106304
106305,UCSB,IZC,,PreservedSpecimen,ddbef616-0144-4bd1-ab05-28c74da91bda,UCSB-IZC00010570,,Animalia,Arthropoda,Insecta,Hymenoptera,Formicidae,Formica,2582,"Linnaeus, 1758",Formica,,,,Zach Brown,2018,,,,,,Anthony Helm,,,,5/6/2015,2015,5,6,126,,,,,,,,,,,,,,,Adult,,1,,,Pinned,United States,California,Santa Barbara,,Refugio Canyon,,0,,34.490317,-119.781731,,15811,,rbehm (2018-09-28 15:25:14),,georef batch tool 2018-09-28; GeoLocate,reviewed - high confidence,,,,,,,,,,phorsley,2/13/2019 16:22,,1,urn:uuid:ddbef616-0144-4bd1-ab05-28c74da91bda,https://symbiota.ccber.ucsb.edu:443/collections/individual/index.php?occid=106305
106306,UCSB,IZC,,PreservedSpecimen,39fb17de-35fb-4a3f-9d6f-1d5567f8c3b6,UCSB-IZC00010595,,Animalia,Arthropoda,Insecta,Hymenoptera,Formicidae,Camponotus,2424,"Mayr, 1861",Camponotus,,,,I. Naughton,2017,,,,,,P. Farrington,,,,1973-06-00,1973,6,,,,,,,,,,,,,,,,,,,,,,,United States,California,Santa Barbara,,Refugio Canyon,,0,,34.490317,-119.781731,,15811,,rbehm (2018-09-28 15:25:14),,georef batch tool 2018-09-28; GeoLocate,reviewed - high confidence,,,,,,,,,,phorsley,9/28/2018 15:25,,1,urn:uuid:39fb17de-35fb-4a3f-9d6f-1d5567f8c3b6,https://symbiota.ccber.ucsb.edu:443/collections/individual/index.php?occid=106306
106307,UCSB,IZC,,PreservedSpecimen,c1336efd-1c96-46df-b0f9-ffcce7f94685,UCSB-IZC00010614,,Animalia,Arthropoda,Insecta,Hymenoptera,Formicidae,Formica,2582,"Linnaeus, 1758",Formica,,,,Elaine Tan,2018,,,,,,,,,,1975-05-00,1975,5,,,,,,,,,,,,,,,,,Adult,,2,,,Pinned,United States,California,Santa Barbara,,Santa Ynez River,,0,,34.650469,-120.335336,WGS84,33407,,,,GeoLocate,,All along Santa Ynez River,,,,,,,,,phorsley,2/22/2019 10:58,,1,urn:uuid:c1336efd-1c96-46df-b0f9-ffcce7f94685,https://symbiota.ccber.ucsb.edu:443/collections/individual/index.php?occid=106307
106308,UCSB,IZC,,PreservedSpecimen,e99a73a8-b351-4f81-b64d-963f21236363,UCSB-IZC00010616,,Animalia,Arthropoda,Insecta,Hymenoptera,Formicidae,Formica,2582,"Linnaeus, 1758",Formica,,,,Elaine Tan,2018,,,,,,,,,,5/19/1984,1984,5,19,140,,,,,,,,,,,,,,,Adult,,1,,,Pinned,United States,California,Santa Barbara,,"Pino Alto, Figueroa Mountain",,0,,34.743317,-119.985143,WGS84,1807,,,,GeoLocate,,Figueroa Mountain,,,,,,,,,phorsley,2/22/2019 10:58,,1,urn:uuid:e99a73a8-b351-4f81-b64d-963f21236363,https://symbiota.ccber.ucsb.edu:443/collections/individual/index.php?occid=106308
112838,UCSB,IZC,,PreservedSpecimen,746aa5b0-d9b8-4959-a9ec-249a74db118e,UCSB-IZC00019808,,Animalia,Arthropoda,Insecta,Hymenoptera,Formicidae,Camponotus,2424,"Mayr, 1861",Camponotus,,,,Martin Kellogg,1999,,,,,,Martin Kellogg,,,,1999-06-00,1999,6,,,,,,,,,,,,,,,,,Adult,,,,,Pinned,United States,California,Santa Barbara,Santa Barbara,Forbush Flat,,0,,34.498015,-119.637633,WGS84,503,,,,GeoLocate,,Forbush Camp,,,,,,,,,zachary_brown,2/22/2019 11:00,,1,urn:uuid:746aa5b0-d9b8-4959-a9ec-249a74db118e,https://symbiota.ccber.ucsb.edu:443/collections/individual/index.php?occid=112838
112839,UCSB,IZC,,PreservedSpecimen,5409eb08-b828-494b-91bd-c1851c75384f,UCSB-IZC00019809,,Animalia,Arthropoda,Insecta,Hymenoptera,Formicidae,Pogonomyrmex,2944,"Mayr, 1868",Pogonomyrmex,,,,Zach Brown,2018,,,,,,G. Lyon,,,,5/17/1996,1996,5,17,138,,,,,,,,,,,,,,,,,,,,Pinned,United States,California,Santa Barbara,Santa Barbara,"University of California, Santa Barbara, Bluffs",,0,,34.410725,-119.845597,WGS84,1047,,,,GeoLocate,,"All of University of California, Santa Barbara coast",,,,,,,,,zachary_brown,2/22/2019 11:01,,1,urn:uuid:5409eb08-b828-494b-91bd-c1851c75384f,https://symbiota.ccber.ucsb.edu:443/collections/individual/index.php?occid=112839
112881,UCSB,IZC,,PreservedSpecimen,9f5da42e-6ccf-4e24-8ded-1f3b220c46b9,UCSB-IZC00019851,,Animalia,Arthropoda,Insecta,Hymenoptera,Formicidae,Pogonomyrmex,2944,"Mayr, 1868",Pogonomyrmex,,,,Zach Brown,2018,,,,,,Erik Dancsecs,,,,5/14/1996,1996,5,14,135,,,,,,,,,,,,,,,Adult,,1,,,Pinned,United States,California,Santa Barbara,Santa Barbara,"University of California, Santa Barbara",,0,,34.411786,-119.846471,WGS84,897,,,,GeoLocate,,,,,,,,,,,zachary_brown,2/22/2019 11:01,,1,urn:uuid:9f5da42e-6ccf-4e24-8ded-1f3b220c46b9,https://symbiota.ccber.ucsb.edu:443/collections/individual/index.php?occid=112881
112883,UCSB,IZC,,PreservedSpecimen,f02fae2d-1eef-4c32-8844-bc5da5b69dc1,UCSB-IZC00019853,,Animalia,Arthropoda,Insecta,Hymenoptera,Formicidae,Pogonomyrmex,2944,"Mayr, 1868",Pogonomyrmex,,,,Zach Brown,2018,,,,,,S. Davia,,,,4/28/1997,1997,4,28,118,,,,,,,,,,,,,,,Adult,,1,,,Pinned,United States,California,Santa Barbara,Isla Vista,Campus Point,,0,,34.405842,-119.844816,WGS84,273,,,,GeoLocate,,,,,,,,,,,zachary_brown,2/22/2019 11:02,,1,urn:uuid:f02fae2d-1eef-4c32-8844-bc5da5b69dc1,https://symbiota.ccber.ucsb.edu:443/collections/individual/index.php?occid=112883
115386,UCSB,IZC,,PreservedSpecimen,0235cab1-ec7b-457b-b5ec-995f9fe8be53,UCSB-IZC00018786,,Animalia,Arthropoda,Insecta,Hymenoptera,Formicidae,Camponotus maccooki,5555,"Forel, 1879",Camponotus,maccooki,,,,1974,,,,,,,,,,9/8/1974,1974,9,8,251,,,"Santa Cruz Island Reserve (SCIR) Collection, 2017",,,,,,,,,,,,Adult,Female,1,,,Pinned,United States,California,Santa Barbara,,Painted Cave Road,,0,,34.499393,-119.789327,WGS84,1358,,,,GeoLocate,,Entire Painted Cave Road,,,,,,,,,clchung,2/22/2019 11:05,,1,urn:uuid:0235cab1-ec7b-457b-b5ec-995f9fe8be53,https://symbiota.ccber.ucsb.edu:443/collections/individual/index.php?occid=115386
115387,UCSB,IZC,,PreservedSpecimen,475dd14d-e350-42af-a664-4b2aa5ea2cab,UCSB-IZC00018787,,Animalia,Arthropoda,Insecta,Hymenoptera,Formicidae,Camponotus maccooki,5555,"Forel, 1879",Camponotus,maccooki,,,,1974,,,,,,,,,,9/8/1974,1974,9,8,251,,,"Santa Cruz Island Reserve (SCIR) Collection, 2017",,,,,,,,,,,,Adult,,1,,,Pinned,United States,California,Santa Barbara,,Painted Cave Road,,0,,34.499393,-119.789327,WGS84,1358,,,,GeoLocate,,Entire Painted Cave Road,,,,,,,,,clchung,2/22/2019 11:05,,1,urn:uuid:475dd14d-e350-42af-a664-4b2aa5ea2cab,https://symbiota.ccber.ucsb.edu:443/collections/individual/index.php?occid=115387
115397,UCSB,IZC,,PreservedSpecimen,7713fd11-8f82-40fa-a8a4-b604236f5db4,UCSB-IZC00018812,,Animalia,Arthropoda,Insecta,Hymenoptera,Formicidae,Camponotus maccooki,5555,"Forel, 1879",Camponotus,maccooki,,,,1974,,,,,,,,,,9/8/1974,1974,9,8,251,,,"Santa Cruz Island Reserve (SCIR) Collection, 2017",,,,,,,,,,,,Adult,Female,1,,,Pinned,United States,California,Santa Barbara,,Painted Cave Road,,0,,34.499393,-119.789327,WGS84,1358,,,,GeoLocate,,Entire Painted Cave Road,,,,,,,,,clchung,2/22/2019 11:06,,1,urn:uuid:7713fd11-8f82-40fa-a8a4-b604236f5db4,https://symbiota.ccber.ucsb.edu:443/collections/individual/index.php?occid=115397
115402,UCSB,IZC,,PreservedSpecimen,cacd4f96-027c-461b-9176-5373b4338914,UCSB-IZC00018828,,Animalia,Arthropoda,Insecta,Hymenoptera,Formicidae,Camponotus maccooki,5555,"Forel, 1879",Camponotus,maccooki,,,,1974,,,,,,,,,,9/8/1974,1974,9,8,251,,,"Santa Cruz Island Reserve (SCIR) Collection, 2017",,,,,,,,,,,,Adult,,1,,,Pinned,United States,California,Santa Barbara,,Painted Cave Road,,0,,34.499393,-119.789327,WGS84,1358,,,,GeoLocate,,,,,,,,,,,clchung,2/22/2019 11:07,,1,urn:uuid:cacd4f96-027c-461b-9176-5373b4338914,https://symbiota.ccber.ucsb.edu:443/collections/individual/index.php?occid=115402
115409,UCSB,IZC,,PreservedSpecimen,60035c83-7f5b-43a1-8638-6a57924db3ad,UCSB-IZC00018856,,Animalia,Arthropoda,Insecta,Hymenoptera,Formicidae,Camponotus hyatti,4443,"Emery, 1893",Camponotus,hyatti,,,J. Longino,1986,,,,,,J. Longino,,,,7/8/1981,1981,7,8,189,,,"Santa Cruz Island Reserve (SCIR) Collection, 2017",,,,,,,,,,,,Adult,,1,,,Pinned,United States,California,Santa Barbara,,Santa Cruz Island,,0,,34.016667,-119.716667,WGS84,20644,,,,GeoLocate,,All of Santa Cruz Island,,,,,,,,,clchung,2/22/2019 11:15,,1,urn:uuid:60035c83-7f5b-43a1-8638-6a57924db3ad,https://symbiota.ccber.ucsb.edu:443/collections/individual/index.php?occid=115409
115416,UCSB,IZC,,PreservedSpecimen,68deb15c-29e6-4ee1-aba4-c3f3e9ce7a52,UCSB-IZC00018870,,Animalia,Arthropoda,Insecta,Hymenoptera,Formicidae,Camponotus maccooki,5555,"Forel, 1879",Camponotus,maccooki,,,,1974,,,,,,,,,,9/8/1974,1974,9,8,251,,,"Santa Cruz Island Reserve (SCIR) Collection, 2017",,,,,,,,,,,,Adult,,1,,,Pinned,United States,California,Santa Barbara,,Painted Cave Road,,0,,34.499393,-119.789327,WGS84,1358,,,,GeoLocate,,Entire Painted Cave Road,,,,,,,,,clchung,2/22/2019 11:16,,1,urn:uuid:68deb15c-29e6-4ee1-aba4-c3f3e9ce7a52,https://symbiota.ccber.ucsb.edu:443/collections/individual/index.php?occid=115416
115417,UCSB,IZC,,PreservedSpecimen,27a545e0-a0ae-49c7-90bb-0d5f0e3d9ff0,UCSB-IZC00018872,,Animalia,Arthropoda,Insecta,Hymenoptera,Formicidae,Camponotus semitestaceus,5556,"Snelling, 1970",Camponotus,semitestaceus,,,J. Longino,1986,,,,,,J. Longino,,,84-51-5,8/24/1984,1984,8,24,237,,24-27 Aug 1984,"Santa Cruz Island Reserve (SCIR) Collection, 2017",,,,,,,,,,,,Adult,,1,,,Pinned,United States,California,Santa Barbara,,Santa Cruz Island,,0,,34.016667,-119.716667,WGS84,20644,,,,GeoLocate,,All of Santa Cruz Island,0,200,,,,0-200m,,,clchung,2/22/2019 11:16,,1,urn:uuid:27a545e0-a0ae-49c7-90bb-0d5f0e3d9ff0,https://symbiota.ccber.ucsb.edu:443/collections/individual/index.php?occid=115417
115420,UCSB,IZC,,PreservedSpecimen,8a3ccfd0-5f50-44d8-b6d6-226330390188,UCSB-IZC00018879,,Animalia,Arthropoda,Insecta,Hymenoptera,Formicidae,Camponotus hyatti,4443,"Emery, 1893",Camponotus,hyatti,,,J. Longino,1986,,,,,,J. Longino,,,84-58,8/24/1984,1984,8,24,237,,24-27 Aug 1984,"Santa Cruz Island Reserve (SCIR) Collection, 2017",,,,,,,,,,,,Adult,,2,,,Pinned,United States,California,Santa Barbara,,Santa Cruz Island,,0,,34.016667,-119.716667,WGS84,20644,,,,GeoLocate,,,0,200,,,,0-200m,,,clchung,2/22/2019 11:16,,1,urn:uuid:8a3ccfd0-5f50-44d8-b6d6-226330390188,https://symbiota.ccber.ucsb.edu:443/collections/individual/index.php?occid=115420
115422,UCSB,IZC,,PreservedSpecimen,29059eba-8a36-4b14-bb2e-b0c69aa13ebe,UCSB-IZC00018883,,Animalia,Arthropoda,Insecta,Hymenoptera,Formicidae,Camponotus clarithorax,5554,"Creighton, 1950",Camponotus,clarithorax,,,J. Longino,1986,,,,,,J. Longino,,,84-56,8/24/1984,1984,8,24,237,,24-27 Aug 1984,"Santa Cruz Island Reserve (SCIR) Collection, 2017",,,,,,,,,,,,Adult,,2,,,Pinned,United States,California,Santa Barbara,,Santa Cruz Island,,0,,34.016667,-119.716667,WGS84,20644,,,,GeoLocate,,,0,200,,,,0-200m,,,clchung,2/22/2019 11:17,,1,urn:uuid:29059eba-8a36-4b14-bb2e-b0c69aa13ebe,https://symbiota.ccber.ucsb.edu:443/collections/individual/index.php?occid=115422
115424,UCSB,IZC,,PreservedSpecimen,76b61de8-0e6c-40bd-897c-364f72f6eb33,UCSB-IZC00018892,,Animalia,Arthropoda,Insecta,Hymenoptera,Formicidae,Camponotus maccooki,5555,"Forel, 1879",Camponotus,maccooki,,,,1974,,,,,,,,,,,,,,,,,"Santa Cruz Island Reserve (SCIR) Collection, 2017",,,,,,,,,,,,Adult,,1,,,Pinned,United States,California,Santa Barbara,,Painted Cave Road,,0,,34.499393,-119.789327,WGS84,1358,,,,GeoLocate,,Entire Painted Cave Road,,,,,,,,,clchung,2/22/2019 11:17,,1,urn:uuid:76b61de8-0e6c-40bd-897c-364f72f6eb33,https://symbiota.ccber.ucsb.edu:443/collections/individual/index.php?occid=115424
115432,UCSB,IZC,,PreservedSpecimen,415614af-acd4-46e8-b29a-d4b4b7a17f30,UCSB-IZC00018904,,Animalia,Arthropoda,Insecta,Hymenoptera,Formicidae,Camponotus maccooki,5555,"Forel, 1879",Camponotus,maccooki,,,,1974,,,,,,,,,,9/8/1974,1974,9,8,251,,,"Santa Cruz Island Reserve (SCIR) Collection, 2017",,,,,,,,,,,,Adult,Female,1,,,Pinned,United States,California,Santa Barbara,,Painted Cave Road,,0,,34.499393,-119.789327,WGS84,1358,,,,GeoLocate,,Entire Painted Cave Road,,,,,,,,,clchung,2/22/2019 11:18,,1,urn:uuid:415614af-acd4-46e8-b29a-d4b4b7a17f30,https://symbiota.ccber.ucsb.edu:443/collections/individual/index.php?occid=115432
115433,UCSB,IZC,,PreservedSpecimen,6a891145-0319-493b-ab54-4deb3fb0698b,UCSB-IZC00018906,,Animalia,Arthropoda,Insecta,Hymenoptera,Formicidae,Camponotus maccooki,5555,"Forel, 1879",Camponotus,maccooki,,,,1974,,,,,,,,,,9/8/1974,1974,9,8,251,,,"Santa Cruz Island Reserve (SCIR) Collection, 2017",,,,,,,,,,,,Adult,,1,,,Pinned,United States,California,Santa Barbara,,Painted Cave Road,,0,,34.499393,-119.789327,WGS84,1358,,,,GeoLocate,,Entire Painted Cave Road,,,,,,,,,clchung,2/22/2019 11:18,,1,urn:uuid:6a891145-0319-493b-ab54-4deb3fb0698b,https://symbiota.ccber.ucsb.edu:443/collections/individual/index.php?occid=115433
115440,UCSB,IZC,,PreservedSpecimen,f60356c4-338a-4a4d-8d29-efab264b4f0d,UCSB-IZC00018924,,Animalia,Arthropoda,Insecta,Hymenoptera,Formicidae,Camponotus maccooki,5555,"Forel, 1879",Camponotus,maccooki,,,,1974,,,,,,,,,,9/8/1974,1974,9,8,251,,,"Santa Cruz Island Reserve (SCIR) Collection, 2017",,,,,,,,,,,,Adult,,1,,,Pinned,United States,California,Santa Barbara,,Painted Cave Road,,0,,34.499393,-119.789327,WGS84,1358,,,,GeoLocate,,Entire Painted Cave Road,,,,,,,,,clchung,2/22/2019 11:18,,1,urn:uuid:f60356c4-338a-4a4d-8d29-efab264b4f0d,https://symbiota.ccber.ucsb.edu:443/collections/individual/index.php?occid=115440
117863,UCSB,IZC,,PreservedSpecimen,8152b284-2afb-469a-b878-c0ff4fada24d,UCSB-IZC00010871,,Animalia,Arthropoda,Insecta,Hymenoptera,Formicidae,Formica,2582,"Linnaeus, 1758",Formica,,,,Elaine Tan,2018,,,,,,R. Stannfield,,,,5/24/1997,1997,5,24,144,,,,,,,,,,,,,,,Adult,,,,,Pinned,United States,California,Santa Barbara,Santa Barbara,"University of California, Santa Barbara Lagoon",,0,,34.408393,-119.847426,WGS84,452,,,,GeoLocate,,,,,,,,,,,,2/22/2019 11:19,,1,urn:uuid:8152b284-2afb-469a-b878-c0ff4fada24d,https://symbiota.ccber.ucsb.edu:443/collections/individual/index.php?occid=117863
117864,UCSB,IZC,,PreservedSpecimen,07706fea-a1cc-4e86-ba5a-c49ccc3eb376,UCSB-IZC00010873,,Animalia,Arthropoda,Insecta,Hymenoptera,Formicidae,Pogonomyrmex,2944,"Mayr, 1868",Pogonomyrmex,,,,Zach Brown,2018,,,,,,C,,,,4/1/1996,1996,4,1,92,,,,,,,,,,,,,,,Adult,,1,,,Pinned,United States,California,Santa Barbara,Santa Barbara,"University of California, Santa Barbara",,0,,34.411786,-119.846471,WGS84,897,,,,GeoLocate,,,,,,,,,,,,2/22/2019 11:20,,1,urn:uuid:07706fea-a1cc-4e86-ba5a-c49ccc3eb376,https://symbiota.ccber.ucsb.edu:443/collections/individual/index.php?occid=117864
117869,UCSB,IZC,,PreservedSpecimen,63f2b66a-2d3a-4a7a-b280-3ee99da9e3c3,UCSB-IZC00010872,,Animalia,Arthropoda,Insecta,Hymenoptera,Formicidae,Linepithema humile,5028,"(Mayr, 1868)",Linepithema,humile,,,Elaine Tan,2018,,,,,,UCSB Natural History Collections Club 2017,,,,5/28/2017,2017,5,28,148,,28-May-17,,,,,,,,,,,,,,,,,,Pointed,United States,California,Santa Barbara,,Santa Cruz Island,,,,33.9999,-119.7338,WGS84,10,,,,,,,,,,,,,,,entan,2/6/2019 14:01,,1,urn:uuid:63f2b66a-2d3a-4a7a-b280-3ee99da9e3c3,https://symbiota.ccber.ucsb.edu:443/collections/individual/index.php?occid=117869
117870,UCSB,IZC,,PreservedSpecimen,9fe67c22-62e6-45ea-b24d-a5f22587d806,UCSB-IZC00010874,,Animalia,Arthropoda,Insecta,Hymenoptera,Formicidae,Linepithema humile,5028,"(Mayr, 1868)",Linepithema,humile,,,Elaine Tan,2018,,,,,,UCSB Natural History Collections Club 2017,,,,5/28/2017,2017,5,28,148,,28-May-17,,,,,,,,,,,,,,,,,,Pointed,United States,California,Santa Barbara,,Santa Cruz Island,,,,33.9999,-119.7338,WGS84,10,,,,,,,,,,,,,,,entan,2/6/2019 14:01,,1,urn:uuid:9fe67c22-62e6-45ea-b24d-a5f22587d806,https://symbiota.ccber.ucsb.edu:443/collections/individual/index.php?occid=117870
117932,UCSB,IZC,,PreservedSpecimen,ee67947f-6854-45ee-868f-13853474cd17,UCSB-IZC00001936,,Animalia,Arthropoda,Insecta,Hymenoptera,Formicidae,Camponotus maritimus,5567,"Ward, 2005",Camponotus,maritimus,,,Elaine Tan,2019,,,,,,,,,,5/4/1974,1974,5,4,124,,,"Santa Cruz Island Reserve (SCIR) Collection, 2017",Colony under rock on grass hillside,,,,,,,,,,,Adult,,1,,,Pinned,USA,California,Santa Barbara,,Santa Cruz Island,,0,,34.016667,-119.716667,WGS84,20644,,,,GeoLocate,,,,,,,,,,,zachary_brown,2/22/2019 11:21,,1,urn:uuid:ee67947f-6854-45ee-868f-13853474cd17,https://symbiota.ccber.ucsb.edu:443/collections/individual/index.php?occid=117932
118604,UCSB,IZC,,PreservedSpecimen,e77c5c32-0700-4375-82b3-3e787a9961e8,UCSB-IZC00018802,,Animalia,Arthropoda,Insecta,Hymenoptera,Formicidae,Camponotus,2424,"Mayr, 1861",Camponotus,,,,,1974,,,,,,,,,,5/30/1974,1974,5,30,150,,30-May-74,,,,,,,,,,,,,,,,,,,United States,California,Santa Barbara,,Santa Cruz Island; in network of trails seen only at night by UC Research Station,,0,,34.010402,-119.733128,WGS84,20633,,,,GeoLocate,,,,,,,,,,,entan,2/22/2019 11:22,,1,urn:uuid:e77c5c32-0700-4375-82b3-3e787a9961e8,https://symbiota.ccber.ucsb.edu:443/collections/individual/index.php?occid=118604
118605,UCSB,IZC,,PreservedSpecimen,33b1a6c2-a9a2-4ea5-ade2-35f9073cee15,UCSB-IZC00018803,,Animalia,Arthropoda,Insecta,Hymenoptera,Formicidae,Camponotus vicinus,5557,"Mayr, 1870",Camponotus,vicinus,,,,1974,,,,,,,,,,4/25/1974,1974,4,25,115,,,,under rock near Madrone Trees,moist soil,,,,,,,,,,Adult,,1,,,Pinned,USA,California,Santa Barbara,,Santa Cruz Island; East Camino Cielo Road,,0,,34.001295,-119.713215,WGS84,20950,,,,GeoLocate,,,,,,,,,,,zachary_brown,2/22/2019 11:22,,1,urn:uuid:33b1a6c2-a9a2-4ea5-ade2-35f9073cee15,https://symbiota.ccber.ucsb.edu:443/collections/individual/index.php?occid=118605
118610,UCSB,IZC,,PreservedSpecimen,c759bfa9-8ded-4984-9cb5-3b801e061199,UCSB-IZC00018816,,Animalia,Arthropoda,Insecta,Hymenoptera,Formicidae,Camponotus,2424,"Mayr, 1861",Camponotus,,,,,1974,,,,,,,,,,5/30/1974,1974,5,30,150,,30-May-74,,,,,,,,,,,,,,,,,,,United States,California,Santa Barbara,,Santa Cruz Island; in network of trails seen only at night by UC Research Station,,0,,34.016667,-119.716667,WGS84,20644,,,,GeoLocate,,,,,,,,,,,entan,2/22/2019 11:23,,1,urn:uuid:c759bfa9-8ded-4984-9cb5-3b801e061199,https://symbiota.ccber.ucsb.edu:443/collections/individual/index.php?occid=118610
118612,UCSB,IZC,,PreservedSpecimen,6dd6471c-9634-4d01-ba4c-825c8c2ea0a0,UCSB-IZC00018818,,Animalia,Arthropoda,Insecta,Hymenoptera,Formicidae,Camponotus,2424,"Mayr, 1861",Camponotus,,,,,1974,,,,,,,,,,5/30/1974,1974,5,30,150,,30-May-74,,,,,,,,,,,,,,,,,,,United States,California,Santa Barbara,,Santa Cruz Island; in network of trails seen only at night by UC Research Station,,0,,34.016667,-119.716667,WGS84,20644,,,,GeoLocate,,,,,,,,,,,entan,2/22/2019 11:23,,1,urn:uuid:6dd6471c-9634-4d01-ba4c-825c8c2ea0a0,https://symbiota.ccber.ucsb.edu:443/collections/individual/index.php?occid=118612
118618,UCSB,IZC,,PreservedSpecimen,6770907e-b1dd-48fc-9070-7107b7c2872f,UCSB-IZC00018827,,Animalia,Arthropoda,Insecta,Hymenoptera,Formicidae,Camponotus maritimus,5567,"Ward, 2005",Camponotus,maritimus,,,Elaine Tan,2019,,,,,,,,,,5/4/1974,1974,5,4,124,,,"Santa Cruz Island Reserve (SCIR) Collection, 2017",Colony under rock on grass hillside,,,,,,,,,,,Adult,,1,,,Pinned,USA,California,Santa Barbara,,Santa Cruz Island,,0,,34.016667,-119.716667,WGS84,20644,,,,GeoLocate,,,,,,,,,,,zachary_brown,2/22/2019 11:24,,1,urn:uuid:6770907e-b1dd-48fc-9070-7107b7c2872f,https://symbiota.ccber.ucsb.edu:443/collections/individual/index.php?occid=118618
118625,UCSB,IZC,,PreservedSpecimen,116951ac-1193-49d6-bf78-0539cd3e96fa,UCSB-IZC00018840,,Animalia,Arthropoda,Insecta,Hymenoptera,Formicidae,Camponotus vicinus,5557,"Mayr, 1870",Camponotus,vicinus,,,,1974,,,,,,,,,,4/25/1974,1974,4,25,115,,,"Santa Cruz Island Reserve (SCIR) Collection, 2017",under rock near Madrone Trees,moist soil,,,,,,,,,,Adult,,1,,,Pinned,USA,California,Santa Barbara,,Santa Cruz Island; E Camino Cielo Rd,,0,,34.016667,-119.716667,WGS84,20644,,,,GeoLocate,,,,,,,,,,,zachary_brown,2/22/2019 11:24,,1,urn:uuid:116951ac-1193-49d6-bf78-0539cd3e96fa,https://symbiota.ccber.ucsb.edu:443/collections/individual/index.php?occid=118625
118634,UCSB,IZC,,PreservedSpecimen,8469397a-238c-4bf6-83e3-8105fd7cf4bd,UCSB-IZC00018855,,Animalia,Arthropoda,Insecta,Hymenoptera,Formicidae,Camponotus maritimus,5567,"Ward, 2005",Camponotus,maritimus,,,Elaine Tan,2019,,,,,,,,,,5/4/1974,1974,5,4,124,,,"Santa Cruz Island Reserve (SCIR) Collection, 2017",Colony under rock on grass hillside,,,,,,,,,,,Adult,Female,1,,,Pinned,USA,California,Santa Barbara,,Santa Cruz Island,,0,,34.016667,-119.716667,WGS84,20644,,,,GeoLocate,,,,,,,,,,,zachary_brown,2/22/2019 11:25,,1,urn:uuid:8469397a-238c-4bf6-83e3-8105fd7cf4bd,https://symbiota.ccber.ucsb.edu:443/collections/individual/index.php?occid=118634
118643,UCSB,IZC,,PreservedSpecimen,4e3f3c1b-dd14-435e-b2e0-e6d69be71e7b,UCSB-IZC00018875,,Animalia,Arthropoda,Insecta,Hymenoptera,Formicidae,Camponotus,2424,"Mayr, 1861",Camponotus,,,,,1974,,,,,,,,,,5/30/1974,1974,5,30,150,,30-May-74,,,,,,,,,,,,,,,,,,,United States,California,Santa Barbara,,Santa Cruz Island; in network of trails seen only at night by UC Research Station,,0,,34.016667,-119.716667,WGS84,20644,,,,GeoLocate,,,,,,,,,,,entan,2/22/2019 11:25,,1,urn:uuid:4e3f3c1b-dd14-435e-b2e0-e6d69be71e7b,https://symbiota.ccber.ucsb.edu:443/collections/individual/index.php?occid=118643
118647,UCSB,IZC,,PreservedSpecimen,226efe58-7280-4338-b72c-47fe6609f794,UCSB-IZC00018886,,Animalia,Arthropoda,Insecta,Hymenoptera,Formicidae,Camponotus,2424,"Mayr, 1861",Camponotus,,,,,1974,,,,,,,,,,5/30/1974,1974,5,30,150,,30-May-74,,,,,,,,,,,,,,,,,,,United States,California,Santa Barbara,,Santa Cruz Island; in network of trails seen only at night by UC Research Station,,0,,34.016667,-119.716667,WGS84,20644,,,,GeoLocate,,,,,,,,,,,entan,2/22/2019 11:26,,1,urn:uuid:226efe58-7280-4338-b72c-47fe6609f794,https://symbiota.ccber.ucsb.edu:443/collections/individual/index.php?occid=118647
118648,UCSB,IZC,,PreservedSpecimen,a1ca5d0e-6e9a-4095-a242-e81b8385fb15,UCSB-IZC00018887,,Animalia,Arthropoda,Insecta,Hymenoptera,Formicidae,Camponotus vicinus,5557,"Mayr, 1870",Camponotus,vicinus,,,,1974,,,,,,,,,,4/25/1974,1974,4,25,115,,,"Santa Cruz Island Reserve (SCIR) Collection, 2017",under rock near Madrone Trees,moist soil,,,,,,,,,,Adult,,1,,,Pinned,USA,California,Santa Barbara,,East Camino Cielo Road,,0,,34.504921,-119.752787,WGS84,6224,,,,GeoLocate,,Entire East Camino Cielo Road,,,,,,,,,zachary_brown,2/22/2019 11:30,,1,urn:uuid:a1ca5d0e-6e9a-4095-a242-e81b8385fb15,https://symbiota.ccber.ucsb.edu:443/collections/individual/index.php?occid=118648
118652,UCSB,IZC,,PreservedSpecimen,a70db4d1-8f76-4ea8-9e99-15e20f1a6335,UCSB-IZC00018893,,Animalia,Arthropoda,Insecta,Hymenoptera,Formicidae,Camponotus yogi,5558,"Wheeler, 1915",Camponotus,yogi,,,John Longino,1986,,,,,,John Longino,,,84-71,8/24/1984,1984,8,24,237,,24-27 Aug 1984,,,,,,,,,,,,,,,,,,,United States,California,Santa Barbara,,Santa Cruz Island,,0,,34.016667,-119.716667,WGS84,20644,,,,GeoLocate,,,0,200,,,,0-200m,,,entan,2/22/2019 11:30,,1,urn:uuid:a70db4d1-8f76-4ea8-9e99-15e20f1a6335,https://symbiota.ccber.ucsb.edu:443/collections/individual/index.php?occid=118652
118661,UCSB,IZC,,PreservedSpecimen,71467f38-6452-4754-9d1e-8a3cddadf596,UCSB-IZC00018921,,Animalia,Arthropoda,Insecta,Hymenoptera,Formicidae,Camponotus vicinus,5557,"Mayr, 1870",Camponotus,vicinus,,,,1974,,,,,,,,,,4/25/1974,1974,4,25,115,,,"Santa Cruz Island Reserve (SCIR) Collection, 2017",under rock near Madrone Trees,moist soil,,,,,,,,,,Adult,,1,,,Pinned,USA,California,Santa Barbara,,Santa Cruz Island; East Camino Cielo Rd,,0,,34.016667,-119.716667,WGS84,20644,,,,GeoLocate,,,,,,,,,,,zachary_brown,2/22/2019 11:31,,1,urn:uuid:71467f38-6452-4754-9d1e-8a3cddadf596,https://symbiota.ccber.ucsb.edu:443/collections/individual/index.php?occid=118661
118668,UCSB,IZC,,PreservedSpecimen,dff5e844-e4ec-48d9-826f-39867030f040,UCSB-IZC00018937,,Animalia,Arthropoda,Insecta,Hymenoptera,Formicidae,Camponotus maritimus,5567,"Ward, 2005",Camponotus,maritimus,,,Elaine Tan,2019,,,,,,,,,,5/4/1974,1974,5,4,124,,,"Santa Cruz Island Reserve (SCIR) Collection, 2017",Colony under rock on grass hillside,,,,,,,,,,,Adult,,1,,,Pinned,USA,California,Santa Barbara,,Santa Cruz Island,,0,,34.016667,-119.716667,WGS84,20644,,,,GeoLocate,,,,,,,,,,,zachary_brown,2/22/2019 11:32,,1,urn:uuid:dff5e844-e4ec-48d9-826f-39867030f040,https://symbiota.ccber.ucsb.edu:443/collections/individual/index.php?occid=118668
118669,UCSB,IZC,,PreservedSpecimen,fe2cebb4-c1e6-4416-9266-024e4e23db18,UCSB-IZC00018938,,Animalia,Arthropoda,Insecta,Hymenoptera,Formicidae,Camponotus,2424,"Mayr, 1861",Camponotus,,,,,1974,,,,,,,,,,5/30/1974,1974,5,30,150,,30-May-74,,,,,,,,,,,,,,,,,,,United States,California,Santa Barbara,,"Santa Cruz Island, in network of trails seen only at night by UC Research Station",,0,,34.016667,-119.716667,WGS84,20644,,,,GeoLocate,,,,,,,,,,,entan,2/22/2019 11:33,,1,urn:uuid:fe2cebb4-c1e6-4416-9266-024e4e23db18,https://symbiota.ccber.ucsb.edu:443/collections/individual/index.php?occid=118669
118673,UCSB,IZC,,PreservedSpecimen,b1659d30-cb8b-455b-9435-033595d29349,UCSB-IZC00018943,,Animalia,Arthropoda,Insecta,Hymenoptera,Formicidae,Camponotus maritimus,5567,"Ward, 2005",Camponotus,maritimus,,,Elaine Tan,2019,,,,,,,,,,5/4/1974,1974,5,4,124,,,"Santa Cruz Island Reserve (SCIR) Collection, 2017",Colony under rock on grass hillside,,,,,,,,,,,Adult,,1,,,Pinned,USA,California,Santa Barbara,,Santa Cruz Island,,0,,34.016667,-119.716667,WGS84,20644,,,,GeoLocate,,,,,,,,,,,zachary_brown,2/22/2019 11:33,,1,urn:uuid:b1659d30-cb8b-455b-9435-033595d29349,https://symbiota.ccber.ucsb.edu:443/collections/individual/index.php?occid=118673
118678,UCSB,IZC,,PreservedSpecimen,9d44070e-d812-4208-8beb-a015c7a26ff9,UCSB-IZC00018950,,Animalia,Arthropoda,Insecta,Hymenoptera,Formicidae,Camponotus vicinus,5557,"Mayr, 1870",Camponotus,vicinus,,,,1974,,,,,,,,,,4/25/1974,1974,4,25,115,,,,under rock near Madrone Trees,moist soil,,,,,,,,,,Adult,,1,,,Pinned,USA,California,Santa Barbara,,Santa Cruz Island; East Camino Cielo Road,,0,,34.001295,-119.713215,WGS84,20950,,,,GeoLocate,,,,,,,,,,,zachary_brown,2/22/2019 11:33,,1,urn:uuid:9d44070e-d812-4208-8beb-a015c7a26ff9,https://symbiota.ccber.ucsb.edu:443/collections/individual/index.php?occid=118678
118681,UCSB,IZC,,PreservedSpecimen,6e189f24-1c00-4c6e-926a-3b5155d10e4b,UCSB-IZC00018956,,Animalia,Arthropoda,Insecta,Hymenoptera,Formicidae,Camponotus maritimus,5567,"Ward, 2005",Camponotus,maritimus,,,Elaine Tan,2019,,,,,,,,,,5/4/1974,1974,5,4,124,,,"Santa Cruz Island Reserve (SCIR) Collection, 2017",Colony under rock on grass hillside,,,,,,,,,,,Adult,,1,,,Pinned,USA,California,Santa Barbara,,Santa Cruz Island,,0,,34.016667,-119.716667,WGS84,20644,,,,GeoLocate,,,,,,,,,,,zachary_brown,2/22/2019 11:33,,1,urn:uuid:6e189f24-1c00-4c6e-926a-3b5155d10e4b,https://symbiota.ccber.ucsb.edu:443/collections/individual/index.php?occid=118681
118684,UCSB,IZC,,PreservedSpecimen,5a17537d-d0ba-4423-b530-33e3a936b99f,UCSB-IZC00018960,,Animalia,Arthropoda,Insecta,Hymenoptera,Formicidae,Camponotus vicinus,5557,"Mayr, 1870",Camponotus,vicinus,,,,1974,,,,,,,,,,4/25/1974,1974,4,25,115,,,"Santa Cruz Island Reserve (SCIR) Collection, 2017",under rock near Madrone Trees,moist soil,,,,,,,,,,Adult,,1,,,Pinned,USA,California,Santa Barbara,,Santa Cruz Island; East Camino Cielo Road,,0,,34.001295,-119.713215,WGS84,20950,,,,GeoLocate,,,,,,,,,,,zachary_brown,2/22/2019 11:34,,1,urn:uuid:5a17537d-d0ba-4423-b530-33e3a936b99f,https://symbiota.ccber.ucsb.edu:443/collections/individual/index.php?occid=118684
119084,UCSB,IZC,,PreservedSpecimen,27dbb74b-0909-4723-81db-0fd67cb04a36,UCSB-IZC00023988,,Animalia,Arthropoda,Insecta,Hymenoptera,Formicidae,Temnothorax,5544,"Mayr, 1861",Temnothorax,,,,Elaine Tan,2019,,,,,,UCSB Arthropod Survey,,,,5/3/2016,2016,5,3,124,,"June 3-10, 2016",,"Willow/Pine - Grassland, before restoration",,,M2-Site3,,,,,Alate,,,Adult,,1,Malaise Trap,,Pinned,United States,California,Santa Barbara,Goleta,UCSB North Campus Open Space,,0,,34.41803426,-119.8765084,WGS84,10,,,,GPS,,Entered coordinates from GPS and may differ from what is on label. Uploaded from spreadsheet.,,,,,,,,,,2/22/2019 15:48,,1,urn:uuid:27dbb74b-0909-4723-81db-0fd67cb04a36,https://symbiota.ccber.ucsb.edu:443/collections/individual/index.php?occid=119084
119085,UCSB,IZC,,PreservedSpecimen,322c6658-fe25-411f-ba97-671dce941cf6,UCSB-IZC00023972,,Animalia,Arthropoda,Insecta,Hymenoptera,Formicidae,Monomorium,2763,"Mayr, 1855",Monomorium,,,,Elaine Tan,2019,,,,,,UCSB Arthropod Survey,,,,5/3/2016,2016,5,3,124,,"June 3-10, 2016",,"Willow/Pine - Grassland, before restoration",,,M2-Site3,,,,,Alate,,,Adult,,1,Malaise Trap,,Pinned,United States,California,Santa Barbara,Goleta,UCSB North Campus Open Space,,0,,34.41803426,-119.8765084,WGS84,10,,,,GPS,,Entered coordinates from GPS and may differ from what is on label. Uploaded from spreadsheet.,,,,,,,,,,2/22/2019 15:41,,1,urn:uuid:322c6658-fe25-411f-ba97-671dce941cf6,https://symbiota.ccber.ucsb.edu:443/collections/individual/index.php?occid=119085
119090,UCSB,IZC,,PreservedSpecimen,b3c00b47-3d29-4200-98e0-bb158e65cf00,UCSB-IZC00023901,,Animalia,Arthropoda,Insecta,Hymenoptera,Formicidae,Monomorium,2763,"Mayr, 1855",Monomorium,,,,Elaine Tan,2019,,,,,,UCSB Arthropod Survey,,,,5/3/2016,2016,5,3,124,,"June 3-10, 2016",,"Willow/Pine - Grassland, before restoration",,,M2-Site3,,,,,Alate,,,Adult,,1,Malaise Trap,,Pinned,United States,California,Santa Barbara,Goleta,UCSB North Campus Open Space,,0,,34.41803426,-119.8765084,WGS84,,,,,GPS,,Entered coordinates from GPS and may differ from what is on label. Uploaded from spreadsheet.,,,,,,,,,,2/22/2019 15:39,,1,urn:uuid:b3c00b47-3d29-4200-98e0-bb158e65cf00,https://symbiota.ccber.ucsb.edu:443/collections/individual/index.php?occid=119090
119093,UCSB,IZC,,PreservedSpecimen,3988c872-7d16-4336-8a2f-87fdef6514cd,UCSB-IZC00023958,,Animalia,Arthropoda,Insecta,Hymenoptera,Formicidae,Temnothorax,5544,"Mayr, 1861",Temnothorax,,,,Elaine Tan,2019,,,,,,UCSB Arthropod Survey,,,,5/3/2016,2016,5,3,124,,"June 3-10, 2016",,"Willow/Pine - Grassland, before restoration",,,M2-Site3,,,,,Alate,,,Adult,,1,Malaise Trap,,Pinned,United States,California,Santa Barbara,Goleta,UCSB North Campus Open Space,,0,,34.41803426,-119.8765084,WGS84,10,,,,GPS,,Entered coordinates from GPS and may differ from what is on label. Uploaded from spreadsheet.,,,,,,,,,,2/22/2019 15:52,,1,urn:uuid:3988c872-7d16-4336-8a2f-87fdef6514cd,https://symbiota.ccber.ucsb.edu:443/collections/individual/index.php?occid=119093
119094,UCSB,IZC,,PreservedSpecimen,ebbf24c2-52c9-46c2-b250-e40915679ea5,UCSB-IZC00023947,,Animalia,Arthropoda,Insecta,Hymenoptera,Formicidae,Temnothorax,5544,"Mayr, 1861",Temnothorax,,,,Elaine Tan,2019,,,,,,UCSB Arthropod Survey,,,,5/3/2016,2016,5,3,124,,"June 3-10, 2016",,"Willow/Pine - Grassland, before restoration",,,M2-Site3,,,,,Alate,,,Adult,,1,Malaise Trap,,Pinned,United States,California,Santa Barbara,Goleta,UCSB North Campus Open Space,,0,,34.41803426,-119.8765084,WGS84,10,,,,GPS,,Entered coordinates from GPS and may differ from what is on label. Uploaded from spreadsheet.,,,,,,,,,,2/22/2019 15:53,,1,urn:uuid:ebbf24c2-52c9-46c2-b250-e40915679ea5,https://symbiota.ccber.ucsb.edu:443/collections/individual/index.php?occid=119094
119095,UCSB,IZC,,PreservedSpecimen,4fd03ff1-e3ad-4610-b29b-49c5d4c73ea6,UCSB-IZC00023951,,Animalia,Arthropoda,Insecta,Hymenoptera,Formicidae,Temnothorax,5544,"Mayr, 1861",Temnothorax,,,,Elaine Tan,2019,,,,,,UCSB Arthropod Survey,,,,5/3/2016,2016,5,3,124,,"June 3-10, 2016",,"Willow/Pine - Grassland, before restoration",,,M2-Site3,,,,,Alate,,,Adult,,1,Malaise Trap,,Pinned,United States,California,Santa Barbara,Goleta,UCSB North Campus Open Space,,0,,34.41803426,-119.8765084,WGS84,10,,,,GPS,,Entered coordinates from GPS and may differ from what is on label. Uploaded from spreadsheet.,,,,,,,,,,2/22/2019 15:49,,1,urn:uuid:4fd03ff1-e3ad-4610-b29b-49c5d4c73ea6,https://symbiota.ccber.ucsb.edu:443/collections/individual/index.php?occid=119095
119466,UCSB,IZC,,PreservedSpecimen,5810e240-4f0c-43dc-8967-da1973216509,UCSB-IZC00023529,,Animalia,Arthropoda,Insecta,Hymenoptera,Formicidae,Linepithema humile,5028,"(Mayr, 1868)",Linepithema,humile,,,Zach Brown,2019,,,,,,UCSB Arthropod Survey,,,,7/1/2016,2016,7,1,183,,"Jul 1-8, 2016",,"Willow/Cottonwood/sandy soil area, before restoration",,,M2-Site4,,,,,,,,Adult,,15,Malaise Trap,,Pinned,United States,California,Santa Barbara,Goleta,UCSB North Campus Open Space,,0,,34.41836616,-119.8817133,WGS84,,,,,GPS,,Entered coordinates from GPS and may differ from what is on label. Uploaded from spreadsheet.,,,,,,,,,,2/22/2019 14:37,,1,urn:uuid:5810e240-4f0c-43dc-8967-da1973216509,https://symbiota.ccber.ucsb.edu:443/collections/individual/index.php?occid=119466
119686,UCSB,IZC,,PreservedSpecimen,24a83d1a-e582-45f1-8044-3be2f20c8adf,UCSB-IZC00023315,,Animalia,Arthropoda,Insecta,Hymenoptera,Formicidae,Linepithema humile,5028,"(Mayr, 1868)",Linepithema,humile,,,Zach Brown,2019,,,,,,Rachel Behm,,,,9/13/2017,2017,9,13,256,,13-Sep-17,,Restored coastal sage scrub,,,,,,,,,,,Adult,,1,Malaise Trap,,Pinned,United States,California,Santa Barbara,Goleta,UCSB at Lagoon Island and Campus Point,,0,,34.4081,-119.8475,WGS84,,,,,GPS,,,,,,,,,,,,2/22/2019 14:54,,1,urn:uuid:24a83d1a-e582-45f1-8044-3be2f20c8adf,https://symbiota.ccber.ucsb.edu:443/collections/individual/index.php?occid=119686
119758,UCSB,IZC,,PreservedSpecimen,e625b572-a3bf-4dba-819a-61753ca01a5b,UCSB-IZC00023457,,Animalia,Arthropoda,Insecta,Hymenoptera,Formicidae,Linepithema humile,5028,"(Mayr, 1868)",Linepithema,humile,,,Zach Brown,2019,,,,,,UCSB Arthropod Survey,,,,7/1/2016,2016,7,1,183,,"Jul 1-8, 2016",,"Willow/Cottonwood/sandy soil area, before restoration",,,M2-Site4,,,,,,,,Adult,,1,Malaise Trap,,Pinned,United States,California,Santa Barbara,Goleta,UCSB North Campus Open Space,,0,,34.41836616,-119.8817133,WGS84,,,,,GPS,,Entered coordinates from GPS and may differ from what is on label. Uploaded from spreadsheet.,,,,,,,,,,2/22/2019 15:23,,1,urn:uuid:e625b572-a3bf-4dba-819a-61753ca01a5b,https://symbiota.ccber.ucsb.edu:443/collections/individual/index.php?occid=119758
119888,UCSB,IZC,,PreservedSpecimen,697ee390-5021-4d35-9456-fec31b02cdf2,UCSB-IZC00023149,,Animalia,Arthropoda,Insecta,Hymenoptera,Formicidae,Linepithema humile,5028,"(Mayr, 1868)",Linepithema,humile,,,Zach Brown,2019,,,,,,UCSB Arthropod Survey,,,,6/17/2016,2016,6,17,169,,"Jun 17-24, 2016",,"Dense mustard/grassland, before restoration",,,M1-Site4,,,,,,,,Adult,,29,Malaise Trap,,Pinned,United States,California,Santa Barbara,Goleta,UCSB North Campus Open Space,,0,,34.42033519,-119.8828507,WGS84,,,,,GPS,,Entered coordinates from GPS and may differ from what is on label. Uploaded from spreadsheet.,,,,,,,,,,2/6/2019 12:43,,1,urn:uuid:697ee390-5021-4d35-9456-fec31b02cdf2,https://symbiota.ccber.ucsb.edu:443/collections/individual/index.php?occid=119888
120030,UCSB,IZC,,PreservedSpecimen,39f6592b-6dba-4bcd-9815-5f3828ea8b4f,UCSB-IZC00022755,,Animalia,Arthropoda,Insecta,Hymenoptera,Formicidae,Linepithema humile,5028,"(Mayr, 1868)",Linepithema,humile,,,Zach Brown,2019,,,,,,UCSB Arthropod Survey,,,,3/31/2016,2016,3,31,91,,"March 31-April 7, 2016",,"Scrub/Fennel edge, before restoration",,,M1-Site1,,,,,,,,Adult,,1,Malaise Trap,,Pinned,United States,California,Santa Barbara,Goleta,UCSB North Campus Open Space,,0,,34.42036883,-119.8814562,WGS84,,,,,GPS,,Entered coordinates from GPS and may differ from what is on label. Uploaded from spreadsheet.,,,,,,,,,,2/22/2019 15:15,,1,urn:uuid:39f6592b-6dba-4bcd-9815-5f3828ea8b4f,https://symbiota.ccber.ucsb.edu:443/collections/individual/index.php?occid=120030
120293,UCSB,IZC,,PreservedSpecimen,db775a47-66f7-4a24-bb2a-4127dbc20591,UCSB-IZC00022621,,Animalia,Arthropoda,Insecta,Hymenoptera,Formicidae,Linepithema humile,5028,"(Mayr, 1868)",Linepithema,humile,,,Zach Brown,2019,,,,,,UCSB Arthropod Survey,,,,6/17/2016,2016,6,17,169,,"Jun 17-24, 2016",,"Dense mustard/grassland, before restoration",,,M1-Site4,,,,,,,,Adult,,23,Malaise Trap,,Pinned,United States,California,Santa Barbara,Goleta,UCSB North Campus Open Space,,0,,34.42033519,-119.8828507,WGS84,,,,,GPS,,Entered coordinates from GPS and may differ from what is on label. Uploaded from spreadsheet.,,,,,,,,,,2/6/2019 12:43,,1,urn:uuid:db775a47-66f7-4a24-bb2a-4127dbc20591,https://symbiota.ccber.ucsb.edu:443/collections/individual/index.php?occid=120293
120432,UCSB,IZC,,PreservedSpecimen,3b8d8b4a-8576-4065-8c05-999d4c5c1a48,UCSB-IZC00023082,,Animalia,Arthropoda,Insecta,Hymenoptera,Formicidae,Linepithema humile,5028,"(Mayr, 1868)",Linepithema,humile,,,Zach Brown,2019,,,,,,UCSB Arthropod Survey,,,,3/31/2016,2016,3,31,91,,"Mar 31-Apr 7, 2016",,"Scrub/Fennel edge, before restoration",,,M1-Site1,,,,,,,,Adult,,1,Malaise Trap,,Pinned,United States,California,Santa Barbara,Goleta,UCSB North Campus Open Space,,0,,34.42036883,-119.8814562,WGS84,,,,,GPS,,Entered coordinates from GPS and may differ from what is on label. Uploaded from spreadsheet.,,,,,,,,,,2/22/2019 15:17,,1,urn:uuid:3b8d8b4a-8576-4065-8c05-999d4c5c1a48,https://symbiota.ccber.ucsb.edu:443/collections/individual/index.php?occid=120432
120439,UCSB,IZC,,PreservedSpecimen,7f4efb94-dfb7-4072-af33-d070dd5e98de,UCSB-IZC00022983,,Animalia,Arthropoda,Insecta,Hymenoptera,Formicidae,Linepithema humile,5028,"(Mayr, 1868)",Linepithema,humile,,,Zach Brown,2019,,,,,,UCSB Arthropod Survey,,,,3/31/2016,2016,3,31,91,,"Mar 31-Apr 7, 2016",,"Scrub/Fennel edge, before restoration",,,M1-Site1,,,,,,,,Adult,,1,Malaise Trap,,Pinned,United States,California,Santa Barbara,Goleta,UCSB North Campus Open Space,,0,,34.42036883,-119.8814562,WGS84,,,,,GPS,,Entered coordinates from GPS and may differ from what is on label. Uploaded from spreadsheet.,,,,,,,,,,2/22/2019 15:22,,1,urn:uuid:7f4efb94-dfb7-4072-af33-d070dd5e98de,https://symbiota.ccber.ucsb.edu:443/collections/individual/index.php?occid=120439
120442,UCSB,IZC,,PreservedSpecimen,f55c1bc2-488e-47a1-9b6d-58cf0d8d160f,UCSB-IZC00023059,,Animalia,Arthropoda,Insecta,Hymenoptera,Formicidae,Linepithema humile,5028,"(Mayr, 1868)",Linepithema,humile,,,Zach Brown,2019,,,,,,UCSB Arthropod Survey,,,,3/31/2016,2016,3,31,91,,"Mar 31-Apr 7, 2016",,"Scrub/Fennel edge, before restoration",,,M1-Site1,,,,,,,,Adult,,1,Malaise Trap,,Pinned,United States,California,Santa Barbara,Goleta,UCSB North Campus Open Space,,0,,34.42036883,-119.8814562,WGS84,,,,,GPS,,Entered coordinates from GPS and may differ from what is on label. Uploaded from spreadsheet.,,,,,,,,,,2/22/2019 15:19,,1,urn:uuid:f55c1bc2-488e-47a1-9b6d-58cf0d8d160f,https://symbiota.ccber.ucsb.edu:443/collections/individual/index.php?occid=120442
120443,UCSB,IZC,,PreservedSpecimen,798d896a-29de-4bb7-9768-9537fbd2359d,UCSB-IZC00023061,,Animalia,Arthropoda,Insecta,Hymenoptera,Formicidae,Linepithema humile,5028,"(Mayr, 1868)",Linepithema,humile,,,Zach Brown,2019,,,,,,UCSB Arthropod Survey,,,,3/31/2016,2016,3,31,91,,"Mar 31-Apr 7, 2016",,"Scrub/Fennel edge, before restoration",,,M1-Site1,,,,,,,,Adult,,1,Malaise Trap,,Pinned,United States,California,Santa Barbara,Goleta,UCSB North Campus Open Space,,0,,34.42036883,-119.8814562,WGS84,,,,,GPS,,Entered coordinates from GPS and may differ from what is on label. Uploaded from spreadsheet.,,,,,,,,,,2/22/2019 15:18,,1,urn:uuid:798d896a-29de-4bb7-9768-9537fbd2359d,https://symbiota.ccber.ucsb.edu:443/collections/individual/index.php?occid=120443
120492,UCSB,IZC,,PreservedSpecimen,8000df33-527c-49e6-8945-3a7ed93f4f65,UCSB-IZC00022805,,Animalia,Arthropoda,Insecta,Hymenoptera,Formicidae,Linepithema humile,5028,"(Mayr, 1868)",Linepithema,humile,,,Zach Brown,2019,,,,,,UCSB Arthropod Survey,,,,4/21/2016,2016,4,21,112,,"Apr 21-28, 2016",Physical labels need to be corrected,"Willow/Grassland edge, before restoration",,,M1-Site2,,,,,,,,Adult,,1,Malaise Trap,,Pinned,United States,California,Santa Barbara,Goleta,UCSB North Campus Open Space,,0,,34.41829435,-119.8826832,WGS84,,,,,GPS,,Entered coordinates from GPS and may differ from what is on label. Uploaded from spreadsheet.,,,,,,,,,,2/22/2019 15:09,,1,urn:uuid:8000df33-527c-49e6-8945-3a7ed93f4f65,https://symbiota.ccber.ucsb.edu:443/collections/individual/index.php?occid=120492
120505,UCSB,IZC,,PreservedSpecimen,d9a5c588-077d-4cf3-a1e4-cc06a99ec088,UCSB-IZC00022818,,Animalia,Arthropoda,Insecta,Hymenoptera,Formicidae,Linepithema humile,5028,"(Mayr, 1868)",Linepithema,humile,,,Zach Brown,2019,,,,,,UCSB Arthropod Survey,,,,4/21/2016,2016,4,21,112,,"Apr 21-28, 2016",Physical labels need to be corrected,"Willow/Grassland edge, before restoration",,,M1-Site2,,,,,,,,Adult,,1,Malaise Trap,,Pinned,United States,California,Santa Barbara,Goleta,UCSB North Campus Open Space,,0,,34.41829435,-119.8826832,WGS84,,,,,GPS,,Entered coordinates from GPS and may differ from what is on label. Uploaded from spreadsheet.,,,,,,,,,,2/22/2019 15:12,,1,urn:uuid:d9a5c588-077d-4cf3-a1e4-cc06a99ec088,https://symbiota.ccber.ucsb.edu:443/collections/individual/index.php?occid=120505
120509,UCSB,IZC,,PreservedSpecimen,630320f2-4cbd-4444-bddb-6bdcc9df3a51,UCSB-IZC00022822,,Animalia,Arthropoda,Insecta,Hymenoptera,Formicidae,Linepithema humile,5028,"(Mayr, 1868)",Linepithema,humile,,,Zach Brown,2019,,,,,,UCSB Arthropod Survey,,,,4/21/2016,2016,4,21,112,,"Apr 21-28, 2016",Physical labels need to be corrected,"Willow/Grassland edge, before restoration",,,M1-Site2,,,,,,,,Adult,,1,Malaise Trap,,Pinned,United States,California,Santa Barbara,Goleta,UCSB North Campus Open Space,,0,,34.41829435,-119.8826832,WGS84,,,,,GPS,,Entered coordinates from GPS and may differ from what is on label. Uploaded from spreadsheet.,,,,,,,,,,2/22/2019 14:33,,1,urn:uuid:630320f2-4cbd-4444-bddb-6bdcc9df3a51,https://symbiota.ccber.ucsb.edu:443/collections/individual/index.php?occid=120509
120647,UCSB,IZC,,PreservedSpecimen,e3395ca9-a3d8-4e83-b37a-8a5407448cad,UCSB-IZC00022733,,Animalia,Arthropoda,Insecta,Hymenoptera,Formicidae,Linepithema humile,5028,"(Mayr, 1868)",Linepithema,humile,,,Zach Brown,2019,,,,,,UCSB Arthropod Survey,,,,7/8/2016,2016,7,8,190,,"Jul 8-15, 2016",,"Creek/wetland - upland salt marsh, Fennel/Grassland, before restoration",,,"M2-Site5, M1-Site5",,,,,,,,Adult,,24,Malaise Trap,,Pinned,United States,California,Santa Barbara,Goleta,UCSB North Campus Open Space,,0,,34.42050607,-119.8782384,WGS84,,"34.420506073339340, 34.419240856497046 -119.877560013010140, -119.878238434055925",,,GPS,,Entered coordinates from GPS and may differ from what is on label. Uploaded from spreadsheet.,,,,,,,,,,2/22/2019 15:25,,1,urn:uuid:e3395ca9-a3d8-4e83-b37a-8a5407448cad,https://symbiota.ccber.ucsb.edu:443/collections/individual/index.php?occid=120647
120690,UCSB,IZC,,PreservedSpecimen,97402907-434b-48ab-878f-2f1df46f95b2,UCSB-IZC00022261,,Animalia,Arthropoda,Insecta,Hymenoptera,Formicidae,Linepithema humile,5028,"(Mayr, 1868)",Linepithema,humile,,,Zach Brown,2019,,,,,,UCSB Arthropod Survey,,,,4/21/2016,2016,4,21,112,,"April 21-28, 2016",Physical labels need to be corrected,"Dead Pine/Willow-wetland OR Willow/Grassland edge, before restoration",,,M2-Site2,,,,,,,,Adult,,1,Malaise Trap,,Pinned,United States,California,Santa Barbara,Goleta,UCSB North Campus Open Space,,0,,34.42131961,-119.872325,WGS84,,,,,GPS,,Entered coordinates from GPS and may differ from what is on label. Uploaded from spreadsheet.,,,,,,,,,,2/22/2019 15:11,,1,urn:uuid:97402907-434b-48ab-878f-2f1df46f95b2,https://symbiota.ccber.ucsb.edu:443/collections/individual/index.php?occid=120690
120699,UCSB,IZC,,PreservedSpecimen,eefe21d1-7609-4c60-8af0-51717db838fe,UCSB-IZC00022270,,Animalia,Arthropoda,Insecta,Hymenoptera,Formicidae,Linepithema humile,5028,"(Mayr, 1868)",Linepithema,humile,,,Zach Brown,2019,,,,,,UCSB Arthropod Survey,,,,4/21/2016,2016,4,21,112,,"April 21-28, 2016",Physical labels need to be corrected,"Dead Pine/Willow-wetland OR Willow/Grassland edge, before restoration",,,M2-Site2,,,,,,,,Adult,,1,Malaise Trap,,Pinned,United States,California,Santa Barbara,Goleta,UCSB North Campus Open Space,,0,,34.42131961,-119.872325,WGS84,,,,,GPS,,Entered coordinates from GPS and may differ from what is on label. Uploaded from spreadsheet.,,,,,,,,,,2/22/2019 15:11,,1,urn:uuid:eefe21d1-7609-4c60-8af0-51717db838fe,https://symbiota.ccber.ucsb.edu:443/collections/individual/index.php?occid=120699
120705,UCSB,IZC,,PreservedSpecimen,544c0169-c456-48af-b3dc-d42aff839073,UCSB-IZC00022276,,Animalia,Arthropoda,Insecta,Hymenoptera,Formicidae,Linepithema humile,5028,"(Mayr, 1868)",Linepithema,humile,,,Zach Brown,2019,,,,,,UCSB Arthropod Survey,,,,4/21/2016,2016,4,21,112,,"April 21-28, 2016",Physical labels need to be corrected,"Dead Pine/Willow-wetland OR Willow/Grassland edge, before restoration",,,M2-Site2,,,,,,,,Adult,,1,Malaise Trap,,Pinned,United States,California,Santa Barbara,Goleta,UCSB North Campus Open Space,,0,,34.42131961,-119.872325,WGS84,,,,,GPS,,Entered coordinates from GPS and may differ from what is on label. Uploaded from spreadsheet.,,,,,,,,,,2/22/2019 15:14,,1,urn:uuid:544c0169-c456-48af-b3dc-d42aff839073,https://symbiota.ccber.ucsb.edu:443/collections/individual/index.php?occid=120705
120706,UCSB,IZC,,PreservedSpecimen,33a6a3e1-219b-41b3-81c5-7b8d5fc0be20,UCSB-IZC00022277,,Animalia,Arthropoda,Insecta,Hymenoptera,Formicidae,Linepithema humile,5028,"(Mayr, 1868)",Linepithema,humile,,,Zach Brown,2019,,,,,,UCSB Arthropod Survey,,,,4/21/2016,2016,4,21,112,,"April 21-28, 2016",Physical labels need to be corrected,"Dead Pine/Willow-wetland OR Willow/Grassland edge, before restoration",,,M2-Site2,,,,,,,,Adult,,1,Malaise Trap,,Pinned,United States,California,Santa Barbara,Goleta,UCSB North Campus Open Space,,0,,34.42131961,-119.872325,WGS84,,,,,GPS,,Entered coordinates from GPS and may differ from what is on label. Uploaded from spreadsheet.,,,,,,,,,,2/22/2019 15:21,,1,urn:uuid:33a6a3e1-219b-41b3-81c5-7b8d5fc0be20,https://symbiota.ccber.ucsb.edu:443/collections/individual/index.php?occid=120706
120713,UCSB,IZC,,PreservedSpecimen,2de66df4-1531-4e1e-94c4-4a577c1c2e94,UCSB-IZC00022284,,Animalia,Arthropoda,Insecta,Hymenoptera,Formicidae,Linepithema humile,5028,"(Mayr, 1868)",Linepithema,humile,,,Zach Brown,2019,,,,,,UCSB Arthropod Survey,,,,4/21/2016,2016,4,21,112,,"April 21-28, 2016",Physical labels need to be corrected,"Dead Pine/Willow-wetland OR Willow/Grassland edge, before restoration",,,M2-Site2,,,,,,,,Adult,,1,Malaise Trap,,Pinned,United States,California,Santa Barbara,Goleta,UCSB North Campus Open Space,,0,,34.42131961,-119.872325,WGS84,,,,,GPS,,Entered coordinates from GPS and may differ from what is on label. Uploaded from spreadsheet.,,,,,,,,,,2/22/2019 15:10,,1,urn:uuid:2de66df4-1531-4e1e-94c4-4a577c1c2e94,https://symbiota.ccber.ucsb.edu:443/collections/individual/index.php?occid=120713
120717,UCSB,IZC,,PreservedSpecimen,1e764837-017b-47ca-ac27-55b43337be5c,UCSB-IZC00022288,,Animalia,Arthropoda,Insecta,Hymenoptera,Formicidae,Linepithema humile,5028,"(Mayr, 1868)",Linepithema,humile,,,Zach Brown,2019,,,,,,UCSB Arthropod Survey,,,,4/21/2016,2016,4,21,112,,"April 21-28, 2016",Physical labels need to be corrected,"Dead Pine/Willow-wetland OR Willow/Grassland edge, before restoration",,,M2-Site2,,,,,,,,Adult,,1,Malaise Trap,,Pinned,United States,California,Santa Barbara,Goleta,UCSB North Campus Open Space,,0,,34.42131961,-119.872325,WGS84,,,,,GPS,,Entered coordinates from GPS and may differ from what is on label. Uploaded from spreadsheet.,,,,,,,,,,2/22/2019 15:18,,1,urn:uuid:1e764837-017b-47ca-ac27-55b43337be5c,https://symbiota.ccber.ucsb.edu:443/collections/individual/index.php?occid=120717
120722,UCSB,IZC,,PreservedSpecimen,543f216d-4ffb-4a53-a8a8-c97a14084946,UCSB-IZC00022293,,Animalia,Arthropoda,Insecta,Hymenoptera,Formicidae,Linepithema humile,5028,"(Mayr, 1868)",Linepithema,humile,,,Zach Brown,2019,,,,,,UCSB Arthropod Survey,,,,4/21/2016,2016,4,21,112,,"April 21-28, 2016",Physical labels need to be corrected,"Dead Pine/Willow-wetland OR Willow/Grassland edge, before restoration",,,M2-Site2,,,,,,,,Adult,,1,Malaise Trap,,Pinned,United States,California,Santa Barbara,Goleta,UCSB North Campus Open Space,,0,,34.42131961,-119.872325,WGS84,,,,,GPS,,Entered coordinates from GPS and may differ from what is on label. Uploaded from spreadsheet.,,,,,,,,,,2/22/2019 15:13,,1,urn:uuid:543f216d-4ffb-4a53-a8a8-c97a14084946,https://symbiota.ccber.ucsb.edu:443/collections/individual/index.php?occid=120722
120724,UCSB,IZC,,PreservedSpecimen,0549361d-c8ba-4774-87bc-cdfee917770e,UCSB-IZC00022295,,Animalia,Arthropoda,Insecta,Hymenoptera,Formicidae,Linepithema humile,5028,"(Mayr, 1868)",Linepithema,humile,,,Zach Brown,2019,,,,,,UCSB Arthropod Survey,,,,4/21/2016,2016,4,21,112,,"April 21-28, 2016",Physical labels need to be corrected,"Dead Pine/Willow-wetland OR Willow/Grassland edge, before restoration",,,M2-Site2,,,,,,,,Adult,,1,Malaise Trap,,Pinned,United States,California,Santa Barbara,Goleta,UCSB North Campus Open Space,,0,,34.42131961,-119.872325,WGS84,,,,,GPS,,Entered coordinates from GPS and may differ from what is on label. Uploaded from spreadsheet.,,,,,,,,,,2/22/2019 15:06,,1,urn:uuid:0549361d-c8ba-4774-87bc-cdfee917770e,https://symbiota.ccber.ucsb.edu:443/collections/individual/index.php?occid=120724
120737,UCSB,IZC,,PreservedSpecimen,9c633e1a-3f88-4dae-b193-77d43459b322,UCSB-IZC00022308,,Animalia,Arthropoda,Insecta,Hymenoptera,Formicidae,Linepithema humile,5028,"(Mayr, 1868)",Linepithema,humile,,,Zach Brown,2019,,,,,,UCSB Arthropod Survey,,,,4/21/2016,2016,4,21,112,,"April 21-28, 2016",Physical labels need to be corrected,"Dead Pine/Willow-wetland OR Willow/Grassland edge, before restoration",,,M2-Site2,,,,,,,,Adult,,1,Malaise Trap,,Pinned,United States,California,Santa Barbara,Goleta,UCSB North Campus Open Space,,0,,34.42131961,-119.872325,WGS84,,,,,GPS,,Entered coordinates from GPS and may differ from what is on label. Uploaded from spreadsheet.,,,,,,,,,,2/22/2019 15:07,,1,urn:uuid:9c633e1a-3f88-4dae-b193-77d43459b322,https://symbiota.ccber.ucsb.edu:443/collections/individual/index.php?occid=120737
120747,UCSB,IZC,,PreservedSpecimen,cff33de4-37bd-4b2d-a962-38544aea31db,UCSB-IZC00002284,,Animalia,Arthropoda,Insecta,Hymenoptera,Formicidae,Linepithema humile,5028,"(Mayr, 1868)",Linepithema,humile,,,Zach Brown,2019,,,,,,UCSB Arthropod Survey,,,,4/21/2016,2016,4,21,112,,"April 21-28, 2016",Physical labels need to be corrected,"Dead Pine/Willow-wetland OR Willow/Grassland edge, before restoration",,,M2-Site2,,,,,,,,Adult,,1,Malaise Trap,,Pinned,United States,California,Santa Barbara,Goleta,UCSB North Campus Open Space,,0,,34.42131961,-119.872325,WGS84,,,,,GPS,,Entered coordinates from GPS and may differ from what is on label. Uploaded from spreadsheet.,,,,,,,,,,2/22/2019 15:08,,1,urn:uuid:cff33de4-37bd-4b2d-a962-38544aea31db,https://symbiota.ccber.ucsb.edu:443/collections/individual/index.php?occid=120747
120765,UCSB,IZC,,PreservedSpecimen,336b351a-2110-4cb8-8511-dfe2c7e5ad64,UCSB-IZC00022092,,Animalia,Arthropoda,Insecta,Hymenoptera,Formicidae,Linepithema humile,5028,"(Mayr, 1868)",Linepithema,humile,,,Zach Brown,2019,,,,,,UCSB Arthropod Survey,,,,7/22/2016,2016,7,22,204,,"Jul 22-29, 2016",,"Creek/Wetland - Upland Salt Marsh, before restoration",,,M2-Site5,,,,,,,,Adult,,1,Malaise Trap,,Pinned,United States,California,Santa Barbara,Goleta,UCSB North Campus Open Space,,0,,34.42050607,-119.87756,WGS84,,,,,GPS,,Entered coordinates from GPS and may differ from what is on label. Uploaded from spreadsheet.,,,,,,,,,,2/22/2019 15:03,,1,urn:uuid:336b351a-2110-4cb8-8511-dfe2c7e5ad64,https://symbiota.ccber.ucsb.edu:443/collections/individual/index.php?occid=120765
120778,UCSB,IZC,,PreservedSpecimen,3c62ef4d-2724-4b1d-8afe-c45cfbaa89a2,UCSB-IZC00022105,,Animalia,Arthropoda,Insecta,Hymenoptera,Formicidae,Linepithema humile,5028,"(Mayr, 1868)",Linepithema,humile,,,Zach Brown,2019,,,,,,UCSB Arthropod Survey,,,,7/22/2016,2016,7,22,204,,"Jul 22-29, 2016",,"Creek/Wetland - Upland Salt Marsh, before restoration",,,M2-Site5,,,,,,,,Adult,,1,Malaise Trap,,Pinned,United States,California,Santa Barbara,Goleta,UCSB North Campus Open Space,,0,,34.42050607,-119.87756,WGS84,,,,,GPS,,Entered coordinates from GPS and may differ from what is on label. Uploaded from spreadsheet.,,,,,,,,,,2/22/2019 15:03,,1,urn:uuid:3c62ef4d-2724-4b1d-8afe-c45cfbaa89a2,https://symbiota.ccber.ucsb.edu:443/collections/individual/index.php?occid=120778
120780,UCSB,IZC,,PreservedSpecimen,8d648282-5946-411e-9293-2e39d9797f7c,UCSB-IZC00022107,,Animalia,Arthropoda,Insecta,Hymenoptera,Formicidae,Linepithema humile,5028,"(Mayr, 1868)",Linepithema,humile,,,Zach Brown,2019,,,,,,UCSB Arthropod Survey,,,,7/22/2016,2016,7,22,204,,"Jul 22-29, 2016",,"Creek/Wetland - Upland Salt Marsh, before restoration",,,M2-Site5,,,,,,,,Adult,,1,Malaise Trap,,Pinned,United States,California,Santa Barbara,Goleta,UCSB North Campus Open Space,,0,,34.42050607,-119.87756,WGS84,,,,,GPS,,Entered coordinates from GPS and may differ from what is on label. Uploaded from spreadsheet.,,,,,,,,,,2/22/2019 15:04,,1,urn:uuid:8d648282-5946-411e-9293-2e39d9797f7c,https://symbiota.ccber.ucsb.edu:443/collections/individual/index.php?occid=120780
120784,UCSB,IZC,,PreservedSpecimen,c3cab604-f1db-4104-a64e-31f9115a9ab9,UCSB-IZC00022111,,Animalia,Arthropoda,Insecta,Hymenoptera,Formicidae,Linepithema humile,5028,"(Mayr, 1868)",Linepithema,humile,,,Zach Brown,2019,,,,,,UCSB Arthropod Survey,,,,7/22/2016,2016,7,22,204,,"Jul 22-29, 2016",,"Creek/Wetland - Upland Salt Marsh, before restoration",,,M2-Site5,,,,,,,,Adult,,1,Malaise Trap,,Pinned,United States,California,Santa Barbara,Goleta,UCSB North Campus Open Space,,0,,34.42050607,-119.87756,WGS84,,,,,GPS,,Entered coordinates from GPS and may differ from what is on label. Uploaded from spreadsheet.,,,,,,,,,,2/22/2019 15:05,,1,urn:uuid:c3cab604-f1db-4104-a64e-31f9115a9ab9,https://symbiota.ccber.ucsb.edu:443/collections/individual/index.php?occid=120784
120793,UCSB,IZC,,PreservedSpecimen,597818c2-3b4e-4b68-b8fd-944cf960f8c9,UCSB-IZC00022120,,Animalia,Arthropoda,Insecta,Hymenoptera,Formicidae,Linepithema humile,5028,"(Mayr, 1868)",Linepithema,humile,,,Zach Brown,2019,,,,,,UCSB Arthropod Survey,,,,7/22/2016,2016,7,22,204,,"Jul 22-29, 2016",,"Creek/Wetland - Upland Salt Marsh, before restoration",,,M2-Site5,,,,,,,,Adult,,1,Malaise Trap,,Pinned,United States,California,Santa Barbara,Goleta,UCSB North Campus Open Space,,0,,34.42050607,-119.87756,WGS84,,,,,GPS,,Entered coordinates from GPS and may differ from what is on label. Uploaded from spreadsheet.,,,,,,,,,,2/22/2019 15:06,,1,urn:uuid:597818c2-3b4e-4b68-b8fd-944cf960f8c9,https://symbiota.ccber.ucsb.edu:443/collections/individual/index.php?occid=120793
120911,UCSB,IZC,,PreservedSpecimen,c547e687-59ac-4a33-a1ab-c65cb78f2fd5,UCSB-IZC00022073,,Animalia,Arthropoda,Insecta,Hymenoptera,Formicidae,Temnothorax,5544,"Mayr, 1861",Temnothorax,,,,Elaine Tan,2019,,,,,,UCSB Arthropod Survey,,,,6/3/2016,2016,6,3,155,,"Jun 3-10, 2016",,"Willow/Pine - Grassland, before restoration",,,M2-Site3,,,,,Alate,,,Adult,,1,Malaise Trap,,Pinned,United States,California,Santa Barbara,Goleta,UCSB North Campus Open Space,,0,,34.41803426,-119.8765084,WGS84,10,,,,GPS,,Entered coordinates from GPS and may differ from what is on label. Uploaded from spreadsheet.,,,,,,,,,,2/22/2019 15:55,,1,urn:uuid:c547e687-59ac-4a33-a1ab-c65cb78f2fd5,https://symbiota.ccber.ucsb.edu:443/collections/individual/index.php?occid=120911
120912,UCSB,IZC,,PreservedSpecimen,278cf1ed-9c55-4839-a07c-8555391fd831,UCSB-IZC00002260,,Animalia,Arthropoda,Insecta,Hymenoptera,Formicidae,Temnothorax,5544,"Mayr, 1861",Temnothorax,,,,Elaine Tan,2019,,,,,,UCSB Arthropod Survey,,,,6/3/2016,2016,6,3,155,,"Jun 3-10, 2016",,"Willow/Pine - Grassland, before restoration",,,M2-Site3,,,,,Alate,,,Adult,,1,Malaise Trap,,Pinned,United States,California,Santa Barbara,Goleta,UCSB North Campus Open Space,,0,,34.41803426,-119.8765084,WGS84,10,,,,GPS,,Entered coordinates from GPS and may differ from what is on label. Uploaded from spreadsheet.,,,,,,,,,,2/22/2019 15:54,,1,urn:uuid:278cf1ed-9c55-4839-a07c-8555391fd831,https://symbiota.ccber.ucsb.edu:443/collections/individual/index.php?occid=120912
120914,UCSB,IZC,,PreservedSpecimen,43cec8ce-186c-4f53-9428-1efb167cc02a,UCSB-IZC00022405,,Animalia,Arthropoda,Insecta,Hymenoptera,Formicidae,Temnothorax,5544,"Mayr, 1861",Temnothorax,,,,Elaine Tan,2019,,,,,,UCSB Arthropod Survey,,,,6/3/2016,2016,6,3,155,,"Jun 3-10, 2016",,"Willow/Pine - Grassland, before restoration",,,M2-Site3,,,,,Alate,,,Adult,,1,Malaise Trap,,Pinned,United States,California,Santa Barbara,Goleta,UCSB North Campus Open Space,,0,,34.41803426,-119.8765084,WGS84,10,,,,GPS,,Entered coordinates from GPS and may differ from what is on label. Uploaded from spreadsheet.,,,,,,,,,,2/22/2019 15:56,,1,urn:uuid:43cec8ce-186c-4f53-9428-1efb167cc02a,https://symbiota.ccber.ucsb.edu:443/collections/individual/index.php?occid=120914
120916,UCSB,IZC,,PreservedSpecimen,a9a65218-73d3-4874-90ae-0759c4ab9a57,UCSB-IZC00022075,,Animalia,Arthropoda,Insecta,Hymenoptera,Formicidae,Monomorium,2763,"Mayr, 1855",Monomorium,,,,Elaine Tan,2019,,,,,,UCSB Arthropod Survey,,,,6/3/2016,2016,6,3,155,,"Jun 3-10, 2016",,"Willow/Pine - Grassland, before restoration",,,M2-Site3,,,,,Alate,,,Adult,,1,Malaise Trap,,Pinned,United States,California,Santa Barbara,Goleta,UCSB North Campus Open Space,,0,,34.41803426,-119.8765084,WGS84,,,,,GPS,,Entered coordinates from GPS and may differ from what is on label. Uploaded from spreadsheet.,,,,,,,,,,2/22/2019 15:43,,1,urn:uuid:a9a65218-73d3-4874-90ae-0759c4ab9a57,https://symbiota.ccber.ucsb.edu:443/collections/individual/index.php?occid=120916
120918,UCSB,IZC,,PreservedSpecimen,dd96479c-1474-4d22-9624-3ab373163585,UCSB-IZC00022055,,Animalia,Arthropoda,Insecta,Hymenoptera,Formicidae,Monomorium,2763,"Mayr, 1855",Monomorium,,,,Elaine Tan,2019,,,,,,UCSB Arthropod Survey,,,,6/3/2016,2016,6,3,155,,"Jun 3-10, 2016",,"Willow/Pine - Grassland, before restoration",,,M2-Site3,,,,,Alate,,,Adult,,1,Malaise Trap,,Pinned,United States,California,Santa Barbara,Goleta,UCSB North Campus Open Space,,0,,34.41803426,-119.8765084,WGS84,,,,,GPS,,Entered coordinates from GPS and may differ from what is on label. Uploaded from spreadsheet.,,,,,,,,,,2/22/2019 15:44,,1,urn:uuid:dd96479c-1474-4d22-9624-3ab373163585,https://symbiota.ccber.ucsb.edu:443/collections/individual/index.php?occid=120918
121044,UCSB,IZC,,PreservedSpecimen,8ecf8d79-2318-4f25-8485-e639e408fbdd,UCSB-IZC00021779,,Animalia,Arthropoda,Insecta,Hymenoptera,Formicidae,Monomorium,2763,"Mayr, 1855",Monomorium,,,,Elaine Tan,2019,,,,,,UCSB Arthropod Survey,,,,7/22/2016,2016,7,22,204,,"Jul 22-29, 2016",,"Creek/wetland - upland salt marsh, before restoration",,,M2-Site5,,,,,Alate,,,Adult,,1,Malaise Trap,,Pinned,United States,California,Santa Barbara,Goleta,UCSB North Campus Open Space,,0,,34.42050607,-119.87756,WGS84,,,,,GPS,,Entered coordinates from GPS and may differ from what is on label. Uploaded from spreadsheet.,,,,,,,,,,2/22/2019 15:44,,1,urn:uuid:8ecf8d79-2318-4f25-8485-e639e408fbdd,https://symbiota.ccber.ucsb.edu:443/collections/individual/index.php?occid=121044
121177,UCSB,IZC,,PreservedSpecimen,c8cbc09f-903e-4d43-b88f-5fd32c79262a,UCSB-IZC00021608,,Animalia,Arthropoda,Insecta,Hymenoptera,Formicidae,Linepithema humile,5028,"(Mayr, 1868)",Linepithema,humile,,,Zach Brown,2019,,,,,,UCSB Arthropod Survey,,,,6/24/2016,2016,6,24,176,,"Jun 24-Jul 2, 2016",,"Willow/Cottonwood/Sandy soil area, before restoration",,,M2-Site4,,,,,,,,Adult,,1,Malaise Trap,,Pinned,United States,California,Santa Barbara,Goleta,UCSB North Campus Open Space,,0,,34.41836616,-119.8817133,WGS84,,,,,GPS,,Entered coordinates from GPS and may differ from what is on label. Uploaded from spreadsheet.,,,,,,,,,,2/22/2019 14:53,,1,urn:uuid:c8cbc09f-903e-4d43-b88f-5fd32c79262a,https://symbiota.ccber.ucsb.edu:443/collections/individual/index.php?occid=121177
121181,UCSB,IZC,,PreservedSpecimen,57dc1fdc-550e-4fe3-a538-1c99402526a6,UCSB-IZC00021612,,Animalia,Arthropoda,Insecta,Hymenoptera,Formicidae,Linepithema humile,5028,"(Mayr, 1868)",Linepithema,humile,,,Zach Brown,2019,,,,,,UCSB Arthropod Survey,,,,6/24/2016,2016,6,24,176,,"Jun 24-Jul 2, 2016",,"Willow/Cottonwood/Sandy soil area, before restoration",,,M2-Site4,,,,,,,,Adult,,1,Malaise Trap,,Pinned,United States,California,Santa Barbara,Goleta,UCSB North Campus Open Space,,0,,34.41836616,-119.8817133,WGS84,,,,,GPS,,Entered coordinates from GPS and may differ from what is on label. Uploaded from spreadsheet.,,,,,,,,,,2/22/2019 14:41,,1,urn:uuid:57dc1fdc-550e-4fe3-a538-1c99402526a6,https://symbiota.ccber.ucsb.edu:443/collections/individual/index.php?occid=121181
121189,UCSB,IZC,,PreservedSpecimen,0b7f6069-dc6b-45c3-8794-984e0779d244,UCSB-IZC00021620,,Animalia,Arthropoda,Insecta,Hymenoptera,Formicidae,Linepithema humile,5028,"(Mayr, 1868)",Linepithema,humile,,,Zach Brown,2019,,,,,,UCSB Arthropod Survey,,,,6/24/2016,2016,6,24,176,,"Jun 24-Jul 2, 2016",,"Willow/Cottonwood/Sandy soil area, before restoration",,,M2-Site4,,,,,,,,Adult,,1,Malaise Trap,,Pinned,United States,California,Santa Barbara,Goleta,UCSB North Campus Open Space,,0,,34.41836616,-119.8817133,WGS84,,,,,GPS,,Entered coordinates from GPS and may differ from what is on label. Uploaded from spreadsheet.,,,,,,,,,,2/22/2019 15:15,,1,urn:uuid:0b7f6069-dc6b-45c3-8794-984e0779d244,https://symbiota.ccber.ucsb.edu:443/collections/individual/index.php?occid=121189
121212,UCSB,IZC,,PreservedSpecimen,46c3f5af-15db-417b-b62f-d90961eba2ec,UCSB-IZC00021643,,Animalia,Arthropoda,Insecta,Hymenoptera,Formicidae,Linepithema humile,5028,"(Mayr, 1868)",Linepithema,humile,,,Zach Brown,2019,,,,,,UCSB Arthropod Survey,,,,6/24/2016,2016,6,24,176,,"Jun 24-Jul 2, 2016",,"Willow/Cottonwood/Sandy soil area, before restoration",,,M2-Site4,,,,,,,,Adult,,1,Malaise Trap,,Pinned,United States,California,Santa Barbara,Goleta,UCSB North Campus Open Space,,0,,34.41836616,-119.8817133,WGS84,,,,,GPS,,Entered coordinates from GPS and may differ from what is on label. Uploaded from spreadsheet.,,,,,,,,,,2/22/2019 14:59,,1,urn:uuid:46c3f5af-15db-417b-b62f-d90961eba2ec,https://symbiota.ccber.ucsb.edu:443/collections/individual/index.php?occid=121212
121220,UCSB,IZC,,PreservedSpecimen,b8667c96-c688-481b-8730-93a02592d238,UCSB-IZC00021651,,Animalia,Arthropoda,Insecta,Hymenoptera,Formicidae,Linepithema humile,5028,"(Mayr, 1868)",Linepithema,humile,,,Zach Brown,2019,,,,,,UCSB Arthropod Survey,,,,6/24/2016,2016,6,24,176,,"Jun 24-Jul 2, 2016",,"Willow/Cottonwood/Sandy soil area, before restoration",,,M2-Site4,,,,,,,,Adult,,1,Malaise Trap,,Pinned,United States,California,Santa Barbara,Goleta,UCSB North Campus Open Space,,0,,34.41836616,-119.8817133,WGS84,,,,,GPS,,Entered coordinates from GPS and may differ from what is on label. Uploaded from spreadsheet.,,,,,,,,,,2/22/2019 14:59,,1,urn:uuid:b8667c96-c688-481b-8730-93a02592d238,https://symbiota.ccber.ucsb.edu:443/collections/individual/index.php?occid=121220
121223,UCSB,IZC,,PreservedSpecimen,a79c3cff-688c-4267-906f-67c4fd9831ad,UCSB-IZC00021654,,Animalia,Arthropoda,Insecta,Hymenoptera,Formicidae,Linepithema humile,5028,"(Mayr, 1868)",Linepithema,humile,,,Zach Brown,2019,,,,,,UCSB Arthropod Survey,,,,6/24/2016,2016,6,24,176,,"Jun 24-Jul 2, 2016",,"Willow/Cottonwood/Sandy soil area, before restoration",,,M2-Site4,,,,,,,,Adult,,1,Malaise Trap,,Pinned,United States,California,Santa Barbara,Goleta,UCSB North Campus Open Space,,0,,34.41836616,-119.8817133,WGS84,,,,,GPS,,Entered coordinates from GPS and may differ from what is on label. Uploaded from spreadsheet.,,,,,,,,,,2/22/2019 15:00,,1,urn:uuid:a79c3cff-688c-4267-906f-67c4fd9831ad,https://symbiota.ccber.ucsb.edu:443/collections/individual/index.php?occid=121223
121224,UCSB,IZC,,PreservedSpecimen,3c07c899-4aef-468c-bfba-ccb22ad871a6,UCSB-IZC00021655,,Animalia,Arthropoda,Insecta,Hymenoptera,Formicidae,Linepithema humile,5028,"(Mayr, 1868)",Linepithema,humile,,,Zach Brown,2019,,,,,,UCSB Arthropod Survey,,,,6/24/2016,2016,6,24,176,,"Jun 24-Jul 2, 2016",,"Willow/Cottonwood/Sandy soil area, before restoration",,,M2-Site4,,,,,,,,Adult,,1,Malaise Trap,,Pinned,United States,California,Santa Barbara,Goleta,UCSB North Campus Open Space,,0,,34.41836616,-119.8817133,WGS84,,,,,GPS,,Entered coordinates from GPS and may differ from what is on label. Uploaded from spreadsheet.,,,,,,,,,,2/22/2019 15:01,,1,urn:uuid:3c07c899-4aef-468c-bfba-ccb22ad871a6,https://symbiota.ccber.ucsb.edu:443/collections/individual/index.php?occid=121224
121233,UCSB,IZC,,PreservedSpecimen,b3ae3ffa-4dd6-40dc-aa3e-22777b9608d6,UCSB-IZC00022149,,Animalia,Arthropoda,Insecta,Hymenoptera,Formicidae,Linepithema humile,5028,"(Mayr, 1868)",Linepithema,humile,,,Zach Brown,2019,,,,,,UCSB Arthropod Survey,,,,6/24/2016,2016,6,24,176,,"Jun 24-Jul 2, 2016",,"Willow/Cottonwood/Sandy soil area, before restoration",,,M2-Site4,,,,,,,,Adult,,1,Malaise Trap,,Pinned,United States,California,Santa Barbara,Goleta,UCSB North Campus Open Space,,0,,34.41836616,-119.8817133,WGS84,,,,,GPS,,Entered coordinates from GPS and may differ from what is on label. Uploaded from spreadsheet.,,,,,,,,,,2/22/2019 15:02,,1,urn:uuid:b3ae3ffa-4dd6-40dc-aa3e-22777b9608d6,https://symbiota.ccber.ucsb.edu:443/collections/individual/index.php?occid=121233
121317,UCSB,IZC,,PreservedSpecimen,68d2620e-7fea-4bbb-a87f-d26fd44fe06a,UCSB-IZC00020961,,Animalia,Arthropoda,Insecta,Hymenoptera,Formicidae,Monomorium,2763,"Mayr, 1855",Monomorium,,,,Elaine Tan,2019,,,,,,UCSB Arthropod Survey,,,,6/24/2016,2016,6,24,176,,"Jun 24-Jul 2, 2016",,"Willow/Cottonwood/Sandy soil area, before restoration",,,M2-Site4,,,,,Alate,,,Adult,,1,Malaise Trap,,Pinned,United States,California,Santa Barbara,Goleta,UCSB North Campus Open Space,,0,,34.41836616,-119.8817133,WGS84,,,,,GPS,,Entered coordinates from GPS and may differ from what is on label. Uploaded from spreadsheet.,,,,,,,,,,2/22/2019 15:45,,1,urn:uuid:68d2620e-7fea-4bbb-a87f-d26fd44fe06a,https://symbiota.ccber.ucsb.edu:443/collections/individual/index.php?occid=121317
121321,UCSB,IZC,,PreservedSpecimen,e439bac5-412b-4c62-8279-208fbd8b723f,UCSB-IZC00020965,,Animalia,Arthropoda,Insecta,Hymenoptera,Formicidae,Linepithema humile,5028,"(Mayr, 1868)",Linepithema,humile,,,Zach Brown,2019,,,,,,UCSB Arthropod Survey,,,,6/24/2016,2016,6,24,176,,"Jun 24-Jul 2, 2016",,"Willow/Cottonwood/Sandy soil area, before restoration",,,M2-Site4,,,,,,,,Adult,,1,Malaise Trap,,Pinned,United States,California,Santa Barbara,Goleta,UCSB North Campus Open Space,,0,,34.41836616,-119.8817133,WGS84,,,,,GPS,,Entered coordinates from GPS and may differ from what is on label. Uploaded from spreadsheet.,,,,,,,,,,2/22/2019 14:58,,1,urn:uuid:e439bac5-412b-4c62-8279-208fbd8b723f,https://symbiota.ccber.ucsb.edu:443/collections/individual/index.php?occid=121321
121332,UCSB,IZC,,PreservedSpecimen,26e1a9f2-2c4e-46d1-a421-7f8c0601c40e,UCSB-IZC00020976,,Animalia,Arthropoda,Insecta,Hymenoptera,Formicidae,Linepithema humile,5028,"(Mayr, 1868)",Linepithema,humile,,,Zach Brown,2019,,,,,,UCSB Arthropod Survey,,,,6/24/2016,2016,6,24,176,,"Jun 24-Jul 2, 2016",,"Willow/Cottonwood/Sandy soil area, before restoration",,,M2-Site4,,,,,,,,Adult,,1,Malaise Trap,,Pinned,United States,California,Santa Barbara,Goleta,UCSB North Campus Open Space,,0,,34.41836616,-119.8817133,WGS84,,,,,GPS,,Entered coordinates from GPS and may differ from what is on label. Uploaded from spreadsheet.,,,,,,,,,,2/22/2019 14:57,,1,urn:uuid:26e1a9f2-2c4e-46d1-a421-7f8c0601c40e,https://symbiota.ccber.ucsb.edu:443/collections/individual/index.php?occid=121332
121355,UCSB,IZC,,PreservedSpecimen,b0ea6997-6957-40ed-820d-b5e79d509f1d,UCSB-IZC00020999,,Animalia,Arthropoda,Insecta,Hymenoptera,Formicidae,Linepithema humile,5028,"(Mayr, 1868)",Linepithema,humile,,,Zach Brown,2019,,,,,,UCSB Arthropod Survey,,,,6/24/2016,2016,6,24,176,,"Jun 24-Jul 2, 2016",,"Willow/Cottonwood/Sandy soil area, before restoration",,,M2-Site4,,,,,,,,Adult,,1,Malaise Trap,,Pinned,United States,California,Santa Barbara,Goleta,UCSB North Campus Open Space,,0,,34.41836616,-119.8817133,WGS84,,,,,GPS,,Entered coordinates from GPS and may differ from what is on label. Uploaded from spreadsheet.,,,,,,,,,,2/22/2019 14:56,,1,urn:uuid:b0ea6997-6957-40ed-820d-b5e79d509f1d,https://symbiota.ccber.ucsb.edu:443/collections/individual/index.php?occid=121355
121386,UCSB,IZC,,PreservedSpecimen,bf471054-49de-460b-8347-199a46475176,UCSB-IZC00022024,,Animalia,Arthropoda,Insecta,Hymenoptera,Formicidae,Linepithema humile,5028,"(Mayr, 1868)",Linepithema,humile,,,Zach Brown,2019,,,,,,UCSB Arthropod Survey,,,,6/24/2016,2016,6,24,176,,"Jun 24-Jul 2, 2016",,"Willow/Cottonwood/Sandy soil area, before restoration",,,M2-Site4,,,,,,,,Adult,,1,Malaise Trap,,Pinned,United States,California,Santa Barbara,Goleta,UCSB North Campus Open Space,,0,,34.41836616,-119.8817133,WGS84,,,,,GPS,,Entered coordinates from GPS and may differ from what is on label. Uploaded from spreadsheet.,,,,,,,,,,2/22/2019 14:55,,1,urn:uuid:bf471054-49de-460b-8347-199a46475176,https://symbiota.ccber.ucsb.edu:443/collections/individual/index.php?occid=121386
121423,UCSB,IZC,,PreservedSpecimen,a6d064f8-e548-4179-a962-cde25b091bb6,UCSB-IZC00021221,,Animalia,Arthropoda,Insecta,Hymenoptera,Formicidae,Temnothorax,5544,"Mayr, 1861",Temnothorax,,,,Elaine Tan,2019,,,,,,UCSB Arthropod Survey,,,,7/15/2016,2016,7,15,197,,"Jul 15-22, 2016",,"Creek/wetland - upland salt marsh, before restoration",,,M2-Site5,,,,,Alate,,,Adult,,1,Malaise Trap,,Pinned,United States,California,Santa Barbara,Goleta,UCSB North Campus Open Space,,0,,34.42050607,-119.87756,WGS84,10,,,,GPS,,Entered coordinates from GPS and may differ from what is on label. Uploaded from spreadsheet.,,,,,,,,,,2/22/2019 15:50,,1,urn:uuid:a6d064f8-e548-4179-a962-cde25b091bb6,https://symbiota.ccber.ucsb.edu:443/collections/individual/index.php?occid=121423
121450,UCSB,IZC,,PreservedSpecimen,d03856e5-20a3-4411-b710-bc9d3d72ff35,UCSB-IZC00020881,,Animalia,Arthropoda,Insecta,Hymenoptera,Formicidae,Linepithema humile,5028,"(Mayr, 1868)",Linepithema,humile,,,Zach Brown,2019,,,,,,UCSB Arthropod Survey,,,,7/29/2016,2016,7,29,211,,"Jul 29-Aug 5, 2016",,"Creek/wetland - upland salt marsh, before restoration",,,M2-Site5,,,,,,,,Adult,,32,Malaise Trap,,Pinned,United States,California,Santa Barbara,Goleta,UCSB North Campus Open Space,,0,,34.42050607,-119.87756,WGS84,,,,,GPS,,Entered coordinates from GPS and may differ from what is on label. Uploaded from spreadsheet.,,,,,,,,,,2/6/2019 12:43,,1,urn:uuid:d03856e5-20a3-4411-b710-bc9d3d72ff35,https://symbiota.ccber.ucsb.edu:443/collections/individual/index.php?occid=121450
121682,UCSB,IZC,,PreservedSpecimen,7ada0b3a-95aa-4197-8757-f9168e5a8e8d,UCSB-IZC00022062,,Animalia,Arthropoda,Insecta,Hymenoptera,Formicidae,Linepithema humile,5028,"(Mayr, 1868)",Linepithema,humile,,,Zach Brown,2019,,,,,,UCSB Arthropod Survey,,,,5/5/2016,2016,5,5,126,,"May 5-12, 2016",,"Eucalyptus Windrow - Grassland, before restoration",,,M1-Site3,,,,,,,,Adult,,1,Malaise Trap,,Pinned,United States,California,Santa Barbara,Goleta,UCSB North Campus Open Space,,0,,34.41754985,-119.8842132,WGS84,,,,,GPS,,Entered coordinates from GPS and may differ from what is on label. Uploaded from spreadsheet.,,,,,,,,,,2/22/2019 14:42,,1,urn:uuid:7ada0b3a-95aa-4197-8757-f9168e5a8e8d,https://symbiota.ccber.ucsb.edu:443/collections/individual/index.php?occid=121682
121707,UCSB,IZC,,PreservedSpecimen,3b3fdb06-c57d-4090-a9aa-0fd97b1cb756,UCSB-IZC00021021,,Animalia,Arthropoda,Insecta,Hymenoptera,Formicidae,Linepithema humile,5028,"(Mayr, 1868)",Linepithema,humile,,,Zach Brown,2019,,,,,,UCSB Arthropod Survey,,,,4/7/2016,2016,4,7,98,,"Apr 7-14, 2016",,"Scrub/Fennel edge, before restoration",,,M1-Site1,,,,,,,,Adult,,1,Malaise Trap,,Pinned,United States,California,Santa Barbara,Goleta,UCSB North Campus Open Space,,0,,34.42036883,-119.8814562,WGS84,,,,,GPS,,Entered coordinates from GPS and may differ from what is on label. Uploaded from spreadsheet.,,,,,,,,,,2/22/2019 14:40,,1,urn:uuid:3b3fdb06-c57d-4090-a9aa-0fd97b1cb756,https://symbiota.ccber.ucsb.edu:443/collections/individual/index.php?occid=121707
121716,UCSB,IZC,,PreservedSpecimen,e06bbb82-38e7-4543-bc99-a26b800eab6c,UCSB-IZC00021016,,Animalia,Arthropoda,Insecta,Hymenoptera,Formicidae,Linepithema humile,5028,"(Mayr, 1868)",Linepithema,humile,,,Zach Brown,2019,,,,,,UCSB Arthropod Survey,,,,4/7/2016,2016,4,7,98,,"Apr 7-14, 2016",,"Scrub/Fennel edge, before restoration",,,M1-Site1,,,,,,,,Adult,,1,Malaise Trap,,Pinned,United States,California,Santa Barbara,Goleta,UCSB North Campus Open Space,,0,,34.42036883,-119.8814562,WGS84,,,,,GPS,,Entered coordinates from GPS and may differ from what is on label. Uploaded from spreadsheet.,,,,,,,,,,2/22/2019 14:39,,1,urn:uuid:e06bbb82-38e7-4543-bc99-a26b800eab6c,https://symbiota.ccber.ucsb.edu:443/collections/individual/index.php?occid=121716
121717,UCSB,IZC,,PreservedSpecimen,217b4ac4-fbbe-4d53-972a-c0dac433b6c4,UCSB-IZC00021001,,Animalia,Arthropoda,Insecta,Hymenoptera,Formicidae,Linepithema humile,5028,"(Mayr, 1868)",Linepithema,humile,,,Zach Brown,2019,,,,,,UCSB Arthropod Survey,,,,4/7/2016,2016,4,7,98,,"Apr 7-14, 2016",,"Scrub/Fennel edge, before restoration",,,M1-Site1,,,,,,,,Adult,,1,Malaise Trap,,Pinned,United States,California,Santa Barbara,Goleta,UCSB North Campus Open Space,,0,,34.42036883,-119.8814562,WGS84,,,,,GPS,,Entered coordinates from GPS and may differ from what is on label. Uploaded from spreadsheet.,,,,,,,,,,2/22/2019 14:38,,1,urn:uuid:217b4ac4-fbbe-4d53-972a-c0dac433b6c4,https://symbiota.ccber.ucsb.edu:443/collections/individual/index.php?occid=121717
121748,UCSB,IZC,,PreservedSpecimen,c8ca2807-9642-43a3-90a2-b4d50570cad8,UCSB-IZC00020671,,Animalia,Arthropoda,Insecta,Hymenoptera,Formicidae,Linepithema humile,5028,"(Mayr, 1868)",Linepithema,humile,,,Zach Brown,2019,,,,,,UCSB Arthropod Survey,,,,4/7/2016,2016,4,7,98,,"Apr 7-14, 2016",,"Scrub/Fennel edge, before restoration",,,M1-Site1,,,,,,,,Adult,,1,Malaise Trap,,Pinned,United States,California,Santa Barbara,Goleta,UCSB North Campus Open Space,,0,,34.42036883,-119.8814562,WGS84,,,,,GPS,,Entered coordinates from GPS and may differ from what is on label. Uploaded from spreadsheet.,,,,,,,,,,2/22/2019 14:45,,1,urn:uuid:c8ca2807-9642-43a3-90a2-b4d50570cad8,https://symbiota.ccber.ucsb.edu:443/collections/individual/index.php?occid=121748
121762,UCSB,IZC,,PreservedSpecimen,041b1434-73f6-4485-a001-131036575d1f,UCSB-IZC00020647,,Animalia,Arthropoda,Insecta,Hymenoptera,Formicidae,Linepithema humile,5028,"(Mayr, 1868)",Linepithema,humile,,,Zach Brown,2019,,,,,,UCSB Arthropod Survey,,,,4/7/2016,2016,4,7,98,,"Apr 7-14, 2016",,"Scrub/Fennel edge, before restoration",,,M1-Site1,,,,,,,,Adult,,1,Malaise Trap,,Pinned,United States,California,Santa Barbara,Goleta,UCSB North Campus Open Space,,0,,34.42036883,-119.8814562,WGS84,,,,,GPS,,Entered coordinates from GPS and may differ from what is on label. Uploaded from spreadsheet.,,,,,,,,,,2/22/2019 14:52,,1,urn:uuid:041b1434-73f6-4485-a001-131036575d1f,https://symbiota.ccber.ucsb.edu:443/collections/individual/index.php?occid=121762
121763,UCSB,IZC,,PreservedSpecimen,a05ef750-be5c-4408-9056-f6ecec8a4dc0,UCSB-IZC00020658,,Animalia,Arthropoda,Insecta,Hymenoptera,Formicidae,Linepithema humile,5028,"(Mayr, 1868)",Linepithema,humile,,,Zach Brown,2019,,,,,,UCSB Arthropod Survey,,,,4/7/2016,2016,4,7,98,,"Apr 7-14, 2016",,"Scrub/Fennel edge, before restoration",,,M1-Site1,,,,,,,,Adult,,1,Malaise Trap,,Pinned,United States,California,Santa Barbara,Goleta,UCSB North Campus Open Space,,0,,34.42036883,-119.8814562,WGS84,,,,,GPS,,Entered coordinates from GPS and may differ from what is on label. Uploaded from spreadsheet.,,,,,,,,,,2/22/2019 14:50,,1,urn:uuid:a05ef750-be5c-4408-9056-f6ecec8a4dc0,https://symbiota.ccber.ucsb.edu:443/collections/individual/index.php?occid=121763
121767,UCSB,IZC,,PreservedSpecimen,26bd1982-6e78-4218-b6e3-2f12205afcc9,UCSB-IZC00020670,,Animalia,Arthropoda,Insecta,Hymenoptera,Formicidae,Linepithema humile,5028,"(Mayr, 1868)",Linepithema,humile,,,Zach Brown,2019,,,,,,UCSB Arthropod Survey,,,,4/7/2016,2016,4,7,98,,"Apr 7-14, 2016",,"Scrub/Fennel edge, before restoration",,,M1-Site1,,,,,,,,Adult,,1,Malaise Trap,,Pinned,United States,California,Santa Barbara,Goleta,UCSB North Campus Open Space,,0,,34.42036883,-119.8814562,WGS84,,,,,GPS,,Entered coordinates from GPS and may differ from what is on label. Uploaded from spreadsheet.,,,,,,,,,,2/22/2019 14:46,,1,urn:uuid:26bd1982-6e78-4218-b6e3-2f12205afcc9,https://symbiota.ccber.ucsb.edu:443/collections/individual/index.php?occid=121767
121937,UCSB,IZC,,PreservedSpecimen,d3c6ea43-660e-4c80-8c3d-24373828be31,UCSB-IZC00020689,,Animalia,Arthropoda,Insecta,Hymenoptera,Formicidae,Linepithema humile,5028,"(Mayr, 1868)",Linepithema,humile,,,Zach Brown,2019,,,,,,UCSB Arthropod Survey,,,,4/7/2016,2016,4,7,98,,"Apr 7-14, 2016",,"Scrub/Fennel edge, before restoration",,,M1-Site1,,,,,,,,Adult,,1,Malaise Trap,,Pinned,United States,California,Santa Barbara,Goleta,UCSB North Campus Open Space,,0,,34.42036883,-119.8814562,WGS84,,,,,GPS,,Entered coordinates from GPS and may differ from what is on label. Uploaded from spreadsheet.,,,,,,,,,,2/22/2019 14:49,,1,urn:uuid:d3c6ea43-660e-4c80-8c3d-24373828be31,https://symbiota.ccber.ucsb.edu:443/collections/individual/index.php?occid=121937
121943,UCSB,IZC,,PreservedSpecimen,78722556-e1f7-4a3e-b7f8-ee75f47c25d8,UCSB-IZC00020666,,Animalia,Arthropoda,Insecta,Hymenoptera,Formicidae,Linepithema humile,5028,"(Mayr, 1868)",Linepithema,humile,,,Zach Brown,2019,,,,,,UCSB Arthropod Survey,,,,4/7/2016,2016,4,7,98,,"Apr 7-14, 2016",,"Scrub/Fennel edge, before restoration",,,M1-Site1,,,,,,,,Adult,,1,Malaise Trap,,Pinned,United States,California,Santa Barbara,Goleta,UCSB North Campus Open Space,,0,,34.42036883,-119.8814562,WGS84,,,,,GPS,,Entered coordinates from GPS and may differ from what is on label. Uploaded from spreadsheet.,,,,,,,,,,2/22/2019 14:48,,1,urn:uuid:78722556-e1f7-4a3e-b7f8-ee75f47c25d8,https://symbiota.ccber.ucsb.edu:443/collections/individual/index.php?occid=121943
122037,UCSB,IZC,,PreservedSpecimen,030d10a4-39e4-4c85-abad-df4ea71c67b3,UCSB-IZC00020449,,Animalia,Arthropoda,Insecta,Hymenoptera,Formicidae,Linepithema humile,5028,"(Mayr, 1868)",Linepithema,humile,,,Zach Brown,2019,,,,,,UCSB Arthropod Survey,,,,4/7/2016,2016,4,7,98,,"Apr 7-14, 2016",,"Scrub/Fennel edge, before restoration",,,M1-Site1,,,,,,,,Adult,,1,Malaise Trap,,Pinned,United States,California,Santa Barbara,Goleta,UCSB North Campus Open Space,,0,,34.42036883,-119.8814562,WGS84,,,,,GPS,,Entered coordinates from GPS and may differ from what is on label. Uploaded from spreadsheet.,,,,,,,,,,2/22/2019 14:47,,1,urn:uuid:030d10a4-39e4-4c85-abad-df4ea71c67b3,https://symbiota.ccber.ucsb.edu:443/collections/individual/index.php?occid=122037
122055,UCSB,IZC,,PreservedSpecimen,0778c225-dbe2-4307-b972-c3d45649f568,UCSB-IZC00020446,,Animalia,Arthropoda,Insecta,Hymenoptera,Formicidae,Linepithema humile,5028,"(Mayr, 1868)",Linepithema,humile,,,Zach Brown,2019,,,,,,UCSB Arthropod Survey,,,,4/7/2016,2016,4,7,98,,"Apr 7-14, 2016",,"Scrub/Fennel edge, before restoration",,,M1-Site1,,,,,,,,Adult,,1,Malaise Trap,,Pinned,United States,California,Santa Barbara,Goleta,UCSB North Campus Open Space,,0,,34.42036883,-119.8814562,WGS84,,,,,GPS,,Entered coordinates from GPS and may differ from what is on label. Uploaded from spreadsheet.,,,,,,,,,,2/22/2019 14:43,,1,urn:uuid:0778c225-dbe2-4307-b972-c3d45649f568,https://symbiota.ccber.ucsb.edu:443/collections/individual/index.php?occid=122055
122056,UCSB,IZC,,PreservedSpecimen,a8868626-534f-4986-bbe2-d9990ca7610c,UCSB-IZC00020437,,Animalia,Arthropoda,Insecta,Hymenoptera,Formicidae,Linepithema humile,5028,"(Mayr, 1868)",Linepithema,humile,,,Zach Brown,2019,,,,,,UCSB Arthropod Survey,,,,4/7/2016,2016,4,7,98,,"Apr 7-14, 2016",,"Scrub/Fennel edge, before restoration",,,M1-Site1,,,,,,,,Adult,,1,Malaise Trap,,Pinned,United States,California,Santa Barbara,Goleta,UCSB North Campus Open Space,,0,,34.42036883,-119.8814562,WGS84,,,,,GPS,,Entered coordinates from GPS and may differ from what is on label. Uploaded from spreadsheet.,,,,,,,,,,2/22/2019 14:44,,1,urn:uuid:a8868626-534f-4986-bbe2-d9990ca7610c,https://symbiota.ccber.ucsb.edu:443/collections/individual/index.php?occid=122056
122159,UCSB,IZC,,PreservedSpecimen,8eee5860-6d1b-4eec-9f2b-4346374cc29f,UCSB-IZC00020282,,Animalia,Arthropoda,Insecta,Hymenoptera,Formicidae,Temnothorax,5544,"Mayr, 1861",Temnothorax,,,,Elaine Tan,2019,,,,,,UCSB Arthropod Survey,,,,7/8/2016,2016,7,8,190,,"Jul 8-15, 2016",,"Creek/wetland - upland salt marsh, Fennel/Grassland, before restoration",,,"M2-Site5, M1-Site5",,,,,Alate,,,Adult,,1,Malaise Trap,,Pinned,United States,California,Santa Barbara,Goleta,UCSB North Campus Open Space,,0,,34.42050607,-119.87756,WGS84,10,"34.420506073339340, -119.878238434056137",,,GPS,,Entered coordinates from GPS and may differ from what is on label. Uploaded from spreadsheet.,,,,,,,,,,2/22/2019 16:00,,1,urn:uuid:8eee5860-6d1b-4eec-9f2b-4346374cc29f,https://symbiota.ccber.ucsb.edu:443/collections/individual/index.php?occid=122159
122980,UCSB,IZC,,PreservedSpecimen,52621b28-da5e-4378-a3d0-571cef53ee4f,UCSB-IZC00021568,,Animalia,Arthropoda,Insecta,Hymenoptera,Formicidae,Linepithema humile,5028,"(Mayr, 1868)",Linepithema,humile,,,Elaine Tan,2018,,,,,,S. Woo,,,,5/24/1996,1996,5,24,145,,,,,,,,,,,,,,,,,,,,,United States,California,Santa Barbara,,"University of California, Santa Barbara",,,,34.411786,-119.846471,WGS84,897,,,,GeoLocate,,,,,,,,,,,zachary_brown,2/22/2019 11:35,,1,urn:uuid:52621b28-da5e-4378-a3d0-571cef53ee4f,https://symbiota.ccber.ucsb.edu:443/collections/individual/index.php?occid=122980
122981,UCSB,IZC,,PreservedSpecimen,e676e1d6-4b7c-4240-9a00-fb7b1b3863a6,UCSB-IZC00021566,,Animalia,Arthropoda,Insecta,Hymenoptera,Formicidae,Linepithema humile,5028,"(Mayr, 1868)",Linepithema,humile,,,Elaine Tan,2018,,,,,,Shelby Heinse,,,,6/3/2018,2018,6,3,154,,,,,,,,,,,,,,,Adult,,,Sweep net,,Pinned,United States,California,Santa Barbara,Goleta,Goleta,,,,34.4428,-119.8476,WGS84,10,,,,,,,,,,,,,,,aurora2,2/13/2019 16:50,,1,urn:uuid:e676e1d6-4b7c-4240-9a00-fb7b1b3863a6,https://symbiota.ccber.ucsb.edu:443/collections/individual/index.php?occid=122981
122982,UCSB,IZC,,PreservedSpecimen,e922bcdd-2a35-46c9-a8b9-84dbb7663c17,UCSB-IZC00021494,,Animalia,Arthropoda,Insecta,Hymenoptera,Formicidae,Linepithema humile,5028,"(Mayr, 1868)",Linepithema,humile,,,Zach Brown,2018,,,,,,UCSB Arthropod Survey,,,,4/25/2016,2016,4,25,116,,"April 25-26, 2016",,Before restoration,,,CSM-PIT-01,,,,,,,,Adult,,,Pitfall trap,,Pinned,United States,California,Santa Barbara,Goleta,"UCSB North Campus Open Space; 34.4205, -119.8792",,,,34.4205,-119.8792,WGS84,10,,,,GPS,,Entered coordinates from GPS and may differ from what is on label. Uploaded from spreadsheet.,,,,,,,,,aurora2,2/13/2019 16:50,,1,urn:uuid:e922bcdd-2a35-46c9-a8b9-84dbb7663c17,https://symbiota.ccber.ucsb.edu:443/collections/individual/index.php?occid=122982
122983,UCSB,IZC,,PreservedSpecimen,0a5eced8-640a-4f07-b2b3-1d12052b89f8,UCSB-IZC00021557,,Animalia,Arthropoda,Insecta,Hymenoptera,Formicidae,Dorymyrmex bicolor,5531,"Wheeler, W.M., 1906",Dorymyrmex,bicolor,,,J. Longino,1986,,,,,,J. Longino,,,84-47,8/24/1984,1984,8,24,237,,"Aug 24-27, 1984",0-200m,,,,,,,,,,,,Adult,,1,,,Pinned,United States,California,Santa Barbara,,Santa Cruz Island,,,,34.016667,-119.716667,,20491,,entan (2019-02-21 13:22:33),,georef batch tool 2019-02-21; GeoLocate,reviewed - high confidence,,,,,,,,,,zachary_brown,2/21/2019 12:22,,1,urn:uuid:0a5eced8-640a-4f07-b2b3-1d12052b89f8,https://symbiota.ccber.ucsb.edu:443/collections/individual/index.php?occid=122983
122984,UCSB,IZC,,PreservedSpecimen,8c27f7a2-bddc-4f13-b922-42b6957afeee,UCSB-IZC00021591,,Animalia,Arthropoda,Insecta,Hymenoptera,Formicidae,Linepithema humile,5028,"(Mayr, 1868)",Linepithema,humile,,,Zach Brown,2018,,,,,,UCSB Arthropod Survey,,,,4/25/2016,2016,4,25,116,,"April 25-26, 2016",,Before restoration,,,CWC-YPT-02,,,,,,,,Adult,,,Yellow Pan Trap,,Pinned,United States,California,Santa Barbara,Goleta,UCSB North Campus Open Space; 34.4202 -119.8809,,,,34.4202,-119.8809,WGS84,10,,,,GPS,,Entered coordinates from GPS and may differ from what is on label. Uploaded from spreadsheet.,,,,,,,,,aurora2,2/13/2019 16:51,,1,urn:uuid:8c27f7a2-bddc-4f13-b922-42b6957afeee,https://symbiota.ccber.ucsb.edu:443/collections/individual/index.php?occid=122984
122985,UCSB,IZC,,PreservedSpecimen,6a867950-8985-4cc3-8929-0221bf20ffe7,UCSB-IZC00021531,,Animalia,Arthropoda,Insecta,Hymenoptera,Formicidae,Dorymyrmex insanus,5532,"(Buckley, 1866)",Dorymyrmex,insanus,,,Elaine Tan,2018,,,,,,UCSB Natural History Collections Club,,,,5/28/2017,2017,5,28,148,,,,,,,,,,,,,,,Adult,,1,,,Pinned,United States,California,Santa Barbara,,Santa Cruz Island,,,,33.9999,-119.7338,WGS84,10,,,,,,,,,,,,,,,zachary_brown,2/6/2019 15:11,,1,urn:uuid:6a867950-8985-4cc3-8929-0221bf20ffe7,https://symbiota.ccber.ucsb.edu:443/collections/individual/index.php?occid=122985
122986,UCSB,IZC,,PreservedSpecimen,e23e3524-5f21-4bb0-bb64-f8a096042db9,UCSB-IZC00021553,,Animalia,Arthropoda,Insecta,Hymenoptera,Formicidae,Dorymyrmex insanus,5532,"(Buckley, 1866)",Dorymyrmex,insanus,,,Elaine Tan,2018,,,,,,UCSB Natural History Collections Club,,,,5/28/2017,2017,5,28,148,,,,,,,,,,,,,,,Adult,,1,,,Pinned,United States,California,Santa Barbara,,Santa Cruz Island,,0,,33.9999,-119.7338,WGS84,10,,,,,,,,,,,,,,,zachary_brown,2/6/2019 15:11,,1,urn:uuid:e23e3524-5f21-4bb0-bb64-f8a096042db9,https://symbiota.ccber.ucsb.edu:443/collections/individual/index.php?occid=122986
122987,UCSB,IZC,,PreservedSpecimen,f9857b34-74e3-45d0-8c2b-6cfc0d7f90a3,UCSB-IZC00021540,,Animalia,Arthropoda,Insecta,Hymenoptera,Formicidae,Linepithema humile,5028,"(Mayr, 1868)",Linepithema,humile,,,Zach Brown,2018,,,,,,UCSB Arthropod Survey,,,,6/23/2016,2016,6,23,175,,"June 23-24, 2016",,Before restoration,,,CSM-YPT-01,,,,,,,,Adult,,,Yellow Pan Trap,,Pinned,United States,California,Santa Barbara,Goleta,UCSB North Campus Open Space; 34.4203 -119.8805,,,,34.4203,-119.8805,WGS84,10,,,,GPS,,Entered coordinates from GPS and may differ from what is on label. Uploaded from spreadsheet.,,,,,,,,,aurora2,2/13/2019 16:51,,1,urn:uuid:f9857b34-74e3-45d0-8c2b-6cfc0d7f90a3,https://symbiota.ccber.ucsb.edu:443/collections/individual/index.php?occid=122987
122988,UCSB,IZC,,PreservedSpecimen,8c806b2e-2b81-478a-b47d-44af3823f4d1,UCSB-IZC00021587,,Animalia,Arthropoda,Insecta,Hymenoptera,Formicidae,Linepithema humile,5028,"(Mayr, 1868)",Linepithema,humile,,,Zach Brown,2018,,,,,,UCSB Arthropod Survey,,,,6/27/2016,2016,6,27,179,,"June 27-30, 2016",,,,,CSM-PIT-01,,,,,,,,Adult,,,Pitfall Trap,,Pinned,United States,California,Santa Barbara,,UCSB North Campus Open Space,,,,34.4206,-119.8729,WGS84,,,,,,,,,,,,,,,,aurora2,2/13/2019 16:51,,1,urn:uuid:8c806b2e-2b81-478a-b47d-44af3823f4d1,https://symbiota.ccber.ucsb.edu:443/collections/individual/index.php?occid=122988
122989,UCSB,IZC,,PreservedSpecimen,693a5182-a28b-43d8-baf7-415149d5aed9,UCSB-IZC00021518,,Animalia,Arthropoda,Insecta,Hymenoptera,Formicidae,Dorymyrmex,1493,"Mayr, 1866",Dorymyrmex,,,,Elaine Tan,2018,,,,,,Zahra Arsalan,,,,4/29/2018,2018,4,29,119,,,,,,,,,,,,,,,Adult,,1,,,Pinned,United States,California,Santa Barbara,Isla Vista,Sands Beach,,,,34.4079,-119.8789,WGS84,10,,,,,,,,,,,,,,,zachary_brown,2/6/2019 13:56,,1,urn:uuid:693a5182-a28b-43d8-baf7-415149d5aed9,https://symbiota.ccber.ucsb.edu:443/collections/individual/index.php?occid=122989
122990,UCSB,IZC,,PreservedSpecimen,312ba80e-bbec-4b34-a98e-219c438b4fd9,UCSB-IZC00021291,,Animalia,Arthropoda,Insecta,Hymenoptera,Formicidae,Linepithema humile,5028,"(Mayr, 1868)",Linepithema,humile,,,Zach Brown,2018,,,,,,Vahan Terterian,,,,4/25/2017,2017,4,25,115,,,,,,,,,,,,,,,Adult,,1,,,Pinned,USA,California,Santa Barbara,,"University of California, Santa Barbara Lagoon",,,,34.408393,-119.847426,WGS84,452,,,,GeoLocate,,,,,,,,,,,aurora2,2/22/2019 11:37,,1,urn:uuid:312ba80e-bbec-4b34-a98e-219c438b4fd9,https://symbiota.ccber.ucsb.edu:443/collections/individual/index.php?occid=122990
122991,UCSB,IZC,,PreservedSpecimen,7d433338-6188-48a0-9fae-6e0d9db12c0e,UCSB-IZC00021482,,Animalia,Arthropoda,Insecta,Hymenoptera,Formicidae,Conomyrma,1466,"Forel, 1913",Conomyrma,,,,J. Longino,1986,,,,,,J. Longino,,,84-78-S,4/24/1984,1984,4,24,115,,"Aug 24-27, 1984",,,,,,,,,,,,,Adult,,2,,,Pinned,USA,California,Santa Barbara,,Santa Cruz Island,,,,34.016667,-119.716667,WGS84,20644,,,,GeoLocate,,,,,,,,,,,zachary_brown,2/22/2019 11:38,,1,urn:uuid:7d433338-6188-48a0-9fae-6e0d9db12c0e,https://symbiota.ccber.ucsb.edu:443/collections/individual/index.php?occid=122991
122992,UCSB,IZC,,PreservedSpecimen,976a8a1f-8680-470e-8309-8d379b9058d6,UCSB-IZC00025901,,Animalia,Arthropoda,Insecta,Hymenoptera,Formicidae,Linepithema humile,5028,"(Mayr, 1868)",Linepithema,humile,,,Elaine Tan,2018,,,,,,Taylor Howard,,,,6/6/2018,2018,6,6,157,,,,,,,,,,,,,,,,,1,Sweep net,,Pinned,USA,California,Santa Barbara,,"University of California, Santa Barbara Campus Point",,,,34.406109,-119.844861,WGS84,207,,,,GeoLocate,,Campus Point on Lagoon,,,,,,,,,aurora2,2/22/2019 11:39,,1,urn:uuid:976a8a1f-8680-470e-8309-8d379b9058d6,https://symbiota.ccber.ucsb.edu:443/collections/individual/index.php?occid=122992
122993,UCSB,IZC,,PreservedSpecimen,195297c7-e333-4cfa-b866-9a1e39d32bc9,UCSB-IZC00021589,,Animalia,Arthropoda,Insecta,Hymenoptera,Formicidae,Linepithema humile,5028,"(Mayr, 1868)",Linepithema,humile,,,Zach Brown,2018,,,,,,UCSB Arthropod Survey,,,,4/6/2016,2016,4,6,97,,"April 6-7, 2016",,Coastal salt marsh,,,CSM-YPT-02,,,,,,,,Adult,,1,Yellow Pan Trap,,Pinned,USA,California,Santa Barbara,Goleta,UCSB North Campus Open Space,,,,34.4219,-119.8843,WGS84,10,,,,,,,,,,,,,,,zachary_brown,2/22/2019 16:01,,1,urn:uuid:195297c7-e333-4cfa-b866-9a1e39d32bc9,https://symbiota.ccber.ucsb.edu:443/collections/individual/index.php?occid=122993
122994,UCSB,IZC,,PreservedSpecimen,60baa5c1-c495-4851-a3dc-feb1567cbc2e,UCSB-IZC00021493,,Animalia,Arthropoda,Insecta,Hymenoptera,Formicidae,Linepithema humile,5028,"(Mayr, 1868)",Linepithema,humile,,,Elaine Tan,2018,,,,,,Dimitry Pyagay,,,,6/1/2018,2018,6,1,152,,,,,,,,,,,,,,,Adult,,1,,,Pinned,USA,California,Santa Barbara,Isla Vista,Isla Vista,,,,34.413329,-119.860972,WGS84,2476,,,,GeoLocate,,,,,,,,,,,zachary_brown,2/22/2019 11:39,,1,urn:uuid:60baa5c1-c495-4851-a3dc-feb1567cbc2e,https://symbiota.ccber.ucsb.edu:443/collections/individual/index.php?occid=122994
122995,UCSB,IZC,,PreservedSpecimen,0f4b36a6-1b20-4d29-a4c1-056309dd86a3,UCSB-IZC00021592,,Animalia,Arthropoda,Insecta,Hymenoptera,Formicidae,Linepithema humile,5028,"(Mayr, 1868)",Linepithema,humile,,,Elaine Tan,2018,,,,,,Eloy Bacilio,,,,5/12/2016,2016,5,12,133,,,,,,,,,,,,,,,Adult,,1,,,Pinned,USA,California,Santa Barbara,,"University of California, Santa Barbara Manzanita Village",,,,34.409326,-119.852013,WGS84,157,,,,GeoLocate,,,,,,,,,,,zachary_brown,2/22/2019 11:40,,1,urn:uuid:0f4b36a6-1b20-4d29-a4c1-056309dd86a3,https://symbiota.ccber.ucsb.edu:443/collections/individual/index.php?occid=122995
122996,UCSB,IZC,,PreservedSpecimen,0a0eacb8-c3af-47b2-8709-a8b4274401d8,UCSB-IZC00021596,,Animalia,Arthropoda,Insecta,Hymenoptera,Formicidae,Linepithema humile,5028,"(Mayr, 1868)",Linepithema,humile,,,Elaine Tan,2018,,,,,,Mimi (Weiwei) Liu,,EEMB 118 Entomology Class,,7/4/2018,2018,7,4,185,,,,Restored coastal sage scrub,,,,,,,,,,,Adult,,1,,,Pinned,USA,California,Santa Barbara,,"University of California, Santa Barbara Lagoon",,,,34.4101,-119.8506,WGS84,10,,,,,,,,,,,,,,,zachary_brown,2/13/2019 12:57,,1,urn:uuid:0a0eacb8-c3af-47b2-8709-a8b4274401d8,https://symbiota.ccber.ucsb.edu:443/collections/individual/index.php?occid=122996
122997,UCSB,IZC,,PreservedSpecimen,20f964c1-0078-4a44-8d7d-97e72e54bb6a,UCSB-IZC00021511,,Animalia,Arthropoda,Insecta,Hymenoptera,Formicidae,Linepithema humile,5028,"(Mayr, 1868)",Linepithema,humile,,,Elaine Tan,2018,,,,,,Jose Bojorquez,,,,5/30/2017,2017,5,30,150,,,,,,,,,,,,,,,Adult,,1,,,Pinned,USA,California,Santa Barbara,Goleta,Hollister Ave,,,,34.434944,-119.833084,WGS84,6886,,,,GeoLocate,,"Along Hollister Ave, only in Goleta",,,,,,,,,zachary_brown,2/22/2019 11:43,,1,urn:uuid:20f964c1-0078-4a44-8d7d-97e72e54bb6a,https://symbiota.ccber.ucsb.edu:443/collections/individual/index.php?occid=122997
122998,UCSB,IZC,,PreservedSpecimen,05473def-109a-4a27-bfc1-d770cc9ef534,UCSB-IZC00021565,,Animalia,Arthropoda,Insecta,Hymenoptera,Formicidae,Linepithema humile,5028,"(Mayr, 1868)",Linepithema,humile,,,Elaine Tan,2018,,,,,,Beth Ensign,,,,5/22/2018,2018,5,22,142,,,,,,,,,,,,,,,Adult,,1,Hand,,Pinned,USA,California,Santa Barbara,Isla Vista,Embarcadero Rd,,,,34.409957,-119.856145,WGS84,70,,,,GeoLocate,,El Embarcadero Rd,,,,,,,,,zachary_brown,2/22/2019 11:44,,1,urn:uuid:05473def-109a-4a27-bfc1-d770cc9ef534,https://symbiota.ccber.ucsb.edu:443/collections/individual/index.php?occid=122998
122999,UCSB,IZC,,PreservedSpecimen,48d7a6ef-fed6-42b7-b882-d7479ca5be52,UCSB-IZC00021525,,Animalia,Arthropoda,Insecta,Hymenoptera,Formicidae,Linepithema humile,5028,"(Mayr, 1868)",Linepithema,humile,,,Elaine Tan,2018,,,,,,UCSB Arthropod Survey,,,,6/23/2016,2016,6,23,175,,"June 23-24, 2016",,,,,CSM-YPT-01,,,,,,,,Adult,,1,Yellow Pan Trap,,Pinned,USA,California,Santa Barbara,Goleta,UCSB North Campus Open Space,,,,34.4203,-119.8805,WGS84,10,,,,,,,,,,,,,,,zachary_brown,2/6/2019 14:22,,1,urn:uuid:48d7a6ef-fed6-42b7-b882-d7479ca5be52,https://symbiota.ccber.ucsb.edu:443/collections/individual/index.php?occid=122999
123000,UCSB,IZC,,PreservedSpecimen,0c55b856-1ad3-49b5-b220-f87d0256b003,UCSB-IZC00025902,,Animalia,Arthropoda,Insecta,Hymenoptera,Formicidae,Linepithema humile,5028,"(Mayr, 1868)",Linepithema,humile,,,Elaine Tan,2018,,,,,,Elaine Tan,,"M. Reichenbach, E. Chestnut",,5/8/2018,2018,5,8,128,,,UCSB EEMB 96 Spring 2018,,,,,,,,Centromadia parryi subsp. australis; Voucher: UCSB050026,,,,Adult,,1,Sweep Net,,Pinned,USA,California,Santa Barbara,Goleta,"UCSB North Campus Open Space, South Parcel",,,,34.4182,-119.8844,WGS84,10,,,,,,,65,,,,,,,,zachary_brown,2/6/2019 14:36,,1,urn:uuid:0c55b856-1ad3-49b5-b220-f87d0256b003,https://symbiota.ccber.ucsb.edu:443/collections/individual/index.php?occid=123000
123001,UCSB,IZC,,PreservedSpecimen,467f542b-a5d3-446c-ab9b-ae6c66a854dd,UCSB-IZC00021561,,Animalia,Arthropoda,Insecta,Hymenoptera,Formicidae,Linepithema humile,5028,"(Mayr, 1868)",Linepithema,humile,,,Zach Brown,2018,,,,,,J. Tai,,,,5/25/2016,2016,5,25,146,,,,,,,,,,,,,,,Adult,,1,,,Pinned,USA,California,Santa Barbara,Isla Vista,Goleta,,,,34.439794,-119.811503,WGS84,9263,,,,GeoLocate,,,,,,,,,,,zachary_brown,2/22/2019 11:45,,1,urn:uuid:467f542b-a5d3-446c-ab9b-ae6c66a854dd,https://symbiota.ccber.ucsb.edu:443/collections/individual/index.php?occid=123001
123002,UCSB,IZC,,PreservedSpecimen,668ef173-06e3-4439-a919-e6b9ce2acf56,UCSB-IZC00021501,,Animalia,Arthropoda,Insecta,Hymenoptera,Formicidae,Linepithema humile,5028,"(Mayr, 1868)",Linepithema,humile,,,Zach Brown,2018,,,,,,EEMB 118 Entomology Class,,,,5/8/2018,2018,5,8,128,,"May 8-15, 2018",,Restored coastal sage scrub,,,,,,,,,,,Adult,,1,Malaise trap,,Pinned,USA,California,Santa Barbara,,UCSB Lagoon Island,,,,34.4192,-119.8841,WGS84,10,,,,,,,,,,,,,,,aurora2,2/13/2019 16:52,,1,urn:uuid:668ef173-06e3-4439-a919-e6b9ce2acf56,https://symbiota.ccber.ucsb.edu:443/collections/individual/index.php?occid=123002
123003,UCSB,IZC,,PreservedSpecimen,2abdfac0-92b8-41a2-a1ab-cef950b0aa8f,UCSB-IZC00021334,,Animalia,Arthropoda,Insecta,Hymenoptera,Formicidae,Linepithema humile,5028,"(Mayr, 1868)",Linepithema,humile,,,Zach Brown,2018,,,,,,McKenzie Sime,,,,6/2/2017,2017,6,2,153,,,,,,,,,,,,,,,Adult,,1,,,Pinned,USA,California,Santa Barbara,Isla Vista,Isla Vista,,,,34.413329,-119.860972,WGS84,2476,,,,GeoLocate,,,,,,,,,,,zachary_brown,2/22/2019 11:46,,1,urn:uuid:2abdfac0-92b8-41a2-a1ab-cef950b0aa8f,https://symbiota.ccber.ucsb.edu:443/collections/individual/index.php?occid=123003
123004,UCSB,IZC,,PreservedSpecimen,45e8e2f2-711b-426b-bb58-c0adf8a4bda2,UCSB-IZC00021530,,Animalia,Arthropoda,Insecta,Hymenoptera,Formicidae,Linepithema humile,5028,"(Mayr, 1868)",Linepithema,humile,,,Zach Brown,2018,,,,,,Elenna Erkeneff,,,,5/23/2016,2016,5,23,144,,,,,,,,,,,,,,,Adult,,1,,,Pinned,USA,California,Santa Barbara,,Devereaux,,,,34.413392,-119.874374,WGS84,1227,,,,GeoLocate,,,,,,,,,,,zachary_brown,2/22/2019 11:46,,1,urn:uuid:45e8e2f2-711b-426b-bb58-c0adf8a4bda2,https://symbiota.ccber.ucsb.edu:443/collections/individual/index.php?occid=123004
123005,UCSB,IZC,,PreservedSpecimen,5fba3769-e82c-46f1-8c13-f6461c1165eb,UCSB-IZC00021595,,Animalia,Arthropoda,Insecta,Hymenoptera,Formicidae,Linepithema humile,5028,"(Mayr, 1868)",Linepithema,humile,,,Zach Brown,2018,,,,,,Kevin Okuda,,,,6/6/2018,2018,6,6,157,,,,,,,,,,,,,,,Adult,,1,,,Pinned,USA,California,Santa Barbara,Isla Vista,Isla Vista,,,,34.413329,-119.860972,WGS84,2476,,,,GeoLocate,,,,,,,,,,,zachary_brown,2/22/2019 11:47,,1,urn:uuid:5fba3769-e82c-46f1-8c13-f6461c1165eb,https://symbiota.ccber.ucsb.edu:443/collections/individual/index.php?occid=123005
123006,UCSB,IZC,,PreservedSpecimen,c885299f-6855-4e71-85ec-de4bf2cbf259,UCSB-IZC00021546,,Animalia,Arthropoda,Insecta,Hymenoptera,Formicidae,Linepithema humile,5028,"(Mayr, 1868)",Linepithema,humile,,,Zach Brown,2018,,,,,,Mimi (Weiwei) Liu,,,,7/11/2018,2018,7,11,192,,,EEMB 118 Entomology class,In CCBER dumpster,,,,,,,,,,,Adult,,1,Aerial net,,Pinned,USA,California,Santa Barbara,,UCSB Cheadle Center for Biodiversity and Ecological Restoration,,,,34.4195,-119.8547,WGS84,,,,,,,,,,,,,,,,aurora2,2/13/2019 16:52,,1,urn:uuid:c885299f-6855-4e71-85ec-de4bf2cbf259,https://symbiota.ccber.ucsb.edu:443/collections/individual/index.php?occid=123006
123008,UCSB,IZC,,PreservedSpecimen,7607fe9f-56f0-450e-8e6c-ef7a5b83d374,UCSB-IZC00025935,,Animalia,Arthropoda,Insecta,Hymenoptera,Formicidae,Monomorium,2763,"Mayr, 1855",Monomorium,,,,Zach Brown,2018,,,,,,C,,,,6/4/1996,1996,6,4,156,,,,,,,,,,,,,,,Adult,,1,,,Pinned,USA,California,Santa Barbara,Santa Barbara,"University of California, Santa Barbara",,,,34.411786,-119.846471,WGS84,897,,,,GeoLocate,,,,,,,,,,,zachary_brown,2/22/2019 11:47,,1,urn:uuid:7607fe9f-56f0-450e-8e6c-ef7a5b83d374,https://symbiota.ccber.ucsb.edu:443/collections/individual/index.php?occid=123008
123015,UCSB,IZC,,PreservedSpecimen,269c3935-7e74-4483-b8d9-b5f97acb710d,UCSB-IZC00025949,,Animalia,Arthropoda,Insecta,Hymenoptera,Formicidae,Atta mexicana,5542,"(Smith, F., 1858)",Atta,mexicana,,,Zach Brown,2018,,,,,,Daniella Chee,,,,7/4/2018,2018,7,4,185,,4-Jun-18,Uncertainty in validity of collection event,,,,,,,,,,,,,,,,,,United States,California,Santa Barbara,Goleta,"Lake Los Carneros, Forest",,,,34.441666,-119.848335,WGS84,559,,,,GeoLocate,,Lake Los Carneros Park,,,,,,,,,entan,2/22/2019 11:49,,1,urn:uuid:269c3935-7e74-4483-b8d9-b5f97acb710d,https://symbiota.ccber.ucsb.edu:443/collections/individual/index.php?occid=123015
123026,UCSB,IZC,,PreservedSpecimen,8d4a7cf3-d9d8-411c-ac8c-f6880b8375d2,UCSB-IZC00026942,,Animalia,Arthropoda,Insecta,Hymenoptera,Formicidae,Linepithema humile,5028,"(Mayr, 1868)",Linepithema,humile,,,Zach Brown,2018,,,,,,Uma Rajpurkar,,,,5/26/2018,2018,5,26,146,,,,,,,,,,,,,,,Adult,,1,Hand,,Pinned,USA,California,Santa Barbara,Goleta,Lake Los Carneros,,,,34.443,-119.8482,WGS84,,,,,,,,,,,,,,,,zachary_brown,2/13/2019 10:26,,1,urn:uuid:8d4a7cf3-d9d8-411c-ac8c-f6880b8375d2,https://symbiota.ccber.ucsb.edu:443/collections/individual/index.php?occid=123026
123027,UCSB,IZC,,PreservedSpecimen,053da692-3bf5-41bf-bed1-a6b213614091,UCSB-IZC00026945,,Animalia,Arthropoda,Insecta,Hymenoptera,Formicidae,Linepithema humile,5028,"(Mayr, 1868)",Linepithema,humile,,,Zach Brown,2018,,,,,,Veronica Fernandez,,,,6/5/2018,2018,6,5,156,,,,,,,,,,,,,,,Adult,,1,,,Pinned,USA,California,Santa Barbara,Santa Maria,Bello Rd,,,,34.913598,-120.420043,WGS84,158,,,,GeoLocate,,,,,,,,,,,zachary_brown,2/22/2019 11:53,,1,urn:uuid:053da692-3bf5-41bf-bed1-a6b213614091,https://symbiota.ccber.ucsb.edu:443/collections/individual/index.php?occid=123027
123028,UCSB,IZC,,PreservedSpecimen,983de234-6cce-4513-9737-ef7a8b3dd71a,UCSB-IZC00027000,,Animalia,Arthropoda,Insecta,Hymenoptera,Formicidae,Linepithema humile,5028,"(Mayr, 1868)",Linepithema,humile,,,Zach Brown,2018,,,,,,Allison Hill,,,,5/24/2018,2018,5,24,144,,,,,,,,,,,,,,,Adult,,1,Hand,,Pinned,USA,California,Santa Barbara,Isla Vista,Isla Vista,,,,34.4147,-119.8651,WGS84,,,,,,,,,,,,,,,,zachary_brown,2/13/2019 10:30,,1,urn:uuid:983de234-6cce-4513-9737-ef7a8b3dd71a,https://symbiota.ccber.ucsb.edu:443/collections/individual/index.php?occid=123028
123029,UCSB,IZC,,PreservedSpecimen,47f9e006-735c-4b59-80e9-c60ae1c9bc2f,UCSB-IZC00026839,,Animalia,Arthropoda,Insecta,Hymenoptera,Formicidae,Linepithema humile,5028,"(Mayr, 1868)",Linepithema,humile,,,Zach Brown,2018,,,,,,Nhi Nguyen,,EEMB 118 Entomology Class,,7/10/2018,2018,7,10,191,,,,On rock by creek,,,,,,,,,,,Adult,,1,Hand,,Pinned,USA,California,Santa Barbara,Santa Barbara,Rattlesnake Canyon Trail,,,,34.4586,-119.8913,,,,,,,,,,,,,,,,,zachary_brown,2/13/2019 10:35,,1,urn:uuid:47f9e006-735c-4b59-80e9-c60ae1c9bc2f,https://symbiota.ccber.ucsb.edu:443/collections/individual/index.php?occid=123029
123030,UCSB,IZC,,PreservedSpecimen,7384171a-0aa1-44c5-84d0-89dba468979e,UCSB-IZC00026857,,Animalia,Arthropoda,Insecta,Hymenoptera,Formicidae,Linepithema humile,5028,"(Mayr, 1868)",Linepithema,humile,,,Zach Brown,2018,,,,,,M. Sun,,,,5/24/2015,2015,5,24,144,,,,,,,,,,,,,,,Adult,,1,,,Pinned,USA,California,Santa Barbara,Isla Vista,Del Playa Drive,,,,34.409698,-119.861596,WGS84,749,,,,GeoLocate,,,,,,,,,,,zachary_brown,2/22/2019 11:56,,1,urn:uuid:7384171a-0aa1-44c5-84d0-89dba468979e,https://symbiota.ccber.ucsb.edu:443/collections/individual/index.php?occid=123030
123031,UCSB,IZC,,PreservedSpecimen,ddf289bc-2d38-4017-a5c0-3ea179a3b56d,UCSB-IZC00026850,,Animalia,Arthropoda,Insecta,Hymenoptera,Formicidae,Linepithema humile,5028,"(Mayr, 1868)",Linepithema,humile,,,Elaine Tan,2018,,,,,,Zach Brown,,EEMB 118 Entomology Class,,6/26/2018,2018,6,26,177,,,,near Brackish Lagoon,,,,,,,Atriplex lentiformis,,,,Adult,,1,Sweep Net,,Pinned,USA,California,Santa Barbara,Santa Barbara,"University of California, Santa Barbara Campus, between Lagoon Island and Campus Point",,,,34.4077,-119.85,,,,,,,,,,,,,,,,,zachary_brown,2/20/2019 18:56,,1,urn:uuid:ddf289bc-2d38-4017-a5c0-3ea179a3b56d,https://symbiota.ccber.ucsb.edu:443/collections/individual/index.php?occid=123031
123032,UCSB,IZC,,PreservedSpecimen,f2ba1082-477e-4431-98bb-b0dadb987133,UCSB-IZC00026845,,Animalia,Arthropoda,Insecta,Hymenoptera,Formicidae,Linepithema humile,5028,"(Mayr, 1868)",Linepithema,humile,,,Elaine Tan,2018,,,,,,Calvin Davidson,,Shelley Bennett,,6/1/2017,2017,6,1,152,,,,,,,,,,,,,,,Adult,,1,Ethylene Glycol Pitfall,,Pinned,USA,California,Santa Barbara,Montecito,Lotusland Botanic Garden,,,,34.442376,-119.657558,WGS84,,,,,,,,,,,,,,,,zachary_brown,2/13/2019 11:08,,1,urn:uuid:f2ba1082-477e-4431-98bb-b0dadb987133,https://symbiota.ccber.ucsb.edu:443/collections/individual/index.php?occid=123032
123033,UCSB,IZC,,PreservedSpecimen,52ac8e28-5052-440e-86e7-ad73525389d7,UCSB-IZC00026971,,Animalia,Arthropoda,Insecta,Hymenoptera,Formicidae,Linepithema humile,5028,"(Mayr, 1868)",Linepithema,humile,,,Zach Brown,2018,,,,,,Darwin Chang,,,,5/27/2018,2018,5,27,147,,,,,,,,,,,,,,,Adult,,1,Sweep Net,,Pinned,USA,California,Santa Barbara,Santa Barbara,"University of California, Santa Barbara Lagoon",,,,34.4076,-119.845,,,,,,,,,,,,,,,,,zachary_brown,2/20/2019 18:56,,1,urn:uuid:52ac8e28-5052-440e-86e7-ad73525389d7,https://symbiota.ccber.ucsb.edu:443/collections/individual/index.php?occid=123033
123034,UCSB,IZC,,PreservedSpecimen,b7526ed3-bea8-49a0-a78f-ed6c42fae2e4,UCSB-IZC00026951,,Animalia,Arthropoda,Insecta,Hymenoptera,Formicidae,Linepithema humile,5028,"(Mayr, 1868)",Linepithema,humile,,,Elaine Tan,2018,,,,,,Christopher Perry,,,,6/21/2016,2016,6,21,173,,,,,,,,,,,,,,,Adult,,1,Mesh Net,,Pinned,USA,California,Santa Barbara,Santa Barbara,Refugio Canyon,,,,34.5077,-120.0645,WGS84,,,,,,,,3,,,,,,,,zachary_brown,2/13/2019 11:17,,1,urn:uuid:b7526ed3-bea8-49a0-a78f-ed6c42fae2e4,https://symbiota.ccber.ucsb.edu:443/collections/individual/index.php?occid=123034
123035,UCSB,IZC,,PreservedSpecimen,866b4b14-dd92-4c4d-88b2-25f46a3fe20d,UCSB-IZC00026849,,Animalia,Arthropoda,Insecta,Hymenoptera,Formicidae,Linepithema humile,5028,"(Mayr, 1868)",Linepithema,humile,,,Zach Brown,2018,,,,,,Vasili Vagenas,,,,4/29/2016,2016,4,29,120,,,,,,,,,,,,,,,Adult,,1,,,Pinned,USA,California,Santa Barbara,Isla Vista,Del Playa,,,,34.409715,-119.861424,WGS84,765,,,,GeoLocate,,Del Playa Drive,,,,,,,,,zachary_brown,2/22/2019 11:58,,1,urn:uuid:866b4b14-dd92-4c4d-88b2-25f46a3fe20d,https://symbiota.ccber.ucsb.edu:443/collections/individual/index.php?occid=123035
123036,UCSB,IZC,,PreservedSpecimen,416bdd3f-a76a-477b-8b9a-f4c728c992e1,UCSB-IZC00026837,,Animalia,Arthropoda,Insecta,Hymenoptera,Formicidae,Linepithema humile,5028,"(Mayr, 1868)",Linepithema,humile,,,Zach Brown,2018,,,,,,Kimberly Tang,,,,5/24/2018,2018,5,24,144,,,,,,,,,,,,,,,Adult,,1,Hand,,Pinned,USA,California,Santa Barbara,Isla Vista,Isla Vista,,,,34.4124,-119.855,WGS84,,,,,,,,,,,,,,,,zachary_brown,2/13/2019 11:20,,1,urn:uuid:416bdd3f-a76a-477b-8b9a-f4c728c992e1,https://symbiota.ccber.ucsb.edu:443/collections/individual/index.php?occid=123036
123037,UCSB,IZC,,PreservedSpecimen,d73ddf4d-f8f8-4233-a865-24b87b4ff44c,UCSB-IZC00026867,,Animalia,Arthropoda,Insecta,Hymenoptera,Formicidae,Linepithema humile,5028,"(Mayr, 1868)",Linepithema,humile,,,Zach Brown,2018,,,,,,K. Chau,,,,5/19/2017,2017,5,19,139,,,,,,,,,,,,,,,Adult,,1,,,Pinned,USA,California,Santa Barbara,Santa Barbara,"University of California, Santa Barbara Lagoon",,,,34.408393,-119.847426,WGS84,452,,,,GeoLocate,,,,,,,,,,,zachary_brown,2/22/2019 11:59,,1,urn:uuid:d73ddf4d-f8f8-4233-a865-24b87b4ff44c,https://symbiota.ccber.ucsb.edu:443/collections/individual/index.php?occid=123037
123038,UCSB,IZC,,PreservedSpecimen,a3ec9c15-502c-42f0-b655-abe160deb558,UCSB-IZC00026443,,Animalia,Arthropoda,Insecta,Hymenoptera,Formicidae,Linepithema humile,5028,"(Mayr, 1868)",Linepithema,humile,,,Elaine Tan,2018,,,,,,Daniella Chee,,,,5/20/2018,2018,5,20,140,,,,,,,,,,,,,,,Adult,,1,,,Pinned,USA,California,Santa Barbara,Goleta,"Santa Ynez Apartments, Field",,,,34.419452,-119.862137,WGS84,352,,,,GeoLocate,,,,,,,,,,,zachary_brown,2/22/2019 12:00,,1,urn:uuid:a3ec9c15-502c-42f0-b655-abe160deb558,https://symbiota.ccber.ucsb.edu:443/collections/individual/index.php?occid=123038
123039,UCSB,IZC,,PreservedSpecimen,0c3d59d0-b422-4a33-9dd5-24eedc70e66d,UCSB-IZC00026974,,Animalia,Arthropoda,Insecta,Hymenoptera,Formicidae,Linepithema humile,5028,"(Mayr, 1868)",Linepithema,humile,,,Zach Brown,2018,,,,,,Michael Drummond,,,,6/6/2018,2018,6,6,157,,,,,,,,,,,,,,,Adult,,1,Sweep Net,,Pinned,USA,California,Santa Barbara,Santa Barbara,"University of California, Santa Barbara",,,,34.4209,-119.8574,WGS84,,,,,,,,,,,,,,,,zachary_brown,2/20/2019 18:54,,1,urn:uuid:0c3d59d0-b422-4a33-9dd5-24eedc70e66d,https://symbiota.ccber.ucsb.edu:443/collections/individual/index.php?occid=123039
123040,UCSB,IZC,,PreservedSpecimen,110c6871-caf2-4a4a-adbb-0e60fad9ce70,UCSB-IZC00026848,,Animalia,Arthropoda,Insecta,Hymenoptera,Formicidae,Linepithema humile,5028,"(Mayr, 1868)",Linepithema,humile,,,Zach Brown,2018,,,,,,A. Richardson,,,,5/9/2018,2018,5,9,129,,,,,,,,,,,,,,,Adult,,1,,,Pinned,USA,California,Santa Barbara,Goleta,Goleta,,,,34.439794,-119.811503,WGS84,9263,,,,GeoLocate,,,,,,,,,,,zachary_brown,2/22/2019 12:01,,1,urn:uuid:110c6871-caf2-4a4a-adbb-0e60fad9ce70,https://symbiota.ccber.ucsb.edu:443/collections/individual/index.php?occid=123040
123044,UCSB,IZC,,PreservedSpecimen,233fb769-6408-4744-8be1-81d9724ab3e7,UCSB-IZC00026866,,Animalia,Arthropoda,Insecta,Hymenoptera,Formicidae,Liometopum occidentale,5024,"Emery, 1895",Liometopum,occidentale,,,Elaine Tan,2018,,,,,,Uma Rajpurkar,,,,5/27/2018,2018,5,27,147,,,,,,,,,,,,,,,Adult,,1,Hand,,Pinned,USA,California,Santa Barbara,Goleta,Inspiration Point,,,,34.4676,-119.7696,WGS84,,,,,,,,,,,,,,,,aurora2,2/13/2019 12:40,,1,urn:uuid:233fb769-6408-4744-8be1-81d9724ab3e7,https://symbiota.ccber.ucsb.edu:443/collections/individual/index.php?occid=123044
123045,UCSB,IZC,,PreservedSpecimen,4a30cda4-350b-438d-bf5b-f3ebffba6ee8,UCSB-IZC00026964,,Animalia,Arthropoda,Insecta,Hymenoptera,Formicidae,Liometopum occidentale,5024,"Emery, 1895",Liometopum,occidentale,,,Elaine Tan,2018,,,,,,May Li,,,,5/27/2016,2016,5,27,148,,,,,,,,,,,,,,,Adult,,1,,,Pinned,USA,California,Santa Barbara,,Botanic Garden,,,,34.458151,-119.710298,WGS84,813,,,,GeoLocate,,Santa Barbara Botanic Garden,,,,,,,,,aurora2,2/22/2019 12:03,,1,urn:uuid:4a30cda4-350b-438d-bf5b-f3ebffba6ee8,https://symbiota.ccber.ucsb.edu:443/collections/individual/index.php?occid=123045
123046,UCSB,IZC,,PreservedSpecimen,6a64566d-aa8d-486a-b321-917bb244c892,UCSB-IZC00026261,,Animalia,Arthropoda,Insecta,Hymenoptera,Formicidae,Liometopum occidentale,5024,"Emery, 1895",Liometopum,occidentale,,,Elaine Tan,2018,,,,,,B. Affeld,,,,5/22/2016,2016,5,22,143,,,,,,,,,,,,,,,Adult,,1,,,Pinned,USA,California,Santa Barbara,,Cold Spring Canyon,,,,34.52805,-119.829585,WGS84,1506,,,,GeoLocate,,,,,,,,,,,zachary_brown,2/22/2019 12:05,,1,urn:uuid:6a64566d-aa8d-486a-b321-917bb244c892,https://symbiota.ccber.ucsb.edu:443/collections/individual/index.php?occid=123046
123048,UCSB,IZC,,PreservedSpecimen,7ce3c938-6a45-4213-818a-19666ccdd049,UCSB-IZC00026858,,Animalia,Arthropoda,Insecta,Hymenoptera,Formicidae,Liometopum occidentale,5024,"Emery, 1895",Liometopum,occidentale,,,Elaine Tan,2018,,,,,,L. Leahy,,,,5/30/2011,2011,5,30,150,,,,,,,,,,,,,,,Adult,,1,,,Pinned,USA,California,Santa Barbara,,Mission Creek,,,,34.421018,-119.712664,WGS84,2797,,,,GeoLocate,,Entire Mission Creek,,,,,,,,,aurora2,2/22/2019 12:09,,1,urn:uuid:7ce3c938-6a45-4213-818a-19666ccdd049,https://symbiota.ccber.ucsb.edu:443/collections/individual/index.php?occid=123048
123049,UCSB,IZC,,PreservedSpecimen,87b621d3-78c4-4f62-91f9-22da64547608,UCSB-IZC00026251,,Animalia,Arthropoda,Insecta,Hymenoptera,Formicidae,Liometopum occidentale,5024,"Emery, 1895",Liometopum,occidentale,,,Elaine Tan,2018,,,,,,D. Vidor,,,,5/27/1999,1999,5,27,147,,,,,,,,,,,,,,,Adult,,1,,,Pinned,USA,California,Santa Barbara,,Seven Falls,,,,34.474766,-119.705127,WGS84,164,,,,GeoLocate,,,,,,,,,,,aurora2,2/22/2019 12:10,,1,urn:uuid:87b621d3-78c4-4f62-91f9-22da64547608,https://symbiota.ccber.ucsb.edu:443/collections/individual/index.php?occid=123049
123050,UCSB,IZC,,PreservedSpecimen,28f0ce0d-419b-4677-8c70-c63d4dfd569e,UCSB-IZC00026409,,Animalia,Arthropoda,Insecta,Hymenoptera,Formicidae,Liometopum occidentale,5024,"Emery, 1895",Liometopum,occidentale,,,Elaine Tan,2018,,,,,,D. Phan,,,,5/11/2016,2016,5,11,132,,,,,,,,,,,,,,,Adult,,1,,,Pinned,USA,California,Santa Barbara,Goleta,Lake Los Cameros,,,,34.441716,-119.847906,WGS84,573,,,,GeoLocate,,Los Carneros Park,,,,,,,,,aurora2,2/22/2019 12:13,,1,urn:uuid:28f0ce0d-419b-4677-8c70-c63d4dfd569e,https://symbiota.ccber.ucsb.edu:443/collections/individual/index.php?occid=123050
123051,UCSB,IZC,,PreservedSpecimen,432f4d05-8272-4dc1-a54c-ef1591bd85d0,UCSB-IZC00026835,,Animalia,Arthropoda,Insecta,Hymenoptera,Formicidae,Liometopum occidentale,5024,"Emery, 1895",Liometopum,occidentale,,,Elaine Tan,2018,,,,,,Kimberly Tang,,,,5/9/2018,2018,5,9,129,,,,,,,,,,,,,,,Adult,,1,Hand,,Pinned,USA,California,Santa Barbara,,Refugio Canyon,,,,34.494269,-120.065422,WGS84,3730,,,,GeoLocate,,Refugio Canyon Rd and surrounding areas,,,,,,,,,aurora2,2/22/2019 12:38,,1,urn:uuid:432f4d05-8272-4dc1-a54c-ef1591bd85d0,https://symbiota.ccber.ucsb.edu:443/collections/individual/index.php?occid=123051
123053,UCSB,IZC,,PreservedSpecimen,5fff88f1-e70d-48d1-a71b-5bd6299be165,UCSB-IZC00026269,,Animalia,Arthropoda,Insecta,Hymenoptera,Formicidae,Liometopum occidentale,5024,"Emery, 1895",Liometopum,occidentale,,,Elaine Tan,2018,,,,,,Karina Krebs,,,,6/1/2018,2018,6,1,152,,,,,,,,,,,,,,,Adult,,1,Pitfall,,Pinned,USA,California,Santa Barbara,Isla Vista,Isla Vista,,,,34.413329,-119.860972,WGS84,2476,,,,GeoLocate,,,,,,,,,,,zachary_brown,2/22/2019 12:38,,1,urn:uuid:5fff88f1-e70d-48d1-a71b-5bd6299be165,https://symbiota.ccber.ucsb.edu:443/collections/individual/index.php?occid=123053
123054,UCSB,IZC,,PreservedSpecimen,6769bea8-4310-4fbf-8818-9b716451448e,UCSB-IZC00026266,,Animalia,Arthropoda,Insecta,Hymenoptera,Formicidae,Tapinoma sessile,5533,"(Say, 1836)",Tapinoma,sessile,,,J. Longino,1986,,,,,,J. Longino,,,84-45,8/24/1984,1984,8,24,237,,24-27 August 1984,,,,,,,,,,,,,Adult,,2,,,Pinned,USA,California,Santa Barbara,,St. Cruz Island,,,,34.016667,-119.716667,WGS84,20644,,,,GeoLocate,,,0,200,,,,0-200m,,,aurora2,2/22/2019 12:39,,1,urn:uuid:6769bea8-4310-4fbf-8818-9b716451448e,https://symbiota.ccber.ucsb.edu:443/collections/individual/index.php?occid=123054
123055,UCSB,IZC,,PreservedSpecimen,8d142990-84cc-4e9f-a325-2d6a6cbea1ce,UCSB-IZC00026981,,Animalia,Arthropoda,Insecta,Hymenoptera,Formicidae,Liometopum occidentale,5024,"Emery, 1895",Liometopum,occidentale,,,Elaine Tan,2018,,,,,,Francis Wang,,,,5/9/2018,2018,5,9,129,,,,,,,,,,,,,,,Adult,,1,Hand,,Pinned,USA,California,Santa Barbara,Goleta,Mountain Chaparral uphill of Refugio Creek,,,,34.533232,-120.062138,WGS84,2462,,,,GeoLocate,,Refugio Pass including surrounding mountains,,,,,,,,,zachary_brown,2/22/2019 12:46,,1,urn:uuid:8d142990-84cc-4e9f-a325-2d6a6cbea1ce,https://symbiota.ccber.ucsb.edu:443/collections/individual/index.php?occid=123055
123056,UCSB,IZC,,PreservedSpecimen,3b43edb5-3c5c-4c40-a00d-0cd00ba9252b,UCSB-IZC00026990,,Animalia,Arthropoda,Insecta,Hymenoptera,Formicidae,Liometopum occidentale,5024,"Emery, 1895",Liometopum,occidentale,,,Elaine Tan,2018,,,,,,Stephania Pantoja,,,,5/9/2018,2018,5,9,129,,,,,,,,,,,,,,,Adult,,1,Hand,,Pinned,USA,California,Santa Barbara,Santa Barbara,Refugio Canyon,,,,34.520156,-120.057526,WGS84,14542,,,,GeoLocate,,Refugio Pass including surrounding mountains,,,,,,,,,zachary_brown,2/22/2019 12:46,,1,urn:uuid:3b43edb5-3c5c-4c40-a00d-0cd00ba9252b,https://symbiota.ccber.ucsb.edu:443/collections/individual/index.php?occid=123056
123057,UCSB,IZC,,PreservedSpecimen,1003e8fd-c9aa-41c5-8b32-727dab4e4598,UCSB-IZC00026972,,Animalia,Arthropoda,Insecta,Hymenoptera,Formicidae,Tapinoma,1765,"Förster, 1850",Tapinoma,,,,Elaine Tan,2018,,,,,,Loren Murray,,,,6/1/2016,2016,6,1,153,,,,,,,,,,,,,,,Adult,,1,Hand,,Pinned,USA,California,Santa Barbara,Isla Vista,,,,,34.4129,-119.8654,WGS84,,,,,,,,,,,,,,,,aurora2,2/13/2019 13:51,,1,urn:uuid:1003e8fd-c9aa-41c5-8b32-727dab4e4598,https://symbiota.ccber.ucsb.edu:443/collections/individual/index.php?occid=123057
123058,UCSB,IZC,,PreservedSpecimen,82cdfbba-5a18-4547-98cd-78dbc5276a6c,UCSB-IZC00026941,,Animalia,Arthropoda,Insecta,Hymenoptera,Formicidae,Liometopum occidentale,5024,"Emery, 1895",Liometopum,occidentale,,,Elaine Tan,2018,,,,,,Zahra Arsalan,,,,6/3/2018,2018,6,3,154,,,,,,,,,,,,,,,Adult,,1,Hand,,Pinned,USA,California,Santa Barbara,Santa Barbara,Knapps Castle,,,,34.5231,-119.7933,WGS84,,,,,,,,,,,,,,,,zachary_brown,2/13/2019 13:52,,1,urn:uuid:82cdfbba-5a18-4547-98cd-78dbc5276a6c,https://symbiota.ccber.ucsb.edu:443/collections/individual/index.php?occid=123058
123059,UCSB,IZC,,PreservedSpecimen,299f5701-e517-4327-aadb-3db8eabd2b52,UCSB-IZC00026844,,Animalia,Arthropoda,Insecta,Hymenoptera,Formicidae,Tapinoma,1765,"Förster, 1850",Tapinoma,,,,Elaine Tan,2018,,,,,,EEMB 118 Entomology Class,,,,6/27/2018,2018,6,27,178,,,,Restored coastal sage scrub,,,,,,,,,,,Adult,,1,Yellow Pan Trap,,Pinned,USA,California,Santa Barbara,,University of California Santa Barbara Lagoon Island,,,,34.4079,-119.8481,WGS84,,,,,,,,,,,,,,,,aurora2,2/13/2019 13:56,,1,urn:uuid:299f5701-e517-4327-aadb-3db8eabd2b52,https://symbiota.ccber.ucsb.edu:443/collections/individual/index.php?occid=123059
123060,UCSB,IZC,,PreservedSpecimen,5abd9ceb-2f24-457e-b013-fb85871c6bab,UCSB-IZC00026946,,Animalia,Arthropoda,Insecta,Hymenoptera,Formicidae,Tapinoma,1765,"Förster, 1850",Tapinoma,,,,Zach Brown,2018,,,,,,EEMB 118 Entomology Class,,,,6/27/2018,2018,6,27,178,,,,Restored coastal sage scrub,,,,,,,,,,,Adult,,1,Yellow Pan Trap,,Pinned,USA,California,Santa Barbara,,University of California Santa Barbara Lagoon Island,,,,34.4079,-119.8481,WGS84,,,,,,,,,,,,,,,,aurora2,2/13/2019 14:00,,1,urn:uuid:5abd9ceb-2f24-457e-b013-fb85871c6bab,https://symbiota.ccber.ucsb.edu:443/collections/individual/index.php?occid=123060
123061,UCSB,IZC,,PreservedSpecimen,ab25a105-eab0-4cb9-afd1-98cd103ce7e9,UCSB-IZC00026871,,Animalia,Arthropoda,Insecta,Hymenoptera,Formicidae,Tapinoma,1765,"Förster, 1850",Tapinoma,,,,Zach Brown,2018,,,,,,EEMB 118 Entomology Class,,,,6/26/2018,2018,6,26,177,,"Jun. 26-Jul. 2, 2018",,Restored coastal sage scrub,,,,,,,,,,,Adult,,1,Malaise Trap,,Pinned,USA,California,Santa Barbara,,University of California Santa Barbara Lagoon Island,,,,34.411,-119.8481,WGS84,,,,,,,,,,,,,,,,aurora2,2/13/2019 14:04,,1,urn:uuid:ab25a105-eab0-4cb9-afd1-98cd103ce7e9,https://symbiota.ccber.ucsb.edu:443/collections/individual/index.php?occid=123061
123062,UCSB,IZC,,PreservedSpecimen,1a208d47-c04e-4793-8051-b140e180462a,UCSB-IZC00026970,,Animalia,Arthropoda,Insecta,Hymenoptera,Formicidae,Formica francoeuri,5534,"Bolton, 1995",Formica,francoeuri,,,Elaine Tan,2018,,,,,,,,,,5/20/1974,1974,5,20,140,,,,near river,,,,,,,,,,,Adult,,1,,,Pinned,USA,California,Santa Barbara,,"Santa Ynez Campground, near river",,,,34.510906,-119.579516,WGS84,2002,,,,GeoLocate,,Middle Santa Ynez Campground,,,,,,,,,zachary_brown,2/22/2019 12:52,,1,urn:uuid:1a208d47-c04e-4793-8051-b140e180462a,https://symbiota.ccber.ucsb.edu:443/collections/individual/index.php?occid=123062
123063,UCSB,IZC,,PreservedSpecimen,c9dbed90-e1de-4a33-993d-ce8e28b221b8,UCSB-IZC00026987,,Animalia,Arthropoda,Insecta,Hymenoptera,Formicidae,Formica francoeuri,5534,"Bolton, 1995",Formica,francoeuri,,,Elaine Tan,2018,,,,,,,,,,5/20/1974,1974,5,20,140,,,,near river,,,,,,,,,,,Adult,,1,,,Pinned,USA,California,Santa Barbara,,"Santa Ynez Campground, near river",,,,34.510906,-119.579516,WGS84,2002,,,,GeoLocate,,Middle Santa Ynez Campground,,,,,,,,,zachary_brown,2/22/2019 12:52,,1,urn:uuid:c9dbed90-e1de-4a33-993d-ce8e28b221b8,https://symbiota.ccber.ucsb.edu:443/collections/individual/index.php?occid=123063
123064,UCSB,IZC,,PreservedSpecimen,3026a87d-eeb2-440e-ba40-e379ad3f7fff,UCSB-IZC00026868,,Animalia,Arthropoda,Insecta,Hymenoptera,Formicidae,Formica francoeuri,5534,"Bolton, 1995",Formica,francoeuri,,,Elaine Tan,2018,,,,,,,,,,5/20/1974,1974,5,20,140,,,,near river,,,,,,,,,,,Adult,,1,,,Pinned,USA,California,Santa Barbara,,"Santa Ynez Campground, near river",,,,34.510906,-119.579516,WGS84,2002,,,,GeoLocate,,,,,,,,,,,zachary_brown,2/22/2019 12:53,,1,urn:uuid:3026a87d-eeb2-440e-ba40-e379ad3f7fff,https://symbiota.ccber.ucsb.edu:443/collections/individual/index.php?occid=123064
123065,UCSB,IZC,,PreservedSpecimen,38098b1f-3d52-4682-8a50-4750c582149e,UCSB-IZC00026267,,Animalia,Arthropoda,Insecta,Hymenoptera,Formicidae,Formica moki,5535,"Wheeler, W.M., 1906",Formica,moki,,,Zach Brown,2018,,,,,,J. Longino,,,23-5,10/26/1984,1984,10,26,300,,26-29 Oct. 1984,,,,,,,,,,,,,Adult,,1,,,Pinned,USA,California,Santa Barbara,,Santa Cruz Island,,0,,34.016667,-119.716667,WGS84,20644,,,,GeoLocate,,,,,,,,,,,aurora2,2/22/2019 12:53,,1,urn:uuid:38098b1f-3d52-4682-8a50-4750c582149e,https://symbiota.ccber.ucsb.edu:443/collections/individual/index.php?occid=123065
123066,UCSB,IZC,,PreservedSpecimen,1d9e7148-8bcc-41c0-b224-e815397a40da,UCSB-IZC00026956,,Animalia,Arthropoda,Insecta,Hymenoptera,Formicidae,Formica francoeuri,5534,"Bolton, 1995",Formica,francoeuri,,,Elaine Tan,2018,,,,,,,,,,5/20/1974,1974,5,20,140,,,,near river,,,,,,,,,,,Adult,,1,,,Pinned,USA,California,Santa Barbara,,"Santa Ynez Campground, near river",,,,34.510906,-119.579516,WGS84,2002,,,,GeoLocate,,,,,,,,,,,zachary_brown,2/22/2019 12:53,,1,urn:uuid:1d9e7148-8bcc-41c0-b224-e815397a40da,https://symbiota.ccber.ucsb.edu:443/collections/individual/index.php?occid=123066
123067,UCSB,IZC,,PreservedSpecimen,0a2d1da5-31aa-402a-b3b0-2f19a135cb7a,UCSB-IZC00026995,,Animalia,Arthropoda,Insecta,Hymenoptera,Formicidae,Formica francoeuri,5534,"Bolton, 1995",Formica,francoeuri,,,Elaine Tan,2018,,,,,,,,,,5/20/1974,1974,5,20,140,,,,near river,,,,,,,,,,,Adult,,1,,,Pinned,USA,California,Santa Barbara,,"Santa Ynez Campground, near river",,,,34.510906,-119.579516,WGS84,2002,,,,GeoLocate,,,,,,,,,,,zachary_brown,2/22/2019 12:54,,1,urn:uuid:0a2d1da5-31aa-402a-b3b0-2f19a135cb7a,https://symbiota.ccber.ucsb.edu:443/collections/individual/index.php?occid=123067
123068,UCSB,IZC,,PreservedSpecimen,951c36e2-f8a4-4c60-a67d-6bd57f741e53,UCSB-IZC00026975,,Animalia,Arthropoda,Insecta,Hymenoptera,Formicidae,Formica moki,5535,"Wheeler, W.M., 1906",Formica,moki,,,Zach Brown,2018,,,,,,,,,,,,,,,,,,,,,,,,,,,,,Adult,,1,,,Pinned,USA,California,Santa Barbara,Goddard Campground,Camino Cielo Rd.,,,,34.503368,-119.842598,WGS84,23390,,,,GeoLocate,,East and West Camino Cielo Road,,,,,,,,,aurora2,2/22/2019 12:58,,1,urn:uuid:951c36e2-f8a4-4c60-a67d-6bd57f741e53,https://symbiota.ccber.ucsb.edu:443/collections/individual/index.php?occid=123068
123069,UCSB,IZC,,PreservedSpecimen,8ae548f0-b4ed-456a-be9b-a4dd1fa5ef87,UCSB-IZC00026963,,Animalia,Arthropoda,Insecta,Hymenoptera,Formicidae,Formica moki,5535,"Wheeler, W.M., 1906",Formica,moki,,,Zach Brown,2018,,,,,,,,,,5/10/1974,1974,5,10,130,,,,,,,,,,,,,,,Adult,,1,,,Pinned,USA,California,Santa Barbara,Goddard Campground,Camino Cielo Rd.,,,,34.503368,-119.842598,WGS84,23390,,,,GeoLocate,,East and West Camino Cielo Road,,,,,,,,,aurora2,2/22/2019 12:59,,1,urn:uuid:8ae548f0-b4ed-456a-be9b-a4dd1fa5ef87,https://symbiota.ccber.ucsb.edu:443/collections/individual/index.php?occid=123069
123071,UCSB,IZC,,PreservedSpecimen,7ba4dbe5-0efc-4d03-8c50-a087204559d8,UCSB-IZC00026257,,Animalia,Arthropoda,Insecta,Hymenoptera,Formicidae,Formica moki,5535,"Wheeler, W.M., 1906",Formica,moki,,,Zach Brown,2018,,,,,,,,,,5/5/1974,1974,5,5,125,,,slaves of Polyergus,,,,,,,,,,,,Adult,,1,,,Pinned,USA,California,Santa Barbara,Santa Barbara,East of UC Research Station,,,,34.016667,-119.716667,WGS84,20644,,,,GeoLocate,,,400,,,,,400m,,,aurora2,2/22/2019 12:59,,1,urn:uuid:7ba4dbe5-0efc-4d03-8c50-a087204559d8,https://symbiota.ccber.ucsb.edu:443/collections/individual/index.php?occid=123071
123072,UCSB,IZC,,PreservedSpecimen,b12c1938-dbb5-49cf-ba0b-0bec36d522f9,UCSB-IZC00026996,,Animalia,Arthropoda,Insecta,Hymenoptera,Formicidae,Formica moki,5535,"Wheeler, W.M., 1906",Formica,moki,,,Zach Brown,2018,,,,,,,,,,5/10/1974,1974,5,10,130,,,,,,,,,,,,,,,Adult,,1,,,Pinned,USA,California,Santa Barbara,Goddard Campground,Camino Cielo Rd.,,,,34.503368,-119.842598,WGS84,23390,,,,GeoLocate,,East and West Camino Cielo Road,,,,,,,,,aurora2,2/22/2019 13:00,,1,urn:uuid:b12c1938-dbb5-49cf-ba0b-0bec36d522f9,https://symbiota.ccber.ucsb.edu:443/collections/individual/index.php?occid=123072
123073,UCSB,IZC,,PreservedSpecimen,1e88d69a-48df-4314-b07c-7dbcc42f0c32,UCSB-IZC00026249,,Animalia,Arthropoda,Insecta,Hymenoptera,Formicidae,Formica moki,5535,"Wheeler, W.M., 1906",Formica,moki,,,Zach Brown,2018,,,,,,,,,,5/10/1974,1974,5,10,130,,,,,,,,,,,,,,,Adult,,1,,,Pinned,USA,California,Santa Barbara,Goddard Campground,Camino Cielo Rd.,,,,34.503368,-119.842598,WGS84,23390,,,,GeoLocate,,East and West Camino Cielo Road,,,,,,,,,aurora2,2/22/2019 13:00,,1,urn:uuid:1e88d69a-48df-4314-b07c-7dbcc42f0c32,https://symbiota.ccber.ucsb.edu:443/collections/individual/index.php?occid=123073
123074,UCSB,IZC,,PreservedSpecimen,25b8588f-be69-4349-a1d1-b964b1261558,UCSB-IZC00026272,,Animalia,Arthropoda,Insecta,Hymenoptera,Formicidae,Formica moki,5535,"Wheeler, W.M., 1906",Formica,moki,,,Zach Brown,2018,,,,,,,,,,5/26/1974,1974,5,26,146,,,,,,,,,,,,,,,Adult,,1,,,Pinned,USA,California,Santa Barbara,,San Antonio Canyon,,,,34.459715,-119.777931,WGS84,1061,,,,GeoLocate,,San Antonio Canyon Park,,,,,,,,,aurora2,2/22/2019 13:03,,1,urn:uuid:25b8588f-be69-4349-a1d1-b964b1261558,https://symbiota.ccber.ucsb.edu:443/collections/individual/index.php?occid=123074
123076,UCSB,IZC,,PreservedSpecimen,6d40da2b-2a13-44df-bbe3-71867b64dfda,UCSB-IZC00026947,,Animalia,Arthropoda,Insecta,Hymenoptera,Formicidae,Formica moki,5535,"Wheeler, W.M., 1906",Formica,moki,,,Zach Brown,2018,,,,,,,,,,5/5/1974,1974,5,5,125,,,slaves of Polyergus,,,,,,,,,,,,Adult,,1,,,Pinned,USA,California,Santa Barbara,,Santa Cruz Island,,,,34.016667,-119.716667,WGS84,20644,,,,GeoLocate,,,,,,,,,,,aurora2,2/22/2019 13:03,,1,urn:uuid:6d40da2b-2a13-44df-bbe3-71867b64dfda,https://symbiota.ccber.ucsb.edu:443/collections/individual/index.php?occid=123076
123077,UCSB,IZC,,PreservedSpecimen,2a2dbfc2-93f2-4186-a5a3-d966994ed890,UCSB-IZC00002752,,Animalia,Arthropoda,Insecta,Hymenoptera,Formicidae,Formica moki,5535,"Wheeler, W.M., 1906",Formica,moki,,,Zach Brown,2018,,,,,,,,,,5/5/1974,1974,5,5,125,,,Slaves of Polyergus,,,,,,,,,,,,Adult,,1,,,Pinned,USA,California,Santa Barbara,,Santa Cruz Island,,,,34.016667,-119.716667,WGS84,20644,,,,GeoLocate,,,400,400,,,,400m,,,aurora2,2/22/2019 13:04,,1,urn:uuid:2a2dbfc2-93f2-4186-a5a3-d966994ed890,https://symbiota.ccber.ucsb.edu:443/collections/individual/index.php?occid=123077
123078,UCSB,IZC,,PreservedSpecimen,9ccdb71d-9f18-4208-a32c-aeef304db7bd,UCSB-IZC00026843,,Animalia,Arthropoda,Insecta,Hymenoptera,Formicidae,Formica,2582,"Linnaeus, 1758",Formica,,,,Zach Brown,2018,,,,,,,,,,5/5/1974,1974,5,5,125,,,Enslaved by Polyergus,,,,,,,,,,,,Adult,,1,,,Pinned,USA,California,Santa Barbara,Santa Cruz Island,East of UC Research Station,,,,34.016667,-119.716667,WGS84,20644,,,,GeoLocate,,,,,,,,,,,aurora2,2/22/2019 13:05,,1,urn:uuid:9ccdb71d-9f18-4208-a32c-aeef304db7bd,https://symbiota.ccber.ucsb.edu:443/collections/individual/index.php?occid=123078
123079,UCSB,IZC,,PreservedSpecimen,6240b4db-a092-4431-9cc2-32dd5d8e7cb1,UCSB-IZC00026852,,Animalia,Arthropoda,Insecta,Hymenoptera,Formicidae,Formica,2582,"Linnaeus, 1758",Formica,,,,Zach Brown,2018,,,,,,,,,,5/5/1974,1974,5,5,125,,,Slaves to Polyergus,,,,,,,,,,,,Adult,,1,,,Pinned,USA,California,Santa Barbara,Santa Cruz Island,East of UC Research Station,,,,34.016667,-119.716667,WGS84,20644,,,,GeoLocate,,,400,400,,,,400m,,,aurora2,2/22/2019 13:05,,1,urn:uuid:6240b4db-a092-4431-9cc2-32dd5d8e7cb1,https://symbiota.ccber.ucsb.edu:443/collections/individual/index.php?occid=123079
123080,UCSB,IZC,,PreservedSpecimen,3d0fadc9-a320-4080-8db1-88d11533c031,UCSB-IZC00026277,,Animalia,Arthropoda,Insecta,Hymenoptera,Formicidae,Formica subpolita,5538,"Mayr, 1886",Formica,subpolita,,,Elaine Tan,2018,,,,,,,,,,5/1/1974,1974,5,1,121,,,,,,,,,,,,,,,Adult,,1,,,Pinned,USA,California,Santa Barbara,Santa Ynez,Santa Ynez Valley; Santa Ynez Campground,,,,34.511038,-119.57949,WGS84,1361,,,,GeoLocate,,Middle Santa Ynez Campground,,,,,,,,,zachary_brown,2/22/2019 13:11,,1,urn:uuid:3d0fadc9-a320-4080-8db1-88d11533c031,https://symbiota.ccber.ucsb.edu:443/collections/individual/index.php?occid=123080
123081,UCSB,IZC,,PreservedSpecimen,ec54222a-b92a-4e7d-9f7c-2a4ac8479a2e,UCSB-IZC00026831,,Animalia,Arthropoda,Insecta,Hymenoptera,Formicidae,Formica subpolita,5538,"Mayr, 1886",Formica,subpolita,,,Elaine Tan,2018,,,,,,,,,,5/1/1974,1974,5,1,121,,,,,,,,,,,,,,,Adult,,1,,,Pinned,USA,California,Santa Barbara,Santa Ynez,Santa Ynez Valley; Santa Ynez Campground,,,,34.511038,-119.57949,WGS84,1361,,,,GeoLocate,,Middle Santa Ynez Campground,,,,,,,,,zachary_brown,2/22/2019 13:12,,1,urn:uuid:ec54222a-b92a-4e7d-9f7c-2a4ac8479a2e,https://symbiota.ccber.ucsb.edu:443/collections/individual/index.php?occid=123081
123082,UCSB,IZC,,PreservedSpecimen,d52a1274-94fe-4b1b-baf4-6955de86d29b,UCSB-IZC00026979,,Animalia,Arthropoda,Insecta,Hymenoptera,Formicidae,Formica subpolita,5538,"Mayr, 1886",Formica,subpolita,,,Elaine Tan,2018,,,,,,,,,,5/1/1974,1974,5,1,121,,,,,,,,,,,,,,,Adult,,1,,,Pinned,USA,California,Santa Barbara,Santa Ynez,Santa Ynez Valley; Santa Ynez Campground,,,,34.511038,-119.57949,WGS84,1361,,,,GeoLocate,,Middle Santa Ynez Campground,,,,,,,,,zachary_brown,2/22/2019 13:12,,1,urn:uuid:d52a1274-94fe-4b1b-baf4-6955de86d29b,https://symbiota.ccber.ucsb.edu:443/collections/individual/index.php?occid=123082
123084,UCSB,IZC,,PreservedSpecimen,da8d4cb3-e15b-4649-ac28-cf368263a2dd,UCSB-IZC00026876,,Animalia,Arthropoda,Insecta,Hymenoptera,Formicidae,Formica,2582,"Linnaeus, 1758",Formica,,,,Zach Brown,2018,,,,,,Sally Li,,,,5/10/2017,2017,5,10,130,,,,,,,,,,,,,,,Adult,,1,,,Pinned,USA,California,Santa Barbara,Santa Barbara,Refugio Canyon,,,,34.5336,-120.062089,WGS84,8094,,,,GeoLocate,,"Refugio Canyon, Creek, and surrounding areas",,,,,,,,,zachary_brown,2/22/2019 13:14,,1,urn:uuid:da8d4cb3-e15b-4649-ac28-cf368263a2dd,https://symbiota.ccber.ucsb.edu:443/collections/individual/index.php?occid=123084
123085,UCSB,IZC,,PreservedSpecimen,ee126d5b-d12e-4ba5-afd0-feaeb971ba67,UCSB-IZC00026977,,Animalia,Arthropoda,Insecta,Hymenoptera,Formicidae,Formica,2582,"Linnaeus, 1758",Formica,,,,Zach Brown,2018,,,,,,Matthew Jones,,,,5/11/2017,2017,5,11,131,,,,,,,,,,,,,,,Adult,,1,,,Pinned,USA,California,Santa Barbara,Santa Barbara,Refugio Canyon,,,,34.520156,-120.057526,WGS84,14542,,,,GeoLocate,,,,,,,,,,,zachary_brown,2/21/2019 18:02,,1,urn:uuid:ee126d5b-d12e-4ba5-afd0-feaeb971ba67,https://symbiota.ccber.ucsb.edu:443/collections/individual/index.php?occid=123085
123086,UCSB,IZC,,PreservedSpecimen,d271ea24-6a71-4140-b52c-2351344df51f,UCSB-IZC00002740,,Animalia,Arthropoda,Insecta,Hymenoptera,Formicidae,Formica,2582,"Linnaeus, 1758",Formica,,,,Elaine Tan,2018,,,,,,Luke Mourton,,Cade Mourton,,4/14/2018,2018,4,14,104,,,,,,,,,,,,,,,Adult,,1,Hand,,Pinned,USA,California,Santa Barbara,,Camp Whittier,,,,34.567469,-119.954817,WGS84,462,,,,GeoLocate,,,,,,,,,,,zachary_brown,2/21/2019 18:02,,1,urn:uuid:d271ea24-6a71-4140-b52c-2351344df51f,https://symbiota.ccber.ucsb.edu:443/collections/individual/index.php?occid=123086
123087,UCSB,IZC,,PreservedSpecimen,915c4744-ce3d-4ebd-a5a4-68bab8e26815,UCSB-IZC00026856,,Animalia,Arthropoda,Insecta,Hymenoptera,Formicidae,Formica,2582,"Linnaeus, 1758",Formica,,,,Elaine Tan,2018,,,,,,May Li,,,,5/16/2016,2016,5,16,137,,,,,,,,,,,,,,,Adult,,1,,,Pinned,USA,California,Santa Barbara,,Elk Wood,,0,,34.754123,-120.004093,WGS84,66805,,,,GeoLocate,,All of Santa Barbara County,,,,,,,,,zachary_brown,2/21/2019 18:00,,1,urn:uuid:915c4744-ce3d-4ebd-a5a4-68bab8e26815,https://symbiota.ccber.ucsb.edu:443/collections/individual/index.php?occid=123087
123088,UCSB,IZC,,PreservedSpecimen,a6eb7672-f0bd-43fd-9f2a-46cbe84b3e57,UCSB-IZC00026274,,Animalia,Arthropoda,Insecta,Hymenoptera,Formicidae,Formica,2582,"Linnaeus, 1758",Formica,,,,Elaine Tan,2018,,,,,,,,,19,3/27/1991,1991,3,27,86,,,,,,,,,,,Brassica sp,,,,Adult,,1,,,Pinned,USA,California,Santa Barbara,,Santa Cruz Island,,,,34.016667,-119.716667,WGS84,20644,,,,GeoLocate,,All of Santa Cruz Island,,,,,,,,,zachary_brown,2/21/2019 17:57,,1,urn:uuid:a6eb7672-f0bd-43fd-9f2a-46cbe84b3e57,https://symbiota.ccber.ucsb.edu:443/collections/individual/index.php?occid=123088
123089,UCSB,IZC,,PreservedSpecimen,9ec4efb9-c6b4-47ae-a0b5-7a1c8325336a,UCSB-IZC00026872,,Animalia,Arthropoda,Insecta,Hymenoptera,Formicidae,Formica,2582,"Linnaeus, 1758",Formica,,,,Elaine Tan,2018,,,,,,,,,20,3/27/1991,1991,3,27,86,,,,,,,,,,,,,,,Adult,,1,,,Pinned,USA,California,Santa Barbara,,Santa Cruz Island,,,,34.016667,-119.716667,WGS84,20644,,,,GeoLocate,,All of Santa Cruz Island,,,,,,,,,zachary_brown,2/21/2019 17:57,,1,urn:uuid:9ec4efb9-c6b4-47ae-a0b5-7a1c8325336a,https://symbiota.ccber.ucsb.edu:443/collections/individual/index.php?occid=123089
123090,UCSB,IZC,,PreservedSpecimen,59c9927e-a1a2-4aa4-9f90-60a8f0ca506f,UCSB-IZC00002680,,Animalia,Arthropoda,Insecta,Hymenoptera,Formicidae,Formica,2582,"Linnaeus, 1758",Formica,,,,Elaine Tan,2018,,,,,,,,,21,3/27/1991,1991,3,27,86,,,,,,,,,,,,,,,Adult,,1,,,Pinned,USA,California,Santa Barbara,,Santa Cruz Island,,0,,34.016667,-119.716667,WGS84,20644,,,,GeoLocate,,All of Santa Cruz Island,,,,,,,,,zachary_brown,2/21/2019 17:57,,1,urn:uuid:59c9927e-a1a2-4aa4-9f90-60a8f0ca506f,https://symbiota.ccber.ucsb.edu:443/collections/individual/index.php?occid=123090
123091,UCSB,IZC,,PreservedSpecimen,1acfd4e5-078e-40c5-90b4-20e179636332,UCSB-IZC00026825,,Animalia,Arthropoda,Insecta,Hymenoptera,Formicidae,Formica,2582,"Linnaeus, 1758",Formica,,,,Elaine Tan,2018,,,,,,,,,23,3/27/1991,1991,3,27,86,,,,,,,,,,,Brassica sp,,,,Adult,,1,,,Pinned,USA,California,Santa Barbara,,Santa Cruz Island,,0,,34.016667,-119.716667,WGS84,20644,,,,GeoLocate,,All of Santa Cruz Island,,,,,,,,,zachary_brown,2/21/2019 17:56,,1,urn:uuid:1acfd4e5-078e-40c5-90b4-20e179636332,https://symbiota.ccber.ucsb.edu:443/collections/individual/index.php?occid=123091
123092,UCSB,IZC,,PreservedSpecimen,3fbfc97e-c0ea-4c23-8d2e-d0c7c86d5725,UCSB-IZC00026832,,Animalia,Arthropoda,Insecta,Hymenoptera,Formicidae,Formica,2582,"Linnaeus, 1758",Formica,,,,Elaine Tan,2018,,,,,,,,,,9/18/1975,1975,9,18,261,,,,,,,,,,,,,,,Adult,,1,,,Pinned,USA,California,Santa Barbara,,,,,,34.547957,-119.970652,WGS84,82285,,,,GeoLocate,,All of Santa Barbara County,,,,,,,,,zachary_brown,2/21/2019 17:56,,1,urn:uuid:3fbfc97e-c0ea-4c23-8d2e-d0c7c86d5725,https://symbiota.ccber.ucsb.edu:443/collections/individual/index.php?occid=123092
123093,UCSB,IZC,,PreservedSpecimen,8bd755a2-1cf1-49e2-8583-b823f9712c68,UCSB-IZC00026959,,Animalia,Arthropoda,Insecta,Hymenoptera,Formicidae,Pogonomyrmex,2944,"Mayr, 1868",Pogonomyrmex,,,,Elaine Tan,2018,,,,,,Nhi Nguyen,,EEMB 118 Entomology Class,,6/26/2018,2018,6,26,177,,,0.25m,Restored coastal scrub,,,,,,,Fagopyrm scrub,,,,Adult,,1,,,Pinned,USA,California,Santa Barbara,Santa Barbara,"University of California, Santa Barbara Campus Point",,,,34.406,-119.8442,WGS84,,,,,,,,,,,,,,,,zachary_brown,2/13/2019 17:17,,1,urn:uuid:8bd755a2-1cf1-49e2-8583-b823f9712c68,https://symbiota.ccber.ucsb.edu:443/collections/individual/index.php?occid=123093
123095,UCSB,IZC,,PreservedSpecimen,6510bab5-2697-46f8-a550-7abe1dfd417d,UCSB-IZC00026424,,Animalia,Arthropoda,Insecta,Hymenoptera,Formicidae,Pogonomyrmex,2944,"Mayr, 1868",Pogonomyrmex,,,,Zach Brown,2018,,,,,,B. Carver,,,,5/15/1998,1998,5,15,135,,,,,,,,,,,,,,,Adult,,1,,,Pinned,USA,California,Santa Barbara,Santa Barbara,"University of California, Santa Barbara",,,,34.411786,-119.846471,WGS84,897,,,,GeoLocate,,,,,,,,,,,zachary_brown,2/21/2019 17:54,,1,urn:uuid:6510bab5-2697-46f8-a550-7abe1dfd417d,https://symbiota.ccber.ucsb.edu:443/collections/individual/index.php?occid=123095
123099,UCSB,IZC,,PreservedSpecimen,ed62baee-0855-4ea2-a02e-bffdc64b77ef,UCSB-IZC00026433,,Animalia,Arthropoda,Insecta,Hymenoptera,Formicidae,Pogonomyrmex,2944,"Mayr, 1868",Pogonomyrmex,,,,Elaine Tan,2018,,,,,,Kyle Mrazek,,,,6/1/2018,2018,6,1,152,,,,,,,,,,,,,,,Adult,,1,,,Pinned,USA,California,Santa Barbara,Santa Barbara,"University of California, Santa Barbara Lagoon",,0,,34.408393,-119.847426,WGS84,452,,,,GeoLocate,,Lagoon Island and Campus Point,,,,,,,,,zachary_brown,2/21/2019 17:53,,1,urn:uuid:ed62baee-0855-4ea2-a02e-bffdc64b77ef,https://symbiota.ccber.ucsb.edu:443/collections/individual/index.php?occid=123099
123100,UCSB,IZC,,PreservedSpecimen,d2194afc-92b9-48fc-aab4-6aeac6db7f1a,UCSB-IZC00026255,,Animalia,Arthropoda,Insecta,Hymenoptera,Formicidae,Pogonomyrmex,2944,"Mayr, 1868",Pogonomyrmex,,,,Elaine Tan,2018,,,,,,A. Ravari,,,,6/6/2018,2018,6,6,157,,,,,,,,,,,,,,,Adult,,1,,,Pinned,USA,California,Santa Barbara,Isla Vista,Isla Vista,,,,34.413329,-119.860972,WGS84,2476,,,,GeoLocate,,Isla Vista Municipality,,,,,,,,,zachary_brown,2/21/2019 17:51,,1,urn:uuid:d2194afc-92b9-48fc-aab4-6aeac6db7f1a,https://symbiota.ccber.ucsb.edu:443/collections/individual/index.php?occid=123100
123101,UCSB,IZC,,PreservedSpecimen,30df2ca1-2aee-44b8-ad37-2ab263709e88,UCSB-IZC00026268,,Animalia,Arthropoda,Insecta,Hymenoptera,Formicidae,Pogonomyrmex,2944,"Mayr, 1868",Pogonomyrmex,,,,Elaine Tan,2018,,,,,,Brannon McBride,,EEMB 118 Entomology Class,,6/26/2018,2018,6,26,177,,,0.25m,Restored coastal scrub,,,,,,,Fagopyrum sp.,,,,Adult,,1,Ariel Net,,Pinned,USA,California,Santa Barbara,Santa Barbara,"University of California, Santa Barbara Campus Point",,,,34.406,-119.8442,WGS84,,,,,,,,,,,,,,,,zachary_brown,2/20/2019 18:11,,1,urn:uuid:30df2ca1-2aee-44b8-ad37-2ab263709e88,https://symbiota.ccber.ucsb.edu:443/collections/individual/index.php?occid=123101
123102,UCSB,IZC,,PreservedSpecimen,be91df8a-664e-4060-bf52-a92af3a20492,UCSB-IZC00026401,,Animalia,Arthropoda,Insecta,Hymenoptera,Formicidae,Pogonomyrmex,2944,"Mayr, 1868",Pogonomyrmex,,,,Elaine Tan,2018,,,,,,Daniella Chee,,,,6/2/2018,2018,6,2,153,,,,,,,,,,,,,,,Adult,,1,,,Pinned,USA,California,Santa Barbara,Santa Barbara,"University of California, Santa Barbara Henley Gate",,,,34.415287,-119.83843,WGS84,102,,,,GeoLocate,,Henley Gate,,,,,,,,,zachary_brown,2/21/2019 17:50,,1,urn:uuid:be91df8a-664e-4060-bf52-a92af3a20492,https://symbiota.ccber.ucsb.edu:443/collections/individual/index.php?occid=123102
123103,UCSB,IZC,,PreservedSpecimen,01729a77-dfba-47d1-acd1-8f471aef38bf,UCSB-IZC00026414,,Animalia,Arthropoda,Insecta,Hymenoptera,Formicidae,Pogonomyrmex,2944,"Mayr, 1868",Pogonomyrmex,,,,Elaine Tan,2018,,,,,,T. Burgess,,A. Henderson,,6/4/2003,2003,6,4,155,,,,,,,,,,,,,,,Adult,,1,,,Pinned,USA,California,Santa Barbara,Santa Barbara,Rattlesnake Canyon,,,,34.470104,-119.688042,WGS84,1506,,,,GeoLocate,,Rattlesnake Canyon Trail and Park,,,,,,,,,zachary_brown,2/21/2019 17:49,,1,urn:uuid:01729a77-dfba-47d1-acd1-8f471aef38bf,https://symbiota.ccber.ucsb.edu:443/collections/individual/index.php?occid=123103
123108,UCSB,IZC,,PreservedSpecimen,61b5f926-b724-46fe-887f-b38001aa58ba,UCSB-IZC00026292,,Animalia,Arthropoda,Insecta,Hymenoptera,Formicidae,Polyergus,2945,"Latreille, 1804",Polyergus,,,,Elaine Tan,2018,,,,,,,,,,5/5/1974,1974,5,5,125,,5-May-74,colony with Formica slaves,,,,,,,,Formica,,,,,,,,,,United States,California,Santa Barbara,,"Santa Cruz Island, 400 meters east of UC Research Station",,,,,,,,,,,,,,,,,,,,,,entan,2/15/2019 11:50,,1,urn:uuid:61b5f926-b724-46fe-887f-b38001aa58ba,https://symbiota.ccber.ucsb.edu:443/collections/individual/index.php?occid=123108
123111,UCSB,IZC,,PreservedSpecimen,b48fbaed-2e1d-44a0-839d-eb4c84f4c533,UCSB-IZC00026192,,Animalia,Arthropoda,Insecta,Hymenoptera,Formicidae,Polyergus,2945,"Latreille, 1804",Polyergus,,,,Elaine Tan,,,,,,,,,,,5/26/1975,1975,5,26,146,,26-May-75,,,,,,,,,,,,,,,,,,,United States,California,Santa Barbara,,Santa Cruz Island,,,,34.016667,-119.716667,,21144,,entan (2019-02-20 12:06:50),,georef batch tool 2019-02-20; GeoLocate,reviewed - high confidence,,,,,,,,,,entan,2/20/2019 11:06,,1,urn:uuid:b48fbaed-2e1d-44a0-839d-eb4c84f4c533,https://symbiota.ccber.ucsb.edu:443/collections/individual/index.php?occid=123111
123112,UCSB,IZC,,PreservedSpecimen,6d082f70-cf4a-4a9f-861a-d1ad1e092fb9,UCSB-IZC00026316,,Animalia,Arthropoda,Insecta,Hymenoptera,Formicidae,Polyergus,2945,"Latreille, 1804",Polyergus,,,,Elaine Tan,,,,,,,,,,,5/5/1974,1974,5,5,125,,5-May-74,colony with Formica slaves,,,,,,,,Formica,,,,,,,,,,United States,California,Santa Barbara,,"Santa Cruz Island, 400 meters east of UC Research Station",,,,,,,,,,,,,,,,,,,,,,entan,2/15/2019 12:12,,1,urn:uuid:6d082f70-cf4a-4a9f-861a-d1ad1e092fb9,https://symbiota.ccber.ucsb.edu:443/collections/individual/index.php?occid=123112
123113,UCSB,IZC,,PreservedSpecimen,5d08eff2-18b1-4625-8e76-9d5ebc5550a0,UCSB-IZC00026300,,Animalia,Arthropoda,Insecta,Hymenoptera,Formicidae,Polyergus,2945,"Latreille, 1804",Polyergus,,,,Elaine Tan,,,,,,,,,,,5/29/1974,1974,5,29,149,,29-May-74,,,,,,,,,,,,,,,,,,,United States,California,Santa Barbara,,"Santa Cruz Island, 0.5 meters west of UC Research Station",,,,,,,,,,,,,,,,,,,,,,entan,2/15/2019 12:05,,1,urn:uuid:5d08eff2-18b1-4625-8e76-9d5ebc5550a0,https://symbiota.ccber.ucsb.edu:443/collections/individual/index.php?occid=123113
123114,UCSB,IZC,,PreservedSpecimen,454ac597-6ebc-41ff-a1d4-ac22073e77d9,UCSB-IZC00026339,,Animalia,Arthropoda,Insecta,Hymenoptera,Formicidae,Polyergus,2945,"Latreille, 1804",Polyergus,,,,Elaine Tan,2018,,,,,,,,,,5/29/1974,1974,5,29,149,,29-May-74,,,,,,,,,,,,,,,,,,,United States,California,Santa Barbara,,"Santa Cruz Island, 0.5 meters west of UC Research Station",,0,,,,,,,,,,,,,,,,,,,,entan,2/15/2019 12:11,,1,urn:uuid:454ac597-6ebc-41ff-a1d4-ac22073e77d9,https://symbiota.ccber.ucsb.edu:443/collections/individual/index.php?occid=123114
123121,UCSB,IZC,,PreservedSpecimen,962e4375-b797-498b-96f7-fd6e3cb24de5,UCSB-IZC00026606,,Animalia,Arthropoda,Insecta,Hymenoptera,Formicidae,Camponotus,2424,"Mayr, 1861",Camponotus,,,,Zach Brown,2018,,,,,,,,,,7/1/1982,1982,7,1,182,,1-Jul-82,,,,,,,,,,,,,,,,,,,United States,California,Santa Barbara,,Santa Cruz Island,,,,34.016667,-119.716667,,21144,,entan (2019-02-20 12:06:50),,georef batch tool 2019-02-20; GeoLocate,reviewed - high confidence,,,,,,,,,,entan,2/20/2019 11:06,,1,urn:uuid:962e4375-b797-498b-96f7-fd6e3cb24de5,https://symbiota.ccber.ucsb.edu:443/collections/individual/index.php?occid=123121
123122,UCSB,IZC,,PreservedSpecimen,372a7cdf-85b6-41dd-979f-7a63fab85427,UCSB-IZC00026605,,Animalia,Arthropoda,Insecta,Hymenoptera,Formicidae,Camponotus,2424,"Mayr, 1861",Camponotus,,,,Zach Brown,2018,,,,,,,,,,7/1/1977,1977,7,1,182,,July 1 1977,,,,,,,,,,,,,,,,,,,United States,California,Santa Barbara,,Santa Cruz Island,,,,34.016667,-119.716667,,21144,,entan (2019-02-20 12:06:50),,georef batch tool 2019-02-20; GeoLocate,reviewed - high confidence,,,,,,,,,,entan,2/20/2019 11:06,,1,urn:uuid:372a7cdf-85b6-41dd-979f-7a63fab85427,https://symbiota.ccber.ucsb.edu:443/collections/individual/index.php?occid=123122
123123,UCSB,IZC,,PreservedSpecimen,a7dbfdbe-73e7-4984-ae92-96ea64d0d878,UCSB-IZC00026914,,Animalia,Arthropoda,Insecta,Hymenoptera,Formicidae,Camponotus,2424,"Mayr, 1861",Camponotus,,,,Zach Brown,2018,,,,,,,,,,7/1/1977,1977,7,1,182,,July 1 1977,,,,,,,,,,,,,,,,,,,United States,California,Santa Barbara,,Santa Cruz Island,,,,34.016667,-119.716667,,21144,,entan (2019-02-20 12:06:50),,georef batch tool 2019-02-20; GeoLocate,reviewed - high confidence,,,,,,,,,,entan,2/20/2019 11:06,,1,urn:uuid:a7dbfdbe-73e7-4984-ae92-96ea64d0d878,https://symbiota.ccber.ucsb.edu:443/collections/individual/index.php?occid=123123
123125,UCSB,IZC,,PreservedSpecimen,4722003b-86ee-44a2-ac4e-db001779dd44,UCSB-IZC00026617,,Animalia,Arthropoda,Insecta,Hymenoptera,Formicidae,Camponotus,2424,"Mayr, 1861",Camponotus,,,,Elaine Tan,2018,,,,,,Zach Muir,,,,5/19/2017,2017,5,19,139,,19-May-17,,,,,,,,,,,,,,,,,,,United States,California,Santa Barbara,Isla Vista,,,,,34.413329,-119.860972,WGS84,2164,,,,GeoLocate,,Isla Vista Municipality,,,,,,,,,entan,2/21/2019 17:43,,1,urn:uuid:4722003b-86ee-44a2-ac4e-db001779dd44,https://symbiota.ccber.ucsb.edu:443/collections/individual/index.php?occid=123125
123128,UCSB,IZC,,PreservedSpecimen,016be064-3e15-4e9f-b49f-3e8292ffe065,UCSB-IZC00026623,,Animalia,Arthropoda,Insecta,Hymenoptera,Formicidae,Camponotus,2424,"Mayr, 1861",Camponotus,,,,Elaine Tan,2018,,,,,,C. Haack,,,,5/30/2015,2015,5,30,150,,,,,,,,,,,,,,,,,,,,,United States,California,Santa Barbara,Isla Vista,Isla Vista Elementary field,,,,34.415896,-119.86801,WGS84,184,,,,GeoLocate,,Isla Vista Elementary and surrounding fields,,,,,,,,,entan,2/21/2019 17:32,,1,urn:uuid:016be064-3e15-4e9f-b49f-3e8292ffe065,https://symbiota.ccber.ucsb.edu:443/collections/individual/index.php?occid=123128
123131,UCSB,IZC,,PreservedSpecimen,6826d173-04ba-4232-92ee-2d5364889ea6,UCSB-IZC00026908,,Animalia,Arthropoda,Insecta,Hymenoptera,Formicidae,Camponotus,2424,"Mayr, 1861",Camponotus,,,,Zach Brown,2018,,,,,,Lauren Welchert,,EEMB 118 Entomology Class,,7/1/2018,2018,7,1,182,,1-Jul-18,,chaparral,sandstone rock,,,,,,,,,,,,,,,,United States,California,Santa Barbara,,brickyard rock climbing area off West Camino Cielo,,,,34.4979,-119.8613,WGS84,,,,,,,,,,,,,,,,entan,2/22/2019 13:43,,1,urn:uuid:6826d173-04ba-4232-92ee-2d5364889ea6,https://symbiota.ccber.ucsb.edu:443/collections/individual/index.php?occid=123131
123132,UCSB,IZC,,PreservedSpecimen,f8bf0f41-68da-4f7f-9c05-34300aaa9fa8,UCSB-IZC00026629,,Animalia,Arthropoda,Insecta,Hymenoptera,Formicidae,Camponotus,2424,"Mayr, 1861",Camponotus,,,,Zach Brown,2018,,,,,,Elenna Erkeneff,,,,5/4/2016,2016,5,4,125,,4-May-16,,,,,,,,,,,,,,,,,,,United States,California,Santa Barbara,,Devereux,,,,34.413005,-119.877175,WGS84,698,,,,GeoLocate,,Devereux Lagoon,,,,,,,,,entan,2/21/2019 17:30,,1,urn:uuid:f8bf0f41-68da-4f7f-9c05-34300aaa9fa8,https://symbiota.ccber.ucsb.edu:443/collections/individual/index.php?occid=123132
123135,UCSB,IZC,,PreservedSpecimen,55f5c44c-48a6-4bb6-a5ce-d590cbfbe0af,UCSB-IZC00026927,,Animalia,Arthropoda,Insecta,Hymenoptera,Formicidae,Camponotus,2424,"Mayr, 1861",Camponotus,,,,Zach Brown,2018,,,,,,B. Affeld,,,,5/22/2016,2016,5,22,143,,22-May-16,,,,,,,,,,,,,,,,,,,United States,California,Santa Barbara,,Cold Spring Canyon,,,,34.578846,-119.753129,WGS84,22385,,,,GeoLocate,,Center of both Cold Spring Canyon's and trail-head,,,,,,,,,entan,2/21/2019 17:23,,1,urn:uuid:55f5c44c-48a6-4bb6-a5ce-d590cbfbe0af,https://symbiota.ccber.ucsb.edu:443/collections/individual/index.php?occid=123135
123137,UCSB,IZC,,PreservedSpecimen,7c7a9c49-6ddf-49c0-9773-fda09d55c48c,UCSB-IZC00026592,,Animalia,Arthropoda,Insecta,Hymenoptera,Formicidae,Camponotus,2424,"Mayr, 1861",Camponotus,,,,Elaine Tan,2018,,,,,,Karina Krebs,,,,6/1/2018,2018,6,1,152,,"01 June, 2018",,,,,,,,,,,,,,,,Pitfall trap,,,United States,California,Santa Barbara,Isla Vista,,,,,34.413329,-119.860972,WGS84,2164,,,,GeoLocate,,Isla Vista Municipality,,,,,,,,,entan,2/21/2019 17:21,,1,urn:uuid:7c7a9c49-6ddf-49c0-9773-fda09d55c48c,https://symbiota.ccber.ucsb.edu:443/collections/individual/index.php?occid=123137
123139,UCSB,IZC,,PreservedSpecimen,860fe5d3-b24f-464b-bbb3-1c2027d5c562,UCSB-IZC00026935,,Animalia,Arthropoda,Insecta,Hymenoptera,Formicidae,Camponotus,2424,"Mayr, 1861",Camponotus,,,,Zach Brown,2018,,,,,,Veronica Fernandez,,,,5/9/2018,2018,5,9,129,,9-May-18,,,,,,,,,,,,,,,,,,,United States,California,Santa Barbara,,"Refugio Canyon, Refugio",,,,34.520156,-120.057526,WGS84,14542,,,,GeoLocate,,Refugio Canyon Rd and surrounding areas,,,,,,,,,entan,2/21/2019 17:20,,1,urn:uuid:860fe5d3-b24f-464b-bbb3-1c2027d5c562,https://symbiota.ccber.ucsb.edu:443/collections/individual/index.php?occid=123139
123145,UCSB,IZC,,PreservedSpecimen,f5359afe-e6e1-4984-89a7-12b5590924d5,UCSB-IZC00026928,,Animalia,Arthropoda,Insecta,Hymenoptera,Formicidae,Camponotus,2424,"Mayr, 1861",Camponotus,,,,Elaine Tan,2018,,,,,,Jose Bojorquez,,,,5/10/2017,2017,5,10,130,,5/10/2017,,,,,,,,,,,,,,,,,,,United States,California,Santa Barbara,,Refugio Canyon,,,,34.520156,-120.057526,WGS84,14542,,,,GeoLocate,,Refugio Canyon Rd and surrounding areas,,,,,,,,,entan,2/21/2019 17:17,,1,urn:uuid:f5359afe-e6e1-4984-89a7-12b5590924d5,https://symbiota.ccber.ucsb.edu:443/collections/individual/index.php?occid=123145
123157,UCSB,IZC,,PreservedSpecimen,457f5d65-a760-45ce-8c74-498128362e12,UCSB-IZC00026904,,Animalia,Arthropoda,Insecta,Hymenoptera,Formicidae,Camponotus,2424,"Mayr, 1861",Camponotus,,,,Elaine Tan,2018,,,,,,,,,,5/25/1975,1975,5,25,145,,25-May-75,,,,,,,,,,,,,,,,,,,United States,California,Santa Barbara,,Santa Cruz Island,,,,34.016667,-119.716667,,21144,,entan (2019-02-20 12:06:50),,georef batch tool 2019-02-20; GeoLocate,reviewed - high confidence,,,,,,,,,,entan,2/20/2019 11:06,,1,urn:uuid:457f5d65-a760-45ce-8c74-498128362e12,https://symbiota.ccber.ucsb.edu:443/collections/individual/index.php?occid=123157
123158,UCSB,IZC,,PreservedSpecimen,837d8fed-9e27-45e9-8a96-f06197062d10,UCSB-IZC00026903,,Animalia,Arthropoda,Insecta,Hymenoptera,Formicidae,Camponotus,2424,"Mayr, 1861",Camponotus,,,,Elaine Tan,2018,,,,,,Vasili Vagenas,,,,4/23/2016,2016,4,23,114,,23-Apr-16,,,,,,,,,,,,,,,,,,,United States,California,Santa Barbara,Santa Barbara,"University of California, Santa Barbara Lagoon trail; 34.408606 -119.847083",,,,34.408606,-119.847083,,548,,rbehm (2018-09-28 16:05:54),,georef batch tool 2018-09-28; GeoLocate,reviewed - high confidence,,,,,,,,,,entan,2/19/2019 16:53,,1,urn:uuid:837d8fed-9e27-45e9-8a96-f06197062d10,https://symbiota.ccber.ucsb.edu:443/collections/individual/index.php?occid=123158
123159,UCSB,IZC,,PreservedSpecimen,95778f65-e4a3-42e7-acaa-6cc0b94b69d2,UCSB-IZC00026898,,Animalia,Arthropoda,Insecta,Hymenoptera,Formicidae,Camponotus,2424,"Mayr, 1861",Camponotus,,,,Elaine Tan,2018,,,,,,Elena Erkaneff,,,,5/23/2016,2016,5,23,144,,25-May-16,,,,,,,,,,,,,,,,,,,United States,California,Santa Barbara,,Devereux,,,,34.413571,-119.877089,WGS84,,,,,GeoLocate,,Devereux Lagoon,,,,,,,,,entan,2/21/2019 17:16,,1,urn:uuid:95778f65-e4a3-42e7-acaa-6cc0b94b69d2,https://symbiota.ccber.ucsb.edu:443/collections/individual/index.php?occid=123159
123160,UCSB,IZC,,PreservedSpecimen,76973e53-16a8-4155-80cc-4f4852c6e783,UCSB-IZC00026601,,Animalia,Arthropoda,Insecta,Hymenoptera,Formicidae,Camponotus,2424,"Mayr, 1861",Camponotus,,,,Elaine Tan,2018,,,,,,Jordan Caldwell,,,,5/9/2018,2018,5,9,129,,May 9 2018,,chaparral,,,,,,,,,,,,,,Sweep net,,,United States,California,Santa Barbara,,Refugio State Park,,,,34.463888,-120.069083,WGS84,56,,,,GeoLocate,,Refugio State Beach,,,,,,,,,entan,2/21/2019 17:15,,1,urn:uuid:76973e53-16a8-4155-80cc-4f4852c6e783,https://symbiota.ccber.ucsb.edu:443/collections/individual/index.php?occid=123160
123172,UCSB,IZC,,PreservedSpecimen,1e093ca7-ce07-4ed9-a706-dc370051fdb4,UCSB-IZC00026590,,Animalia,Arthropoda,Insecta,Hymenoptera,Formicidae,Pheidole,2918,"Westwood, 1839",Pheidole,,,,Elaine Tan,2018,,,,,,Howarth,,,14,12/3/1998,1998,12,3,337,,3-Dec-98,,,,,,,,,,,,,,,,,,,United States,California,Santa Barbara,,Santa Cruz Island,,,,34.016667,-119.716667,,21144,,entan (2019-02-20 12:06:50),,georef batch tool 2019-02-20; GeoLocate,reviewed - high confidence,,,,,,,,,,entan,2/20/2019 11:06,,1,urn:uuid:1e093ca7-ce07-4ed9-a706-dc370051fdb4,https://symbiota.ccber.ucsb.edu:443/collections/individual/index.php?occid=123172
123173,UCSB,IZC,,PreservedSpecimen,13bc4ca1-23b7-4b9b-b3da-fef836e09481,UCSB-IZC00026640,,Animalia,Arthropoda,Insecta,Hymenoptera,Formicidae,Pheidole,2918,"Westwood, 1839",Pheidole,,,,Elaine Tan,2018,,,,,,Emily Hebard,,,4,11/30/1998,1998,11,30,334,,30-Nov-98,,,,,,,,,,,,,,,,,,,United States,California,Santa Barbara,,Santa Cruz Island,,,,34.016667,-119.716667,,21144,,entan (2019-02-20 12:06:50),,georef batch tool 2019-02-20; GeoLocate,reviewed - high confidence,,,,,,,,,,entan,2/20/2019 11:06,,1,urn:uuid:13bc4ca1-23b7-4b9b-b3da-fef836e09481,https://symbiota.ccber.ucsb.edu:443/collections/individual/index.php?occid=123173
123174,UCSB,IZC,,PreservedSpecimen,6d8c2cf8-4b80-4eb8-8b38-8faab7f63ea6,UCSB-IZC00026626,,Animalia,Arthropoda,Insecta,Hymenoptera,Formicidae,Pheidole,2918,"Westwood, 1839",Pheidole,,,,Elaine Tan,2018,,,,,,Emily Hebard,,,4,11/30/1998,1998,11,30,334,,30-Nov-98,,,,,,,,,,,,,,,,,,,United States,California,Santa Barbara,,Santa Cruz Island,,,,34.016667,-119.716667,,21144,,entan (2019-02-20 12:06:50),,georef batch tool 2019-02-20; GeoLocate,reviewed - high confidence,,,,,,,,,,entan,2/20/2019 11:06,,1,urn:uuid:6d8c2cf8-4b80-4eb8-8b38-8faab7f63ea6,https://symbiota.ccber.ucsb.edu:443/collections/individual/index.php?occid=123174
123175,UCSB,IZC,,PreservedSpecimen,25fb761b-be49-4ba9-92e0-05815fe56da2,UCSB-IZC00026630,,Animalia,Arthropoda,Insecta,Hymenoptera,Formicidae,Pheidole,2918,"Westwood, 1839",Pheidole,,,,Elaine Tan,2018,,,,,,Emily Hebard,,,,11/30/1998,1998,11,30,334,,30-Nov-98,,,,,,,,,,,,,,,,,,,United States,California,Santa Barbara,,Santa Cruz Island,,,,34.016667,-119.716667,,21144,,entan (2019-02-20 12:06:50),,georef batch tool 2019-02-20; GeoLocate,reviewed - high confidence,,,,,,,,,,entan,2/20/2019 11:06,,1,urn:uuid:25fb761b-be49-4ba9-92e0-05815fe56da2,https://symbiota.ccber.ucsb.edu:443/collections/individual/index.php?occid=123175
123176,UCSB,IZC,,PreservedSpecimen,58045d97-86e3-4138-a314-d49a81a217b9,UCSB-IZC00026624,,Animalia,Arthropoda,Insecta,Hymenoptera,Formicidae,Pheidole,2918,"Westwood, 1839",Pheidole,,,,Elaine Tan,2018,,,,,,Emily Hebard,,,,11/30/1998,1998,11,30,334,,30-Nov-98,,,,,,,,,,,,,,,,,,,United States,California,Santa Barbara,,Santa Cruz Island,,,,34.016667,-119.716667,,21144,,entan (2019-02-20 12:06:50),,georef batch tool 2019-02-20; GeoLocate,reviewed - high confidence,,,,,,,,,,entan,2/20/2019 11:06,,1,urn:uuid:58045d97-86e3-4138-a314-d49a81a217b9,https://symbiota.ccber.ucsb.edu:443/collections/individual/index.php?occid=123176
123177,UCSB,IZC,,PreservedSpecimen,98180125-7fde-4572-baab-f6dd8ddf510e,UCSB-IZC00026884,,Animalia,Arthropoda,Insecta,Hymenoptera,Formicidae,Pheidole,2918,"Westwood, 1839",Pheidole,,,,Elaine Tan,2018,,,,,,Emily Hebard,,,,11/30/1998,1998,11,30,334,,30-Nov-98,,,,,,,,,,,,,,,,,,,United States,California,Santa Barbara,,Santa Cruz Island,,,,34.016667,-119.716667,,21144,,entan (2019-02-20 12:06:50),,georef batch tool 2019-02-20; GeoLocate,reviewed - high confidence,,,,,,,,,,entan,2/20/2019 11:06,,1,urn:uuid:98180125-7fde-4572-baab-f6dd8ddf510e,https://symbiota.ccber.ucsb.edu:443/collections/individual/index.php?occid=123177
123178,UCSB,IZC,,PreservedSpecimen,17c9f5c4-a585-48f6-a6e2-fc55af34ebfa,UCSB-IZC00026932,,Animalia,Arthropoda,Insecta,Hymenoptera,Formicidae,Pheidole,2918,"Westwood, 1839",Pheidole,,,,Elaine Tan,2018,,,,,,Emily Hebard,,,,11/30/1998,1998,11,30,334,,30-Nov-98,,,,,,,,,,,,,,,,,,,United States,California,Santa Barbara,,Santa Cruz Island,,,,34.016667,-119.716667,,21144,,entan (2019-02-20 12:06:50),,georef batch tool 2019-02-20; GeoLocate,reviewed - high confidence,,,,,,,,,,entan,2/20/2019 11:06,,1,urn:uuid:17c9f5c4-a585-48f6-a6e2-fc55af34ebfa,https://symbiota.ccber.ucsb.edu:443/collections/individual/index.php?occid=123178
123179,UCSB,IZC,,PreservedSpecimen,c889729b-072a-46af-8558-76de1e6d9f07,UCSB-IZC00026635,,Animalia,Arthropoda,Insecta,Hymenoptera,Formicidae,Pheidole,2918,"Westwood, 1839",Pheidole,,,,Elaine Tan,2018,,,,,,Howarth,,,,12/3/1998,1998,12,3,337,,3-Dec-98,,,,,,,,,,,,,,,,,,,United States,California,Santa Barbara,,Santa Cruz Island,,,,34.016667,-119.716667,,21144,,entan (2019-02-20 12:06:50),,georef batch tool 2019-02-20; GeoLocate,reviewed - high confidence,,,,,,,,,,entan,2/20/2019 11:06,,1,urn:uuid:c889729b-072a-46af-8558-76de1e6d9f07,https://symbiota.ccber.ucsb.edu:443/collections/individual/index.php?occid=123179
123180,UCSB,IZC,,PreservedSpecimen,0bf65412-36e8-4aec-9e8e-e0a19f98c947,UCSB-IZC00026922,,Animalia,Arthropoda,Insecta,Hymenoptera,Formicidae,Pheidole,2918,"Westwood, 1839",Pheidole,,,,Elaine Tan,2018,,,,,,Howarth,,,,12/3/1998,1998,12,3,337,,3-Dec-98,,,,,,,,,,,,,,,,,,,United States,California,Santa Barbara,,Santa Cruz Island,,,,34.016667,-119.716667,,21144,,entan (2019-02-20 12:06:50),,georef batch tool 2019-02-20; GeoLocate,reviewed - high confidence,,,,,,,,,,entan,2/20/2019 11:06,,1,urn:uuid:0bf65412-36e8-4aec-9e8e-e0a19f98c947,https://symbiota.ccber.ucsb.edu:443/collections/individual/index.php?occid=123180
123181,UCSB,IZC,,PreservedSpecimen,07e0c1a8-844b-49da-a88e-29d87b890994,UCSB-IZC00026618,,Animalia,Arthropoda,Insecta,Hymenoptera,Formicidae,Pheidole,2918,"Westwood, 1839",Pheidole,,,,Elaine Tan,2018,,,,,,Howarth,,,,12/3/1998,1998,12,3,337,,3-Dec-98,,,,,,,,,,,,,,,,,,,United States,California,Santa Barbara,,Santa Cruz Island,,,,34.016667,-119.716667,,21144,,entan (2019-02-20 12:06:50),,georef batch tool 2019-02-20; GeoLocate,reviewed - high confidence,,,,,,,,,,entan,2/20/2019 11:06,,1,urn:uuid:07e0c1a8-844b-49da-a88e-29d87b890994,https://symbiota.ccber.ucsb.edu:443/collections/individual/index.php?occid=123181
123182,UCSB,IZC,,PreservedSpecimen,d1a9b936-fb7a-4fb9-991c-301645eaea29,UCSB-IZC00026599,,Animalia,Arthropoda,Insecta,Hymenoptera,Formicidae,Pheidole,2918,"Westwood, 1839",Pheidole,,,,Elaine Tan,2019,,,,,,Howarth,,,,12/3/1998,1998,12,3,337,,3-Dec-98,,,,,,,,,,,,,,,,,,,United States,California,Santa Barbara,,Santa Cruz Island,,,,34.016667,-119.716667,,21144,,entan (2019-02-20 12:06:50),,georef batch tool 2019-02-20; GeoLocate,reviewed - high confidence,,,,,,,,,,entan,2/20/2019 11:06,,1,urn:uuid:d1a9b936-fb7a-4fb9-991c-301645eaea29,https://symbiota.ccber.ucsb.edu:443/collections/individual/index.php?occid=123182
123183,UCSB,IZC,,PreservedSpecimen,c58cf04e-dcab-4fe5-8cd6-b4879a45f562,UCSB-IZC00026600,,Animalia,Arthropoda,Insecta,Hymenoptera,Formicidae,Pheidole,2918,"Westwood, 1839",Pheidole,,,,Elaine Tan,2019,,,,,,Emily Hebard,,,,11/30/1998,1998,11,30,334,,30-Nov-98,,,,,,,,,,,,,,,,,,,United States,California,Santa Barbara,,Santa Cruz Island,,,,34.016667,-119.716667,,21144,,entan (2019-02-20 12:06:50),,georef batch tool 2019-02-20; GeoLocate,reviewed - high confidence,,,,,,,,,,entan,2/20/2019 11:06,,1,urn:uuid:c58cf04e-dcab-4fe5-8cd6-b4879a45f562,https://symbiota.ccber.ucsb.edu:443/collections/individual/index.php?occid=123183
123184,UCSB,IZC,,PreservedSpecimen,f4b20dc3-e5b7-432c-bb14-26a110e5d336,UCSB-IZC00026915,,Animalia,Arthropoda,Insecta,Hymenoptera,Formicidae,Pheidole,2918,"Westwood, 1839",Pheidole,,,,Elaine Tan,2019,,,,,,Emily Hebard,,,,11/30/1998,1998,11,30,334,,30-Nov-98,,,,,,,,,,,,,,,,,,,United States,California,Santa Barbara,,Santa Cruz Island,,,,34.016667,-119.716667,,21144,,entan (2019-02-20 12:06:50),,georef batch tool 2019-02-20; GeoLocate,reviewed - high confidence,,,,,,,,,,entan,2/20/2019 11:06,,1,urn:uuid:f4b20dc3-e5b7-432c-bb14-26a110e5d336,https://symbiota.ccber.ucsb.edu:443/collections/individual/index.php?occid=123184
123185,UCSB,IZC,,PreservedSpecimen,0de8ea80-83f3-4dba-ae84-c39ff0570151,UCSB-IZC00026891,,Animalia,Arthropoda,Insecta,Hymenoptera,Formicidae,Pheidole,2918,"Westwood, 1839",Pheidole,,,,Elaine Tan,2019,,,,,,Emily Hebard,,,,11/30/1998,1998,11,30,334,,30-Nov-98,,,,,,,,,,,,,,,,,,,United States,California,Santa Barbara,,Santa Cruz Island,,,,34.016667,-119.716667,,21144,,entan (2019-02-20 12:06:50),,georef batch tool 2019-02-20; GeoLocate,reviewed - high confidence,,,,,,,,,,entan,2/20/2019 11:06,,1,urn:uuid:0de8ea80-83f3-4dba-ae84-c39ff0570151,https://symbiota.ccber.ucsb.edu:443/collections/individual/index.php?occid=123185
123186,UCSB,IZC,,PreservedSpecimen,d6d1bd5f-f4c0-4f3d-8aa3-52d5856a6780,UCSB-IZC00026901,,Animalia,Arthropoda,Insecta,Hymenoptera,Formicidae,Pheidole,2918,"Westwood, 1839",Pheidole,,,,Elaine Tan,2019,,,,,,Emily Hebard,,,,11/30/1998,1998,11,30,334,,30-Nov-98,,,,,,,,,,,,,,,,,,,United States,California,Santa Barbara,,Santa Cruz Island,,,,34.016667,-119.716667,,21144,,entan (2019-02-20 12:06:50),,georef batch tool 2019-02-20; GeoLocate,reviewed - high confidence,,,,,,,,,,entan,2/20/2019 11:06,,1,urn:uuid:d6d1bd5f-f4c0-4f3d-8aa3-52d5856a6780,https://symbiota.ccber.ucsb.edu:443/collections/individual/index.php?occid=123186
123187,UCSB,IZC,,PreservedSpecimen,d717db08-7090-45b0-977f-4c602a3a5027,UCSB-IZC00026603,,Animalia,Arthropoda,Insecta,Hymenoptera,Formicidae,Pheidole,2918,"Westwood, 1839",Pheidole,,,,Elaine Tan,2019,,,,,,Emily Hebard,,,,11/30/1998,1998,11,30,334,,30-Nov-98,,,,,,,,,,,,,,,,,,,United States,California,Santa Barbara,,Santa Cruz Island,,,,34.016667,-119.716667,,21144,,entan (2019-02-20 12:06:50),,georef batch tool 2019-02-20; GeoLocate,reviewed - high confidence,,,,,,,,,,entan,2/20/2019 11:06,,1,urn:uuid:d717db08-7090-45b0-977f-4c602a3a5027,https://symbiota.ccber.ucsb.edu:443/collections/individual/index.php?occid=123187
123188,UCSB,IZC,,PreservedSpecimen,22cc3f7e-c4aa-406c-8ab1-ae0a3db07ba1,UCSB-IZC00026905,,Animalia,Arthropoda,Insecta,Hymenoptera,Formicidae,Pheidole,2918,"Westwood, 1839",Pheidole,,,,Elaine Tan,2019,,,,,,Emily Hebard,,,,11/30/1998,1998,11,30,334,,30-Nov-98,,,,,,,,,,,,,,,,,,,United States,California,Santa Barbara,,Santa Cruz Island,,,,34.016667,-119.716667,,21144,,entan (2019-02-20 12:06:50),,georef batch tool 2019-02-20; GeoLocate,reviewed - high confidence,,,,,,,,,,entan,2/20/2019 11:06,,1,urn:uuid:22cc3f7e-c4aa-406c-8ab1-ae0a3db07ba1,https://symbiota.ccber.ucsb.edu:443/collections/individual/index.php?occid=123188
123189,UCSB,IZC,,PreservedSpecimen,7289c695-f811-43c4-81b5-e1406850c24d,UCSB-IZC00002746,,Animalia,Arthropoda,Insecta,Hymenoptera,Formicidae,Pheidole,2918,"Westwood, 1839",Pheidole,,,,Elaine Tan,2019,,,,,,Emily Hebard,,,,11/30/1998,1998,11,30,334,,30-Nov-98,,,,,,,,,,,,,,,,,,,United States,California,Santa Barbara,,Santa Cruz Island,,,,34.016667,-119.716667,,21144,,entan (2019-02-20 12:06:50),,georef batch tool 2019-02-20; GeoLocate,reviewed - high confidence,,,,,,,,,,entan,2/20/2019 11:06,,1,urn:uuid:7289c695-f811-43c4-81b5-e1406850c24d,https://symbiota.ccber.ucsb.edu:443/collections/individual/index.php?occid=123189
123190,UCSB,IZC,,PreservedSpecimen,afb1d35a-3d18-47a0-a23b-91101707cb98,UCSB-IZC00026588,,Animalia,Arthropoda,Insecta,Hymenoptera,Formicidae,Pheidole,2918,"Westwood, 1839",Pheidole,,,,Elaine Tan,2019,,,,,,Emily Hebard,,Heller,,4/16/1999,1999,4,16,106,,16-Apr-99,,,,,,,,,,,,,,,,,,,United States,California,Santa Barbara,,Santa Cruz Island,,,,34.016667,-119.716667,,21144,,entan (2019-02-20 12:06:50),,georef batch tool 2019-02-20; GeoLocate,reviewed - high confidence,,,,,,,,,,entan,2/20/2019 11:06,,1,urn:uuid:afb1d35a-3d18-47a0-a23b-91101707cb98,https://symbiota.ccber.ucsb.edu:443/collections/individual/index.php?occid=123190
123191,UCSB,IZC,,PreservedSpecimen,592c3a49-feee-4cde-9f3a-443152450a15,UCSB-IZC00026596,,Animalia,Arthropoda,Insecta,Hymenoptera,Formicidae,Pheidole,2918,"Westwood, 1839",Pheidole,,,,Elaine Tan,2019,,,,,,Emily Hebard,,Heller,,4/16/1999,1999,4,16,106,,16-Apr-99,,,,,,,,,,,,,,,,,,,United States,California,Santa Barbara,,Santa Cruz Island,,,,34.016667,-119.716667,,21144,,entan (2019-02-20 12:06:50),,georef batch tool 2019-02-20; GeoLocate,reviewed - high confidence,,,,,,,,,,entan,2/20/2019 11:06,,1,urn:uuid:592c3a49-feee-4cde-9f3a-443152450a15,https://symbiota.ccber.ucsb.edu:443/collections/individual/index.php?occid=123191
123192,UCSB,IZC,,PreservedSpecimen,fdcc87b7-cfd7-4b5c-8e6a-e6b19c246365,UCSB-IZC00026902,,Animalia,Arthropoda,Insecta,Hymenoptera,Formicidae,Pheidole,2918,"Westwood, 1839",Pheidole,,,,Elaine Tan,2019,,,,,,,,,,12/3/1998,1998,12,3,337,,3-Dec-98,,,,,,,,,,,,,,,,,,,United States,California,Santa Barbara,,Santa Cruz Island,,,,34.016667,-119.716667,,21144,,entan (2019-02-20 12:06:50),,georef batch tool 2019-02-20; GeoLocate,reviewed - high confidence,,,,,,,,,,entan,2/20/2019 11:06,,1,urn:uuid:fdcc87b7-cfd7-4b5c-8e6a-e6b19c246365,https://symbiota.ccber.ucsb.edu:443/collections/individual/index.php?occid=123192
123193,UCSB,IZC,,PreservedSpecimen,60620b2b-52f1-407b-8e10-ea6899d1fc24,UCSB-IZC00026911,,Animalia,Arthropoda,Insecta,Hymenoptera,Formicidae,Pheidole,2918,"Westwood, 1839",Pheidole,,,,Zach Brown,2019,,,,,,Emily Hebard,,,,11/30/1998,1998,11,30,334,,30-Nov-98,,,,,,,,,,,,,,,,,,,United States,California,Santa Barbara,,Santa Cruz Island,,,,34.016667,-119.716667,,21144,,entan (2019-02-20 12:06:50),,georef batch tool 2019-02-20; GeoLocate,reviewed - high confidence,,,,,,,,,,entan,2/20/2019 11:06,,1,urn:uuid:60620b2b-52f1-407b-8e10-ea6899d1fc24,https://symbiota.ccber.ucsb.edu:443/collections/individual/index.php?occid=123193
123194,UCSB,IZC,,PreservedSpecimen,7f76419c-879a-443e-a665-43c01c184278,UCSB-IZC00026597,,Animalia,Arthropoda,Insecta,Hymenoptera,Formicidae,Pheidole,2918,"Westwood, 1839",Pheidole,,,,Zach Brown,2019,,,,,,Emily Hebard,,,,11/30/1998,1998,11,30,334,,30-Nov-98,,,,,,,,,,,,,,,,,,,United States,California,Santa Barbara,,Santa Cruz Island,,,,34.016667,-119.716667,,21144,,entan (2019-02-20 12:06:50),,georef batch tool 2019-02-20; GeoLocate,reviewed - high confidence,,,,,,,,,,entan,2/20/2019 11:06,,1,urn:uuid:7f76419c-879a-443e-a665-43c01c184278,https://symbiota.ccber.ucsb.edu:443/collections/individual/index.php?occid=123194
123195,UCSB,IZC,,PreservedSpecimen,de04f851-7d07-4001-82b6-7d3fa3f1dd4e,UCSB-IZC00002716,,Animalia,Arthropoda,Insecta,Hymenoptera,Formicidae,Pheidole,2918,"Westwood, 1839",Pheidole,,,,Zach Brown,2019,,,,,,Emily Hebard,,,,11/30/1998,1998,11,30,334,,30-Nov-98,,,,,,,,,,,,,,,,,,,United States,California,Santa Barbara,,Santa Cruz Island,,,,34.016667,-119.716667,,21144,,entan (2019-02-20 12:06:50),,georef batch tool 2019-02-20; GeoLocate,reviewed - high confidence,,,,,,,,,,entan,2/20/2019 11:06,,1,urn:uuid:de04f851-7d07-4001-82b6-7d3fa3f1dd4e,https://symbiota.ccber.ucsb.edu:443/collections/individual/index.php?occid=123195
123196,UCSB,IZC,,PreservedSpecimen,955dbae3-0e84-4652-afee-20ffb7c5644d,UCSB-IZC00026917,,Animalia,Arthropoda,Insecta,Hymenoptera,Formicidae,Pheidole,2918,"Westwood, 1839",Pheidole,,,,Zach Brown,2019,,,,,,Emily Hebard,,,,11/30/1998,1998,11,30,334,,30-Nov-98,,,,,,,,,,,,,,,,,,,United States,California,Santa Barbara,,Santa Cruz Island,,,,34.016667,-119.716667,,21144,,entan (2019-02-20 12:06:50),,georef batch tool 2019-02-20; GeoLocate,reviewed - high confidence,,,,,,,,,,entan,2/20/2019 11:06,,1,urn:uuid:955dbae3-0e84-4652-afee-20ffb7c5644d,https://symbiota.ccber.ucsb.edu:443/collections/individual/index.php?occid=123196
123197,UCSB,IZC,,PreservedSpecimen,e3d334bb-1ebe-4ff3-b625-41abf46e9ce0,UCSB-IZC00026610,,Animalia,Arthropoda,Insecta,Hymenoptera,Formicidae,Pheidole,2918,"Westwood, 1839",Pheidole,,,,Zach Brown,2019,,,,,,Emily Hebard,,,,2/28/1999,1999,2,28,59,,28-Feb-99,,,,,,,,,,,,,,,,,,,United States,California,Santa Barbara,,Santa Cruz Island,,,,34.016667,-119.716667,,21144,,entan (2019-02-20 12:06:50),,georef batch tool 2019-02-20; GeoLocate,reviewed - high confidence,,,,,,,,,,entan,2/20/2019 11:06,,1,urn:uuid:e3d334bb-1ebe-4ff3-b625-41abf46e9ce0,https://symbiota.ccber.ucsb.edu:443/collections/individual/index.php?occid=123197
123198,UCSB,IZC,,PreservedSpecimen,0b4db999-f132-4917-9c92-cbeade8fe91a,UCSB-IZC00026913,,Animalia,Arthropoda,Insecta,Hymenoptera,Formicidae,Pheidole,2918,"Westwood, 1839",Pheidole,,,,Elaine Tan,2018,,,,,,Emily Hebard,,,,2/28/1999,1999,2,28,59,,28-Feb-99,,,,,,,,,,,,,,,,,,,United States,California,Santa Barbara,,Santa Cruz Island,,,,34.016667,-119.716667,,21144,,entan (2019-02-20 12:06:50),,georef batch tool 2019-02-20; GeoLocate,reviewed - high confidence,,,,,,,,,,entan,2/20/2019 11:06,,1,urn:uuid:0b4db999-f132-4917-9c92-cbeade8fe91a,https://symbiota.ccber.ucsb.edu:443/collections/individual/index.php?occid=123198
123199,UCSB,IZC,,PreservedSpecimen,987d2898-a42e-494b-87b9-687b071f7929,UCSB-IZC00026589,,Animalia,Arthropoda,Insecta,Hymenoptera,Formicidae,Pheidole,2918,"Westwood, 1839",Pheidole,,,,Zach Brown,2019,,,,,,Howarth,,,,12/3/1998,1998,12,3,337,,3-Dec-98,,,,,,,,,,,,,,,,,,,United States,California,Santa Barbara,,Santa Cruz Island,,0,,34.016667,-119.716667,,21144,,entan (2019-02-20 12:06:50),,georef batch tool 2019-02-20; GeoLocate,reviewed - high confidence,,,,,,,,,,entan,2/20/2019 11:06,,1,urn:uuid:987d2898-a42e-494b-87b9-687b071f7929,https://symbiota.ccber.ucsb.edu:443/collections/individual/index.php?occid=123199
123200,UCSB,IZC,,PreservedSpecimen,2f9d4ecd-ec79-4e9f-bede-e63ff247ca60,UCSB-IZC00026383,,Animalia,Arthropoda,Insecta,Hymenoptera,Formicidae,Formica,2582,"Linnaeus, 1758",Formica,,,,Zach Brown,2018,,,,,,Lina Solomon,,EEMB 118 Entomology Class,,6/16/2018,2018,6,16,167,,,,Found indoors,,,,,,,,,,,Adult,,1,Hand,,Pinned,USA,California,Santa Barbara,Goleta,"University of California, Santa Barbara Santa Ynez Apartments",,,,34.419,-119.8619,WGS84,10,,,,,,,,,,,,,,,zachary_brown,2/20/2019 10:35,,1,urn:uuid:2f9d4ecd-ec79-4e9f-bede-e63ff247ca60,https://symbiota.ccber.ucsb.edu:443/collections/individual/index.php?occid=123200
123201,UCSB,IZC,,PreservedSpecimen,9a3ec558-d03b-4371-9c78-f6d824f785c8,UCSB-IZC00026386,,Animalia,Arthropoda,Insecta,Hymenoptera,Formicidae,Formica,2582,"Linnaeus, 1758",Formica,,,,Elaine Tan,2018,,,,,,,,,,5/25/1975,1975,5,25,145,,,,,,,,,,,,,,,Adult,,1,,,Pinned,USA,California,Santa Barbara,,Santa Cruz Island,,,,34.016667,-119.716667,WGS84,20644,,,,GeoLocate,,All of Santa Cruz Island,,,,,,,,,zachary_brown,2/21/2019 16:59,,1,urn:uuid:9a3ec558-d03b-4371-9c78-f6d824f785c8,https://symbiota.ccber.ucsb.edu:443/collections/individual/index.php?occid=123201
123202,UCSB,IZC,,PreservedSpecimen,f02b28a8-5f5d-4cab-83cc-96fba49baa15,UCSB-IZC00026379,,Animalia,Arthropoda,Insecta,Hymenoptera,Formicidae,Formica,2582,"Linnaeus, 1758",Formica,,,,Elaine Tan,2018,,,,,,,,,,5/24/1975,1975,5,24,144,,,,,,,,,,,,,,,Adult,,1,,,Pinned,USA,California,Santa Barbara,,Santa Cruz Island,,,,34.016667,-119.716667,WGS84,20644,,,,GeoLocate,,All of Santa Cruz Island,,,,,,,,,zachary_brown,2/21/2019 16:59,,1,urn:uuid:f02b28a8-5f5d-4cab-83cc-96fba49baa15,https://symbiota.ccber.ucsb.edu:443/collections/individual/index.php?occid=123202
123203,UCSB,IZC,,PreservedSpecimen,30733410-f12f-4b59-9b1e-d39eb55e6f9e,UCSB-IZC00026385,,Animalia,Arthropoda,Insecta,Hymenoptera,Formicidae,Formica,2582,"Linnaeus, 1758",Formica,,,,Elaine Tan,2018,,,,,,UCSB Natural History Collections Club 2017,,,,5/28/2017,2017,5,28,148,,,,,,,,,,,,,,,Adult,,1,,,Pinned,USA,California,Santa Barbara,,Santa Cruz Island,,,,33.9999,-119.7338,WGS84,10,,,,,,,,,,,,,,,zachary_brown,2/20/2019 10:45,,1,urn:uuid:30733410-f12f-4b59-9b1e-d39eb55e6f9e,https://symbiota.ccber.ucsb.edu:443/collections/individual/index.php?occid=123203
123204,UCSB,IZC,,PreservedSpecimen,94f03ae2-6d68-4a6c-86a9-7ff3ff643673,UCSB-IZC00026632,,Animalia,Arthropoda,Insecta,Hymenoptera,Formicidae,Hypoponera,2642,"Santschi, 1938",Hypoponera,,,,Elaine Tan,2018,,,,,,Howarth,,,,1/19/1999,1999,1,19,19,,19-Jan-99,,tent,,,,,,,,,,,,,,,,,United States,California,Santa Barbara,,Santa Cruz Island,,,,34.016667,-119.716667,,21144,,entan (2019-02-20 12:06:50),,georef batch tool 2019-02-20; GeoLocate,reviewed - high confidence,,,,,,,,,,entan,2/20/2019 11:06,,1,urn:uuid:94f03ae2-6d68-4a6c-86a9-7ff3ff643673,https://symbiota.ccber.ucsb.edu:443/collections/individual/index.php?occid=123204
123205,UCSB,IZC,,PreservedSpecimen,9e53c9c3-ca4a-48e6-a369-907a337de779,UCSB-IZC00026349,,Animalia,Arthropoda,Insecta,Hymenoptera,Formicidae,Formica,2582,"Linnaeus, 1758",Formica,,,,Elaine Tan,2018,,,,,,Vasili Vagenas,,,,5/5/2016,2016,5,5,126,,,,,,,,,,,,,,,Adult,,1,,,Pinned,USA,California,Santa Barbara,Santa Barbara,Refugio Canyon,,,,34.520156,-120.057526,WGS84,14542,,,,GeoLocate,,Refugio Canyon Rd and surrounding areas,,,,,,,,,zachary_brown,2/21/2019 16:58,,1,urn:uuid:9e53c9c3-ca4a-48e6-a369-907a337de779,https://symbiota.ccber.ucsb.edu:443/collections/individual/index.php?occid=123205
123206,UCSB,IZC,,PreservedSpecimen,3dd52d6b-46ad-4b10-a7e3-a4b62771b8dd,UCSB-IZC00026931,,Animalia,Arthropoda,Insecta,Hymenoptera,Formicidae,Hypoponera,2642,"Santschi, 1938",Hypoponera,,,,Elaine Tan,2018,,,,,,Howarth,,,,1/19/1999,1999,1,19,19,,19-Jan-99,,tent,,,,,,,,,,,,,,,,,United States,California,Santa Barbara,,Santa Cruz Island,,,,34.016667,-119.716667,,21144,,entan (2019-02-20 12:06:50),,georef batch tool 2019-02-20; GeoLocate,reviewed - high confidence,,,,,,,,,,entan,2/20/2019 11:06,,1,urn:uuid:3dd52d6b-46ad-4b10-a7e3-a4b62771b8dd,https://symbiota.ccber.ucsb.edu:443/collections/individual/index.php?occid=123206
123207,UCSB,IZC,,PreservedSpecimen,9c0e428d-5e0d-4405-936c-4dc8a912fdfd,UCSB-IZC00026633,,Animalia,Arthropoda,Insecta,Hymenoptera,Formicidae,Hypoponera,2642,"Santschi, 1938",Hypoponera,,,,Elaine Tan,2018,,,,,,Howarth,,,,1/19/1999,1999,1,19,19,,19-Jan-99,,tent,,,,,,,,,,,,,,,,,United States,California,Santa Barbara,,Santa Cruz Island,,,,34.016667,-119.716667,,21144,,entan (2019-02-20 12:06:50),,georef batch tool 2019-02-20; GeoLocate,reviewed - high confidence,,,,,,,,,,entan,2/20/2019 11:06,,1,urn:uuid:9c0e428d-5e0d-4405-936c-4dc8a912fdfd,https://symbiota.ccber.ucsb.edu:443/collections/individual/index.php?occid=123207
123208,UCSB,IZC,,PreservedSpecimen,6ca746f8-f41a-43b4-a935-902cafb3fdce,UCSB-IZC00026468,,Animalia,Arthropoda,Insecta,Hymenoptera,Formicidae,Formica,2582,"Linnaeus, 1758",Formica,,,,Elaine Tan,2018,,,,,,UCSB Natural History Collections Club 2017,,,,5/28/2017,2017,5,28,148,,,,,,,,,,,,,,,Adult,,1,,,Pinned,USA,California,Santa Barbara,,Santa Cruz Island,,,,33.9999,-119.7338,WGS84,10,,,,,,,,,,,,,,,zachary_brown,2/20/2019 10:49,,1,urn:uuid:6ca746f8-f41a-43b4-a935-902cafb3fdce,https://symbiota.ccber.ucsb.edu:443/collections/individual/index.php?occid=123208
123209,UCSB,IZC,,PreservedSpecimen,3f5c8ce3-7df4-4f3d-abd3-ab665cc7f225,UCSB-IZC00026581,,Animalia,Arthropoda,Insecta,Hymenoptera,Formicidae,Hypoponera,2642,"Santschi, 1938",Hypoponera,,,,Elaine Tan,2018,,,,,,Howarth,,,,1/19/1999,1999,1,19,19,,19-Jan-99,,tent,,,,,,,,,,,,,,,,,United States,California,Santa Barbara,,Santa Cruz Island,,,,34.016667,-119.716667,,21144,,entan (2019-02-20 12:06:50),,georef batch tool 2019-02-20; GeoLocate,reviewed - high confidence,,,,,,,,,,entan,2/20/2019 11:06,,1,urn:uuid:3f5c8ce3-7df4-4f3d-abd3-ab665cc7f225,https://symbiota.ccber.ucsb.edu:443/collections/individual/index.php?occid=123209
123210,UCSB,IZC,,PreservedSpecimen,f74cb0e1-c074-4af7-aff6-f7ee516cf9f3,UCSB-IZC00026895,,Animalia,Arthropoda,Insecta,Hymenoptera,Formicidae,Hypoponera,2642,"Santschi, 1938",Hypoponera,,,,Elaine Tan,2018,,,,,,Howarth,,,,1/19/1999,1999,1,19,19,,19-Jan-99,,tent,,,,,,,,,,,,,,,,,United States,California,Santa Barbara,,Santa Cruz Island,,,,34.016667,-119.716667,,21144,,entan (2019-02-20 12:06:50),,georef batch tool 2019-02-20; GeoLocate,reviewed - high confidence,,,,,,,,,,entan,2/20/2019 11:06,,1,urn:uuid:f74cb0e1-c074-4af7-aff6-f7ee516cf9f3,https://symbiota.ccber.ucsb.edu:443/collections/individual/index.php?occid=123210
123211,UCSB,IZC,,PreservedSpecimen,bd18813c-d74b-42ea-a1bc-111c31b903e7,UCSB-IZC00026806,,Animalia,Arthropoda,Insecta,Hymenoptera,Formicidae,Formica,2582,"Linnaeus, 1758",Formica,,,,Elaine Tan,2018,,,,,,Kelsey Loman,,,,5/5/2016,2016,5,5,126,,,midday,,,,,,,,,,,,Adult,,1,,,Pinned,USA,California,Santa Barbara,Santa Barbara,Refugio Canyon,,,,34.520156,-120.057526,WGS84,14542,,,,GeoLocate,,Refugio Canyon Rd and surrounding areas,,,,,,,,,zachary_brown,2/21/2019 16:57,,1,urn:uuid:bd18813c-d74b-42ea-a1bc-111c31b903e7,https://symbiota.ccber.ucsb.edu:443/collections/individual/index.php?occid=123211
123212,UCSB,IZC,,PreservedSpecimen,a37da940-7c1a-48ea-9cbd-a5d0c95b8fed,UCSB-IZC00026712,,Animalia,Arthropoda,Insecta,Hymenoptera,Formicidae,Formica,2582,"Linnaeus, 1758",Formica,,,,Elaine Tan,2018,,,,,,K. Chau,,,,5/10/2017,2017,5,10,130,,,,,,,,,,,,,,,Adult,,1,,,Pinned,USA,California,Santa Barbara,Santa Barbara,"Refugio Canyon, Refugio Creek",,,,34.480468,-120.066311,WGS84,2199,,,,GeoLocate,,"Refugio Canyon, Creek, and surrounding areas",,,,,,,,,zachary_brown,2/21/2019 16:57,,1,urn:uuid:a37da940-7c1a-48ea-9cbd-a5d0c95b8fed,https://symbiota.ccber.ucsb.edu:443/collections/individual/index.php?occid=123212
123213,UCSB,IZC,,PreservedSpecimen,05ad5bda-78da-46ed-a84a-f0c6b3cae3ab,UCSB-IZC00026807,,Animalia,Arthropoda,Insecta,Hymenoptera,Formicidae,Formica,2582,"Linnaeus, 1758",Formica,,,,Elaine Tan,2018,,,,,,Francis Wang,,,,4/14/2018,2018,4,14,104,,,,,,,,,,,,,,,Adult,,1,Hand,,Pinned,USA,California,Santa Barbara,,Bill Wallace Trail,,,,34.4691,-120.0251,WGS84,10,,,,,,,,,,,,,,,zachary_brown,2/20/2019 10:55,,1,urn:uuid:05ad5bda-78da-46ed-a84a-f0c6b3cae3ab,https://symbiota.ccber.ucsb.edu:443/collections/individual/index.php?occid=123213
123214,UCSB,IZC,,PreservedSpecimen,c4b5efce-dc3b-432f-8e26-b833f92ea9f2,UCSB-IZC00026491,,Animalia,Arthropoda,Insecta,Hymenoptera,Formicidae,Formica,2582,"Linnaeus, 1758",Formica,,,,Zach Brown,2018,,,,,,Zahra Arsalan,,,,5/7/2018,2018,5,7,127,,,,,,,,,,,,,,,Adult,,1,Hand,,Pinned,USA,California,Santa Barbara,Isla Vista,650 Storke Rd,,,,34.419,-119.867,WGS84,10,,,,,,,,,,,,,,,zachary_brown,2/20/2019 10:57,,1,urn:uuid:c4b5efce-dc3b-432f-8e26-b833f92ea9f2,https://symbiota.ccber.ucsb.edu:443/collections/individual/index.php?occid=123214
123215,UCSB,IZC,,PreservedSpecimen,a4e7e546-9a25-4c7e-97ff-5da18dc5d7dc,UCSB-IZC00026495,,Animalia,Arthropoda,Insecta,Hymenoptera,Formicidae,Formica,2582,"Linnaeus, 1758",Formica,,,,Zach Brown,2018,,,,,,Taylor Howard,,,,5/9/2018,2018,5,9,129,,,,,,,,,,,,,,,Adult,,1,Hand,,Pinned,USA,California,Santa Barbara,,Refugio Canyon Mountain,,,,34.5336,-120.062089,WGS84,5715,,,,GeoLocate,,Refugio Pass including surrounding mountains,,,,,,,,,zachary_brown,2/21/2019 16:49,,1,urn:uuid:a4e7e546-9a25-4c7e-97ff-5da18dc5d7dc,https://symbiota.ccber.ucsb.edu:443/collections/individual/index.php?occid=123215
123216,UCSB,IZC,,PreservedSpecimen,611af716-e547-421a-816b-635b3fe0639f,UCSB-IZC00026631,,Animalia,Arthropoda,Insecta,Hymenoptera,Formicidae,Pogonomyrmex,2944,"Mayr, 1868",Pogonomyrmex,,,,Zach Brown,2019,,,,,,Emily Hebard,,,,7/8/1999,1999,7,8,189,,8-Jul-99,,,,,,,,,,,,,,,,,,,United States,California,Santa Barbara,,"Santa Cruz Island, Three Fork Canyon",,,,33.991387,-119.664955,,698,,entan (2019-02-21 13:39:34),,georef batch tool 2019-02-21; GeoLocate,reviewed - high confidence,,,,,,,,,,entan,2/21/2019 12:39,,1,urn:uuid:611af716-e547-421a-816b-635b3fe0639f,https://symbiota.ccber.ucsb.edu:443/collections/individual/index.php?occid=123216
123217,UCSB,IZC,,PreservedSpecimen,63168c86-9f7c-4065-beb2-385b4dd6877b,UCSB-IZC00026926,,Animalia,Arthropoda,Insecta,Hymenoptera,Formicidae,Pseudomyrmex,1717,"Lund, 1831",Pseudomyrmex,,,,Elaine Tan,2019,,,,,,Emily Hebard,,,,7/8/1999,1999,7,8,189,,8-Jul-99,,,,,,,,,,,,,,,,,,,United States,California,Santa Barbara,,"Santa Cruz Island, Three Fork Canyon",,,,33.991387,-119.664955,,698,,entan (2019-02-21 13:39:34),,georef batch tool 2019-02-21; GeoLocate,reviewed - high confidence,,,,,,,,,,entan,2/21/2019 12:39,,1,urn:uuid:63168c86-9f7c-4065-beb2-385b4dd6877b,https://symbiota.ccber.ucsb.edu:443/collections/individual/index.php?occid=123217
123218,UCSB,IZC,,PreservedSpecimen,f365b680-2db8-49fa-af88-c593fe2aa51a,UCSB-IZC00026353,,Animalia,Arthropoda,Insecta,Hymenoptera,Formicidae,Formica,2582,"Linnaeus, 1758",Formica,,,,Elaine Tan,2018,,,,,,Jose Bojorquez,,,,5/30/2017,2017,5,30,150,,,,,,,,,,,,,,,Adult,,1,,,Pinned,USA,California,Santa Barbara,Isla Vista,Pardall Rd,,,,34.413098,-119.855942,WGS84,,,,,GeoLocate,,Along Pardall Rd,,,,,,,,,zachary_brown,2/21/2019 16:47,,1,urn:uuid:f365b680-2db8-49fa-af88-c593fe2aa51a,https://symbiota.ccber.ucsb.edu:443/collections/individual/index.php?occid=123218
123219,UCSB,IZC,,PreservedSpecimen,0718066b-1344-4a73-aa47-2b82122c3919,UCSB-IZC00002710,,Animalia,Arthropoda,Insecta,Hymenoptera,Formicidae,Formica,2582,"Linnaeus, 1758",Formica,,,,Elaine Tan,2018,,,,,,UCSB Natural History Collections Club 2017,,,,5/28/2017,2017,5,28,148,,,"Santa Cruz Island Reserve (SCIR) Collection, 2017",,,,,,,,,,,,Adult,,1,,,Pinned,USA,California,Santa Barbara,,Santa Cruz Island,,,,33.9999,-119.7338,WGS84,10,,,,,,,,,,,,,,,zachary_brown,2/20/2019 11:02,,1,urn:uuid:0718066b-1344-4a73-aa47-2b82122c3919,https://symbiota.ccber.ucsb.edu:443/collections/individual/index.php?occid=123219
123223,UCSB,IZC,,PreservedSpecimen,17897d65-003f-4afe-ad1f-72a472d93451,UCSB-IZC00026920,,Animalia,Arthropoda,Insecta,Hymenoptera,Formicidae,Prenolepis imparis,4717,"(Say, 1836)",Prenolepis,imparis,,,Elaine Tan,2018,,,,,,Howarth,,,,12/3/1998,1998,12,3,337,,3-Dec-98,,,,,,,,,,,,,,,,,,,United States,California,Santa Barbara,,Santa Cruz Island,,,,34.016667,-119.716667,WGS84,20644,,,,GeoLocate,,All of Santa Cruz Island,,,,,,,,,entan,2/21/2019 16:45,,1,urn:uuid:17897d65-003f-4afe-ad1f-72a472d93451,https://symbiota.ccber.ucsb.edu:443/collections/individual/index.php?occid=123223
123225,UCSB,IZC,,PreservedSpecimen,472d2cd7-a774-4158-8acc-9e8eb02046fd,UCSB-IZC00026582,,Animalia,Arthropoda,Insecta,Hymenoptera,Formicidae,Prenolepis imparis,4717,"(Say, 1836)",Prenolepis,imparis,,,Elaine Tan,2018,,,,,,Howarth,,,,12/3/1998,1998,12,3,337,,3-Dec-98,,,,,,,,,,,,,,,,,,,United States,California,Santa Barbara,,Santa Cruz Island,,,,34.016667,-119.716667,WGS84,20644,,,,GeoLocate,,All of Santa Cruz Island,,,,,,,,,entan,2/21/2019 16:44,,1,urn:uuid:472d2cd7-a774-4158-8acc-9e8eb02046fd,https://symbiota.ccber.ucsb.edu:443/collections/individual/index.php?occid=123225
123227,UCSB,IZC,,PreservedSpecimen,73ea6ac9-e25e-4b32-a335-89b6e62707a0,UCSB-IZC00026608,,Animalia,Arthropoda,Insecta,Hymenoptera,Formicidae,Prenolepis imparis,4717,"(Say, 1836)",Prenolepis,imparis,,,Elaine Tan,2019,,,,,,Howarth,,,,12/3/1998,1998,12,3,337,,3-Dec-98,,,,,,,,,,,,,,,,,,,United States,California,Santa Barbara,,Santa Cruz Island,,,,34.016667,-119.716667,WGS84,20644,,,,GeoLocate,,All of Santa Cruz Island,,,,,,,,,entan,2/21/2019 16:44,,1,urn:uuid:73ea6ac9-e25e-4b32-a335-89b6e62707a0,https://symbiota.ccber.ucsb.edu:443/collections/individual/index.php?occid=123227
123228,UCSB,IZC,,PreservedSpecimen,fdff3525-f644-4cb6-a78f-74ff3273f94b,UCSB-IZC00026636,,Animalia,Arthropoda,Insecta,Hymenoptera,Formicidae,Prenolepis imparis,4717,"(Say, 1836)",Prenolepis,imparis,,,Elaine Tan,2019,,,,,,Emily Hebard,,,,12/4/1998,1998,12,4,338,,4-Dec-98,,,,,,,,,,,,,,,,,,,United States,California,Santa Barbara,,Santa Cruz Island,,,,34.016667,-119.716667,WGS84,20644,,,,GeoLocate,,All of Santa Cruz Island,,,,,,,,,entan,2/21/2019 16:44,,1,urn:uuid:fdff3525-f644-4cb6-a78f-74ff3273f94b,https://symbiota.ccber.ucsb.edu:443/collections/individual/index.php?occid=123228
123231,UCSB,IZC,,PreservedSpecimen,eda9ca85-f071-4b8b-be7a-79e178494cb5,UCSB-IZC00026591,,Animalia,Arthropoda,Insecta,Hymenoptera,Formicidae,Prenolepis imparis,4717,"(Say, 1836)",Prenolepis,imparis,,,Elaine Tan,2018,,,,,,Emily Hebard,,,,12/3/1998,1998,12,3,337,,3-Dec-98,,,,,,,,,,,,,Adult,,1,,,Pinned,United States,California,Santa Barbara,,Santa Cruz Island,,,,34.016667,-119.716667,WGS84,20644,,,,GeoLocate,,All of Santa Cruz Island,,,,,,,,,entan,2/21/2019 16:36,,1,urn:uuid:eda9ca85-f071-4b8b-be7a-79e178494cb5,https://symbiota.ccber.ucsb.edu:443/collections/individual/index.php?occid=123231
123232,UCSB,IZC,,PreservedSpecimen,1c7fb4a3-71ea-46be-97e5-9133b417979b,UCSB-IZC00026889,,Animalia,Arthropoda,Insecta,Hymenoptera,Formicidae,Prenolepis imparis,4717,"(Say, 1836)",Prenolepis,imparis,,,Elaine Tan,2019,,,,,,Howarth,,,,12/3/1998,1998,12,3,337,,3-Dec-98,,,,,,,,,,,,,Adult,,1,,,Pinned,United States,California,Santa Barbara,,Santa Cruz Island,,,,34.016667,-119.716667,WGS84,20644,,,,GeoLocate,,All of Santa Cruz Island,,,,,,,,,entan,2/21/2019 16:34,,1,urn:uuid:1c7fb4a3-71ea-46be-97e5-9133b417979b,https://symbiota.ccber.ucsb.edu:443/collections/individual/index.php?occid=123232
123234,UCSB,IZC,,PreservedSpecimen,1571ded5-450b-4e5b-a345-27455898ead4,UCSB-IZC00026584,,Animalia,Arthropoda,Insecta,Hymenoptera,Formicidae,Prenolepis imparis,4717,"(Say, 1836)",Prenolepis,imparis,,,Elaine Tan,2019,,,,,,Emily Hebard,,,,12/4/1998,1998,12,4,338,,4-Dec-98,,,,,,,,,,,,,Adult,,1,,,Pinned,United States,California,Santa Barbara,,Santa Cruz Island,,,,34.016667,-119.716667,WGS84,20644,,,,GeoLocate,,All of Santa Cruz Island,,,,,,,,,entan,2/21/2019 16:34,,1,urn:uuid:1571ded5-450b-4e5b-a345-27455898ead4,https://symbiota.ccber.ucsb.edu:443/collections/individual/index.php?occid=123234
123235,UCSB,IZC,,PreservedSpecimen,3328a8b4-be86-4b8c-93c6-ec9041c29e50,UCSB-IZC00026585,,Animalia,Arthropoda,Insecta,Hymenoptera,Formicidae,Prenolepis imparis,4717,"(Say, 1836)",Prenolepis,imparis,,,Elaine Tan,2019,,,,,,Emily Hebard,,,,12/4/1998,1998,12,4,338,,4-Dec-98,,,,,,,,,,,,,Adult,,1,,,Pinned,United States,California,Santa Barbara,,Santa Cruz Island,,,,34.016667,-119.716667,WGS84,20644,,,,GeoLocate,,,,,,,,,,,entan,2/21/2019 16:33,,1,urn:uuid:3328a8b4-be86-4b8c-93c6-ec9041c29e50,https://symbiota.ccber.ucsb.edu:443/collections/individual/index.php?occid=123235
123236,UCSB,IZC,,PreservedSpecimen,9d163c5a-b96c-4e91-a07e-4ac01db4eb0a,UCSB-IZC00026883,,Animalia,Arthropoda,Insecta,Hymenoptera,Formicidae,Prenolepis imparis,4717,"(Say, 1836)",Prenolepis,imparis,,,Elaine Tan,2019,,,,,,Howarth,,,,12/3/1998,1998,12,3,337,,3-Dec-98,,,,,,,,,,,,,Adult,,1,,,Pinned,United States,California,Santa Barbara,,Santa Cruz Island,,,,34.016667,-119.716667,WGS84,20644,,,,GeoLocate,,All of Santa Cruz Island,,,,,,,,,entan,2/21/2019 16:33,,1,urn:uuid:9d163c5a-b96c-4e91-a07e-4ac01db4eb0a,https://symbiota.ccber.ucsb.edu:443/collections/individual/index.php?occid=123236
123238,UCSB,IZC,,PreservedSpecimen,85f563c0-13f5-4777-8f02-4d926a2b10e9,UCSB-IZC00026881,,Animalia,Arthropoda,Insecta,Hymenoptera,Formicidae,Prenolepis imparis,4717,"(Say, 1836)",Prenolepis,imparis,,,Elaine Tan,2019,,,,,,Howarth,,,,12/3/1998,1998,12,3,337,,3-Dec-98,,,,,,,,,,,,,Adult,,1,,,Pinned,United States,California,Santa Barbara,,Santa Cruz Island,,,,34.016667,-119.716667,WGS84,20644,,,,GeoLocate,,,,,,,,,,,entan,2/21/2019 16:32,,1,urn:uuid:85f563c0-13f5-4777-8f02-4d926a2b10e9,https://symbiota.ccber.ucsb.edu:443/collections/individual/index.php?occid=123238
123239,UCSB,IZC,,PreservedSpecimen,d1105ce2-c401-4d5b-bc57-8bd270819edf,UCSB-IZC00026939,,Animalia,Arthropoda,Insecta,Hymenoptera,Formicidae,Prenolepis imparis,4717,"(Say, 1836)",Prenolepis,imparis,,,John Longino,1986,,,,,,John Longino,,,84-80,12/3/1998,1998,12,3,337,,3-Dec-98,,,,,,,,,,,,,,,,,,,United States,California,Santa Barbara,,Santa Cruz Island,,,,34.016667,-119.716667,WGS84,20644,,,,GeoLocate,,All of Santa Cruz Island,,,,,,,,,entan,2/21/2019 16:32,,1,urn:uuid:d1105ce2-c401-4d5b-bc57-8bd270819edf,https://symbiota.ccber.ucsb.edu:443/collections/individual/index.php?occid=123239
123262,UCSB,IZC,,PreservedSpecimen,c60d0903-1ffc-42e6-9477-bd0baba62c64,UCSB-IZC00026509,,Animalia,Arthropoda,Insecta,Hymenoptera,Formicidae,Monomorium,2763,"Mayr, 1855",Monomorium,,,,Elaine Tan,2018,,,,,,Jack Hammang,,,,5/15/2015,2015,5,15,135,,,,,,,,,,,,,,,Adult,,1,,,Pinned,USA,California,Santa Barbara,,Deveruex Slough,,,,34.413199,-119.877668,WGS84,,,,,GeoLocate,,Entirety of Slough,,,,,,,,,aurora2,2/21/2019 16:31,,1,urn:uuid:c60d0903-1ffc-42e6-9477-bd0baba62c64,https://symbiota.ccber.ucsb.edu:443/collections/individual/index.php?occid=123262
123265,UCSB,IZC,,PreservedSpecimen,69ae0bf2-6ff9-4db5-9adf-a2db57d65f18,UCSB-IZC00026392,,Animalia,Arthropoda,Insecta,Hymenoptera,Formicidae,Monomorium,2763,"Mayr, 1855",Monomorium,,,,Elaine Tan,2018,,,,,,Mimi (Weiwei) Liu,,EEMB 118 Entomology Class,,7/13/2018,2018,7,13,194,,,,Restored coastal sage scrub,,,,,,,,,,,Adult,,1,Aerial net,,Pinned,USA,California,Santa Barbara,,Bluffs Overlook Trail,,,,34.4163,-119.8854,WGS84,,,,,,,,,,,,,,,,aurora2,2/22/2019 13:43,,1,urn:uuid:69ae0bf2-6ff9-4db5-9adf-a2db57d65f18,https://symbiota.ccber.ucsb.edu:443/collections/individual/index.php?occid=123265
123268,UCSB,IZC,,PreservedSpecimen,bc8fc0da-e559-4c0e-a92b-e0123dd78931,UCSB-IZC00026649,,Animalia,Arthropoda,Insecta,Hymenoptera,Formicidae,Temnothorax,5544,"Mayr, 1861",Temnothorax,,,,Zach Brown,2018,,,,,,,,,,6/30/1982,1982,6,30,181,,,"Santa Cruz Island Reserve (SCIR) Collection, 2017",,,,,,,,,,,,Adult,,1,,,Pinned,USA,California,Santa Barbara,,Santa Cruz Island,,,,34.016667,-119.716667,WGS84,20644,,,,GeoLocate,,All of Santa Cruz Island,,,,,,,,,zachary_brown,2/21/2019 16:29,,1,urn:uuid:bc8fc0da-e559-4c0e-a92b-e0123dd78931,https://symbiota.ccber.ucsb.edu:443/collections/individual/index.php?occid=123268
123272,UCSB,IZC,,PreservedSpecimen,656594b5-df26-41b2-b06a-ce5b21522522,UCSB-IZC00026735,,Animalia,Arthropoda,Insecta,Hymenoptera,Formicidae,Temnothorax,5544,"Mayr, 1861",Temnothorax,,,,Zach Brown,2018,,,,,,,,,,7/8/1981,1981,7,8,189,,,"Santa Cruz Island Reserve (SCIR) Collection, 2017",,,,,,,,,,,,Adult,,1,,,Pinned,USA,California,Santa Barbara,,Santa Cruz Island,,,,34.016667,-119.716667,WGS84,20644,,,,GeoLocate,,All of Santa Cruz Island,,,,,,,,,zachary_brown,2/21/2019 16:29,,1,urn:uuid:656594b5-df26-41b2-b06a-ce5b21522522,https://symbiota.ccber.ucsb.edu:443/collections/individual/index.php?occid=123272
123273,UCSB,IZC,,PreservedSpecimen,611a11f1-e399-41f2-a8fa-c776f1f245f6,UCSB-IZC00026366,,Animalia,Arthropoda,Insecta,Hymenoptera,Formicidae,Monomorium minimum,5547,"(Buckley, 1867)",Monomorium,minimum,,,J. Longino,1986,,,,,,J. Longino,,24-27 Aug. 1984,,8/24/1984,1984,8,24,237,,,,,,,,,,,,,,,Adult,,2,,,Pinned,USA,California,Santa Barbara,,Santa Cruz Island,,,,34.016667,-119.716667,WGS84,20644,,,,GeoLocate,,All of Santa Cruz Island,,,,,,200,,,aurora2,2/21/2019 16:28,,1,urn:uuid:611a11f1-e399-41f2-a8fa-c776f1f245f6,https://symbiota.ccber.ucsb.edu:443/collections/individual/index.php?occid=123273
123274,UCSB,IZC,,PreservedSpecimen,ec930b30-9f13-43c3-84b1-4fac73c95379,UCSB-IZC00026705,,Animalia,Arthropoda,Insecta,Hymenoptera,Formicidae,Temnothorax,5544,"Mayr, 1861",Temnothorax,,,,Elaine Tan,2018,,,,,,,,,,7/8/1981,1981,7,8,189,,,"Santa Cruz Island Reserve (SCIR) Collection, 2017",,,,,,,,,,,,Adult,,1,,,Pinned,USA,California,Santa Barbara,,Santa Cruz Island,,,,34.016667,-119.716667,WGS84,20644,,,,GeoLocate,,All of Santa Cruz Island,,,,,,,,,zachary_brown,2/21/2019 16:28,,1,urn:uuid:ec930b30-9f13-43c3-84b1-4fac73c95379,https://symbiota.ccber.ucsb.edu:443/collections/individual/index.php?occid=123274
123276,UCSB,IZC,,PreservedSpecimen,6e67d5b1-46b3-4893-981f-e5a90a348bad,UCSB-IZC00026681,,Animalia,Arthropoda,Insecta,Hymenoptera,Formicidae,Temnothorax,5544,"Mayr, 1861",Temnothorax,,,,Zach Brown,2018,,,,,,,,,,7/8/1981,1981,7,8,189,,,"Santa Cruz Island Reserve (SCIR) Collection, 2017",,,,,,,,,,,,Adult,,1,,,Pinned,USA,California,Santa Barbara,,Santa Cruz Island,,,,34.016667,-119.716667,WGS84,20644,,,,GeoLocate,,All of Santa Cruz Island,,,,,,,,,zachary_brown,2/21/2019 16:27,,1,urn:uuid:6e67d5b1-46b3-4893-981f-e5a90a348bad,https://symbiota.ccber.ucsb.edu:443/collections/individual/index.php?occid=123276
123279,UCSB,IZC,,PreservedSpecimen,16413633-2509-40b3-af7f-173db52466a5,UCSB-IZC00026351,,Animalia,Arthropoda,Insecta,Hymenoptera,Formicidae,Temnothorax,5544,"Mayr, 1861",Temnothorax,,,,Elaine Tan,2018,,,,,,UCSB Arthropod Survey,,,CSM-PIT-01,4/25/2016,2016,4,25,116,,"Apr 25-26, 2016",,,,,,,,,,,,,Adult,,2,Pitfall,,,USA,California,Santa Barbara,Goleta,North Campus Open Space,,,,34.4205,-119.8792,WGS84,10,,,,GeoLocate,,,,,,,,,,,zachary_brown,2/22/2019 15:47,,1,urn:uuid:16413633-2509-40b3-af7f-173db52466a5,https://symbiota.ccber.ucsb.edu:443/collections/individual/index.php?occid=123279
123281,UCSB,IZC,,PreservedSpecimen,a4dcd94b-b2e5-4fed-a7c6-acb4fa081a44,UCSB-IZC00026356,,Animalia,Arthropoda,Insecta,Hymenoptera,Formicidae,Leptothorax andrei,5546,"Emery, 1895",Leptothorax,andrei,,,J. Longino,1986,,,,,,J. Longino,,,,8/24/1984,1984,8,24,237,,24-27 Aug. 1984,,,,,,,,,,,,,Adult,,1,,,Pinned,USA,California,Santa Barbara,,Santa Cruz Island,,,,34.016667,-119.716667,WGS84,20644,,,,GeoLocate,,All of Santa Cruz Island,0,200,,,,,,,aurora2,2/21/2019 16:27,,1,urn:uuid:a4dcd94b-b2e5-4fed-a7c6-acb4fa081a44,https://symbiota.ccber.ucsb.edu:443/collections/individual/index.php?occid=123281
123282,UCSB,IZC,,PreservedSpecimen,ddc59ee1-d961-4753-a511-a417d79a03cf,UCSB-IZC00026498,,Animalia,Arthropoda,Insecta,Hymenoptera,Formicidae,Pheidole,2918,"Westwood, 1839",Pheidole,,,,Zach Brown,2018,,,,,,Zach Muir,,,,5/10/2017,2017,5,10,130,,,,,,,,,,,,,,,Adult,,1,,,Pinned,USA,California,Santa Barbara,Refugio Canyon,Refugio Creek,,,,34.490824,-120.066082,WGS84,3198,,,,GeoLocate,,"Refugio Canyon, Creek, and surrounding areas",,,,,,,,,aurora2,2/21/2019 16:26,,1,urn:uuid:ddc59ee1-d961-4753-a511-a417d79a03cf,https://symbiota.ccber.ucsb.edu:443/collections/individual/index.php?occid=123282
123288,UCSB,IZC,,PreservedSpecimen,e8e04837-50d9-470d-b3d2-daeeb13d71c5,UCSB-IZC00026726,,Animalia,Arthropoda,Insecta,Hymenoptera,Formicidae,Veromessor chamberlini,5550,"(Wheeler, W.M., 1915)",Veromessor,chamberlini,,,Zach Brown,2018,,,,,,,,,,5/4/1974,1974,5,4,124,,,,500m West of UC Research Station,,,,,,,,,,,Adult,,1,,,Pinned,USA,California,Santa Barbara,,Santa Cruz Island,,,,34.016667,-119.716667,WGS84,20644,,,,GeoLocate,,All of Santa Cruz Island,,,,,,,,,zachary_brown,2/21/2019 16:18,,1,urn:uuid:e8e04837-50d9-470d-b3d2-daeeb13d71c5,https://symbiota.ccber.ucsb.edu:443/collections/individual/index.php?occid=123288
123290,UCSB,IZC,,PreservedSpecimen,7b356fc8-c051-4085-8d0c-7a6a93ceca43,UCSB-IZC00026672,,Animalia,Arthropoda,Insecta,Hymenoptera,Formicidae,Pheidole,2918,"Westwood, 1839",Pheidole,,,,Elaine Tan,2018,,,,,,UCSB Natural History Collections Club,,,,5/28/2017,2017,5,28,148,,,,,,,,,,,,,,,Adult,,1,,,Pinned,USA,California,Santa Barbara,,St. Cruz Is.,,,,33.9999,-119.7338,WGS84,,,,,,,,,,,,,,,,aurora2,2/22/2019 13:43,,1,urn:uuid:7b356fc8-c051-4085-8d0c-7a6a93ceca43,https://symbiota.ccber.ucsb.edu:443/collections/individual/index.php?occid=123290
123293,UCSB,IZC,,PreservedSpecimen,b322c89c-e2a9-46f7-aff9-b3c0493c110b,UCSB-IZC00026753,,Animalia,Arthropoda,Insecta,Hymenoptera,Formicidae,Veromessor chamberlini,5550,"(Wheeler, W.M., 1915)",Veromessor,chamberlini,,,Elaine Tan,2018,,,,,,,,,,5/4/1974,1974,5,4,124,,,,500m West of UC Research Station,,,,,,,,,,,Adult,,1,,,Pinned,USA,California,Santa Barbara,,Santa Cruz Island,,,,34.016667,-119.716667,WGS84,20644,,,,GeoLocate,,All of Santa Cruz Island,,,,,,,,,zachary_brown,2/21/2019 16:17,,1,urn:uuid:b322c89c-e2a9-46f7-aff9-b3c0493c110b,https://symbiota.ccber.ucsb.edu:443/collections/individual/index.php?occid=123293
123294,UCSB,IZC,,PreservedSpecimen,3be14ac5-b056-4756-915b-28a5f6a23346,UCSB-IZC00026808,,Animalia,Arthropoda,Insecta,Hymenoptera,Formicidae,Pheidole,2918,"Westwood, 1839",Pheidole,,,,Elaine Tan,2018,,,,,,UCSB Natural History Collections Club,,,,5/28/2017,2017,5,28,148,,,,,,,,,,,,,,,Adult,,1,,,Pinned,USA,California,Santa Barbara,,Santa Cruz Island,,,,33.9999,-119.7338,WGS84,,,,,,,,,,,,,,,,aurora2,2/22/2019 13:43,,1,urn:uuid:3be14ac5-b056-4756-915b-28a5f6a23346,https://symbiota.ccber.ucsb.edu:443/collections/individual/index.php?occid=123294
123295,UCSB,IZC,,PreservedSpecimen,30da08eb-114b-432d-b2cc-c4f0b131cbaa,UCSB-IZC00026653,,Animalia,Arthropoda,Insecta,Hymenoptera,Formicidae,Veromessor chamberlini,5550,"(Wheeler, W.M., 1915)",Veromessor,chamberlini,,,Zach Brown,2018,,,,,,,,,,5/4/1974,1974,5,4,124,,,"Santa Cruz Island Reserve (SCIR) Collection, 2017",500m West of UC Research Station,,,,,,,,,,,Adult,,1,,,Pinned,USA,California,Santa Barbara,,Santa Cruz Island,,,,34.016667,-119.716667,WGS84,20644,,,,GeoLocate,,All of Santa Cruz Island,,,,,,,,,zachary_brown,2/21/2019 16:16,,1,urn:uuid:30da08eb-114b-432d-b2cc-c4f0b131cbaa,https://symbiota.ccber.ucsb.edu:443/collections/individual/index.php?occid=123295
123297,UCSB,IZC,,PreservedSpecimen,ffcece2c-b545-4344-b986-6397ba218cb8,UCSB-IZC00026715,,Animalia,Arthropoda,Insecta,Hymenoptera,Formicidae,Pheidole,2918,"Westwood, 1839",Pheidole,,,,Elaine Tan,2018,,,,,,UCSB Natural History Collections Club,,,,5/28/2017,2017,5,28,148,,,,,,,,,,,,,,,Adult,,1,,,Pinned,USA,California,Santa Barbara,,Santa Cruz Island,,,,33.9999,-119.7338,WGS84,,,,,,,,,,,,,,,,aurora2,2/22/2019 13:43,,1,urn:uuid:ffcece2c-b545-4344-b986-6397ba218cb8,https://symbiota.ccber.ucsb.edu:443/collections/individual/index.php?occid=123297
123299,UCSB,IZC,,PreservedSpecimen,922b364b-6002-42f2-9a8b-60f942fa45d5,UCSB-IZC00026341,,Animalia,Arthropoda,Insecta,Hymenoptera,Formicidae,Veromessor chamberlini,5550,"(Wheeler, W.M., 1915)",Veromessor,chamberlini,,,J. Longino,1986,,,,,,,,,,5/4/1974,1974,5,4,124,,,"Santa Cruz Island Reserve (SCIR) Collection, 2017",300m East of UC Reserve Station,,,,,,,,,,,Adult,,1,,,Pinned,USA,California,Santa Barbara,,Santa Cruz Island,,,,34.016667,-119.716667,WGS84,20644,,,,GeoLocate,,All of Santa Cruz Island,,,,,,,,,zachary_brown,2/21/2019 16:16,,1,urn:uuid:922b364b-6002-42f2-9a8b-60f942fa45d5,https://symbiota.ccber.ucsb.edu:443/collections/individual/index.php?occid=123299
123300,UCSB,IZC,,PreservedSpecimen,d0394cc6-75ab-4e32-8f4a-f79ba5523a66,UCSB-IZC00026805,,Animalia,Arthropoda,Insecta,Hymenoptera,Formicidae,Pheidole,2918,"Westwood, 1839",Pheidole,,,,Elaine Tan,2018,,,,,,UCSB Natural History Collections Club,,,,5/28/2017,2017,5,28,148,,,,,,,,,,,,,,,Adult,,1,,,Pinned,USA,California,Santa Barbara,,Santa Cruz Island,,,,33.9999,-119.7338,WGS84,,,,,,,,,,,,,,,,aurora2,2/22/2019 13:43,,1,urn:uuid:d0394cc6-75ab-4e32-8f4a-f79ba5523a66,https://symbiota.ccber.ucsb.edu:443/collections/individual/index.php?occid=123300
123303,UCSB,IZC,,PreservedSpecimen,ad8596c5-7f1d-4da3-ba22-633073fff00d,UCSB-IZC00026388,,Animalia,Arthropoda,Insecta,Hymenoptera,Formicidae,Pheidole,2918,"Westwood, 1839",Pheidole,,,,Elaine Tan,2018,,,,,,UCSB Natural History Collections Club,,,,5/28/2017,2017,5,28,148,,,,,,,,,,,,,,,Adult,,1,,,Pinned,USA,California,Santa Barbara,,Santa Cruz Island,,,,33.9999,-119.7338,WGS84,,,,,,,,,,,,,,,,aurora2,2/22/2019 13:43,,1,urn:uuid:ad8596c5-7f1d-4da3-ba22-633073fff00d,https://symbiota.ccber.ucsb.edu:443/collections/individual/index.php?occid=123303
123305,UCSB,IZC,,PreservedSpecimen,c7933a61-34de-4ab7-a2ec-aaf608546ad2,UCSB-IZC00026467,,Animalia,Arthropoda,Insecta,Hymenoptera,Formicidae,Pheidole,2918,"Westwood, 1839",Pheidole,,,,Elaine Tan,2018,,,,,,UCSB Natural History Collections Club,,,,5/28/2017,2017,5,28,148,,,,,,,,,,,,,,,Adult,,1,,,Pinned,USA,Califonia,Santa Barbara,,Santa Cruz Island,,,,33.9999,-119.7338,WGS84,,,,,,,,,,,,,,,,aurora2,2/22/2019 13:43,,1,urn:uuid:c7933a61-34de-4ab7-a2ec-aaf608546ad2,https://symbiota.ccber.ucsb.edu:443/collections/individual/index.php?occid=123305
123306,UCSB,IZC,,PreservedSpecimen,bd8a6df0-3bf7-4ef1-8d54-326c7adb8276,UCSB-IZC00026478,,Animalia,Arthropoda,Insecta,Hymenoptera,Formicidae,Dorymyrmex,1493,"Mayr, 1866",Dorymyrmex,,,,Elaine Tan,2019,,,,,,Emily Hebard,,,,2/27/1999,1999,2,27,58,,,"Santa Cruz Island Reserve (SCIR) Collection, 2017",,,,,,,,,,,,Adult,,1,,,Pinned,USA,California,Santa Barbara,,Santa Cruz Island,,,,34.016667,-119.716667,WGS84,20644,,,,GeoLocate,,All of Santa Cruz Island,,,,,,,,,zachary_brown,2/21/2019 16:15,,1,urn:uuid:bd8a6df0-3bf7-4ef1-8d54-326c7adb8276,https://symbiota.ccber.ucsb.edu:443/collections/individual/index.php?occid=123306
123307,UCSB,IZC,,PreservedSpecimen,e44b4808-5ccf-417c-aa5a-552b39fb15da,UCSB-IZC00026577,,Animalia,Arthropoda,Insecta,Hymenoptera,Formicidae,Dorymyrmex,1493,"Mayr, 1866",Dorymyrmex,,,,Elaine Tan,2019,,,,,,Emily Hebard,,,,2/27/1999,1999,2,27,58,,,"Santa Cruz Island Reserve (SCIR) Collection, 2017",,,,,,,,,,,,Adult,,1,,,Pinned,USA,California,Santa Barbara,,Santa Cruz Island,,0,,34.016667,-119.716667,WGS84,20644,,,,GeoLocate,,All of Santa Cruz Island,,,,,,,,,zachary_brown,2/21/2019 16:14,,1,urn:uuid:e44b4808-5ccf-417c-aa5a-552b39fb15da,https://symbiota.ccber.ucsb.edu:443/collections/individual/index.php?occid=123307
123308,UCSB,IZC,,PreservedSpecimen,525d3e05-bef5-4652-82d6-eccfce7392cf,UCSB-IZC00026675,,Animalia,Arthropoda,Insecta,Hymenoptera,Formicidae,Dorymyrmex,1493,"Mayr, 1866",Dorymyrmex,,,,Elaine Tan,2019,,,,,,Emily Hebard,,,,2/27/1999,1999,2,27,58,,,"Santa Cruz Island Reserve (SCIR) Collection, 2017",,,,,,,,,,,,Adult,,1,,,Pinned,USA,California,Santa Barbara,,Santa Cruz Island,,0,,34.016667,-119.716667,WGS84,20644,,,,GeoLocate,,All of Santa Cruz Island,,,,,,,,,zachary_brown,2/21/2019 16:14,,1,urn:uuid:525d3e05-bef5-4652-82d6-eccfce7392cf,https://symbiota.ccber.ucsb.edu:443/collections/individual/index.php?occid=123308
123309,UCSB,IZC,,PreservedSpecimen,c244bbf8-b8df-4e1c-9a68-e469e200ff53,UCSB-IZC00026572,,Animalia,Arthropoda,Insecta,Hymenoptera,Formicidae,Pheidole,2918,"Westwood, 1839",Pheidole,,,,Elaine Tan,2018,,,,,,UCSB Natural History Collections Club,,,,5/28/2017,2017,5,28,148,,,,,,,,,,,,,,,Adult,,1,,,Pinned,USA,California,Santa Barbara,,Santa Cruz Island,,,,33.9999,-119.7338,WGS84,,,,,,,,,,,,,,,,aurora2,2/22/2019 13:43,,1,urn:uuid:c244bbf8-b8df-4e1c-9a68-e469e200ff53,https://symbiota.ccber.ucsb.edu:443/collections/individual/index.php?occid=123309
123312,UCSB,IZC,,PreservedSpecimen,4c15902d-f8aa-4add-8be7-35fc55a9a143,UCSB-IZC00026813,,Animalia,Arthropoda,Insecta,Hymenoptera,Formicidae,Dorymyrmex,1493,"Mayr, 1866",Dorymyrmex,,,,Zach Brown,2019,,,,,,Emily Hebard,,,,12/2/1998,1998,12,2,336,,,"Santa Cruz Island Reserve (SCIR) Collection, 2017",,,,,,,,,,,,Adult,,1,,,Pinned,USA,California,Santa Barbara,,Santa Cruz Island,,,,34.016667,-119.716667,WGS84,20644,,,,GeoLocate,,,,,,,,,,,zachary_brown,2/21/2019 16:13,,1,urn:uuid:4c15902d-f8aa-4add-8be7-35fc55a9a143,https://symbiota.ccber.ucsb.edu:443/collections/individual/index.php?occid=123312
123313,UCSB,IZC,,PreservedSpecimen,ed145716-725d-42de-a425-9abd0beec7ea,UCSB-IZC00026362,,Animalia,Arthropoda,Insecta,Hymenoptera,Formicidae,Dorymyrmex,1493,"Mayr, 1866",Dorymyrmex,,,,Zach Brown,2019,,,,,,Emily Hebard,,,,1/23/1999,1999,1,23,23,,,"Santa Cruz Island Reserve (SCIR) Collection, 2017",,,,,,,,,,,,Adult,,1,,,Pinned,USA,California,Santa Barbara,,Santa Cruz Island,,,,34.016667,-119.716667,WGS84,20644,,,,GeoLocate,,All of Santa Cruz Island,,,,,,,,,zachary_brown,2/21/2019 16:13,,1,urn:uuid:ed145716-725d-42de-a425-9abd0beec7ea,https://symbiota.ccber.ucsb.edu:443/collections/individual/index.php?occid=123313
123315,UCSB,IZC,,PreservedSpecimen,a283069a-78ec-4161-a61c-3c36117b20e1,UCSB-IZC00026680,,Animalia,Arthropoda,Insecta,Hymenoptera,Formicidae,Dorymyrmex,1493,"Mayr, 1866",Dorymyrmex,,,,Elaine Tan,2019,,,,,,Emily Hebard,,,,11/30/1998,1998,11,30,334,,,"Santa Cruz Island Reserve (SCIR) Collection, 2017",,,,,,,,,,,,Adult,,1,,,Pinned,USA,California,Santa Barbara,,Santa Cruz Island,,,,34.016667,-119.716667,WGS84,20644,,,,GeoLocate,,All of Santa Cruz Island,,,,,,,,,zachary_brown,2/21/2019 16:13,,1,urn:uuid:a283069a-78ec-4161-a61c-3c36117b20e1,https://symbiota.ccber.ucsb.edu:443/collections/individual/index.php?occid=123315
123316,UCSB,IZC,,PreservedSpecimen,c7ff435a-0caf-42dd-9bcb-12a4382129a4,UCSB-IZC00026756,,Animalia,Arthropoda,Insecta,Hymenoptera,Formicidae,Dorymyrmex,1493,"Mayr, 1866",Dorymyrmex,,,,Elaine Tan,2019,,,,,,Emily Hebard,,,,11/30/1998,1998,11,30,334,,,"Santa Cruz Island Reserve (SCIR) Collection, 2017",,,,,,,,,,,,Adult,,1,,,Pinned,USA,California,Santa Barbara,,Santa Cruz Island,,,,34.016667,-119.716667,WGS84,20644,,,,GeoLocate,,All of Santa Cruz Island,,,,,,,,,zachary_brown,2/21/2019 16:12,,1,urn:uuid:c7ff435a-0caf-42dd-9bcb-12a4382129a4,https://symbiota.ccber.ucsb.edu:443/collections/individual/index.php?occid=123316
123317,UCSB,IZC,,PreservedSpecimen,a2ac41b7-ce29-4f36-95bc-9e9d0ba9ec33,UCSB-IZC00026678,,Animalia,Arthropoda,Insecta,Hymenoptera,Formicidae,Dorymyrmex,1493,"Mayr, 1866",Dorymyrmex,,,,Elaine Tan,2019,,,,,,Emily Hebard,,,,11/30/1998,1998,11,30,334,,,"Santa Cruz Island Reserve (SCIR) Collection, 2017",,,,,,,,,,,,Adult,,1,,,Pinned,USA,California,Santa Barbara,,Santa Cruz Island,,,,34.016667,-119.716667,WGS84,20644,,,,GeoLocate,,All of Santa Cruz Island,,,,,,,,,zachary_brown,2/21/2019 16:09,,1,urn:uuid:a2ac41b7-ce29-4f36-95bc-9e9d0ba9ec33,https://symbiota.ccber.ucsb.edu:443/collections/individual/index.php?occid=123317
123319,UCSB,IZC,,PreservedSpecimen,02478743-e490-4256-8aa1-e77ff5fd997f,UCSB-IZC00026487,,Animalia,Arthropoda,Insecta,Hymenoptera,Formicidae,Dorymyrmex,1493,"Mayr, 1866",Dorymyrmex,,,,Elaine Tan,2019,,,,,,Emily Hebard,,,,11/30/1998,1998,11,30,334,,,"Santa Cruz Island Reserve (SCIR) Collection, 2017",,,,,,,,,,,,Adult,,1,,,Pinned,USA,California,Santa Barbara,,Santa Cruz Island,,,,34.016667,-119.716667,WGS84,20644,,,,GeoLocate,,All of Santa Cruz Island,,,,,,,,,zachary_brown,2/21/2019 16:09,,1,urn:uuid:02478743-e490-4256-8aa1-e77ff5fd997f,https://symbiota.ccber.ucsb.edu:443/collections/individual/index.php?occid=123319
123320,UCSB,IZC,,PreservedSpecimen,5b04aca6-9a67-4770-96ac-446947a505e1,UCSB-IZC00026481,,Animalia,Arthropoda,Insecta,Hymenoptera,Formicidae,Dorymyrmex,1493,"Mayr, 1866",Dorymyrmex,,,,Zach Brown,2019,,,,,,Emily Hebard,,,,11/30/1998,1998,11,30,334,,,"Santa Cruz Island Reserve (SCIR) Collection, 2017",,,,,,,,,,,,Adult,,1,,,Pinned,USA,California,Santa Barbara,,Santa Cruz Island,,,,34.016667,-119.716667,WGS84,20644,,,,GeoLocate,,All of Santa Cruz Island,,,,,,,,,zachary_brown,2/21/2019 16:08,,1,urn:uuid:5b04aca6-9a67-4770-96ac-446947a505e1,https://symbiota.ccber.ucsb.edu:443/collections/individual/index.php?occid=123320
123322,UCSB,IZC,,PreservedSpecimen,46810489-e85f-468f-94cd-bdb89dacbcae,UCSB-IZC00026472,,Animalia,Arthropoda,Insecta,Hymenoptera,Formicidae,Dorymyrmex,1493,"Mayr, 1866",Dorymyrmex,,,,Zach Brown,2019,,,,,,Emily Hebard,,,,11/30/1998,1998,11,30,334,,,"Santa Cruz Island Reserve (SCIR) Collection, 2017",,,,,,,,,,,,Adult,,1,,,Pinned,USA,California,Santa Barbara,,Santa Cruz Island,,,,34.016667,-119.716667,WGS84,20644,,,,GeoLocate,,All of Santa Cruz Island,,,,,,,,,zachary_brown,2/21/2019 16:08,,1,urn:uuid:46810489-e85f-468f-94cd-bdb89dacbcae,https://symbiota.ccber.ucsb.edu:443/collections/individual/index.php?occid=123322
123323,UCSB,IZC,,PreservedSpecimen,398d9c08-c962-4469-b355-ad8600a99682,UCSB-IZC00026803,,Animalia,Arthropoda,Insecta,Hymenoptera,Formicidae,Dorymyrmex,1493,"Mayr, 1866",Dorymyrmex,,,,Zach Brown,2019,,,,,,Emily Hebard,,,,11/30/1998,1998,11,30,334,,,"Santa Cruz Island Reserve (SCIR) Collection, 2017",,,,,,,,,,,,Adult,,1,,,Pinned,USA,California,Santa Barbara,,Santa Cruz Island,,,,34.016667,-119.716667,WGS84,20644,,,,GeoLocate,,All of Santa Cruz Island,,,,,,,,,zachary_brown,2/21/2019 16:07,,1,urn:uuid:398d9c08-c962-4469-b355-ad8600a99682,https://symbiota.ccber.ucsb.edu:443/collections/individual/index.php?occid=123323
123325,UCSB,IZC,,PreservedSpecimen,0aa2496f-4b7d-47b4-b71e-355d221506f4,UCSB-IZC00026707,,Animalia,Arthropoda,Insecta,Hymenoptera,Formicidae,Pogonomyrmex,2944,"Mayr, 1868",Pogonomyrmex,,,,Zach Brown,2018,,,,,,Kimberly Tang,,,,6/5/2018,2018,6,5,156,,,,,,,,,,,,,,,Adult,,1,Hand Collected,,Pinned,USA,California,Santa Barbara,,"University of California, Santa Barbara Henley Gate",,,,34.4145,-119.839,WGS84,,,,,,,,,,,,,,,,aurora2,2/20/2019 18:54,,1,urn:uuid:0aa2496f-4b7d-47b4-b71e-355d221506f4,https://symbiota.ccber.ucsb.edu:443/collections/individual/index.php?occid=123325
123326,UCSB,IZC,,PreservedSpecimen,83e1470c-8211-45a4-9c81-305e2619988b,UCSB-IZC00026771,,Animalia,Arthropoda,Insecta,Hymenoptera,Formicidae,Tapinoma,1765,"Förster, 1850",Tapinoma,,,,Elaine Tan,2019,,,,,,Howarth,,,,1/19/1999,1999,1,19,19,,,"Santa Cruz Island Reserve (SCIR) Collection, 2017",,,,,,,,,,,,Adult,,1,,,Pinned,USA,California,Santa Barbara,,Santa Cruz Island,,,,34.016667,-119.716667,WGS84,20644,,,,GeoLocate,,All of Santa Cruz Island,,,,,,,,,zachary_brown,2/21/2019 16:07,,1,urn:uuid:83e1470c-8211-45a4-9c81-305e2619988b,https://symbiota.ccber.ucsb.edu:443/collections/individual/index.php?occid=123326
123328,UCSB,IZC,,PreservedSpecimen,cfa7ecda-1d61-490f-a33e-8e73321ba119,UCSB-IZC00026704,,Animalia,Arthropoda,Insecta,Hymenoptera,Formicidae,Tapinoma,1765,"Förster, 1850",Tapinoma,,,,Elaine Tan,2019,,,,,,Howarth,,,,1/19/1999,1999,1,19,19,,,"Santa Cruz Island Reserve (SCIR) Collection, 2017",,,,,,,,,,,,Adult,,1,,,Pinned,USA,California,Santa Barbara,,Santa Cruz Island,,,,34.016667,-119.716667,WGS84,20644,,,,GeoLocate,,All of Santa Cruz Island,,,,,,,,,zachary_brown,2/21/2019 16:06,,1,urn:uuid:cfa7ecda-1d61-490f-a33e-8e73321ba119,https://symbiota.ccber.ucsb.edu:443/collections/individual/index.php?occid=123328
123329,UCSB,IZC,,PreservedSpecimen,5639cdb1-9e1d-47ae-bfc4-3a7aa79818a0,UCSB-IZC00026579,,Animalia,Arthropoda,Insecta,Hymenoptera,Formicidae,Tapinoma,1765,"Förster, 1850",Tapinoma,,,,Elaine Tan,2019,,,,,,Howarth,,,,1/19/1999,1999,1,19,19,,,"Santa Cruz Island Reserve (SCIR) Collection, 2017",,,,,,,,,,,,Adult,,1,,,Pinned,USA,California,Santa Barbara,,Santa Cruz Island,,,,34.016667,-119.716667,WGS84,20644,,,,GeoLocate,,All of Santa Cruz Island,,,,,,,,,zachary_brown,2/21/2019 16:06,,1,urn:uuid:5639cdb1-9e1d-47ae-bfc4-3a7aa79818a0,https://symbiota.ccber.ucsb.edu:443/collections/individual/index.php?occid=123329
123331,UCSB,IZC,,PreservedSpecimen,6bd824c1-27b8-4127-95d0-3d3cb7ff519a,UCSB-IZC00026784,,Animalia,Arthropoda,Insecta,Hymenoptera,Formicidae,Crematogaster,2473,"Lund, 1831",Crematogaster,,,,Elaine Tan,2019,,,,,,,,,,0000-00-00,,,,,,,"Santa Cruz Island Reserve (SCIR) Collection, 2017","""Upper Maripro"" near Navy Base",,,,,,,,,,,Adult,,1,,,Pinned,USA,California,Santa Barbara,,Santa Cruz Island,,,,34.016667,-119.716667,WGS84,20644,,,,GeoLocate,,,,,,,,,,,zachary_brown,2/22/2019 13:15,,1,urn:uuid:6bd824c1-27b8-4127-95d0-3d3cb7ff519a,https://symbiota.ccber.ucsb.edu:443/collections/individual/index.php?occid=123331
123332,UCSB,IZC,,PreservedSpecimen,a57bf449-0120-48a9-b1dc-02d6c0706c5d,UCSB-IZC00026533,,Animalia,Arthropoda,Insecta,Hymenoptera,Formicidae,Crematogaster,2473,"Lund, 1831",Crematogaster,,,,Elaine Tan,2019,,,,,,,,,,0000-00-00,,,,,,,"Santa Cruz Island Reserve (SCIR) Collection, 2017","""Upper Maripro"" near Navy Base",,,,,,,,,,,Adult,,1,,,Pinned,USA,California,Santa Barbara,,Santa Cruz Island,,,,34.016667,-119.716667,WGS84,20644,,,,GeoLocate,,All of Santa Cruz Island,,,,,,,,,zachary_brown,2/21/2019 15:59,,1,urn:uuid:a57bf449-0120-48a9-b1dc-02d6c0706c5d,https://symbiota.ccber.ucsb.edu:443/collections/individual/index.php?occid=123332
123335,UCSB,IZC,,PreservedSpecimen,8ed2b5d2-568b-4e14-81a7-dfe0146429b0,UCSB-IZC00026462,,Animalia,Arthropoda,Insecta,Hymenoptera,Formicidae,Linepithema humile,5028,"(Mayr, 1868)",Linepithema,humile,,,Elaine Tan,2019,,,,,,Emily Hebard,,,,12/4/1998,1998,12,4,338,,,"Santa Cruz Island Reserve (SCIR) Collection, 2017",,,,,,,,,,,,Adult,,1,,,Pinned,USA,California,Santa Barbara,,Santa Cruz Island,,,,34.016667,-119.716667,WGS84,20644,,,,GeoLocate,,All of Santa Cruz Island,,,,,,,,,zachary_brown,2/21/2019 15:58,,1,urn:uuid:8ed2b5d2-568b-4e14-81a7-dfe0146429b0,https://symbiota.ccber.ucsb.edu:443/collections/individual/index.php?occid=123335
123336,UCSB,IZC,,PreservedSpecimen,1251faf4-3e0c-49f4-8e3c-20d9803611f7,UCSB-IZC00026791,,Animalia,Arthropoda,Insecta,Hymenoptera,Formicidae,Linepithema humile,5028,"(Mayr, 1868)",Linepithema,humile,,,Elaine Tan,2019,,,,,,Emily Hebard,,,,12/4/1998,1998,12,4,338,,,"Santa Cruz Island Reserve (SCIR) Collection, 2017",,,,,,,,,,,,Adult,,1,,,Pinned,USA,California,Santa Barbara,,Santa Cruz Island,,,,34.016667,-119.716667,WGS84,20644,,,,GeoLocate,,All of Santa Cruz Island,,,,,,,,,zachary_brown,2/21/2019 15:58,,1,urn:uuid:1251faf4-3e0c-49f4-8e3c-20d9803611f7,https://symbiota.ccber.ucsb.edu:443/collections/individual/index.php?occid=123336
123337,UCSB,IZC,,PreservedSpecimen,0adef91f-035a-4fed-a9c5-b5a87f34b79c,UCSB-IZC00026740,,Animalia,Arthropoda,Insecta,Hymenoptera,Formicidae,Linepithema humile,5028,"(Mayr, 1868)",Linepithema,humile,,,Elaine Tan,2019,,,,,,Emily Hebard,,,,12/4/1998,1998,12,4,338,,,"Santa Cruz Island Reserve (SCIR) Collection, 2017",,,,,,,,,,,,Adult,,1,,,Pinned,USA,California,Santa Barbara,,Santa Cruz Island,,,,34.016667,-119.716667,WGS84,20644,,,,GeoLocate,,All of Santa Cruz Island,,,,,,,,,zachary_brown,2/21/2019 15:58,,1,urn:uuid:0adef91f-035a-4fed-a9c5-b5a87f34b79c,https://symbiota.ccber.ucsb.edu:443/collections/individual/index.php?occid=123337
123338,UCSB,IZC,,PreservedSpecimen,bc76f139-8448-4cd0-8911-10a063ecf693,UCSB-IZC00026368,,Animalia,Arthropoda,Insecta,Hymenoptera,Formicidae,Linepithema humile,5028,"(Mayr, 1868)",Linepithema,humile,,,Elaine Tan,2019,,,,,,Emily Hebard,,,,12/4/1998,1998,12,4,338,,,"Santa Cruz Island Reserve (SCIR) Collection, 2017",,,,,,,,,,,,Adult,,1,,,Pinned,USA,California,Santa Barbara,,Santa Cruz Island,,,,34.016667,-119.716667,WGS84,20644,,,,GeoLocate,,All of Santa Cruz Island,,,,,,,,,zachary_brown,2/21/2019 15:57,,1,urn:uuid:bc76f139-8448-4cd0-8911-10a063ecf693,https://symbiota.ccber.ucsb.edu:443/collections/individual/index.php?occid=123338
123339,UCSB,IZC,,PreservedSpecimen,2a1735c6-5d07-46bc-ab84-0b42cc7aed35,UCSB-IZC00026473,,Animalia,Arthropoda,Insecta,Hymenoptera,Formicidae,Linepithema humile,5028,"(Mayr, 1868)",Linepithema,humile,,,Elaine Tan,2019,,,,,,Emily Hebard,,,,12/4/1998,1998,12,4,338,,,"Santa Cruz Island Reserve (SCIR) Collection, 2017",,,,,,,,,,,,Adult,,1,,,Pinned,USA,California,Santa Barbara,,Santa Cruz Island,,,,34.016667,-119.716667,WGS84,20644,,,,GeoLocate,,All of Santa Cruz Island,,,,,,,,,zachary_brown,2/21/2019 15:57,,1,urn:uuid:2a1735c6-5d07-46bc-ab84-0b42cc7aed35,https://symbiota.ccber.ucsb.edu:443/collections/individual/index.php?occid=123339
123341,UCSB,IZC,,PreservedSpecimen,142b300f-7a1b-4569-99eb-e640cde0ca49,UCSB-IZC00026497,,Animalia,Arthropoda,Insecta,Hymenoptera,Formicidae,Linepithema humile,5028,"(Mayr, 1868)",Linepithema,humile,,,Elaine Tan,2019,,,,,,Emily Hebard,,,,12/4/1998,1998,12,4,338,,,"Santa Cruz Island Reserve (SCIR) Collection, 2017",,,,,,,,,,,,Adult,,1,,,Pinned,USA,California,Santa Barbara,,Santa Cruz Island,,,,34.016667,-119.716667,WGS84,20644,,,,GeoLocate,,All of Santa Cruz Island,,,,,,,,,zachary_brown,2/21/2019 15:56,,1,urn:uuid:142b300f-7a1b-4569-99eb-e640cde0ca49,https://symbiota.ccber.ucsb.edu:443/collections/individual/index.php?occid=123341
123343,UCSB,IZC,,PreservedSpecimen,43afe2a6-0774-4292-ad29-17bb44fd7dd9,UCSB-IZC00026785,,Animalia,Arthropoda,Insecta,Hymenoptera,Formicidae,Linepithema humile,5028,"(Mayr, 1868)",Linepithema,humile,,,Elaine Tan,2019,,,,,,Emily Hebard,,,,12/4/1998,1998,12,4,338,,,"Santa Cruz Island Reserve (SCIR) Collection, 2017",,,,,,,,,,,,Adult,,1,,,Pinned,USA,California,Santa Barbara,,Santa Cruz Island,,,,34.016667,-119.716667,WGS84,20644,,,,GeoLocate,,All of Santa Cruz Island,,,,,,,,,zachary_brown,2/21/2019 15:56,,1,urn:uuid:43afe2a6-0774-4292-ad29-17bb44fd7dd9,https://symbiota.ccber.ucsb.edu:443/collections/individual/index.php?occid=123343
123344,UCSB,IZC,,PreservedSpecimen,fdc5756a-ae6f-4c85-b859-e8d241199769,UCSB-IZC00026347,,Animalia,Arthropoda,Insecta,Hymenoptera,Formicidae,Linepithema humile,5028,"(Mayr, 1868)",Linepithema,humile,,,Elaine Tan,2019,,,,,,Emily Hebard,,,,12/4/1998,1998,12,4,338,,,"Santa Cruz Island Reserve (SCIR) Collection, 2017",,,,,,,,,,,,Adult,,1,,,Pinned,USA,California,Santa Barbara,,Santa Cruz Island,,,,34.016667,-119.716667,WGS84,20644,,,,GeoLocate,,All of Santa Cruz Island,,,,,,,,,zachary_brown,2/21/2019 15:56,,1,urn:uuid:fdc5756a-ae6f-4c85-b859-e8d241199769,https://symbiota.ccber.ucsb.edu:443/collections/individual/index.php?occid=123344
123345,UCSB,IZC,,PreservedSpecimen,910a8ab9-722f-4210-ba47-052f72d5a96b,UCSB-IZC00026812,,Animalia,Arthropoda,Insecta,Hymenoptera,Formicidae,Linepithema humile,5028,"(Mayr, 1868)",Linepithema,humile,,,Elaine Tan,2019,,,,,,Emily Hebard,,,,12/4/1998,1998,12,4,338,,,"Santa Cruz Island Reserve (SCIR) Collection, 2017",,,,,,,,,,,,Adult,,1,,,Pinned,USA,California,Santa Barbara,,Santa Cruz Island,,,,34.016667,-119.716667,WGS84,20644,,,,GeoLocate,,All of Santa Cruz Island,,,,,,,,,zachary_brown,2/21/2019 15:55,,1,urn:uuid:910a8ab9-722f-4210-ba47-052f72d5a96b,https://symbiota.ccber.ucsb.edu:443/collections/individual/index.php?occid=123345
123348,UCSB,IZC,,PreservedSpecimen,1751b82b-3e41-4a75-af63-a6b4de55db37,UCSB-IZC00026364,,Animalia,Arthropoda,Insecta,Hymenoptera,Formicidae,Linepithema humile,5028,"(Mayr, 1868)",Linepithema,humile,,,Elaine Tan,2019,,,,,,Emily Hebard,,,,12/4/1998,1998,12,4,338,,,"Santa Cruz Island Reserve (SCIR) Collection, 2017",,,,,,,,,,,,Adult,,1,,,Pinned,USA,California,Santa Barbara,,Santa Cruz Island,,,,34.016667,-119.716667,WGS84,20644,,,,GeoLocate,,All of Santa Cruz Island,,,,,,,,,zachary_brown,2/21/2019 15:55,,1,urn:uuid:1751b82b-3e41-4a75-af63-a6b4de55db37,https://symbiota.ccber.ucsb.edu:443/collections/individual/index.php?occid=123348
123349,UCSB,IZC,,PreservedSpecimen,f9de0901-cc26-4bd9-b347-f5d3bf0a4a27,UCSB-IZC00026676,,Animalia,Arthropoda,Insecta,Hymenoptera,Formicidae,Linepithema humile,5028,"(Mayr, 1868)",Linepithema,humile,,,Elaine Tan,2019,,,,,,Emily Hebard,,,,12/4/1998,1998,12,4,338,,,"Santa Cruz Island Reserve (SCIR) Collection, 2017",,,,,,,,,,,,Adult,,1,,,Pinned,USA,California,Santa Barbara,,Santa Cruz Island,,,,34.016667,-119.716667,WGS84,20644,,,,GeoLocate,,All of Santa Cruz Island,,,,,,,,,zachary_brown,2/21/2019 15:55,,1,urn:uuid:f9de0901-cc26-4bd9-b347-f5d3bf0a4a27,https://symbiota.ccber.ucsb.edu:443/collections/individual/index.php?occid=123349
123350,UCSB,IZC,,PreservedSpecimen,445c3bf0-6cb3-4944-8b0c-efc7195306f5,UCSB-IZC00026552,,Animalia,Arthropoda,Insecta,Hymenoptera,Formicidae,Linepithema humile,5028,"(Mayr, 1868)",Linepithema,humile,,,Elaine Tan,2019,,,,,,Emily Hebard,,,,12/4/1998,1998,12,4,338,,,"Santa Cruz Island Reserve (SCIR) Collection, 2017",,,,,,,,on Manzanita,,,,Adult,,1,,,Pinned,USA,California,Santa Barbara,,Santa Cruz Island,,,,34.016667,-119.716667,WGS84,20644,,,,GeoLocate,,All of Santa Cruz Island,,,,,,,,,zachary_brown,2/21/2019 15:54,,1,urn:uuid:445c3bf0-6cb3-4944-8b0c-efc7195306f5,https://symbiota.ccber.ucsb.edu:443/collections/individual/index.php?occid=123350
123351,UCSB,IZC,,PreservedSpecimen,b7643eec-d4a1-4d39-92b5-b4ed14b174eb,UCSB-IZC00026363,,Animalia,Arthropoda,Insecta,Hymenoptera,Formicidae,Camponotus,2424,"Mayr, 1861",Camponotus,,,,Elaine Tan,2018,,,,,,Emily Hebard,,Heller,,4/19/1999,1999,4,19,109,,,"Santa Cruz Island Reserve (SCIR) Collection, 2017",,,,,,,,,,,,Adult,,1,,,Pinned,USA,California,Santa Barbara,,Santa Cruz Island,,,,34.016667,-119.716667,WGS84,20644,,,,GeoLocate,,All of Santa Barbara County,,,,,,,,,zachary_brown,2/21/2019 15:54,,1,urn:uuid:b7643eec-d4a1-4d39-92b5-b4ed14b174eb,https://symbiota.ccber.ucsb.edu:443/collections/individual/index.php?occid=123351
123352,UCSB,IZC,,PreservedSpecimen,4998e553-77b5-4e1a-a679-1276fbd7ff31,UCSB-IZC00026361,,Animalia,Arthropoda,Insecta,Hymenoptera,Formicidae,Camponotus,2424,"Mayr, 1861",Camponotus,,,,Elaine Tan,2019,,,,,,Emily Hebard,,,,12/4/1998,1998,12,4,338,,,"Santa Cruz Island Reserve (SCIR) Collection, 2017",,,,,,,,,,,,Adult,,1,,,Pinned,USA,California,Santa Barbara,,Santa Cruz Island,,,,34.016667,-119.716667,WGS84,20644,,,,GeoLocate,,All of Santa Cruz Island,,,,,,,,,zachary_brown,2/21/2019 15:54,,1,urn:uuid:4998e553-77b5-4e1a-a679-1276fbd7ff31,https://symbiota.ccber.ucsb.edu:443/collections/individual/index.php?occid=123352
123353,UCSB,IZC,,PreservedSpecimen,fe62a9ba-9ff5-4b82-90d0-1b0c6def393e,UCSB-IZC00026378,,Animalia,Arthropoda,Insecta,Hymenoptera,Formicidae,Camponotus,2424,"Mayr, 1861",Camponotus,,,,Elaine Tan,2019,,,,,,Emily Hebard,,,,12/3/1998,1998,12,3,337,,,"Santa Cruz Island Reserve (SCIR) Collection, 2017",,,,,,,,,,,,Adult,,1,,,Pinned,USA,California,Santa Barbara,,Santa Cruz Island,,,,34.016667,-119.716667,WGS84,20644,,,,GeoLocate,,All of Santa Cruz Island,,,,,,,,,zachary_brown,2/21/2019 15:52,,1,urn:uuid:fe62a9ba-9ff5-4b82-90d0-1b0c6def393e,https://symbiota.ccber.ucsb.edu:443/collections/individual/index.php?occid=123353
123354,UCSB,IZC,,PreservedSpecimen,6d557a16-12ac-4bb6-a6aa-ec0ee4c33858,UCSB-IZC00026575,,Animalia,Arthropoda,Insecta,Hymenoptera,Formicidae,Camponotus,2424,"Mayr, 1861",Camponotus,,,,Elaine Tan,2019,,,,,,Emily Hebard,,,,7/6/1999,1999,7,6,187,,,"Santa Cruz Island Reserve (SCIR) Collection, 2017",Canada Pomona,,,,,,,,,,,Adult,,1,,,Pinned,USA,California,Santa Barbara,,Santa Cruz Island,,,,34.016667,-119.716667,WGS84,20644,,,,GeoLocate,,All of Santa Cruz Island,,,,,,,,,zachary_brown,2/21/2019 15:52,,1,urn:uuid:6d557a16-12ac-4bb6-a6aa-ec0ee4c33858,https://symbiota.ccber.ucsb.edu:443/collections/individual/index.php?occid=123354
123355,UCSB,IZC,,PreservedSpecimen,788622a6-aca3-45d8-a355-47cc485cd38b,UCSB-IZC00026701,,Animalia,Arthropoda,Insecta,Hymenoptera,Formicidae,Linepithema humile,5028,"(Mayr, 1868)",Linepithema,humile,,,Zach Brown,2019,,,,,,Zach Brown,,Elaine Tan,,1/8/2019,2019,1,8,8,,,,,,,,,,,,,,,Adult,Female,1,Hand,,Pinned,USA,California,Santa Barbara,Isla Vista,Cheadle Center for Biodiversity and Ecological Restoration Herpetology Chamber,,,,34.4201,-119.8552,WGS84,10,,,,,,,,,,,,,,,zachary_brown,2/20/2019 14:43,,1,urn:uuid:788622a6-aca3-45d8-a355-47cc485cd38b,https://symbiota.ccber.ucsb.edu:443/collections/individual/index.php?occid=123355
123357,UCSB,IZC,,PreservedSpecimen,961660e8-bd1a-452d-ad04-038a2246bb52,UCSB-IZC00026576,,Animalia,Arthropoda,Insecta,Hymenoptera,Formicidae,Stenamma,3078,"Westwood, 1839",Stenamma,,,,Zach Brown,2018,,,,,,Diana A. Tamayo,,,,5/20/2018,2018,5,20,140,,,,,,,,,,,,,,,Adult,,1,,,Pinned,USA,California,Santa Barbara,,Grass Mountain,,,,34.742047,-120.061492,WGS84,1807,,,,GeoLocate,,Grass Mountain Trail-head,,,,,,,,,aurora2,2/21/2019 15:51,,1,urn:uuid:961660e8-bd1a-452d-ad04-038a2246bb52,https://symbiota.ccber.ucsb.edu:443/collections/individual/index.php?occid=123357
123358,UCSB,IZC,,PreservedSpecimen,e7e205e6-4b08-483f-8074-4da3602518af,UCSB-IZC00026381,,Animalia,Arthropoda,Insecta,Hymenoptera,Formicidae,Stenamma,3078,"Westwood, 1839",Stenamma,,,,Zach Brown,2018,,,,,,McKenzie Sime,,,,5/11/2017,2017,5,11,131,,,,,,,,,,,,,,,Adult,,1,,,Pinned,USA,California,Santa Barbara,,Refugio Canyon,,,,34.520156,-120.057526,WGS84,14542,,,,GeoLocate,,Refugio Canyon Rd and surrounding areas,,,,,,,,,aurora2,2/21/2019 15:49,,1,urn:uuid:e7e205e6-4b08-483f-8074-4da3602518af,https://symbiota.ccber.ucsb.edu:443/collections/individual/index.php?occid=123358
123359,UCSB,IZC,,PreservedSpecimen,59a2084c-e810-4858-8359-1f5e84cd7204,UCSB-IZC00026691,,Animalia,Arthropoda,Insecta,Hymenoptera,Formicidae,Crematogaster,2473,"Lund, 1831",Crematogaster,,,,Zach Brown,2018,,,,,,Lance Takata,,,,5/9/2017,2017,5,9,129,,,,,,,,,,,,,,,Adult,,1,,,Pinned,USA,California,Santa Barbara,Santa Barbara,"University of California, Santa Barbara Lagoon Island",,,,34.408113,-119.848151,WGS84,125,,,,GeoLocate,,Lagoon Island and Campus Point,,,,,,,,,zachary_brown,2/21/2019 15:43,,1,urn:uuid:59a2084c-e810-4858-8359-1f5e84cd7204,https://symbiota.ccber.ucsb.edu:443/collections/individual/index.php?occid=123359
123361,UCSB,IZC,,PreservedSpecimen,5507841d-e4d4-4917-9065-5a0dbd59d63c,UCSB-IZC00026749,,Animalia,Arthropoda,Insecta,Hymenoptera,Formicidae,Crematogaster,2473,"Lund, 1831",Crematogaster,,,,Zach Brown,2018,,,,,,EEMB 118 Entomology Class,,,,6/27/2018,2018,6,27,178,,,,Restored coastal sage scrub,,,,,,,,,,,Adult,,1,Yellow Pan Trap,,Pinned,USA,California,Santa Barbara,Santa Barbara,"University of California, Santa Barbara Lagoon Island",,,,34.4079,-119.8481,WGS84,10,,,,,,,,,,,,,,,zachary_brown,2/20/2019 15:47,,1,urn:uuid:5507841d-e4d4-4917-9065-5a0dbd59d63c,https://symbiota.ccber.ucsb.edu:443/collections/individual/index.php?occid=123361
123362,UCSB,IZC,,PreservedSpecimen,8cde9ba2-a682-40b8-97d7-e015bf11a17d,UCSB-IZC00026528,,Animalia,Arthropoda,Insecta,Hymenoptera,Formicidae,Crematogaster,2473,"Lund, 1831",Crematogaster,,,,Zach Brown,2018,,,,,,Justine Bethel,,Sierra Lien,,5/1/2018,2018,5,1,121,,,UCSB EEMB 96 Spring 2018,,,,,,,,Calandrinia menziesii,,,,Adult,,1,Sweep Net,,Pinned,USA,California,Santa Barbara,Santa Barbara,"University of California, Santa Barbara Lagoon Island",,,,34.4083,-119.8486,WGS84,10,,,,,,,16,,,,,16m,,,zachary_brown,2/20/2019 15:51,,1,urn:uuid:8cde9ba2-a682-40b8-97d7-e015bf11a17d,https://symbiota.ccber.ucsb.edu:443/collections/individual/index.php?occid=123362
123363,UCSB,IZC,,PreservedSpecimen,f753eacb-7657-45d6-87cb-8fa4944d81fa,UCSB-IZC00026511,,Animalia,Arthropoda,Insecta,Hymenoptera,Formicidae,Crematogaster,2473,"Lund, 1831",Crematogaster,,,,Zach Brown,2018,,,,,,EEMB 118 Entomology Class,,,,6/27/2018,2018,6,27,178,,,,Restored coastal sage scrub,,,,,,,,,,,Adult,,1,Yellow Pan Trap,,Pinned,USA,California,Santa Barbara,Santa Barbara,"University of California, Santa Barbara Lagoon Island",,,,34.4079,-119.8481,WGS84,10,,,,,,,,,,,,,,,zachary_brown,2/20/2019 15:53,,1,urn:uuid:f753eacb-7657-45d6-87cb-8fa4944d81fa,https://symbiota.ccber.ucsb.edu:443/collections/individual/index.php?occid=123363
123364,UCSB,IZC,,PreservedSpecimen,724f3c3a-e142-47a9-a95f-954298065051,UCSB-IZC00026677,,Animalia,Arthropoda,Insecta,Hymenoptera,Formicidae,Crematogaster,2473,"Lund, 1831",Crematogaster,,,,Elaine Tan,2018,,,,,,Justine Bethel,,Sierra Lien,,5/1/2018,2018,5,1,121,,,UCSB EEMB 96 Spring 2018,,,,,,,,Calandrinia menziesii,,,,Adult,,1,Sweep Net,,Pinned,USA,California,Santa Barbara,Santa Barbara,"University of California, Santa Barbara Lagoon Island",,,,34.4083,-119.8486,,,,,,,,,16,,,,,16m,,,zachary_brown,2/20/2019 15:55,,1,urn:uuid:724f3c3a-e142-47a9-a95f-954298065051,https://symbiota.ccber.ucsb.edu:443/collections/individual/index.php?occid=123364
123365,UCSB,IZC,,PreservedSpecimen,bc91a00f-b18c-4023-b0c3-5ac898cc0735,UCSB-IZC00026352,,Animalia,Arthropoda,Insecta,Hymenoptera,Formicidae,Crematogaster,2473,"Lund, 1831",Crematogaster,,,,Elaine Tan,2018,,,,,,Eloy Bacilio,,,,5/12/2016,2016,5,12,133,,,,,,,,,,,,,,,Adult,,1,,,Pinned,USA,California,Santa Barbara,Isla Vista,"University of California, Santa Barbara Manzanita Village",,,,34.409326,-119.852013,WGS84,157,,,,GeoLocate,,"Manzanita Village, including Loma Paloma Center",,,,,,,,,zachary_brown,2/21/2019 15:41,,1,urn:uuid:bc91a00f-b18c-4023-b0c3-5ac898cc0735,https://symbiota.ccber.ucsb.edu:443/collections/individual/index.php?occid=123365
123366,UCSB,IZC,,PreservedSpecimen,2b1e1364-8bbd-4a1f-be29-32004c532536,UCSB-IZC00026489,,Animalia,Arthropoda,Insecta,Hymenoptera,Formicidae,Crematogaster marioni,5565,"Buren, 1968",Crematogaster,marioni,,,J. Longino,1986,,,,,,J. Longino,,,36,10/26/1984,1984,10,26,300,,"Oct 26-29, 1984","Santa Cruz Island Reserve (SCIR) Collection, 2017",,,,,,,,,,,,Adult,,2,,,Pinned,USA,California,Santa Barbara,,Santa Cruz Island,,,,34.016667,-119.716667,WGS84,20644,,,,GeoLocate,,All of Santa Cruz Island,0,400,,,,0-400m,,,zachary_brown,2/21/2019 15:39,,1,urn:uuid:2b1e1364-8bbd-4a1f-be29-32004c532536,https://symbiota.ccber.ucsb.edu:443/collections/individual/index.php?occid=123366
123367,UCSB,IZC,,PreservedSpecimen,f2fd45f1-abb1-4f47-a608-b2e00117a96d,UCSB-IZC00026646,,Animalia,Arthropoda,Insecta,Hymenoptera,Formicidae,Crematogaster hespera,5563,"Buren, 1968",Crematogaster,hespera,,,J. Longino,1986,,,,,,J. Longino,,,84-65,8/24/1984,1984,8,24,237,,"Aug 24-27, 1984","Santa Cruz Island Reserve (SCIR) Collection, 2017",,,,,,,,,,,,Adult,,2,,,Pinned,USA,California,Santa Barbara,,Santa Cruz Island,,,,34.005283,-119.758552,WGS84,20644,,,,GeoLocate,,All of Santa Cruz Island,0,200,,,,0-200m,,,zachary_brown,2/21/2019 15:37,,1,urn:uuid:f2fd45f1-abb1-4f47-a608-b2e00117a96d,https://symbiota.ccber.ucsb.edu:443/collections/individual/index.php?occid=123367
123373,UCSB,IZC,,PreservedSpecimen,3fe7a56b-043f-4da9-8cd8-e8982b0e4003,UCSB-IZC00026537,,Animalia,Arthropoda,Insecta,Hymenoptera,Formicidae,Solenopsis,3064,"Westwood, 1840",Solenopsis,,,,Elaine Tan,2018,,,,,,UCSB Natural History Collections Club 2017,,,,5/28/2017,2017,5,28,148,,,"Santa Cruz Island Reserve (SCIR) Collection, 2017",,,,,,,,,,,,Adult,,1,,,Pinned,USA,California,Santa Barbara,,Santa Cruz Island,,,,33.9999,-119.7338,WGS84,10,,,,,,,,,,,,,,,zachary_brown,2/20/2019 18:41,,1,urn:uuid:3fe7a56b-043f-4da9-8cd8-e8982b0e4003,https://symbiota.ccber.ucsb.edu:443/collections/individual/index.php?occid=123373
123374,UCSB,IZC,,PreservedSpecimen,530ccd62-3fee-4c00-800b-fb46df415f1d,UCSB-IZC00026342,,Animalia,Arthropoda,Insecta,Hymenoptera,Formicidae,Solenopsis,3064,"Westwood, 1840",Solenopsis,,,,Elaine Tan,2018,,,,,,UCSB Natural History Collections Club 2017,,,,5/28/2017,2017,5,28,148,,,"Santa Cruz Island Reserve (SCIR) Collection, 2017",,,,,,,,,,,,Adult,,1,,,Pinned,USA,California,Santa Barbara,,Santa Cruz Island,,,,33.9999,-119.7338,WGS84,10,,,,,,,,,,,,,,,zachary_brown,2/20/2019 18:43,,1,urn:uuid:530ccd62-3fee-4c00-800b-fb46df415f1d,https://symbiota.ccber.ucsb.edu:443/collections/individual/index.php?occid=123374
123375,UCSB,IZC,,PreservedSpecimen,d96bd71c-484c-4459-8a9e-2b68121f00cb,UCSB-IZC00026344,,Animalia,Arthropoda,Insecta,Hymenoptera,Formicidae,Solenopsis,3064,"Westwood, 1840",Solenopsis,,,,Zach Brown,2018,,,,,,UCSB Natural History Collections Club 2017,,,,5/28/2017,2017,5,28,148,,,,,,,,,,,,,,,Adult,,1,,,Pinned,USA,California,Santa Barbara,,Santa Cruz Island,,,,33.9999,-119.7338,WGS84,10,,,,,,,,,,,,,,,zachary_brown,2/20/2019 18:44,,1,urn:uuid:d96bd71c-484c-4459-8a9e-2b68121f00cb,https://symbiota.ccber.ucsb.edu:443/collections/individual/index.php?occid=123375
123376,UCSB,IZC,,PreservedSpecimen,5da029a7-de0a-417c-bece-5b2f0179da23,UCSB-IZC00026666,,Animalia,Arthropoda,Insecta,Hymenoptera,Formicidae,Solenopsis,3064,"Westwood, 1840",Solenopsis,,,,Zach Brown,2018,,,,,,Darcie Frounfelter,,,,5/22/1999,1999,5,22,142,,,,,,,,,,,,,,,Adult,,1,,,Pinned,USA,California,Santa Barbara,Goleta,Ellwood Bluffs,,,,34.423343,-119.891887,WGS84,1022,,,,GeoLocate,,Ellwood Bluffs Trail head and Trail,,,,,,,,,zachary_brown,2/22/2019 15:45,,1,urn:uuid:5da029a7-de0a-417c-bece-5b2f0179da23,https://symbiota.ccber.ucsb.edu:443/collections/individual/index.php?occid=123376
123377,UCSB,IZC,,PreservedSpecimen,c167126f-218e-4eb8-9321-9e15ac25ba27,UCSB-IZC00026668,,Animalia,Arthropoda,Insecta,Hymenoptera,Formicidae,Solenopsis,3064,"Westwood, 1840",Solenopsis,,,,Zach Brown,2018,,,,,,EEMB 118 Entomology Class,,,,6/27/2018,2018,6,27,178,,,,Restored coastal sage scrub,,,,,,,,,,,Adult,,1,Yellow Pan Trap,,Pinned,USA,California,Santa Barbara,Santa Barbara,"University of California, Santa Barbara Lagoon Island",,,,34.4079,-119.8481,WGS84,10,,,,,,,,,,,,,,,zachary_brown,2/20/2019 18:49,,1,urn:uuid:c167126f-218e-4eb8-9321-9e15ac25ba27,https://symbiota.ccber.ucsb.edu:443/collections/individual/index.php?occid=123377
123378,UCSB,IZC,,PreservedSpecimen,b5f9bd7e-731e-4f15-8a46-2af9f2c15be9,UCSB-IZC00026393,,Animalia,Arthropoda,Insecta,Hymenoptera,Formicidae,Linepithema humile,5028,"(Mayr, 1868)",Linepithema,humile,,,Elaine Tan,2019,,,,,,UCSB Arthropod Survey,,,,5/16/2016,2016,5,16,137,,"May 16-19, 2016",,"Annual grassland, before restoration",,,AS-PIT-01,,,,,,,,,,,Pitfall Trap,,,United States,California,Santa Barbara,Goleta,UCSB North Campus Open Space,,,,34.4197,-119.8812,WGS84,10,,,,,,,,,,,,,,,entan,2/22/2019 14:14,,1,urn:uuid:b5f9bd7e-731e-4f15-8a46-2af9f2c15be9,https://symbiota.ccber.ucsb.edu:443/collections/individual/index.php?occid=123378
123379,UCSB,IZC,,PreservedSpecimen,13236fa0-6213-457c-950a-2d5e4f119648,UCSB-IZC00002692,,Animalia,Arthropoda,Insecta,Hymenoptera,Formicidae,Linepithema humile,5028,"(Mayr, 1868)",Linepithema,humile,,,Elaine Tan,2019,,,,,,UCSB Arthropod Survey,,,,5/16/2016,2016,5,16,137,,"May 16-19, 2016",,"Annual grassland, before restoration",,,AS-PIT-01,,,,,,,,,,,Pitfall Trap,,,United States,California,Santa Barbara,Goleta,UCSB North Campus Open Space,,,,34.4197,-119.8812,WGS84,10,,,,,,,,,,,,,,,entan,2/22/2019 14:14,,1,urn:uuid:13236fa0-6213-457c-950a-2d5e4f119648,https://symbiota.ccber.ucsb.edu:443/collections/individual/index.php?occid=123379
123380,UCSB,IZC,,PreservedSpecimen,343a23db-76a4-46b5-a1a4-b7856212d13f,UCSB-IZC00026542,,Animalia,Arthropoda,Insecta,Hymenoptera,Formicidae,Linepithema humile,5028,"(Mayr, 1868)",Linepithema,humile,,,Elaine Tan,2019,,,,,,UCSB Arthropod Survey,,,,5/16/2016,2016,5,16,137,,"May 16-19, 2016",,"Annual grassland, before restoration",,,AS-PIT-01,,,,,,,,,,,Pitfall Trap,,,United States,California,Santa Barbara,Goleta,UCSB North Campus Open Space,,,,34.4197,-119.8812,WGS84,10,,,,,,,,,,,,,,,entan,2/22/2019 14:14,,1,urn:uuid:343a23db-76a4-46b5-a1a4-b7856212d13f,https://symbiota.ccber.ucsb.edu:443/collections/individual/index.php?occid=123380
123381,UCSB,IZC,,PreservedSpecimen,748ebd4e-ab79-4142-9c95-db7547e01686,UCSB-IZC00026391,,Animalia,Arthropoda,Insecta,Hymenoptera,Formicidae,Linepithema humile,5028,"(Mayr, 1868)",Linepithema,humile,,,Elaine Tan,2019,,,,,,UCSB Arthropod Survey,,,,5/16/2016,2016,5,16,137,,"May 16-19, 2016",,"Annual grassland, before restoration",,,AS-PIT-01,,,,,,,,,,,Pitfall Trap,,,United States,California,Santa Barbara,Goleta,UCSB North Campus Open Space,,,,34.4197,-119.8812,WGS84,10,,,,,,,,,,,,,,,entan,2/22/2019 14:14,,1,urn:uuid:748ebd4e-ab79-4142-9c95-db7547e01686,https://symbiota.ccber.ucsb.edu:443/collections/individual/index.php?occid=123381
123382,UCSB,IZC,,PreservedSpecimen,b49a1f6f-6d24-4b07-8c3a-6616bc2d53fe,UCSB-IZC00026571,,Animalia,Arthropoda,Insecta,Hymenoptera,Formicidae,Temnothorax,5544,"Mayr, 1861",Temnothorax,,,,Elaine Tan,2019,,,,,,UCSB Arthropod Survey,,,,7/25/2016,2016,7,25,207,,"July 25-28, 2016",,"Fennel grassland, before restoration",,OTU1007,FG-PIT-03,,,,,,,,,,,Pitfall Trap,,,United States,California,Santa Barbara,Goleta,UCSB North Campus Open Space,,0,,34.4188,-119.8781,WGS84,10,,,,,,,,,,,,,,,entan,2/22/2019 14:14,,1,urn:uuid:b49a1f6f-6d24-4b07-8c3a-6616bc2d53fe,https://symbiota.ccber.ucsb.edu:443/collections/individual/index.php?occid=123382
123397,UCSB,IZC,,PreservedSpecimen,a86d808a-da05-43e3-8de1-79af92a59361,UCSB-IZC00026369,,Animalia,Arthropoda,Insecta,Hymenoptera,Formicidae,Monomorium,2763,"Mayr, 1855",Monomorium,,,,Elaine Tan,2019,,,,,,UCSB Arthropod Survey,,,,4/11/2016,2016,4,11,102,,"April 11-17, 2016",,"Annual grassland, before restoration",,,AS-PIT-01,,,,,,,,,,,Pitfall Trap,,,United States,California,Santa Barbara,Goleta,UCSB North Campus Open Space,,,,34.42027725,-119.8804894,WGS84,10,,,,,,,,,,,,,,,entan,2/22/2019 14:15,,1,urn:uuid:a86d808a-da05-43e3-8de1-79af92a59361,https://symbiota.ccber.ucsb.edu:443/collections/individual/index.php?occid=123397
123399,UCSB,IZC,,PreservedSpecimen,34c2ddbe-8af2-4558-9cb4-d5518008f12a,UCSB-IZC00026761,,Animalia,Arthropoda,Insecta,Hymenoptera,Formicidae,Monomorium,2763,"Mayr, 1855",Monomorium,,,,Elaine Tan,2019,,,,,,UCSB Arthropod Survey,,,,4/11/2016,2016,4,11,102,,"April 11-17, 2016",,"Annual grassland, before restoration",,,AS-PIT-01,,,,,,,,,,,Pitfall Trap,,,United States,California,Santa Barbara,Goleta,UCSB North Campus Open Space,,,,34.42027725,-119.8804894,WGS84,10,,,,,,,,,,,,,,,entan,2/22/2019 14:17,,1,urn:uuid:34c2ddbe-8af2-4558-9cb4-d5518008f12a,https://symbiota.ccber.ucsb.edu:443/collections/individual/index.php?occid=123399
123400,UCSB,IZC,,PreservedSpecimen,3874c298-f866-4762-9d43-3e3ddb04989b,UCSB-IZC00026400,,Animalia,Arthropoda,Insecta,Hymenoptera,Formicidae,Monomorium,2763,"Mayr, 1855",Monomorium,,,,Elaine Tan,2019,,,,,,UCSB Arthropod Survey,,,,4/11/2016,2016,4,11,102,,"April 11-17, 2016",,"Annual grassland, before restoration",,,AS-PIT-01,,,,,,,,,,,Pitfall Trap,,,United States,California,Santa Barbara,Goleta,UCSB North Campus Open Space,,,,34.42027725,-119.8804894,WGS84,10,,,,,,,,,,,,,,,entan,2/22/2019 14:18,,1,urn:uuid:3874c298-f866-4762-9d43-3e3ddb04989b,https://symbiota.ccber.ucsb.edu:443/collections/individual/index.php?occid=123400
123401,UCSB,IZC,,PreservedSpecimen,c33f901c-093d-4e45-91bf-d181abff74a2,UCSB-IZC00026919,,Animalia,Arthropoda,Insecta,Hymenoptera,Formicidae,Monomorium,2763,"Mayr, 1855",Monomorium,,,,Elaine Tan,2019,,,,,,UCSB Arthropod Survey,,,,4/11/2016,2016,4,11,102,,"April 11-17, 2016",,"Annual grassland, before restoration",,,AS-PIT-01,,,,,,,,,,,Pitfall Trap,,,United States,California,Santa Barbara,Goleta,UCSB North Campus Open Space,,,,34.42027725,-119.8804894,WGS84,10,,,,,,,,,,,,,,,entan,2/22/2019 14:18,,1,urn:uuid:c33f901c-093d-4e45-91bf-d181abff74a2,https://symbiota.ccber.ucsb.edu:443/collections/individual/index.php?occid=123401
